,abstract,id,title
1218,,4916508,Necrologia; Julio Endara Moreno (1899-1969)
1219,,11628203,"Historia de la enseñanza de la clínica psiquiátrica en Buenos Aires. (Primer Congreso de Historia de la Medicina Argentina. Buenos Aires - 27 al 30 noviembre, 1968)."
1220,,4888447,Resumen de las ideas de Bartolomé Llopis.
1221,,5740589,El psiquíatra mirando al resto de la medicina.
1222,,5613737,Discurso de incorporación a la Academia de Medicina del profesor Dr. Armando Roa.
1223,,5603871,Observaciones sobre desadaptación de enfermos tuberculosos al ambiente hospitalario. Relación con las formas clínicas y sus tipos constitucionales y psicológicos.
1224,,5998686,Discurso presidencial.
1225,,5991461,Una evocación oportuna.
1226,,4222503,El problema de las definiciones en el campo de la salud mental. Definiciones aplicables en estudios epidemiológicos.
1227,,4881854,Psicoanálisis sin Freud.
1228,,5837189,Neurología Social.
1229,,14196211,EL MUNDO ACTUAL VISTO POR UN PSIQUIATRA.
1230,,24984573,Desarrollo de la versión española de la Escala Breve para la Evaluación de la Capacidad Funcional [Sp-UPSA-Brief] para pacientes con esquizofrenia y trastorno bipolar.
1231,,26575126,Prevalencia de dolor en pacientes sometidos a polisomnograma con y sin SAHOS. Un estudio transversal.
1232,,26575124,Crisis en ciencia y tecnología en Colombia.
1233,,24667067,Número de suicidios en España: diferencias entre los datos del Instituto Nacional de Estadística y los aportados por los Institutos de Medicina Legal.
1234,,24656762,Protocolo de estudio de un programa para la prevención de la recurrencia del comportamiento suicida basado en el manejo de casos (PSyMAC).
1235,,15332380,El cambio de la práctica médica. Desafíos psicosociales para la profesión.
1236,,15332374,Psiquiatría de enlace en servicios médico-quirúrgicos de dos hospitales de Santiago.
1237,,25546545,"Suicidio, palabra maldita (muerte, palabra prohibida)."
1238,"Objetivo: Describir la experiencia recogida durante el programa multidisciplinar,y en particular describir la incidencia de los trastornos psiquiátricosen pacientes con hepatitis C crónica (HCC) durante el tratamiento coninterferón y ribavirina, y determinar la adherencia al tratamiento antiviraly la respuesta viral sobtenida (RVS).Material y métodos: Estudio observacional, descriptivo y retrospectivo realizadoa partir de los datos recogidos durante el programa de dispensaciónambulatoria de tratamiento antiviral.Se incluyó a todos los pacientes monoinfectados por el virus hepatitis C(VHC) que iniciaron tratamiento durante el 2010. El cribaje de lostrastornos psiquiátricos se realizó mediante el Hospital Anxiety-DepressionScale (HADS) y el General Health Questionnaire (Goldberg) las semanas 0,4, 12, 24, 48 y 72. La adherencia se evaluó mediante el recuento de dispensacionesy de la medicación sobrante del paciente y la exposición al fármacosegún la regla 80/80/80. La respuesta virológica se determinó por elmédico responsable de acuerdo a las definiciones estándar.Resultados: Se incluyeron 76 pacientes, 19 (25%) de los cuales teníanantecedentes psiquiátricos. La incidencia de trastornos psiquiátricos fue del33% (n = 25). El pico de resultados anormales en los test fue en la semana12. El 43% alcanzó RVS, sin diferencias entre ambos grupos (p > 0,05). Laadherencia (96,0% y 96,8%, p > 0,05) y RVS (39% y 52%, p > 0,05)fueron similares en ambos subgrupos con y sin trastornos.Conclusiones: Los trastornos psiquiátricos no tuvieron impacto en la adherenciay la RVS. El seguimiento multidisciplinar durante el tratamiento de la hepatitisC crónica (HCC) puede contribuir a la detección precoz y manejo de lostrastornos psiquiátricos y a mejorar la atención integral del paciente. ",24951901,Abordaje multidisciplinar como modelo de detección y seguimiento de la moribilidad psiquiátrica en pacientes en tratamiento con interferón de la moribilidad psiquiátrica en pacientes en tratamiento con interferón y ribavirina.
1239,,24629806,Trastornos de conducta alimentaria y atención primaria: el desafío de las nuevas tecnologías.
1240,,24661346,Crisis económica y salud mental. Informe SESPAS 2014.
1241,"Antecedentes: el hostigamiento y el maltrato son conductas intimidantes persistentes que se ejercen contra una persona; en la práctica médica, son aceptadas y justificadas en todos los niveles de la formación y propias de la cultura hospitalaria. Objetivo: conocer la frecuencia del acoso y algunos factores relacionados en médicos residentes de la Ciudad de México. Material y métodos: estudio longitudinal en el que participaron 260 residentes de las especialidades médicas de cirugía, medicina interna, ginecología y obstetricia y pediatría de tres hospitales generales de la Ciudad de México. Se realizaron dos evaluaciones con seis meses de diferencia utilizando el Leymann Inventory of Psychological-Terrorization (LIPT-60). Resultados: la comparación entre la primera y la segunda aplicación no mostró cambios en ninguna de las medidas de acoso. Del total de residentes, 256 (98.5%) manifestaron haber sufrido por lo menos una conducta de acoso durante los últimos seis meses, con una intensidad promedio de 1.4 (DE ± 0.5), sin diferencias entre hombres y mujeres. Las mujeres calificaron más alto en la escala de bloqueo de la comunicación que los hombres. Las conductas de acoso con promedios más altos fueron la intimidación manifiesta y el desprestigio laboral. La especialidad de ginecología y obstetricia tuvo los puntajes más elevados en todas las medidas de acoso. El hospital influyó sobre los reportes de esta conducta. Conclusiones: las formas de acoso con los puntajes mayores fueron: el demérito del trabajo, amenazas verbales, gritos o ridiculización. La alta frecuencia de acoso dentro de la formación de los médicos residentes amerita atención. ",25238471,Experiencias de maltrato y hostigamiento en médicos residentes.
1242,,24480289,Calidad de vida relacionada con la salud y trasplante renal: comparación con los valores poblacionales a los 6 meses postrasplante.
1243,,24968055,Utilidad de la prueba de la nitrato reductasa para la detección rápida de resistencia en Mycobacterium tuberculosis.
1244,,26574964,Evaluación del programa de mantenimiento con metadona del Hospital Mental de Risaralda.
1245,,26574962,Prevalencia de variantes en el gen de la apolipoproteína E (APOE) en adultos de la población general del área urbana de Medellín (Antioquia).
1246,,26574960,Prevalencia de abuso y dependencia de alcohol en adultos con fobia social en Medellín.
1247,,23768464,Impacto de la conducta suicida en el trastorno delirante: descripción de una serie de 44 casos.
1248,,25153978,"Viajeros, locos, errantes."
1249,,24913755,Patologías urológicas más frecuentemente implicadas en las reclamaciones por responsabilidad profesional médica.
1250,,24913749,Valoración forense del riesgo de violencia.
1251,,26573256,Evaluación objetiva del procesamiento de las emociones. Estudio de un caso forense.
1252,,24930080,Daño orgánico y síndrome cardiorrenal en la insuficiencia cardíaca aguda.
1253,,24913754,Procedimientos quirúrgicos objeto de reclamación por presunto defecto de praxis.
1254,,24913750,Aspectos medicolegales de la contención física y farmacológica.
1255,,26573251,"Factores asociados al abandono temprano del tratamiento de trastornos por uso de sustancias en una institución de Medellín, Colombia."
1256,,26576465,Tratamiento con intervenciones psicoterapéuticas en la fase aguda y de mantenimiento del paciente adulto con diagnóstico de esquizofrenia.
1257,,26576463,Prevención y tratamiento de los efectos adversos agudos más frecuentes por el uso de antipsicóticos en pacientes adultos con diagnóstico de esquizofrenia.
1258,,26576461,Tratamiento con antipsicóticos de depósito del paciente adulto con diagnóstico de esquizofrenia.
1259,,26576459,Tratamiento con antipsicóticos en la fase aguda del paciente adulto con diagnóstico de esquizofrenia.
1260,,25927885,Síndrome de piernas inquietas: una amenaza a la calidad de vida.
1261,,24210519,Satisfacción y utilidad percibidas por pacientes y familiares acerca de la información sobre prevención de suicidio.
1262,,23562530,Adopción y alteraciones de conducta en la adolescencia. Estudio en población hospitalaria.
1263,,24618233,Medicina académica y medicina asistencial.
1264,,24504991,"Comorbilidad entre trastorno obsesivo-compulsivo y esquizofrenia: prevalencia, teorías explicativas y estatus nosológico."
1265,,26576466,Modalidades de atención para el paciente adulto con diagnóstico de esquizofrenia en fase aguda y de mantenimiento.
1266,,26576464,Tratamiento con intervenciones psicosociales en la fase aguda y de mantenimiento del paciente adulto con diagnóstico de esquizofrenia.
1267,,26576462,Tratamiento farmacológico del paciente adulto con diagnóstico de esquizofrenia que presenta conducta violenta o agitación.
1268,,26576460,Tratamiento con antipsicóticos de mantenimiento del paciente adulto con diagnóstico de esquizofrenia.
1269,,24547631,Reflexiones sobre la relación terapéutica y su práctica asistencial en enfermería de salud mental.
1270,,26573121,"Respuesta a ""Comments on the Use of Agomelatine in the Treatment of Depressive Disorder According to Clinical Guidelines in Colombia""."
1271,,24715011,"La carga de enfermedad, lesiones, factores de riesgo y desafíos para el sistema de salud en México."
1272,"Contribucion genetica, ambiental y epigenetica en la susceptibilidad a los trastornos del espectro autista. Introduccion. Los trastornos del espectro autista (TEA) son condiciones neuropsiquiatricas comunes y complejas en las que estan involucrados diversos factores. Objetivo. Revisar el conocimiento actual sobre los posibles factores de riesgo para los TEA. Desarrollo. Se investigo sobre factores potenciales de riesgo para los TEA, y se recabo informacion sobre trastornos y genes en las bases de datos de Medline, OMIM y Ensembl. Conclusiones. En los TEA se presenta una notoria heterogeneidad genetica y probablemente distintos modos de transmision. Ademas, muchos casos se asocian con mutaciones de novo o con alelos raros con un efecto probablemente importante. La heredabilidad en estos trastornos puede ser menor a la estimada anteriormente. Una fraccion de esta puede ser explicada por alelos relativamente comunes con un efecto debil. El ambiente perinatal y posnatal, la epigenetica, la edad del padre y, posiblemente, la de los abuelos varones cuando nacieron sus respectivos hijos son relevantes en los TEA. Estos ultimos podrian relacionarse con el desarrollo y la conectividad de las sinapsis, la neurotransmision, la señalizacion, la neuroplasticidad y la expresion genetica. Diversos tipos de estudios han contribuido a entender la etiologia de los TEA. Los estudios de enlace genetico y asociacion no son apropiados cuando hay mutaciones nuevas con efecto importante. Finalmente, el incremento en la prevalencia de los TEA podria deberse a una mayor conciencia sobre los trastornos, a cambios en los criterios diagnosticos y exposiciones ambientales, a modificaciones epigeneticas y a un numero creciente de mutaciones de novo que incrementan el riesgo a los trastornos. ",24288105,"Contribucion genetica, ambiental y epigenetica en la susceptibilidad a los trastornos del espectro autista."
1273,"Pensamos que los modelos matemáticos, como la regresión lineal, son conceptos que solo atañen a quienes se dedican a investigar, noción que dista de la realidad. La primera descripción de un modelo matemático fue realizada por Legendré, en 1805, y la introducción formal del término fue hecha por Galton, en 1886. La regresión lineal es útil para predecir la relación entre dos o más variables, siempre y cuando la variable dependiente sea cuantitativa y cuente con una distribución normal. Su desarrollo tiene como primer objetivo determinar la pendiente o inclinación de la línea de regresión: Y = a + bx, donde ""a"" es la ""constante de regresión"" que equivale al valor de ""Y"" cuando ""x"" es igual a 0 y ""b"", también llamada pendiente de la recta, indica el incremento o decremento que se produce en ""Y"" cuando la variable ""x"" aumenta o disminuye una unidad. En la línea de regresión, ""b"" recibe también el nombre de coeficiente de regresión. El coeficiente de determinación (R ",24290018,Investigación clínica XVIII. Del juicio clínico al modelo de regresión lineal.
1274,,24276181,Factores que predicen depresión en estudiantes de medicina.
1275,,24144061,Reacciones adversas de medicamentos relacionadas con el abuso y formas farmacéuticas disuasorias.
1276,,24011716,Trastorno de pánico y fibrilación auricular.
1277,,23891130,Guía de práctica clínica sobre el trastorno bipolar: tratamiento farmacológico y psicosocial.
1278,,24312923,"Condiciones, controversias y contradicciones entre el síndrome sensitivo central y la depresión."
1279,,26572949,Síndrome metabólico y trastorno afectivo bipolar: una revisión de la literatura.
1280,,26572943,El compromiso debe ser de todos.
1281,,26572946,Validación de la escala Schizophrenia Quality Of Life Scale (SQLS) para medir la calidad de vida en pacientes con diagnóstico de esquizofrenia en Colombia.
1282,,23764394,Efectividad de un programa de estiramientos sobre los niveles de ansiedad de los trabajadores de una plataforma logística: un estudio controlado aleatorizado.
1283,,23884614,Traducción al español y validación de la Escala de Placer Snaith-Hamilton para Anhedonia (SHAPS).
1284,,23884612,Factores asociados al ingreso hospitalario y evaluación de un programa de gestión de casos para trastorno mental grave mediante un estudio de cohortes históricas.
1285,"Antecedentes: en países como Estados Unidos y las naciones europeas se han propuesto cambios a la estructura asistencial y académica de los médicos especialistas en formación que proponen transformaciones a las normas relativas al número de horas que trabajan a la semana los residentes. El argumento principal que sustenta esas transformaciones se basa en el supuesto de que las horas de trabajo excesivas (más de 16 horas ininterrumpidas) provocan alteraciones cognitivas y psicomotrices en los residentes. Objetivo: evaluar la asociación entre la privación de sueño y las habilidades cognitivas y psicomotoras de una muestra de residentes de diferentes especialidades médicas. Material y métodos: estudio longitudinal, con mediciones pre y post guardia, en 31 residentes de Medicina. Se midieron las variables de: habilidades cognitivas y psicomotoras, datos sociodemográficos y de condiciones de guardia, calidad de sueño y psicopatología. resultados: 81% de los residentes tuvo detrimento en, al menos, una de las pruebas realizadas; sin embargo, en los resultados de las habilidades psicomotoras y en la maniobra de reanimación cardiopulmonar básica se encontró una diferencia significativa en los momentos pre y post guardia con mejoría en las puntuaciones. Conclusiones: la privación de sueño disminuye las habilidades cognitivas y psicomotoras. Si bien nuestros resultados no son generalizables, pueden constituir un precedente para fundamentar posibles cambios referentes a las guardias en las residencias médicas. ",25063897,"Efectos de la privación de sueño en las habilidades cognitivas, psicomotoras y su relación con las características personales de los médicos residentes."
1286,,26572820,Abuso sexual infantil: ¿territorio omitido o inadvertido en Colombia?
1287,,26572809,Las buenas nuevas.
1288,,23912537,Impacto de los trastornos psiquiátricos comunes y las condiciones crónicas físicas en el individuo y la sociedade.
1289,,23478015,Evaluación del sufrimiento en la demencia avanzada.
1290,,23698173,Evaluación del sistema de salud mental en México: ¿hacia dónde encaminar la atención?
1291,,14635594,Delirium: la confusión de los clínicos.
1292,,18815907,Prevalencia clínica y motivo de consulta en pacientes con trastorno de ansiedad generalizada atendidos en consultas ambulatorias de psiquiatría en España. Resultados del estudio LIGANDO.
1293,,23900362,"Soledad, impulsividad, consumo de alcohol y su relación con suicidalidad en adolescentes."
1294,,24251299,El concepto de identidad personal.
1295,,24892665,Validación para Colombia de la escala CRAFFT para tamización de consumo de sustancias psicoactivas en adolescentes.
1296,,26572711,"Factores relacionados con la carga de discapacidad en personas con intento de suicidio, atendidas en la red pública de servicios de salud de Santiago de Cali."
1297,,24251296,Apuntes sobre el acontecer adolescente actual y su relación con las Tribus Urbanas.
1298,,23652192,El Infierno de Peredo: un médico y traductor mexicano del siglo XIX.
1299,,26572720,Presentación atípica de un hipertiroidismo inducido.
1300,,26572718,"Autonomía, confianza y ética médica en la obra de Onora O'Neill."
1301,,26572712,"Caracterización sociodemográfica, del desarrollo psicosexual y del delito en hombres condenados por delitos sexuales recluidos en el centro penitenciario de Manizales."
1302,,22657871,Impacto de la nueva legislación sobre tabaquismo (Ley 42/2010) en los niveles de humo ambiental de tabaco en locales de hostelería.
1303,,23732491,Características del empleo y bienestar subjetivo en médicos de la Región Metropolitana.
1304,,23446729,Neuroanatomia del trastorno por deficit de atencion/hiperactividad en el adulto: hallazgos de neuroimagen estructural y funcional.
1305,,23745442,MVlidación concurrente en población mexicana universitaria de la escala de autorreporte de TDAH en el adulto de la Organización Mundial de la Salud.
1306,,23435074,Estilo de vida en adultos mayores y su asociación  con demencia.
1307,,23370260,Las drogas y la salud pública: ¿hacia dónde vamos?
1308,,26574116,"Familia, suicidio y duelo."
1309,,26574110,Factores asociados con intento de suicidio y comportamientos de autolesión no suicida en pacientes con trastornos del comportamiento alimentario.
1310,,26574108,Evaluación del riesgo de suicidio en la guía de práctica clínica para diagnóstico y manejo de la depresión en Colombia.
1311,,24626703,Indicadores de bienestar y desarrollo infantil en México.
1312,,23748940,Estudio Madrid sobre prevalencia y características de los pacientes con patología dual en tratamiento en las redes de salud mental y de atención al drogodependiente.
1313,,23732201,Dificultades del sueño y síntomas psicológicos en estudiantes de medicina de la ciudad de México.
1314,,23487282,Efectividad del ejercicio físico como intervención coadyuvante en las adicciones: una revisión.
1315,,23370261,Depresión: estado del conocimiento y la necesidad de políticas públicas y planes de acción en México.
1316,,26574117,Suicidio en el anciano.
1317,,26574115,"Depresión y satisfacción con la vida en personas mayores de 60 años en Bogotá: Encuesta de Salud, Bienestar y Envejecimiento (SABE)."
1318,,26574111,Factores de riesgo para ideación suicida en pacientes con trastorno depresivo en Colombia.
1319,,26574109,Caracterización de noticias sobre suicidio en medios impresos en Colombia.
1320,,24626702,Violencia interpersonal en jóvenes mexicanos y oportunidades de prevención.
1321,,26572274,A propósito de un caso de autoamputación peneana.
1322,,26572268,"Plan de implementación de dos Guías de Práctica Clínica (GPC) contenidas en las Guías de Atención Integral (GAI) en el Sistema General de Seguridad Social en Salud de Colombia: A) ""Detección temprana del episodio depresivo y trastorno depresivo recurrente en adultos. Atención integral de los adultos con diagnóstico de episodio depresivo o trastorno depresivo recurrente (GPC-depresión)"". B) ""Detección temprana, diagnóstico y tratamiento de la fase aguda de intoxicación de pacientes mayores de 18 años con abuso o dependencia del alcohol (GPC-alcohol)""."
1323,,26572266,"Guía de práctica clínica para la detección temprana, diagnóstico y tratamiento de la fase aguda de intoxicación de pacientes con abuso o dependencia del alcohol: Parte I: Tamización, detección temprana y factores de riesgo en pacientes con abuso o dependencia del alcohol."
1324,,26572264,"Guía de atención integral para la detección temprana y diagnóstico del episodio depresivo y trastorno depresivo recurrente en adultos. Atención integral de los adultos con diagnóstico de episodio depresivo o trastorno depresivo recurrente: Parte II: Aspectos generales del tratamiento, manejo de la fase aguda, continuación y mantenimiento del paciente con diagnóstico de depresión."
1325,,23677229,Estudio multicéntrico para la validación de la versión en español del Eating Disorder Diagnostic Scale.
1326,,26572269,Polaridad predominante en pacientes bipolares tipo I: Estudio en una población aislada con alta prevalencia de trastornos de ánimo.
1327,,26572267,"Guía de práctica clínica para la detección temprana, diagnóstico y tratamiento de la fase aguda de intoxicación de pacientes con abuso o dependencia del alcohol: Parte II: Evaluación y manejo de los pacientes con intoxicación aguda por alcohol."
1328,,26572265,"Guía de atención integral para la detección temprana y diagnóstico del episodio depresivo y trastorno depresivo recurrente en adultos. Atención integral de los adultos con diagnóstico de episodio depresivo o trastorno depresivo recurrente: Parte III: Tratamiento de la depresión resistente y la depresión con psicosis, tratamiento con terapia ocupacional y hospital día."
1329,,26572263,"Guía de atención integral para la detección temprana y diagnóstico del episodio depresivo y trastorno depresivo recurrente en adultos. Atención integral de los adultos con diagnóstico de episodio depresivo o trastorno depresivo recurrente: Parte I: Factores de riesgo, tamización, diagnóstico y evaluación de riesgo de suicidio en pacientes con diagnóstico de depresión."
1330,,23979550,Detección de síntomas depresivos durante el postparto inmediato y el seguimiento a largo plazo: estabilidad temporal y factores asociados.
1331,,23677186,Trastorno por déficit de atención e hiperactividad en niños aymara: primera aproximación clínica.
1332,,23254719,Impactos de la globalización en la salud mental.
1333,,23111994,Déficit cognitivo en la esquizofrenia: MATRICS Consensus Cognitive Battery.
1334,,22841467,Síndrome metabólico en pacientes esquizofrénicos con tratamiento antipsicótico.
1335,,23979553,"Diabetes, alexitimia y depresión."
1336,,23593781,Factores psicosociales que predicen síntomas de ansiedad posnatal y su relación con los síntomas depresivos en el posparto.
1337,,23318896,Índice de riesgo para el intento suicida en México.
1338,,23559293,Actualización en lupus neuro-psiquiátrico con énfasis en déficit cognitivo.
1339,,31042240,Síndrome de Rapunzel gigante con complicación atípica. Reporte de un caso.
1340,"Encefalitis antirreceptor de NMDA. Diagnostico y tratamiento precoz en pacientes con sintomatologia psicotica aguda-subaguda. Introduccion. La encefalitis por anticuerpos antirreceptor de NMDA es una entidad aguda y grave, cuya rapida identificacion y tratamiento puede comportar recuperaciones sin secuelas. Es mas prevalente en mujeres jovenes y a menudo esta asociada a un tumor subyacente. Los sintomas iniciales son habitualmente psiquiatricos y en dias o semanas adquieren el perfil neurologico caracteristico. Casos clinicos. Tres mujeres, de 17, 23 y 35 años, que ingresaron en el Servicio de Psiquiatria con clinica psicotica aguda. La mala respuesta a los antipsicoticos, las fluctuaciones del nivel de conciencia, la disautonomia y las crisis epilepticas fueron los sintomas que despertaron la sospecha clinica. El liquido cefalorraquideo mostro leve pleocitosis y positividad para los anticuerpos antirreceptor de NMDA en todas las pacientes. Solo una mostro alteraciones en la resonancia magnetica cerebral, y dos, el patron electroencefalografico extreme delta brush. En todas se diagnostico un teratoma ovarico, que fue resecado antes del mes. Dos se recuperaron sin secuelas y la tercera, a los seis meses del alta, presenta secuelas cognitivas. Conclusiones. Los casos descritos comenzaron con clinica psicotica aguda. La evolucion psiquiatrica atipica y la clinica neurologica alertaron de la posibilidad de una encefalitis. El reconocimiento de la enfermedad y la coordinacion entre servicios es fundamental para un diagnostico y tratamiento precoz. El analisis sistematico de liquido cefalorraquideo en pacientes con un primer episodio psicotico agudo-subagudo contribuiria a adelantar el diagnostico. En mujeres jovenes hay que buscar siempre un teratoma ovarico u otro tumor asociado. ",30560985,Encefalitis antirreceptor de NMDA. Diagnostico y tratamiento precoz en pacientes con sintomatologia psicotica aguda-subaguda.
1341,,23559284,Variación de alelos del gen receptor de dopamina DRD4 en escolares chilenos de diferente origen étnico y su relación con riesgo de déficit atencional/hiperactividad.
1342,,23282267,Zolpidem de liberación modificada para insomnio crónico. Eficacia y seguridad.
1343,,23128891,El médico imperial antes y después del Imperio.
1344,,26572120,Brote psicótico agudo y rabdomiólisis tras el uso de lovastatina.
1345,,26572116,Depresión en pacientes con degeneración macular relacionada con la edad.
1346,,26572112,Crianza y sexualidad de hijos de mujeres prostitutas marginales del centro de Bogotá.
1347,,26572108,Las infidelidades: aprendiendo desde dentro de las conversaciones terapéuticas.
1348,,29032844,La adherencia familiar en el trastorno mental grave.
1349,,23296226,Estudio descriptivo de la transexualidad en Navarra.
