,abstract,id,title
0,,29754706,Comités de ética y salud mental.
1,,27842739,Psiquiatria y biopolítica en el escenario de la guerra: comprender el conflicto para construir el post conflicto.
2,,27842737,"Pensar, practicar y escribir: la revista colombiana de psiquiatría y la historia de la psiquiatría colombiana en la segunda mitad del siglo xx."
3,,30314812,"Estadificación clínica en los trastornos mentales graves: trastorno bipolar, depresión y esquizofrenia."
4,,30785981,Objetos perdidos. El territorio de estudio y acción de la psiquiatría.
5,,30785979,Pigliatría (o qué nos enseña Ricardo Piglia a los psiquiatras). Apuntes para una psiquiatría basada en narraciones.
6,,30785980,Cerebro y mente: ¿disidencia o subordinación? Apuntes para una lectura epistemológica.
7,,30286847,Trastornos psiquiátricos secundarios a enfermedades neurometabólicas.
8,,29317210,"Indicadores de calidad en el tratamiento de pacientes con depresión, trastorno bipolar o esquizofrenia. Estudio de consenso."
9,,29037462,El suicidio en Castellón entre 2009 y 2015: ¿ayudan los factores sociodemográficos y psiquiátricos a entender las diferencias entre los ámbitos urbano y rural?
10,,30778406,Impacto emocional y cambios en la conducta profesional a causa del suicidio de pacientes.
11,,30605198,Un breve recorrido histórico acerca del concepto de paranoia.
12,,27993255,"Prevalencia y factores asociados a trastornos mentales en la población de niños colombianos, Encuesta Nacional de Salud Mental (ENSM) 2015."
13,,26651326,Detección precoz de la enfermedad psicoemocional en dermatología.
14,,28282086,La razón narrativa: apuntes de psiquiatría y narrativa.
15,,28225842,El caso Ximenes Lopes vs Brasil. La psiquiatría y el derecho internacional de los derechos humanos en la vida real.
16,,28199439,"El hiato órgano-clínico en la actualidad. Algunas reflexiones acerca de las neurociencias, la psicopatología y la clínica psiquiátrica en el comienzo del Siglo XXI."
17,,26896397,La psiquiatria colombiana: un compromiso de todos.
18,,26298396,La psiquiatría y el nuevo baremo de tráfico.
19,,26572950,¿Trastorno esquizotípico o esquizofrenia? Evaluación de la responsabilidad penal en un caso de parricidio.
20,,28763085,El Dr. Raúl González Enríquez y la fundación de la Asociación Psiquiátrica de América Latina.
21,,25546645,¿Estamos (los psiquiatras infantiles) patologizando la infancia?
22,,25153981,Aplicación de una red social a la práctica y el aprendizaje de la psiquiatría.
23,,29522594,Las mujeres somos humanas: breve guía sobre el Derecho Internacional de los Derechos Humanos para psiquiatras.
24,,29522624,Nosologías y nosografías psiquiátricas argentinas.
25,,24251293,Palabras que no se lleva el viento. Identidad y diagnóstico en psiquiatría.
26,,27325257,Nivel formativo sobre trastornos del espectro autista (TEA) entre los pediatras de atención hospitalaria.
27,,26572122,Esquizofrenia y trasplante hepático: reporte de un caso.
28,,26572579,Evaluación de un sistema de evaluación del aprendizaje en psiquiatría.
29,,26572577,Evaluación en educación médica.
30,,26572575,Uso de pacientes simulados en psiquiatría.
31,,27282590,SERP: una Sociedad en crecimiento y con horizonte europeo.
32,,29522613,Experiencia de una sala de internación de psiquiatría en un hospital pediátrico de la provincia de Córdoba (Argentina): entre cambios epidemiológicos y legislativos.
33,,30785977,Filosofía y Psiquiatría.
34,,30785982,¿Los datos masivos serán el futuro de la psiquiatría?
35,,30785978,Antropología clínica: entre la Filosofía de la Psiquiatría y las Ciencias Humanas.
36,,30017038,Lo visible y lo menos visible en el padecimiento de un trastorno conversivo en niños y adolescentes. Un estudio cualitativo sobre los modelos explicativos de la enfermedad que ofrecen los cuidadores de niños y adolescentes con trastorno conversivo.
37,,28890233,¿Qué haría usted ante un paciente musulmán con trastorno conversivo?
38,,26573502,Del principio de beneficencia al principio de autonomía: aproximación a la evaluación de la competencia mental de los pacientes en el hospital general.
39,,23677199,José Juan Bruner (1825-1899): una estrella fugaz en la historia de la psiquiatría chilena.
40,,27569007,AVANCES EN MOMENTOS DE CRISIS.
41,,30605181,Psiquiatría y obesidad.
42,,28641960,Internamiento no voluntario del paciente psiquiátrico: normas legales y aspectos críticos.
43,,26572568,Percepción de la psiquiatría en estudiantes de pregrado de una facultad de medicina.
44,,30605192,"""Big data"" y psiquiatría."
45,,29625890,Lo que no muestran las revistas de psiquiatría más influyentes.
46,,29522598,"Vincenzo Chiarugi. La Pazzia, sus géneros y especies: obra fundacional de la Psiquiatría Moderna."
47,,26578469,Invitación a renovar vínculos.
48,,26896400,"Caracterización sociodemográfica, psicopatológica y terapéutica en la primera década de servicio (1958-1968) del Hospital Psiquiátrico San Isidro del Valle del Cauca."
49,,29522630,No hay psiquiatría sin historias. Apuntes preliminares.
50,,22432097,La interconsulta y las actividades de enlace en el Hospital General: estrategias para su efectividad.
51,,21953359,Un lustro de investigaciónpsiquiátrica (2004-2009): análisisde un departamento universitario.
52,,28596125,Biomarcadores en Psiquiatría: entre el mito y la realidad clínica.
53,,29522611,El saber clínico como saber antropológico: reflexiones en torno al pacto de cuidado.
54,,27132761,Manejo integral del paciente con esquizofrenia: más allá de los psicofármacos.
55,,27992050,Los simuladores: verdad y poder en la psiquiatría de José Ingenieros.
56,,28327856,Relaciones interinstitucionales para la salud centrada en la persona.
57,,27992051,Viajes y redes profesionales en los orígenes del alienismo español.
58,,27992049,"El tratamiento de la locura entre los siglos XIX y XX: los discursos sobre la cura en la medicina mental española, 1890-1917."
59,,28282075,Psiquiatría y genética: un enlace para enfrentar la incertidumbre.
60,,25498853,Tendencias y necesidad clínica de los principios éticos.
61,,28282076,Conceptos farmacogenómicos aplicados a Psiquiatría.
62,,28282072,Genética y Psiquiatría.
63,,29463449,Oportunidades colaborativas para los médicos residentes y psiquiatras jóvenes en Europa: el Early Career Psychiatrists Committee de la European Psychiatric Association.
64,,28282082,Narrativas en Psiquiatría.
65,,27598494,"Importancia de la interacción social en la retroalimentación, según residentes de Psiquiatría."
66,,28225847,Kurt Goldstein: El concepto de estructura en Neurología y Psiquiatría.
67,,28225846,"Platón psiquiatra, Foucault platónico."
68,,28225840,Historiografías: de la psiquiatría en Brasil y sus instituciones.
69,,21218210,Algunas reflexiones en torno a la corriente de Psiquiatría basada en evidencias y su impacto en la Psiquiatría contemporánea.
70,,28199423,"Perfil de pacientes ambulatorios atendidos por la Residencia de Psiquiatría del HIGA ""Prof. Dr. R. Rossi"" de La Plata."
71,,25418657,Educación psiquiátrica y componentes culturales en la formacion del médico: perspectivas latinoamericanas.
72,,26578420,Elucidación epistémica e histórica del trastorno de la personalidad límite o borderline.
73,,28199433,Filosofía y epistemología en la psiquiatría de la transparencia.
74,,27089168,La Psiquiatría Clásica Francesa: el delirio de interpretación de Sérieux y Capgras.
75,,26573257,Intersubjetividad: entre explicación y comprensión.
76,,26672504,La investigación en psicofarmacología.
77,,25959401,La medicina personalizada aplicada a la salud mental: la psiquiatría de precisión.
78,,21888284,"Instituto Nacional de Psiquiatría ""Ramón de la Fuente Muñiz""."
79,,26716180,PSIQUIATRÍA Y VIH. UN CAMPO QUE RECLAMA SU LUGAR. Coordinacíon.
80,,26650560,Psiquiatría en debate. Una revisíon de tendencias críticas actuales en la literatura de origen anglosajón.
81,,26650408,Impacto del envejecimiento en la psiquiatría.
82,,26578221,¿Los trastornos mentales son clases naturales?
83,,26323108,Hábitos prescriptivos en el tratamiento de la esquizofrenia.
84,,26574961,Trastornos psiquiátricos en pacientes pediátricos con lupus eritematoso sistémico en un hospital de referencia.
85,,22595254,Confidencialidad en las historias clínicas informatizadas en salud mental hospitalaria.
86,,24996401,¿Qué aportan a la Psiquiatría los estudios en cerebro post mórtem?
87,,25546539,Suicidio y Psiquiatría.
88,,25153980,"Institución, subjetividad y psiquiatría."
89,,25153976,Psiquiatría y cultura.
90,,24887365,Aproximándose al DSM-5: ¿un avance en psiquiatría?
91,,27386673,LUCES Y SOMBRAS DE LA NOSOLOGÍA PSIQUIÁTRICA.
92,,24887374,Las Clasificaciones en Psiquiatría: de Praxeos Medicae al DSM-I.
93,,24887366,Research Domain Criteria (RDoC). Marco político y contenido.
94,,19954092,"Historia del desarrollo del Departamento de Psiquiatría de la Universidad de Puerto Rico, Recinto de Ciencias Médicas."
95,,19267266,El médico psiquiatra latinoamericano: su perfil y su grado de satisfacción con la especialidad.
96,,30785967,"Salud Mental en Hospitales Generales de la ciudad de Rosario y del Gran Rosario, Argentina."
97,,21218209,"¿Qué es la ""Evidencia"" en la Psiquiatría?"
98,,30778424,Condiciones laborales de los psiquiatras en Argentina.
99,,30778410,Psicogénesis: ¿concepto central de las disciplinas de la mente?
100,,30778411,III Coloquio de Bonneval: Ey y Lacan discuten sobre la realidad de la enfermedad mental.
101,,24255906,Psiquiatría y neuroética.
102,,24255904,El cine como dispositivo de enseňanza de lo complejo en Salud Mental.
103,,24255902,La formación actual de especialistas en psiquiatría: un desafío epistemológico.
104,,24255900,Acreditaciones demoradas. Proyecto de intervención en una cátedra de Clínica Psiquiátrica: PiACLiP.
105,,24255898,Vigencia del enfoque existencialista en psiquiatría.
106,,24251301,"Nerio Rojas: psiquiatría, política y cultura. Un trabajo sobre Medicina Legal con menores."
107,,18592048,La conciencia en psiquiatría.
108,,21898968,Conceptos clínicos asociados a la subestimación del litio en el tratamiento del Trastorno Bipolar.
109,,18075982,Los vaivenes de la psiquiatría.
110,,23923142,Antropología y psiquiatría.
111,,23269970,"Métodos cualitativos en psiquiatría: utilización del ""relato de vida"" para el estudio del suicidio en la vejez."
112,,21437371,Aportaciones de dos clasificaciones psiquiátricas latinoamericanas para el desarrollo de la CIE-11.
113,,23170302,Farmacogenética en psiquiatría: ¿qué tan lejos estamos de su aplicación clínica?
114,,29522625,Pinel en las Pampas: primer diagnóstico psiquiátrico en la era independiente.
115,,29522623,Análisis comparativo sobre las características de las internaciones en una sala de Salud Mental en un hospital general de agudos.
116,,26572572,La pertinencia social y el posgrado en psiquiatría.
117,,26572566,Aspectos conceptuales de la enseñanza de la psiquiatría en Colombia.
118,,21505642,La evaluación de trastornos mentales y de capacidad laboral en juntas psiquiátricas.
119,,23282619,Telepsiquiatría: una revisión sistemática cualitativa.
120,,29522639,Ludwig Binswanger. La locura como fenómeno biográfico en la totalidad de la existencia.
121,,29522627,"Los psiquiatras argentinos y la investigación. Encuesta sobre conocimiento, actitudes y prácticas."
122,,28728795,Artifex spondet peritiam artis (El artesano responde de su arte).
123,,28483175,Costo-efectividad de telepsiquiatría sincrónica frente a asincrónica para personas con depresión privadas de la libertad.
124,,28363860,Person centered-care y recovery: ¿pueden servir para alcanzar una asistencia sanitaria más humana?
125,,27887920,Valoración del daño corporal en el trastorno orgánico de la personalidad.
126,,21570746,Las primeras sociedades neurológicas catalanas y sus protagonistas.
127,,23286543,Acta fundacional de la psiquiatria Chilena. La endemoniada de Santiago.
128,,24294723,El fenómeno anancástico en psiquiatría (anclajes y albures en la vida mental).
129,,22880191,La Salud mental vista desde la perspectiva de la psiquiatría.
130,,17643138,El Curso de Psiquiatría del Consejo de Médicos de la Provincia de Córdoba. Orígenes e historia.
131,,22086426,Patología psicógena en la planta de neurología. Revisión de los últimos 10 años de hospitalización en un servicio de tercer nivel.
132,,22799146,"Fisiopatogenia En Psiquiatría: ¿descubrimiento, construcción o descubrimiento + construcción? El ""caso"" de la depresión."
133,,22799142,Algunas reflexiones en torno a los cambios observados en la Psiquiatría Argentina de los últimos veinte años.
134,,22799147,Recuperación. Un nuevo paradigma para la psiquiatría.
135,,28282085,El diario de formación como estrategia para la reflexión sobre la práctica en la formación inicial y continua de los especialistas en Salud Mental.
136,,22042071,¿A qué llamamos salud y enfermedad mental en pediatría?: una mirada reflexiva sobre los diagnósticos psiquiátricos y su relación con nuevas teorías de subjetivación en el niño.
137,,22645781,"15° Congreso Mundial de psiquiatría nuestro legado y nuestro futuro. 18 al 22 de Septiembre de 2011, Buenos Aires, Argentina."
138,,28225848,Enfoque metodológico para el estudio del desorden del pensamiento esquizofrénico (1939).
139,,27132759,Experiencia pedagógica: escenario de simulación de entrevista psiquiátrica con la participación de actores del grupo de teatro representativo Altergesto.
140,,27132753,La calidad de los psiquiatras en Colombia.
141,,17441282,"Prejuicio y evidencia, oposciones y convergencias en la psiquiatría actual."
142,,22312600,Breve síntesis de la evolución de la psiquiatría en el Uruguay.
143,,22312599,Evolución y situación actual de la historiografía de la psiquiatría en la Argentina.
144,,27299827,Historia de los terrenos de la Casa de Orates de Santiago de Chile.
145,,28199435,La clínica de la subjetividad.
146,,26600194,Procedimiento bioético para la toma de decisiones en salud mental.
147,,22091457,Los primeros aportes de la Psiquiatría a la Medicina Legal en la Argentina.
148,,26966750,La investigación en los psiquiatras en formación de la Ciudad de Buenos Aires.
149,,26672507,"Ernst Kretschmer: Cuerpo, Mente y Dimensión."
150,,26672501,Algunos apuntes sobre el futuro cercano.
151,,26672508,Constitución y Carácter. Investigaciones acerca del problema de la constitución y de la doctrina de los temperamentos (1921).
152,,26353457,José Tiburcio Borda
153,,21218206,Posibilidad y límites del horizonte de comprensión de la Psiquiatría.
154,,26204543,Consideraciones acerca de la conducta suicida de pacientes hospitalizados y responsabilidad del médico tratante.
155,,21218198,Estimulación Magnética Transcraneal y sus aportes a la psiquiatría actual.
156,,26668924,Klaus Conrad: la esquizofrenia incipiente.
157,"Organizacion de las unidades de cefalea desde un punto de vista multidisciplinar. Las unidades de cefaleas surgen ante la necesidad de abordar de forma multidisciplinar el tratamiento de pacientes con dolores de cabeza complejos. A pesar de que las cefaleas son una de las patologias medicas mas prevalentes, es llamativa la poca promocion que existe para su desarrollo. Dentro de la organizacion multidisciplinar, el papel del neurologo debidamente formado en este campo es crucial. Es la persona encargada de recibir, dirigir, supervisar y coordinar el tratamiento, junto con otras especialidades medicas. Se debe contar con la participacion del psiquiatra, del psicologo y del fisioterapeuta como nucleo basico. Su actuacion conjunta y coordinada genera de forma objetiva una mejoria del dolor frente a cada tratamiento de forma aislada. ",26337643,Organizacion de las unidades de cefalea desde un punto de vista multidisciplinar.
158,,25023182,Perspectiva de los psiquiatras españoles respecto a la atención de las demencias. la encuesta PsicoDem.
159,,26323116,Christofredo Jakob: la llegada de la ciencia del cerebro a la Argentina moderna (1899-1956).
160,,21188310,Cien años de psiquiatría.
161,,21188304,Apuntes para un análisis epistemológico de algunos problemas de la psiquiatría contemporánea.
162,,25119249,Las obsesiones antes de Freud: historia y clínica.
163,,25558495,Asociación mundial de psiquiatría (AMP).
164,,20626125,Interfase neurología-psiquiatría en pacientes hospitalizados por patologías del sistema nervioso central.
165,,25237805,Memoria: el pasado nos debe enseñar algo sobre el presente.
166,,25546640,"El concepto de ""comprensión"" (Verstehen) en Karl Jaspers."
167,,25546540,El suicidio de un paciente. Impacto en el psiquiatra.
168,,20011967,Docencia universitaria y psicoanálisis: Los aportes de Ignacio Matte Blanco.
169,,24887363,Aún lo social: crisis en la práctica clínica.
170,,15918082,Estudio bibliométrico comparativo de las publicaciones en psiquiatría españolas y de otros países europeos.
171,,24500544,El campo artístico-cultural en la reforma psiquiátrica brasileña: el paradigma identitario del reconocimiento.
172,,24687360,El Hospital Granja y la Escuela Granja Bernardino Álvarez: antecedentes del Instituto Nacional de Neurología y Neurocirugía.
173,,24260758,Psychopathia sexualis: estudio clínico y forense.
174,,24260757,Richard von Krafft-Ebing: las perversiones sexuales como problema médico y legal.
175,,24255905,Gregorio Bermann y la formación psiquiátrica.
176,,24255901,"El psiquiatra en formación. Reflexiones acerca del comienzo, el tránsito por la formación básica, los puntos sólidos y débiles del sistema formativo."
177,,19954079,50 aniversario Departamento de Psiquiatría Escuela de Medicina-Universidad de Puerto Rico.
178,,19385013,Psiquiatría y derechos humanos: la prioridad es el bien del paciente.
179,,23122479,Análisis de las defunciones de pacientes con demencia ingresados en una unidad de psicogeriatría.
180,,19424523,El tratamiento moral de Pinel en los orígenes de la psiquiatría moderna.
181,,23757800,Investigación y sexenios.
182,,19835027,Problemáticas de género en psiquiatría.
183,,15232747,La psiquiatría en Andalucía. Una lección de creatividad y tolerancia.
184,,22575484,Perspectivas de los pacientes diagnosticados de depresión y atendidos por médicos de familia y psiquiatras.
185,,19618537,"Médicos e loucos no sul do Brasil: um olhar sobre o Hospício São Pedro de Porto Allegre/RS, seus internos e as práticas de tratamento da loucura (1884-1924)."
186,,19142242,Categoría y dimensión en psiquiatría.
187,,19142243,Psicofármacos y teorías etiopatogénicas en Psiquiatría. Del contexto de descubrimiento al obstáculo epistemológico.
188,,23923143,Entrevista a Miguel Mihanovich.
189,,23923141,La aplicación de la psicoterapia fue desde siempre consustancial.
190,,23269973,"Entre la Epidemiología Psiquiátrica y la Antropología Cultural: Fernando Pagés Larraya, un pensamiento singular."
191,,22854607,Las soluciones para los pacientes dependen de que podamos salvar la distancia que separa los enfoques de investigación de ciencias sociales y ciencias naturales en el campo de la salud mental.
192,,15085221,Historia de la psiquiatría en Europa. Modos de hacer historia de la psiquiatría.
193,,15085224,La psiquiatría como ciencia clínica. De Emil Kraepelin al neokraepelinismo.
194,,18368689,Neurología frente a psiquiatría:un pseudoproblema.
195,,18351574,Acerca del reencuentro dela neurología y la psiquiatría.
196,,30473478,"Repetición de conductas suicidas en urgencias psiquiátricas en pacientes sin intentos previos, index y repetidores: un estudio prospectivo."
197,,22849223,"Locura, opinión pública y medicina mental en los orígenes de la España contemporánea."
198,,22880195,La salud en los vínculos.
199,,18075990,Acerca del reencuentro entre la neurología y la psiquiatría. Reflexiones de un viejo neuropsiquiatra.
200,,15529220,Factor de impacto nacional e internacional de Actas Españolas de Psiquiatría.
201,,18075981,Psiquiatría y neurología: neurociencias clínicas.
202,,22799140,"Arribamos así a este, nuestro número 100."
203,,22127912,Análisis de las sentencias judiciales contra psiquiatras resueltas en segunda instancia en España entre 1992 y 2007.
204,,18273423,Algunos problemas de la psiquiatría contemporánea analizados desde la perspectiva bioética.
205,,19845048,Neurosciencias en la Junta para Ampliación de Estudios.
206,,22312598,El Positivismo en Argentina y su proyección en Latinoamérica.
207,,22312601,Historia de la asistencia psiquiátrica en Brasil: el caso de la Colonia Juliano Moreira (1940-1954).
208,,17643140,"Etica, Inequidad, Pobreza y Derechos Humanos en Psiquiatría. Sus implicancias en la formación de los especialistas."
209,,20570412,"Fibromialgia: el no diálogo soma-psique, el no diálogo médicos-psiquiatras."
210,,21977610,Sante de Sanctis: las primeras descripciones de psicosis infantiles.
211,,12772037,Declaración de Madrid sobre los requisitos éticos de la práctica de la psiquiatría.
212,,21505644,La desinstitucionalización italiana: pistas y desafíos.
213,,17356722,"Los prejuicios, las mujeres y la psiquiatría. Loca como tu madre."
214,,21395193,Entrevista a David Healy.
215,,20554352,"Opiniones de médicos de atención primaria, psiquiatras y psicólogos acerca de las guías de práctica clínica para la depresión. Un estudio cualitativo exploratorio."
216,,17091165,Cuando las hormigas corretean por el cerebro: retos y realidades de la psiquiatría cultural.
217,,16991021,Análisis de los patrones de prescripción de antipsicóticos en psiquiatría.
218,,16967109,Psiquiatría y Psicoanálisis: diálogo de locos.
219,,21188309,Emil Kraepelin: la consolidación de las enfermedades mentales.
220,,15957018,"""Cuando la leyenda se convierte en hecho, publica la leyenda"". Estudio de campo sobre aspectos éticos de la práctica psiquiátrica en la Argentina."
221,,16602062,"Cerebro, mente y síntoma."
222,,17240638,Sigmund freud y la psiquiatría moderna.
223,,16550244,Los psiquiatras y los hospitales psiquiátricos. Del asilo a la comunidad.
224,,15529222,Variabilidad en la práctica medicopsiquiátrica evaluada mediante el estudio de los reingresos psiquiátricos a corto plazo.
225,,15529221,Polifarmacia en la prescripción de antipsicóticos en consultas de psiquiatría.
226,,19660838,Síntomas psicológicos y conductuales en deterioro cognitivo leve y enfermedad de Alzheimer.
227,,20038985,Epistemología de la época actual y saber psiquiátrico. Las características de la modernidad tardía: post e hiper.
228,,16314903,Una perspectiva histórico-epistemológica del problema ontológico del positivismo. Positivismo y psiquiatría.
229,,19543648,Alto subdiagnóstico del síndrome de piernas inquietas en la consulta ambulatoria neurológica y psiquiátrica.
230,,19434304,Criminalidad y locura: las monomanías de Esquirol.
231,,19434305,"Sobre las enfermedades mentales consideradas en sus aspectos médico, higiénico y médico legal."
232,,19434301,A propósito de la reforma en el Servicio Psiquiátrico Central de Varones (Unidad 20).
233,,19187840,Médicos de familia y psiquiatras ante el paciente con depresión: la necesidad de readecuar enfoques asistenciales y dinámicas organizativas.
234,,19100158,Desacuerdos diagnósticos entre médicos generales y psiquiatras.
235,,19424524,Tratado Médico-Filosófico de la Enajenación Mental o Manía (1801).
236,,19080950,Aceptabilidad y cumplimiento en el uso de los protectores de cadera en ancianos con demencia ingresados en una unidad de psicogeriatría.
237,,15912223,Primero no dañar: el rol de la psiquiatría en la Alemania nazi.
238,,19227942,Charles Ernest Lasègue.
239,,19142248,"De la Alienación a las Enfermedades Mentales en Alemania: Karl Kahlbaum, un pensamiento de cambio."
240,,15693209,Isaac y José Horwitz en la psiquiatría chilena.
241,,15529229,Aproximación histórica al descubrimiento de la reserpina y su introducción en la clínica psiquiátrica.
242,,18997901,Características del trabajo compartido entre psiquiatras y psicoterapeutas en el área metropolitana de la ciudad de Buenos Aires.
243,,18428107,Locos y dementes en la literatura cervantina: a propósito de las fuentes médicas de Cervantes en materia neuropsiquiátrica.
244,,18443669,La psicoterapia en el Hospital General.
245,,20509180,José Ma Villaverde: retrato de un desconocido.
246,,15232753,"Estudios de casos y controles en psiquiatría: causalidad, diseño y advertencias."
247,,12867021,Telepsiquiatría: utopía o realidad asistencial.
248,,15207147,"Actitudes del personal sanitario de atención primaria hacia el enfermo mental, la psiquiatría y el equipo de salud mental."
249,,18273422,¿Es posible pensar una Psico-ética?
250,,18273420,Bioética. Una aproximación a su estatuto epistemológico.
251,,18273418,¿Cómo tratan los psiquiatras argentinos la depresión? Encuesta a una muestra de 402 psiquiatras acerca de sus hábitos prescriptivos para el tratamiento farmacológico.
252,,18273427,"Enrique Pichon Rivière. Médico, Psiquiatra, Psicoanalista, Psicólogo Social (Homenaje in memoriam)."
253,,18273421,Etica: cuestiones y problemas contemporáneos.
254,,11262285,Guía docente en psiquiatría de enlace.
255,,15085223,La noción de epistemología regional en psiquiatría.
256,,15085222,La epistemología y la historia de la psiquiatría.
257,,17643137,Residencias de Salud Mental de la Ciudad de Buenos Aires. Dilemas y avances en su construcción.
258,,17508291,La virtud de aquel precioso bálsamo...: aproximación a El Quijote desde la vertiente de la psicofarmacología.
