,abstract,id,title
163,"Este estudio tiene como objetivo analizar la prevalencia y la asociación entre victimización y consumo de sustancias psicoactivas entre la población universitaria en el sureste de España en una muestra de 543 estudiantes universitarios seleccionados aleatoriamente (405 mujeres y 138 hombres con una media de edad de 22,6 años). Estudio transversal analítico, la recogida de los datos se llevó a cabo por medio de una encuesta anónima que recogía información acerca de victimización y consumo de drogas durante los últimos 12 meses. Los resultados muestran que un 62,2% de los estudiantes había sufrido algún tipo de victimización y un 82,9% había consumido alguna sustancia psicoactiva, con una asociación estadísticamente significativa entre ambas variables analizadas. Además, el análisis de regresión logística mostró que el consumo de sustancias psicoactivas se relacionaba con diferentes tipos de victimización. Nuestros hallazgos confirman la necesidad de implementar programas para prevenir la relación entre victimización y consumo de sustancias. ",27391848,Asociación entre victimización por bullying y consumo de sustancias entre la población universitaria de España.
164,"Comparar la frecuencia y características de las muertes por traumatismo grave prehospitalarias y hospitalarias, así como conocer la capacidad de la gravedad de la lesión asociada a la edad para predecir la muerte y su variación según se incluyan o no las muertes prehospitalarias. Estudio descriptivo, analítico de cohorte retrospectiva realizado en Navarra sobre 918 pacientes politraumatizados atendidos por los servicios médicos de emergencia durante 2010-2013. Se estudió la letalidad por causas y se modeló la predicción de la mortalidad a través de regresión logística para comparar la precisión de los modelos. La mayoría de las muertes fueron prehospitalarias. Tres cuartas partes de las muertes ocurrieron en el ámbito prehospitalario en menores de 65 años. Al incorporar las muertes prehospitalarias las tasas de letalidad de los mecanismos relacionados con el tráfico pasaron del 16 al 42% y las producidas por armas del 13 al 70%. Al realizar la predicción del fallecimiento a través de la regresión logística tomando como variable independiente el NISS (New Injury Severity Score) y como variable de control la edad, existen mínimas variaciones si se compara el grupo de pacientes que llegan vivos al hospital con el de la suma de estos pacientes con los fallecidos in situ. Las muertes prehospitalarias constituyen la mayoría de las muertes por traumatismo y difieren en las características principales con los fallecimientos que se producen en el hospital. La incorporación de las muertes prehospitalarias no modifica la capacidad predictiva de mortalidad de un modelo de regresión logística que incluya la edad y el NISS. ",29105450,La importancia de incluir las muertes prehospitalarias en los registros de traumatismo grave y su relación con la letalidad y la capacidad de predicción de la supervivencia.
165,,26481662,Prevalencia de marcadores de los virus de la inmunodeficiencia humana y la hepatitis C en los cadáveres judiciales de Barcelona y Lleida.
166,,26769485,La responsabilidad profesional médica y la seguridad clínica en el ejercicio de la Cirugía Ortopédica y Traumatología.
167,,26541554,Sobre las agresiones a profesionales sanitarios.
168,,26153540,Fiabilidad de los registros electrónicos de prescripción de medicamentos de Atención Primaria.
169,,26769486,Seguridad clínica y reclamaciones por responsabilidad profesional en Cirugía Ortopédica y Traumatología.
170,,27474485,Responsabilidad por pérdida de oportunidad asistencial en patología oncológica maligna en la medicina pública española.
171,,27420141,Eventos traumáticos en la infancia en una poblaciób masculina privada de su libertad: estudio de prevalencia.
172,,27067102,Validación de la versión española del McLean Screening Instrument for Borderline Personality Disorder.
173,,25749624,Tratamiento antidepresivo y asociación con el ingreso urgente en unidades médicas en pacientes de 65 años o mayores.
174,,26896401,"Sensibilidad y especificidad entre la Entrevista Diagnóstica Internacional Compuesta versión 3.0 (World Mental Health, CIDI) con la Evaluación Clínica Estandarizada versión I (SCID-I) en la Encuesta de Salud Mental de la ciudad de Medellín, 2012."
175,,29106094,Sospecha de sumisión química en urgencias: procedimiento de actuación y análisis toxicológico en una serie de casos.
176,,26345174,Análisis de sentencias judiciales relativas a negligencias médicas emitidas contra traumatólogos entre 1995 y 2011.
177,,26298396,La psiquiatría y el nuevo baremo de tráfico.
178,"Introducción: las bebidas refrescantes son cada vez más consumidas por la sociedad. Están compuestas por una gran variedad de sustancias, de las cuales algunas, si se consumen en dosis altas y con elevada frecuencia, pueden provocar efectos negativos. Objetivos: determinar la concentración de cafeína y quinina para comprobar si sus niveles se encuentran por debajo de los máximos permitidos por la reglamentación técnico-sanitaria vigente y calcular la contribución a la ingesta dietética obteniendo la Ingesta Diaria Estimada. Método: se analizaron las concentraciones de cafeína y quinina en las principales marcas comerciales de refrescos, usando para ello la técnica de cromatografía líquida de alta resolución. Resultados: se obtuvieron concentraciones para todas las marcas analizadas, que permitieron estimar la media en cada una. Conclusiones: se ha observado que en ningún caso se superan las concentraciones máximas y que la contribución a la ingesta no genera aparición alguna de reacción adversa. ",26667747,CAFEÍNA Y QUININA EN BEBIDAS REFRESCANTES; CONTRIBUCIÓN A LA INGESTA DIETÉTICA.
179,,26228003,Prevalencia y predictores del consumo de sustancias psicoactivas entre varones en prisión.
180,"Introducción: en estudios observacionales, las dietas vegetarianas se han asociado con menor riesgo de enfermedad cardiovascular y un perfil lipídico más favorable en las personas que siguen estas dietas a largo plazo pero sus efectos a corto plazo son menos conocidos. Objetivo: analizar el efecto a corto plazo en población mediterránea previamente no vegetariana de una dieta vegetariana baja en grasas sobre el perfil lipídico y la glucemia. Métodos: se realizó un estudio de intervención nutricional en 159 voluntarios (42 hombres y 117 mujeres) administrando un patrón de dieta completa lacto-vegetariana baja en grasa (20%). Se proporcionó un menú diario completo en condiciones de régimen de internado estricto durante 15 días. Se realizaron extracciones de sangre en ayunas antes y después de la intervención dietética y se determinó el colesterol total, C-HDL, C-LDL, triglicéridos y glucemia. Se emplearon modelos multivariantes de medidas repetidas. Resultados: tras la intervención dietética se detectaron reducciones estadísticamente significativas en el colesterol total (-17,54 ± 37,14 mg/dl), C-LDL (-9,33 ± 34,29 mg/ dl), C-HDL (-5,32 ± 12,16 mg/dl), y triglicéridos (-18,92 ± 50,50 mg/dl) que permanecieron tras ajustar por edad y sexo. También se produjeron cambios significativos de peso. El ajuste adicional por los cambios en el índice de masa corporal (IMC) restó significación a la disminución de los triglicéridos (P = 0.067). Conclusión: la dieta lacto-vegetariana baja en grasa a corto plazo produce descensos favorables y significativos de colesterol total, C-LDL (independientes de la pérdida de peso) y triglicéridos (mediados por la pérdida de peso). También produjo un descenso esperable de C-HDL al ser reducida en grasa. ",26262711,EFECTOS A CORTO PLAZO EN EL PERFIL LIPÍDICO Y LA GLUCEMIA DE UNA DIETA VEGETARIANA BAJA EN GRASA.
181,,25661465,Implicaciones del consumo de sustancias psicoactivas sobre la salud de hombres privados de libertad.
182,,25639497,Defecto de información en las reclamaciones por responsabilidad profesional médica.
183,"Comparar las tasas de morbimortalidad, el perfil epidemiológico y la supervivencia de los pacientes politraumatizados atendidos en Navarra por el sistema de emergencias en los períodos 2002-2003 y 2010-2012. Estudio observacional, analítico, de dos cohortes de pacientes accidentados con un Injury Severity Score superior a 15 puntos. Se utiliza la regresión logística para identificar las variables involucradas en la mortalidad. Se incluyen 651 pacientes atendidos en el primer periodo y se comparan con los 626 del segundo. La tasa de incidencia descendió de 58,1 a 33,5/100.000 habitantes y año, así como la de mortalidad, que descendió de 30,3 a 15,3. La edad media de los accidentados pasó de 45 (22) a 52 (23) años y se mantuvo su distribución por sexos (75% varones). Disminuyeron los accidentados de tráfico del 44 al 24% y se incrementaron las caídas en ancianos del 9 al 26%. En los últimos años se ha controlado en Navarra el problema de los jóvenes accidentados de tráfico y ha surgido el grupo de ancianos que se caen accidentalmente. Esto puede ralentizar la mejora en las tasas de mortalidad de los politraumatizados y obliga a poner en marcha medidas preventivas en relación con este mecanismo en este colectivo. ",29077310,Cambios durante la última década en la incidencia y las características de los pacientes politraumatizados en Navarra.
184,,26378602,Enseñar Bioética a Estudiantes de Medicina Mediante el Aprendizaje Basado en Problemas (ABP).
185,,25475339,Suicidios y fuentes médico-forenses en España.
186,,24986472,Clusters de casos de suicidio espacio-temporal en la comunidad de Antequera (España).
187,,25643885,Agresiones hacia los médicos durante el servicio social.
188,"Durante los meses de verano, un grupo de niños/as saharauis es acogido por familias españolas con el objetivo de que aprendan una realidad diferente y mejoren su estado de salud. Al revisar las herramientas educativas existentes para este tipo de población infantil dirigidas a las familias de acogida, se vio la necesidad de desarrollar una guía alimentaria educativa y específica con el fin de resolver las posibles dudas sobre alimentación y nutrición. Elaboración de una guía alimentaria, la jaima alimentaria, dirigida a las familias de acogida de los niños/as saharauis con la que se contribuya a mejorar su salud durante su estancia en España. Desarrollo de la jaima alimentaria y de las actividades diarias para los niños/as saharauis acogidos. Nuestra propuesta trata de una jaima alimentaria, un modelo gráfico-cromático, similar a las conocidas pirámides alimentarias. En cada uno de los escalones se detallan los diferentes alimentos y por orden descendente en cantidad diaria recomendada y a un lateral de la misma aparecen las actividades diarias para los niños/as saharauis acogidos. La jaima alimentaria es una guía alimentaria que permite cubrir las necesidades nutricionales de este tipo de población en la prevención de las enfermedades relacionadas con la dieta, como la anemia o el bocio, y el normal crecimiento. ",25433122,"La jaima alimentaria, guía alimentaria para las familias de acogida de los niños/as Saharauis."
189,,24268320,Guía de práctica clínica sobre el trastorno bipolar: aspectos médico-legales.
190,,24996401,¿Qué aportan a la Psiquiatría los estudios en cerebro post mórtem?
191,,24931103,Prevalencia de síntomas de trastorno por déficit de atención con hiperactividad en adolescentes y adultos jóvenes con otros trastornos psiquiátricos refractarios a tratamientos previos.
192,,24365522,"Definición de alta hospitalaria, lesión grave y muerte por lesiones por tráfico."
193,,30030015,La autopsia molecular en la muerte súbita cardiaca.
194,,24745879,WITHDRAWN: Muerte súbita por anomalía coronaria congénita no diagnosticada.
195,,24913754,Procedimientos quirúrgicos objeto de reclamación por presunto defecto de praxis.
196,,24913750,Aspectos medicolegales de la contención física y farmacológica.
197,,24913755,Patologías urológicas más frecuentemente implicadas en las reclamaciones por responsabilidad profesional médica.
198,,24913749,Valoración forense del riesgo de violencia.
199,,26573256,Evaluación objetiva del procesamiento de las emociones. Estudio de un caso forense.
200,,24120102,Regulación de la obtención de muestras procedentes de cadáveres.
201,,24035268,De la responsabilidad profesional médica a la seguridad clínica.
202,,22981374,Respeto a la autonomía del paciente con demencia y la necesidad de colaboración interdisciplinar.
203,"El esguince cervical es una lesión que se presenta en personas que sufrieron un accidente automovilístico, pero también como consecuencia de agresiones físicas y otros mecanismos. El diagnóstico y el manejo inicial del paciente por el médico de urgencias o el ortopedista, así como las indicaciones que prescriben, suelen tomarse en consideración por dos especialistas con intervención médico-legal. Uno de ellos es el médico del trabajo, el cual, mediante un análisis del mecanismo de lesión, establece la relación causa-efecto, califica si el accidente sufrido por un trabajador tiene o no relación con el trabajo, determina cuánto tiempo permanecerá incapacitado y señala si la lesión provocó alguna incapacidad permanente prevista en la Ley Federal del Trabajo. Mediante la clasificación de la lesión, el médico legista auxilia al Ministerio Público para que este pueda encuadrar el delito de lesiones en el Código Penal del Distrito Federal. Por estas razones, se realiza una revisión de la información médica acerca del mecanismo de la lesión, el diagnóstico, el tratamiento y el tiempo de curación, lo cual ayudará a ambos especialistas a establecer el criterio en su actividad cotidiana. ",23883460,Consideraciones médico-legales del esguince cervical.
204,,8048752,La antropología forense y sus aplicaciones.
205,,11630066,Problemática e ideologías de la responsabilidad médica en España (1850-1949).
206,,1303029,En memoria del Excmo. Sr. D. Bonifacio Piga Sánchez-Morate.
207,,3916019,Algunos aspectos históricos y médicos sobre el asesinato de Facundo Quiroga en Barranca Yaco.
208,,6594300,Patología forense.
209,,6758084,La utilidad clínica de los potenciales evocados. Investigación de las vías sensoriales.
210,,11627266,Cesare Lombroso (1835-1909) y el nacimiento de la medicina legal contemporánea.
211,,141223,"Valoración de las deficiencias, invalideces y perjuicios corporales desde el punto de vista juridico-laboral"
212,,141221,"Valoración de las deficiencias, invalideces y perjuicios corporales desde el punto de vista juridico penal"
213,,141219,Valoración sobre los problemas médico-legales
214,,11627913,Cesare Lombroso (1836-1909) y la medicina legal.
215,,1209051,Concepto médico-legal de la muerte
216,,4635478,Ginecologia forense.
217,,4659315,Inmunogenética de poblaciones extinguidas y vivientes: Implicancias en la investigación criminológica y forense.
218,,4525604,Introducción al estudio de la identificación general
219,,5033228,Muerte por descarga eléctrica. Estrudio macroscópico y microscópico del rombencéfalo. Valor médico-legal.
220,,5033224,Cual debe ser la base para el diagnóstico médico-legal de la desfloración.
221,,5097756,La enseńanza prãctica de la medicina legal en la Universidao Nacional de la Repũblica de Costa Rica.
222,,11626366,"Aspectos medico legales de ""Las centurias medicas"", de Amato Lusitano."
223,,4316009,Homicidio seguido de incineración criminal de cadáveres de recién nacidos. Consideraciones médico-legales.
224,,4918058,El diagnóstico médico-legal de la muerte.
225,,5377972,Capacitación en criminología de los funcionarios judiciales y peritos.
226,,5975451,"Significado de las alteraciones electroencefalográficas en los traumatismos craneoencefálicos en los niños y en los adultos. Consideraciones sobre su valor clínico, pronóstico y médico-legal."
227,,6004210,La tanatorradiología. Su importancia médico-legal.
228,,13609449,"Los síndromes coronarios en la medicina forense del trabajo estudio médico legal; su valorización como elementos causales, accidentales y concausales profesionales, frente a la ley 9688 y su decreto reglamentario."
229,,13527996,Importancia creciente de la neurología clínica médicolegal.
230,,13500601,Medicina legal de la triquinosis.
231,,13528028,La medicina de Bialet Massé.
232,,13453978,El secreto médico en la jurisprudencia argentina y extranjera.
233,,13323581,La medicina legal y sus vinculaciones con la medicina psicosomática.
234,,8231369,El parte al juzgado: implicaciones para médicos y pacientes. Nuevos conceptos médico-legales de falta y delito de lesiones.
235,,8291805,Visión por el Instituto del Síndrome de la Muerte Súbita del Lactante.
236,,8291803,"Experiencia con la aplicación de protocolo multidisciplinar (epidemiológico, clínico, anatomo-patológico y médico-legal) en la muerte súbita infantil."
237,,2046445,Amplificación del DNA y aplicaciones en medicina.
238,,1972429,La genética molecular en la investigación y el diagnóstico de la patología humana.
239,,11637588,"Apuntes para una biografía de Melchor de Villena, catedrático de la Universidad de Valencia."
240,,3509825,Algunas características de los homicidios en menores de 21 años de la región metropolitana.
241,,11638227,"El proceso inquisitorial al Dr. Pedro de la Torre por blasfemo, bígamo y pacto con el demonio."
242,,11612117,La profilaxis médica del crimen en la obra de Lecha-Marzo.
243,,6884681,Prueba serológica de personalidad.
244,,11628538,La aportacion de pedromata al derecho medico de su tiempo.
245,,727598,Mortalidad por quemaduras en niños.
246,,11628435,El crecimiento del saber medico legal en España en el siglo XVI.
247,,11635192,Locura y crimen (1883): tesis de grado de Alejandro Korn.
248,,141222,Valoración de los daños corporales desde el punto de vista del derecho civil
249,,4726422,"Importancia del centellograma cerebral en los cuadros postconmocionales, enfoque asistencial y medicolegal."
250,,4942906,Prof. Dr. Nerio Rojas.
251,,5516965,Homicidio seguida de incineración criminal de cadáveres de recién nacidos. Consideraciones médico-legales. II.
252,,5258872,El médico y los accidentes automovilísticos.
253,,11628197,"Historia médicolegal del atentado contra el Presidente Roca. (Primer Congreso de Historia de la Medicina Argentina. Buenos Aires - 27 al 30 noviembre, 1968)."
254,,11626207,La formulación de la enajenación mental en la legislación penal española del siglo XIX.
255,,5737751,Homicidio seguido de incineración criminal de cadáveres de menores o adultos. Consideraciones médico-legales.
256,,14141419,MEMORIA Y LECCIÓN DEL TIEMPO VIVIDO. LA MEDICINA LEGAL.
257,,13672011,Las lesiones dentarias en la medicina forense; estudio médico-legal; su valoración; proyecto de baremo nacional argentino; tabla de incapacidades.
258,,13505500,Conferencia inaugural de la cátedra de Medicina Legal de la Facultad de Ciencias Medicas de Buenos Aires.
259,,13375415,Psicopatología forense:  homicidio y robo.
260,,13394913,La función medico-forense en el Peru.
261,,13270636,La medicina legal y sus vinculaciones con la medicina psicosomatica.
262,,23177301,Polimorfismos genéticos como indicadores de la vulnerabilidad individual a la adicción al tabaco.
263,"La posibilidad de sostener artificialmente las funciones vitales hace más difícil diferenciar al paciente en agonía terminal del paciente con posibilidades de supervivencia, lo que pone al grupo que lo rodea frente a un dilema. Por un lado, se presenta la continuación de soporte que solo prolongue un proceso irreversible, que causa daños físicos, psíquicos y a su dignidad. Por otro, la abstención o retiro de soporte vital sin la reflexión y el esfuerzo diagnóstico-terapéutico apropiado puede dejar sin esperanza y llevar a la muerte a un niño potencialmente recuperable. Además, la toma de decisiones, en estas circunstancias, enfrenta diversas barreras que dificultan lograr el mejor interés del paciente. Entre ellas, los temores legales son un factor importante. ¿En qué medida esos temores están justificados? Explorar la opinión del Poder Judicial de la Nación respecto al enfoque que, desde el derecho, se da a situaciones de limitación de soporte vital. Profesionales activos del ámbito penal, civil y médico forense. Encuesta semiestructurada sobre tres casos hipotéticos con decisiones sobre la limitación del soporte vital. Se repartieron 185 encuestas; se contestaron 68 (36,76%) y 51 (30,3%) fueron respondidas en forma completa. No tipificaron ningún delito en ninguno de los tres casos 28 (55%) encuestados. Trece (25%) interpretaron como delitos las decisiones de los tres casos; 6 (12%), alguno de los casos; y 4 (8%), 2 de los 3 casos. Los delitos seleccionados por los encuestados incluyeron homicidio doloso, homicidio culposo y abandono de persona. El 45% de los encuestados consideraron que hubo alguna forma de delito en las decisiones tomadas. ",27399006,Opinión de los miembros de la Justicia Nacional en lo Penal y Civil (Familia) en situaciones de limitación del soporte vital en pediatría.
264,,22534452,Parte judicial de lesiones: uso y abuso.
265,,22464196,Estudio genético de RNASEL en cáncer de próstata y su relación con la estadificación clínica.
266,,22127912,Análisis de las sentencias judiciales contra psiquiatras resueltas en segunda instancia en España entre 1992 y 2007.
267,,22047851,Descripción del Síndrome de Alienación Parental en una muestra forense.
268,,26578216,Asociación entre desigualdad y tasa de suicidio en Colombia (1994-2013).
269,,22432095,Evolución del concepto de calidad de vida: la dimensión subjetiva como factor relevante en las drogodependencias.
270,,16396415,"Comportamiento de las muertes violentas en Bogotá, 1997-2003."
271,,22185861,Pericial médica: su exposición en la comparecencia en casos de mala práctica médica.
272,,21043084,Impacto de la apolipoproteína A5 en el riesgo cardiovascular. Modulaciones genéticas y ambientales.
273,,20886912,La objeción de conciencia de los profesionales sanitarios en la ética y deontología.
274,,19837484,Internamientos psiquiátricos. Aspectos medicolegales.
275,,20186376,Análisis de las sentencias judiciales contra neurocirujanos resueltas en segunda instancia en España entre 1995 y 2007.
276,,20379662,"Violencia sexual en jóvenes de 10 a 19 años. Cali, 2001-2006."
277,,19861107,Evaluación de trastornos de personalidad mediante el Inventario Clínico Multiaxial (MCMI-II) en una muestra forense.
278,,19472158,Aportaciones de la resonancia magnética estructural al esclarecimiento de la neurobiología del trastorno por déficit de atención/hiperactividad: hacia la identificación de un fenotipo neuroanatómico.
279,,19396760,Validacion al espanol de la escala de cribado del trastorno por deficit de atencion/hiperactividad en adultos (ASRS v. 1.1): una nueva estrategia de puntuacion.
280,,19434295,Estudio de la consistencia interna y estructura factorial de la Escala de Impacto de los Estresores en mujeres colombianas víctimas de violencia.
281,,18803032,Factores meteorológicos y urgencias psiquiátricas.
282,,19094881,Sumisión química: epidemiología y claves para su diagnóstico.
283,,24294725,El académico D. Pedro Mata en el II centenario de su nacimiento.
284,,22091454,Vicisitudes en el ingreso y la emergencia de un Hospital Psiquiátrico Penitenciario.
285,,18457621,El médico en el estrado. Recomendaciones para comparecer como perito ante los tribunales.
286,,18021645,Estudios de asociación en enfermedades complejas: problemas estadísticos relacionados con el análisis de polimorfismos genéticos.
287,,17970541,Hábitos dietéticos en estudiantes de fisioterapia.
288,,17286920,Actitudes de los médicos de familia hacia los derechos de los pacientes.
289,,19802425,La electroforesis capilar como una nueva estrategia en la medicina y el diagnóstico clínico.
290,,17393795,Diagnóstico genético embrionario y libertad reproductiva en la procrea- ción asistida.
291,,16823687,El umbral de inhibición latente en las ratas romanas de alta evitación: un modelo psicogenético de anomalías en el filtraje atencional?
292,,17067216,Serología hepatitis C: estudio de prevalencia en población post mortem.
293,,16792984,La autopsia médico-legal.
294,,16759581,Diagnóstico de muerte y trasplante de órganos. Implicaciones jurídicas y médico-legales.
295,,16759569,Aspectos médico-legales de las incapacidades laborales.
296,,16756908,Aspectos médico-legales del internamiento psiquiátrico y la incapacidad civil.
297,,16620736,Importancia de la documentación clínica para la Administración de Justicia.
298,,16712748,Mortalidad por enfermedades del miocardio en niños y jóvenes. Estudio observacional de base poblacional.
299,,16527111,Derecho de información de los pacientes: influencia de las características socioprofesionales en atención primaria.
300,,16510097,Abuso sexual de menores.
301,,16472501,Aspectos médico-legales de la responsabilidad profesional médica.
302,,16998513,Aspectos legales del trasplante y la donación.
303,,16137487,"""Sensibilidad a múltiples compuestos"", una enfermedad comúnmente inadvertida."
304,,15919035,Identificación de víctimas del desastre del tsunami en Tailandia.
305,,15529210,Perfiles psicométricos fingidos en relación con estilos de personalidad en reclusos.
306,,15207193,Algo se está moviendo.
307,,10835754,Estudio anátomo-patológico del disco de la articulación temporomandibular en individuos colombianos.
308,,11625827,El Dr. Juan Ramon Beltran y su aporte a la Escuela de Odontologia.
