,abstract,id,title
1299,,29229295,Papel del internista en un programa de optimización de uso transfusional.
1300,,29179892,Tratamiento de la osteoporosis.
1301,,28867335,Automedición en el domicilio frente a lectura de la presión arterial en la consulta en el seguimiento de diabéticos tipo ii: efecto sobre la presión arterial ambulatoria y la albuminuria. Estudio aleatorizado.
1302,,16011405,La anemia es un factor pronóstico de mortalidad en la insuficiencia cardiaca.
1303,,29970266,ACTIVLIM: adaptación transcultural al castellano y validación en adultos con miopatías hereditarias utilizando el modelo Rasch.
1304,,29914692,"Incidencia y características clínicas del síndrome de Guillain-Barré en la comarca de Osona (Barcelona, España) (2003-2016)."
1305,,29687666,Insuficiencia cardiaca aguda: básico conocer al paciente.
1306,,29402393,Pustulosis exantemática generalizada aguda simulando necrólisis epidérmica tóxica: forma combinada.
1307,,29229298,Empiema necessitatis 17 años después de una neumonectomía.
1308,,29054576,Infección cutánea en un receptor de trasplante renal.
1309,,28947297,Salud bucodental y riesgo de neumonía en pacientes asmáticos con tratamiento inhalado.
1310,,15970184,Epidemiología de la hepatitis crónica por virus de la hepatitis C en pacientes infectados por el virus de la inmunodeficiencia humana (VIH). Estudio de 767 pacientes infectados por el VIH.
1311,"Establecer una nueva metodología predictiva de la proporción de dengue grave respecto al total anual de infectados de dengue por departamento con base en la teoría de la probabilidad. Con base en los datos anuales de número de infectados por departamentos en el periodo 2005 -2010, se calculó la proporción entre casos de dengue grave respecto al total para cada año, y se construyeron espacios de probabilidad que evalúan estos eventos en rangos de 0,5 y 0,3. Se determinaron conjuntos de rangos y se calculó probabilidad, desviación media cuadrática y la diferencia entre ellas. Se realizó una predicción del rango de infectados para el 2011 con el promedio aritmético de los valores de los últimos dos años. Se predijo correctamente el rango en el que se encuentra incluida la proporción de número de infectados de dengue grave sobre el total en cada departamento con una efectividad del 93,3% para el rango de 0,5 y de 86,7% para el de 0,3. Se evidenció una autoorganización matemática espacio temporal en la proporción de dengue grave respecto al total que permite establecer predicciones de utilidad para la toma de decisiones de salud pública. ",30844009,Predicción espacio-temporal probabilista de la epidemia de dengue total y grave en Colombia.
1312,,29802044,Precauciones en la prescripción de inhibidores de la recaptación de serotonina.
1313,,29789229,Vasculitis crioglobulinémica y artritis psoriásica: reporte de caso de una inusual asociación.
1314,,29776888,Vasculitis IgA como forma de presentación de la infección por el virus de inmunodeficiencia humana.
1315,,29631866,Documento de consenso. Manejo de la enfermedad hepática grasa no alcohólica (EHGNA). Guía de práctica clínica.
1316,,29566964,Una causa atípica de hipertensión pulmonar en el anciano.
1317,,29566962,Escala de Norton y pronóstico vital.
1318,,29499984,Intervención multidimensional que mejora el pronóstico a corto plazo entre los ancianos frágiles dados de alta desde una unidad de corta estancia: estudio cuasiexperimental.
1319,,29223638,Expresión de PD-L1 en muestras de cáncer pulmonar no microcítico obtenidas por EBUS-TBNA.
1320,,29196038,Cetoacidosis diabética por empaglifozina y obstrucción intestinal. La importancia de la gasometría arterial.
1321,,29187287,Relación entre las concentraciones de la leptina y la actividad de la enfermedad en pacientes con artritis reumatoide.
1322,,28870424,Influencia de la fibrilación auricular en la mortalidad de los pacientes con insuficiencia cardiaca con fracción de eyección preservada.
1323,,28743405,Tuberculosis miliar durante el tratamiento con adalimumab en enfermedad de Crohn.
1324,,28655409,Enfermedad inflamatoria intestinal concurrente con tumor del estroma gastrointestinal.
1325,"Los problemas de oído, nariz y garganta son un motivo frecuente de consulta en Atención Primaria. Numerosos estudios han reportado que los médicos de Atención Primaria perciben una capacitación insuficiente en el manejo de estos problemas. El objetivo de este estudio fue evaluar las competencias en el diagnóstico y tratamiento de problemas prevalentes de Otorrinolaringología de médicos residentes de Atención Primaria en un hospital universitario, en Buenos Aires, Argentina, mediante la implementación de un examen clínico objetivo estructurado. Participaron 25 residentes, de Pediatría (7), de Medicina Interna (10) y de Medicina Familiar (8). Los de Medicina Familiar y Pediatría tuvieron mejor desempeño que los de Medicina Interna. Los residentes de Atención Primaria demostraron competencias disímiles en el manejo de problemas prevalentes de Otorrinolaringología. Se detectaron áreas de oportunidad de mejora comunes para los tres grupos, que proporcionaron dirección y motivación en futuros aprendizajes, tanto en conocimientos como en habilidades. ",31063324,"Competencias de los residentes de Atención Primaria en el manejo de los problemas prevalentes de oído, nariz y garganta."
1326,,30148918,Disminución en la frecuencia de infección por Helicobacter pylori en endoscopías digestivas altas.
1327,,29866360,Prevención de los trastornos de la salud mental en atención primaria. Actualización PAPPS 2018.
1328,,29807860,"Endocarditis izquierdas, cambios con el nuevo milenio."
1329,,29784435,Síndrome pulmón-riñón secundario a vasculitis por cocaína/levamisol: reporte de caso.
1330,,29566963,Análisis de la relación entre polimorfismos en regiones diana de micro-ARN y la enfermedad hepática alcohólica.
1331,,29526473,Es básico realizar una valoración e intervención geriátricas en el paciente anciano hospitalizado.
1332,,29523491,Programa de cribado en cascada para la detección de la hipercolesterolemia familiar.
1333,,29217206,Comentarios al tratamiento de la tuberculosis con resistencia.
1334,,29173986,Aportaciones acerca del uso de hierro intravenoso.
1335,,29150121,Absceso gástrico y esplénico secundarios a salmonelosis invasiva por Salmonella enteritidis.
1336,,28743398,Pérdida de peso y dolor abdominal en una mujer joven: tricobezoar gástrico.
1337,,28645447,Colitis como forma de presentación de una granulomatosis eosinofílica con poliangitis.
1338,,28641865,Influencia de la puntuación MELD basal en la eficacia del tratamiento de la hepatitis C con sofosbuvir y simeprevir.
1339,,29699926,Documento de la Sociedad Española de Hipertensión-Liga Española para la Lucha contra la Hipertensión Arterial (SEH-LELHA) sobre las guías ACC/AHA 2017 de hipertensión arterial.
1340,,29644824,Respuesta autores – Profilaxis post-exposición frente VIH: visión desde Urgenciass.
1341,,29628195,Parálisis de sexto nervio craneal en adulto inmunocompetente con varicela.
1342,"La infección del tracto urinario es la infección bacteriana más común y su recurrencia es frecuente. Entre las variadas medidas que potencialmente disminuirían este riesgo se ha planteado el uso de probióticos. Sin embargo, no está claro si realmente son efectivos. Para responder esta pregunta utilizamos Epistemonikos, la mayor base de datos de revisiones sistemáticas en salud a nivel mundial, la cual es mantenida mediante búsquedas en múltiples fuentes de información, incluyendo MEDLINE, EMBASE, Cochrane, entre otras. Extrajimos los datos desde las revisiones identificadas, reanalizamos los datos de los estudios primarios, realizamos un metanálisis y preparamos una tabla de resumen de los resultados utilizando el método GRADE. Identificamos seis revisiones sistemáticas que en conjunto incluyeron nueve estudios, entre ellos siete ensayos aleatorizados. Concluimos que no está claro si los probióticos disminuyen el riesgo de infección urinaria sintomática, porque la certeza de la evidencia es muy baja. ",29624569,¿Son efectivos los probióticos en prevenir infecciones del tracto urinario?
1343,,29477408,El índice trabecular óseo: una nueva herramienta para la valoración de la osteoporosis.
1344,,29358046,Evolución clínica de una cohorte de pacientes con diabetes mellitus tipo 2 tras su valoración en endocrinología. Estudio a 26 semanas.
1345,,29329766,Mujer de 77 años con anomalías en el pulso.
1346,,29254620,Réplica a «Acerca de las guías europeas de insuficiencia cardiaca de 2016».
1347,,29223676,Vacunación antigripal e insuficiencia cardiaca. Un prioritario campo de mejora.
1348,,29173987,"Diferencias epidemiológicas, clínico-microbiológicas y terapéuticas de la enfermedad tuberculosa en pacientes con infección por VIH y sin ella."
1349,,29089119,Sobre la seguridad de las formulaciones de hierro intravenoso.
1350,,28874261,Neoplasias e infección por el virus de la inmunodeficiencia humana: ¿enfermedades emergentes?
1351,,28869049,Digoxina: ¿también descansa los fines de semana?
1352,,28648671,Complicaciones tardías de la traqueotomía percutánea con la modalidad de dilatación con balón.
1353,,28629658,Fractura de fémur en un paciente con enfermedad de Paget poliostótica.
1354,,28624075,"Eosinofilia, exantema pruriginoso y necrosis digital."
1355,,28431755,Fiebre por mesalazina.
1356,"Determinar la frecuencia y el valor pronóstico de la anemia en pacientes con cáncer atendidos en el Instituto Nacional de Enfermedades Neoplásicas (INEN) entre enero y abril del 2010. Se consideró anemia en varones cuando la hemoglobina fue <13 g/dL, y en mujeres cuando fue <12 g/dL. Para determinar asociaciones se usó la prueba Chi-cuadrado. Para el análisis de las curvas de sobrevida se usó el estimador de Kaplan-Meier y log rank test. 772 pacientes fueron incluidos; 584 (75,7%) tuvieron tumores sólidos y 188 (24,3%) neoplasias hematológicas. Se diagnóstico anemia en 359 (46,5%) pacientes, en 124 (66,0%) neoplasias hematológicas, y en 235 (40,2%) neoplasias sólidas. Las neoplasias hematológicas con mayor frecuencia de anemia fueron la leucemia mieloide crónica, las leucemias agudas, y el mieloma múltiple (100%, 92,5% y 60%; respectivamente) y en el grupo de neoplasias sólidas fueron los cánceres de origen: gastrointestinal, ginecológico, y urológico (62%, 52,1% y 45%; respectivamente). Recibieron transfusiones 204 pacientes (26,4%). En 762 pacientes se encontró una diferencia en la sobrevida global entre los grupos sin y con presencia de anemia, estimándose a los cinco años en 62% y 47% respectivamente (p<0,001), además se encontraron diferencias en la sobrevida global para el subgrupo de tumores sólidos (p=0,002) y neoplasias hematológicas (p=0,007). La anemia es frecuente en pacientes con cáncer y su presencia determina un factor pronóstico independiente en la sobrevida global. ",30183919,Anemia como factor pronóstico en pacientes con cáncer.
1357,"Los antipsicóticos se han propuesto como una medida farmacológica para la profilaxis del delirium postoperatorio. No obstante, su real utilidad clínica y seguridad no han sido demostrados. Para responder esta pregunta utilizamos Epistemonikos, la mayor base de datos de revisiones sistemáticas en salud, la cual es mantenida mediante búsquedas en múltiples fuentes de información, incluyendo MEDLINE, EMBASE, Cochrane, entre otras. Extrajimos los datos desde las revisiones identificadas, reanalizamos los datos de los estudios primarios, realizamos un metanálisis y preparamos una tabla de resumen de los resultados utilizando el método GRADE. Identificamos 16 revisiones sistemáticas que en conjunto incluyeron ocho estudios primarios, todos correspondientes a ensayos aleatorizados. Concluimos que el uso de antipsicóticos profilácticos disminuye la incidencia de delirium postoperatorio, pero no hace diferencia en el tiempo de hospitalización y podría aumentar la mortalidad. ",29677175,¿Son los antipsicóticos efectivos para prevenir el delirium postoperatorio?
1358,,29625816,Pseudotumor orbitario relacionado con IgG4.
1359,,29174704,Aproximación diagnóstica y terapéutica de las crisis hipertensivas.
1360,,29108758,Micobacteriosis pulmonar en un paciente en tratamiento crónico con metotrexato.
1361,,29054580,Bacteriemia por Leptotrichia trevesanii. Descripción de un caso.
1362,,28610767,Infección diseminada por Mycobacterium bovis tras instilación intravesical de bacilo de Calmette-Guérin.
1363,,28528797,Estudio caso-control de tumores no definitorios de sida en una cohorte prospectiva de pacientes infectados por el VIH.
1364,"la lesión renal aguda en pacientes ancianos hospitalizados es un evento frecuente que los predispone a complicaciones e incluso a la muerte. Es así que al atender a un anciano es prioritario identificar los factores de riesgo para presentar tal evento. identificar los principales factores de riesgo para lesión renal aguda en el anciano hospitalizado y a partir de ellos, calcular la probabilidad de presentación. estudio de casos y controles anidado en una cohorte que incluyó pacientes de 60 años o más, ingresados en el servicio de medicina interna de una institución de seguridad social en Querétaro, México. Se identificó como caso al paciente con lesión renal aguda y como control al paciente sin lesión renal aguda. La lesión renal aguda se diagnosticó cuando existió un incremento de la creatinina ≥ 0.3 mg/dL (≥ 26.4 mmol/L) en un tiempo < 48 horas. se identificaron como factores de riesgo para lesión renal aguda la hipovolemia y la infección, se integraron al modelo de regresión logística múltiple (y = −1.111 + 1.063 [infección] + 1.422 [hipovolemia]) p = 0.002. La probabilidad más alta de presentar lesión renal aguda fue de 80%. se identificaron dos factores para lesión renal aguda y un modelo de predicción. ",31071250,Factores de riesgo para desarrollar lesión renal aguda en pacientes ancianos
1365,"En el presente trabajo se expone la relación existente entre incidencia de microcefalia y los diversos arbovirus en auge actual. Destaca que en la infección por el virus del dengue, no se ha registrado casos de microcefalia, sin embargo en las series de casos de infección por chikunguña, se reportó incidencia de casos con esta afectación, destacando una cohorte denominada CHIMERE; asimismo se menciona la mayor incidencia de microcefalia asociada al virus del Zika, la cual ha sido ampliamente estudiada. Todo lo anterior por el neurotropismo de estos arbovirus. ",29906032,Microcefalia y arbovirus
1366,,29526312,Síndrome de Guillain-Barré e hiponatremia.
1367,,29397910,La importancia del estado nutricional en la insuficiencia cardiaca.
1368,,29233580,Resultados de morbimortalidad en cáncer colorrectal en paciente quirúrgico frágil. Implementación de un Área de Atención al Paciente Quirúrgico Complejo.
1369,,29217077,Validación externa de la regla NaURSE para predecir mortalidad intrahospitalaria en nonagenarios.
1370,,29183626,¿Mantiene la intervención nutricional en pacientes hospitalizados por insuficiencia cardiaca desnutridos su beneficio pronóstico a largo plazo?
1371,,29180232,Áreas de mejora en la tromboprofilaxis de pacientes médicos hospitalizados.
1372,,28992984,Hospitalizaciones evitables por reacciones adversas a medicamentos en una unidad geriátrica de agudos. Análisis de 3.292 pacientes.
1373,,28859837,Seguridad de los fármacos antidiabéticos en pacientes con insuficiencia cardiaca.
1374,,28743397,Medicina de precisión: precisamente ahora.
1375,"la evaluación de la calidad de vida relacionada con la salud (CVRS) se ha convertido en un importante indicador pronóstico en el enfermo con VIH/SIDA. El objetivo de este estudio fue determinar el impacto de los factores sociodemográficos, clínicos y psicológicos en la CVRS de un grupo de pacientes portadores de VIH/SIDA del noroeste de México, así como determinar qué variables predicen mejor la CVRS. estudio transversal con una muestra del 87% de los pacientes que recibían atención en una clínica de VIH/SIDA en el noroeste de México, entre noviembre del 2010 y junio del 2011, se midió la CVRS utilizando el instrumento Medical Outcomes Study HIV Health Survey (MOS-HIV). Se realizó un modelo de regresión lineal múltiple para identificar aquellas variables que permiten predecir la CVRS en esta población. en una muestra de 54 sujetos con VIH/SIDA que tenían una edad de 43 ± 9 años, 83% eran hombres con un tiempo de 6.5 ± 4.5 años desde el diagnóstico. Las puntuaciones de CVRS de salud mental y física de los participantes fueron de 57 ± 6 y 57 ± 13 respectivamente. En el análisis multivariado, las variables que influyeron en la puntuación de salud física fueron el género, el estado civil, la orientación sexual, el tiempo transcurrido desde el diagnóstico y la carga viral (log). es necesario realizar estudios prospectivos para explicar mejor la influencia de los factores que predicen cambios o tendencias en la CVRS en pacientes con VIH/SIDA. ",29901901,Calidad de vida en personas infectadas con virus de la inmunodeficiencia humana en México
1376,,28073647,Prevalencia de la diabetes mellitus en la provincia de Cádiz.
1377,,27449154,Costes indirectos asociados al glioblastoma. Experiencia en un centro.
1378,,29668137,Costo-efectividad de dos esquemas de prevención de la infección por citomegalovirus en pacientes con trasplante renal y riesgo intermedio en Colombia.
1379,,29548895,Hombro doloroso en paciente anticoagulado con rivaroxabán.
1380,,29503178,Relación entre productividad laboral y características clínicas de la artritis reumatoide.
1381,,29366502,Tratamiento de la diabetes mellitus tipo 2 en el paciente anciano.
1382,,29217076,Derrame pleural en el mieloma múltiple.
1383,,29162273,Supervivencia a los 10 años de nonagenarios tras el alta hospitalaria.
1384,,29157558,Hiperpigmentación cutánea en el déficit de vitamina B12.
1385,,28870423,"Diagnóstico de endocarditis infecciosa mediante 18F-FDG-PET/TC, presentación de un resultado falso negativo."
1386,,28865918,Linfoma folicular de bajo grado extraparotídeo asociado a síndrome de Sjögren primario.
1387,,28571961,Anillos de Kayser-Fleischer.
1388,"Se postula que los cannabinoides pudieran tener beneficios en la fibromialgia, sin embargo, su efectividad clínica sigue siendo un tema de discusión. Para responder esta pregunta utilizamos Epistemonikos, la mayor base de datos de revisiones sistemáticas en salud, la cual es mantenida mediante búsquedas en múltiples fuentes de información, incluyendo MEDLINE, EMBASE, Cochrane, entre otras. Extrajimos los datos desde las revisiones identificadas, reanalizamos los datos de los estudios primarios y preparamos una tabla de resumen de los resultados utilizando el método GRADE. Identificamos quince revisiones sistemáticas que en conjunto incluyen dos ensayos aleatorizados pertinentes. Concluimos que no está claro si los cannabinoides tienen beneficios en la fibromialgia porque la certeza de la evidencia es muy baja. Por otra parte, están asociados a efectos adversos frecuentes. ",29474351,¿Son los cannabinoides un tratamiento efectivo para la fibromialgia?
1389,"Se ha planteado que la estimulación del sueño con cannabinoides podría constituir una alternativa terapéutica en pacientes con insomnio. Para responder esta pregunta utilizamos Epistemonikos, la mayor base de datos de revisiones sistemáticas en salud, la cual es mantenida mediante búsquedas en múltiples fuentes de información, incluyendo MEDLINE, EMBASE, Cochrane, entre otras. Extrajimos los datos desde las revisiones identificadas, reanalizamos los datos de los estudios primarios y preparamos una tabla de resumen de los resultados utilizando el método GRADE. Identificamos ocho revisiones sistemáticas que en conjunto incluyen tres estudios primarios, de los cuales dos corresponden a ensayos aleatorizados. Concluimos que no está claro si los cannabinoides tienen un efecto en la severidad del insomnio o en la calidad del sueño; que podrían no tener efecto en la conciliación del sueño, despertar del sueño ni comportamiento durante vigilia, y probablemente se asocian a efectos adversos frecuentes. ",29474349,¿Constituyen los cannabinoides una alternativa terapéutica para insomnio?
1390,"Las elevadas tasas de resistencia a fluoroquinolonas han hecho de la ceftriaxona una de las principales opciones terapéuticas en las infecciones del tracto urinario febriles (ITUF). El objetivo del estudio es identificar factores predictivos de infección por microorganismos resistentes a ceftriaxona (MRC) en ITUF comunitaria en hombres. Estudio transversal ambispectivo en el que se incluyeron hombres con ITUF atendidos en el servicio de urgencias de un hospital comarcal. Se incluyeron 552 episodios de ITUF, 103 (18,6%) causadas por MRC. Los pacientes con ITUF por MRC tenían mayor edad, más frecuencia de ITUF relacionada con la atención sanitaria (ITUF-AS), demencia, diabetes mellitus, neoplasia, ITU previa, patología urológica, ITUF complicada y antecedente de tratamiento antibiótico reciente. Las variables independientemente asociadas a ITUF por MRC fueron la cirrosis hepática (OR 6,00; IC 95%: 1,25-28; p = 0,025), tener una ITUF-AS (OR 2,3; IC 95%: 1,23-4,27; p = 0,009) y el consumo previo de antibióticos (OR 2,15; IC 95%: 1,23-3,76; p = 0,007). Entre los componentes de la ITUF-AS, el antecedentes de estancia en centro larga estancia (OR 2,90; IC 95%: 1,21-7,16; p = 0,017) y entre los antibióticos el consumo de penicilinas con/sin inhibidores de betalactamasa (OR 2,16; IC 95%: 1,05-4,42; p = 0,035) se asociaron a ITUF por MRC. La cirrosis, presentar una ITUF-AS, especialmente provenir de un centro de larga estancia, y el consumo reciente de antibióticos, principalmente de penicilinas con/sin inhibidores de betalactamasa, son factores de riesgo de ITUF por MRC en hombres. ",29437306,Factores clínicos predictivos de resistencia a ceftriaxona en microorganismos causantes de infección del tracto urinario febril en hombres.
1391,,29428197,Impacto terapéutico de las estatinas en el perfil lipídico y el riesgo cardiovascular en pacientes con lupus eritematoso sistémico: revisión sistemática de la literatura y metaanálisis.
1392,,29208370,Diseño y desarrollo de una bomba manual para la nutrición enteral en bolos.
1393,,29110929,Respuesta a «Observaciones sobre endocarditis nativa de la válvula causada por Kocuria kristinae».
1394,,28864085,Esteatonecrosis aséptica en una paciente con esclerosis múltiple y tratamiento con interferón beta 1b.
1395,,28843364,Fiabilidad del conjunto mínimo básico de datos como herramienta epidemiológica de la enfermedad tuberculosa.
1396,,28838746,Granulomatosis linfomatoide: una neoplasia infrecuente de mal pronóstico.
1397,,28476452,Acalasia vigorosa.
1398,,28087145,Protocolo informático de manejo integral de la sepsis. Descripción de un sistema de identificación precoz.
1399,"Es común que los pacientes en estado terminal tengan una reducida ingesta de líquidos, lo que muchas veces repercute en una necesidad de mayor apoyo médico. Sin embargo, no está claro si esta medida tiene un impacto clínico real. Para responder esta pregunta utilizamos Epistemonikos, la mayor base de datos de revisiones sistemáticas en salud, la cual es mantenida mediante búsquedas en múltiples fuentes de información, incluyendo MEDLINE, EMBASE, Cochrane, entre otras. Extrajimos los datos desde las revisiones identificadas, reanalizamos los datos de los estudios primarios y preparamos una tabla de resumen de los resultados utilizando el método GRADE. Concluimos que la administración de hidratación parenteral podría hacer poca o ninguna diferencia en la sobrevida y en la calidad de vida de los pacientes oncológicos terminales, y que no está claro si tiene algún otro beneficio porque la certeza de la evidencia es muy baja. ",29474350,¿Es realmente beneficiosa la hidratación parenteral en pacientes con cáncer terminal?
1400,,29456153,Diferencias entre los pacientes con sarcoidosis con y sin compromiso articular atendidos durante quince años en un hospital de tercer nivel de complejidad.
1401,,29055509,¿Son válidos los criterios del síndrome de respuesta inflamatoria sistémica en la valoración de la neutropenia febril?
1402,,29054578,Tularemia en período interepidémico.
1403,,28988059,Exposición a radiación diagnóstica en pacientes con enfermedad de Crohn: estudio retrospectivo en un hospital medio y sus factores predictivos.
1404,,28919212,Pericarditis aguda recurrente idiopática: presentación de un caso con respuesta favorable a anakinra.
1405,,28919210,Insuficiencia cardiaca aguda por amiloidosis senil sistémica: descripción de un caso.
1406,,28778682,Desempeño de los sistemas de puntuación PSI y CURB-65 para predecir la mortalidad a 30 días de la neumonía asociada a la asistencia sanitaria.
1407,,28571957,La microbiota materna y los grandes síndromes obstétricos: cuando el enemigo se convierte en aliado.
