,abstract,id,title
2158,,10380180,Validación de la versión española de la Escala de Adaptación Social en pacientes depresivos.
2159,,10380154,Aspectos arquetípicos del envejecimiento: del Eros al Tánatos.
2160,,10380150,El reconocimiento de la enfermedad mental en Atención Primaria y sus factores determinantes.
2161,,12192420,Citoquinas y Psiquiatría.
2162,,12084359,Miguel Gayarre (1866-1936) y la neurología madrileña: contribución a su biografía.
2163,,10714328,Secuelas neuropsicológicas de los traumatismos craneoencefálicos.
2164,,12106516,Factores asociados al diagnóstico de trastorno límite de la personalidad en pacientes psiquiátricos ambulatorios.
2165,,10436687,Al fin una medicina humanista?
2166,,10380148,Los trastornos de ansiedad y la dependencia de alcohol o drogas.
2167,,10380146,El papel de la personalidad en los trastornos de la conducta alimentaria.
2168,,10380143,Fatiga crónica y neurastenia en población estudiantil.
2169,,10380141,Evolución a largo plazo de la discapacidad en pacientes esquizofrénicos en tratamiento de mantenimiento con risperidona.
2170,,10081329,"Consumo de bebidas alcohólicas en pacientes de los servicios de urgencias de la ciudad de Pachuca, Hidalgo."
2171,,14158207,PAIDOCIATRÍA (PEDIATRÍA NEUROPSIQUIÁTRICA Y PEDAGÓGICA)
2172,,14153061,MADURACIÓN DEL SISTEMA NERVIOSO.
2173,,14184415,PROBLEMAS PSIQUICO-SOMATICOS EN LA INFANCIA.
2174,,14061716,USO DE UN TÍMOLÉPTICO EN NI NOS.
2175,,14112724,TRASTORNOS PSÍQUICOS EN LOS STATUS DYSRAPHICUS.
2176,,14080212,LA INTERPRETACIÓN LÚDICA (UN ESTUDIO SOBRE LOS MEDIOS DE EXPRESIÓN)
2177,,18888938,Accesos agudos de ansiedad con intensa sintomatologia somática en una niña de 13 años de edad.
2178,,10380145,Un estudio de la función tiroidea en pacientes psiquiátricos ingresados.
2179,,10380142,El Cuestionario Sevilla de Calidad de Vida: Perspectiva histórica de su instauración.
2180,,9951032,La memoria en esclerosis múltiple: revisión sobre aspectos de rendimiento y relación con variables clínicas y de neuroimagen.
2181,,11967571,Conocimiento de residentes de Salud Mental sobre precios y disponibilidad de los fármacos que prescriben.
2182,,9972593,Combinación de risperidona y antidepresivos serotoninérgicos en el trastorno obsesivo compulsivo refractario.
2183,,9972587,Valoración de la fiabilidad de la evaluación clínica entre los investigadores de un ensayo clínico multicéntrico.
2184,,9972585,Ansiedad de separación y trastorno por angustia.
2185,,9927884,Patrón de consumo de alcohol en pacientes captados en salas de urgencias.
2186,,12447800,Amnesias del desarrollo.
2187,,9972590,Apolipoproteínas y deterioro cognitivo.
2188,,9972588,Datos normativos para la exploración neuropsicológica de usuarios de drogas por vía parenteral.
2189,,16354419,Los trastornos mentales en América Latina y el Caribe: asunto prioritario para la salud pública.
2190,,9859690,Mecanismo de acción de zolmitriptán.
2191,,9949561,Un estudio de la personalidad en los trastornos de la conducta alimentaria.
2192,,9842281,Ideación suicida y características asociadas en mujeres adolescentes.
2193,,9949562,Trastorno de pánico en el anciano.
2194,,9949560,Autismo e intersubjetividad.
2195,,9922512,Trastornos del hábito del comer en adolescentes: aspectos clínicos y epidemiológicos.
2196,,9842133,Los genes de los receptores a dopamina D2 y D4 distinguen la presencia clínica de tics en el trastorno obsesivo-compulsivo.
2197,,11730577,Variabilidad en actitudes y condiciones de utilización de la terapia electroconvulsiva. Resultados de un estudio preliminar.
2198,,9830744,La conducta suicida en mujeres: un estudio prospectivo.
2199,,9810835,Estamos estudiando adecuadamente las prácticas de inyección de drogas que implican riesgo de transmisión de enfermedades por vía parenteral?
2200,,9807860,Trastornos psiquiátricos y consumo de MDMA (éxtasis): revisión de casos.
2201,,9807858,Sobre las bases anatomofisiológicas del trance y la disociación.
2202,,9807853,Estudio crítico de la influencia de los síntomas negativos en la respuesta terapeútica de la esquizofrenia.
2203,,9807854,Procesamiento cortical e estímulos visuales y auditivos en pacientes depresivos: estudio mediante potenciales evocados.
2204,,9807857,La influencia de las emociones en la rememoración de la crianza: un estudio antes-después con el Parental Bonding Instrument (PBI).
2205,,9807855,Estudio con la SPECT de un grupo de pacientes con depresión recurrente grave.
2206,,9706585,Lesiones deportivas y rasgo de ansiedad en los jugadores de fútbol.
2207,,9731443,"Desórdenes mentales comunes, depresión y salud pública."
2208,,9731441,"La revelación del diagnóstico: el lugar de la beneficencia, autonomía y veracidad en la ética médica."
2209,,9717344,El manejo y el tratamiento de los trastornos mentales graves en la embarazada.
2210,,9717339,Evaluación de trastornos de la personalidad en una población penal con el IPDE y el MMPI.
2211,,9670783,Prevalencia de abuso sexual en estudiantes y su relación con el consumo de drogas.
2212,,11550582,Estimación de la oferta de médicos especialistas en Colombia con el método de captura-recaptura.
2213,,9646265,Subtipificación de los trastornos de pánico en función de sus síntomas.
2214,,15597121,La relación entre depresión y enfermedad cerebrovascular: aspectos clínicos y biológicos.
2215,,9595824,Estilo de crianza en madres con depresión postparto.
2216,,9595819,Subgrupos clínicos de trastorno por angustia: de la fenomenología a la agrupación diagnóstica.
2217,,9607230,Eficacia de una técnica de adiestramiento sobre las destrezas de entrevista clínica asociadas con la capacidad psicodiagnóstica del médico.
2218,,9558918,Prevalencia de trastornos psiquiátricos y estado psicopatológico en pacientes con lupus eritematoso sistémico.
2219,,11333532,Disfunción genética del receptor de serotonina 5-HT2A en los trastornos psiquiátricos.
2220,,9549136,Naltrexona en el tratamiento de la dependencia del alcohol.
2221,,9522580,Fisiopatología de la migraña.
2222,,9580355,Evaluación del impacto de la jubilación anticipada en la calidad de vida.
2223,,9549135,Tabaquismo en población psiquiátrica.
2224,,9549133,Grupo ambulatorio psicoeducativo en bulimia nerviosa. Evaluación de un abordaje de corta duración.
2225,,9549131,Los límites del diagnóstico del trastorno bipolar.
2226,,9534342,Validación de la prueba para la identificación de trastornos por uso de alcohol (AUDIT) en Atención Primaria.
2227,,11780164,"La interfase entre el eje tiroideo, la psicología y la psiquiatría."
2228,,11333517,El abandono terapéutico.
2229,,9528045,La atención: una compleja función cerebral.
2230,,9528019,Calidad y estilo de vida como factores de riesgo de enfermedad vascular cerebral aguda.
2231,,9498859,"Cefaleas tusígena, de esfuerzo y sexual."
2232,,9528044,La memoria y el aprendizaje: 'experiencia' y 'habilidad' en el cerebro.
2233,,9528020,Acontecimientos vitales estresantes como factor de riesgo de enfermedad vascular cerebral aguda.
2234,,9477687,El enmascaramiento y desenmascaramiento de la depresión.
2235,,9477603,Validez y seguridad del cuestionario de cogniciones anticipatorias. Grupo de Estudio ACQ. El Cuestionario de Cogniciones Anticipatorias.
2236,,9477691,Calidad de vida y depresión.
2237,,9477688,Etiopatogenia de los trastornos depresivos.
2238,,9470188,"Trastorno facticio, un diagnóstico a tener en cuenta."
2239,,9441197,Dependencia de alcohol y sistema serotoninérgico: implicaciones terapéuticas.
2240,,9609057,Relevancia del estudio tiroideo en pacientes con trastornos psiquiátricos.
2241,,9477689,Tratamiento de los trastornos depresivos.
2242,,9528309,Una aproximación psicoanalítica a la ética de la relación médico-paciente.
2243,,9477607,Fluoxetina en el tratamiento de los trastornos límite de personalidad.
2244,,9477686,Clasificación y clínica de las depresiones.
2245,,10420965,Aspectos diferenciales de los ISRS.
2246,,9432223,Manejo de depresión y ansiedad en atención primaria.
2247,,11109646,Por qué la medicina basada en la evidencia? 20 años de metaanálisis.
2248,,11082891,Hacia dónde vamos con la neuroimagen?
2249,,9462996,Conceptos básicos de la teoría electroencefalográfica.
2250,,9547213,Síntomas positivos y negativos en la esquizofrenia: patrones de cambio durante la exacerbación aguda.
2251,,9547211,"Los ""ataques de nervios"": un estudio de caracterización diagnóstica."
2252,,9411567,Transferrina deficiente en carbohidratos y otros marcadores de consumo de alcohol en el hospital general.
2253,,9333687,Análisis de la intensidad de la depresión después de un accidente cerebrovascular y de su relación con la localización de la lesión cerebral.
2254,,11269908,Indicaciones de terapia grupal para alcohólicos.
2255,,9547214,"Deficits neuropsicológicos, complicaciones obstétricas y ajuste premórbido en pacientes con un primer episodio psicótico."
2256,,9547212,Trastornos psiquiátricos y deterioro cognitivo en la ataxia de Friedreich.
2257,,9453759,Utilidad de la transferrina deficiente en carbohidratos en los problemas por uso de alcohol.
2258,,9340159,Memoria y epilepsia.
2259,,9280680,Neuroquímica de la enfermedad de Parkinson y parkinsonismos plus.
2260,,9412164,Evaluación crítica de la utilización de antidepresivos en la adolescencia.
2261,,9412162,Trastorno disfórico premenstrual: tratamiento a largo plazo con fluoxetina y discontinuación.
2262,,9412160,Predictores de rehospitalización en la esquizofrenia.
2263,,9412163,Estudio de validación del Center for Epidemiologic Studies-Depresion (CES-D) en una población española de pacientes con trastornos afectivos.
2264,,9412159,Un enfoque psicobiológico de los trastornos de la personalidad.
2265,,10996882,Eficacia de la terapia de grupo para alcohólicos. Resultados de un ensayo clínico controlado.
2266,,9303658,Relación entre atención primaria y especializada.
2267,,9382249,Aspectos psicosociales del niño enfermo crónico y su familia.
2268,,9515285,Respuesta inmune disminuida por estrés académico intenso: cambios de la proliferación linfocitaria en estudiantes de medicina.
2269,,9382290,Factores de riesgo en los intentos de suicidio del adolescente.
2270,,9324587,Nuevas aplicaciones clínicas de los potenciales evocados cerebrales: mismatch negativity (MMN).
2271,,9381963,"Reacciones de la familia después de la muerte de un ser querido: duelo, aflicción y luto."
2272,,9381959,Clima emocional familiar y perfil clínico en la esquizofrenia.
2273,,9381957,Trastorno bipolar II: curso y conducta suicida.
2274,,9381962,Consecuencias neuropsicológicas de la asfixia perinatal.
2275,,9381958,Conciencia de enfermedad y síndrome positivo/negativo en la esquizofrenia.
2276,,9381956,Tratamiento del trastorno mixto de ansiedad-depresión con sertralina.
2277,,11625761,De pequenino e que se torce o pepino: a infancia nos programas eugenicos da Liga Brasileira de Higiene Mental.
2278,,9333918,Burnout y reactividad al estrés.
2279,,9139153,Motivo de consultas médicas en pacientes con enfermedades psiquiátricas: fenómenos de somatización e intentos de autólisis.
2280,,9245195,Síndromes psiquiátricos y factores sociales en atención primaria.
2281,,9245193,Tratamiento con tianeptina de trastornos depresivos en el anciano.
2282,,9245189,Discinesia tardía: una revisión.
2283,,9380967,Los cien años del signo de Babinski.
2284,,9245194,Validez de constructo y seguridad del indice de Endogeneidad Newcastle I.
2285,,12690408,Mecanismo de acción molecular de los neurolépticos.
2286,,9504107,Epidemiología genética y molecular de los trastornos del comportamiento.
2287,,9092099,El Sistema de Registro de Información sobre Drogas. Un auxiliar diagnóstico en la evaluación de la farmacodependencia.
2288,,10611562,Morbilidad psiquiátrica asociada a enuresis infantil.
2289,,9133159,Tratamiento del trastorno obsesivo-compulsivo resistente: una actualización.
2290,,9133155,Tratamiento de las distimias con sertralina.
2291,,9334478,"Estudio de factores genéticos en la agregación familiar de la esquizofrenia en Santiago, Chile."
2292,,9054205,Consideraciones clínicas sobre la comorbilidad de los trastornos por ansiedad en la infancia y adolescencia.
2293,,9054203,Aplicaciones de la neuropsicología en el ámbito médico: el estudio de la diabetes mellitus como modelo de investigación.
2294,,10545663,Eficacia de la fluoxetina (FX) en el tratamiento de la adicción a cocaína en pacientes en mantenimiento con metadona y su interacción en los niveles plasmáticos.
2295,,9280446,Salud mental en Atención Primaria: un estudio bibliométrico.
2296,,9132843,Trastornos mentales en la infección por el VIH-1.
2297,,9054204,Dismorfofobia y espectro obsesivo-compulsivo.
2298,,10752262,Alcances de la responsabilidad moral por la acción terapéutica.
2299,,8991387,Capacidad de aprendizaje y memoria en los pacientes con epilepsia criptogénica y crisis parciales.
2300,,12372221,Influencia de la transmisión serotoninérgica en la respuesta a olanzapina.
2301,,8999724,Estacionalidad y urgencias psiquiátricas.
2302,,10422297,Estudio epidemiológico sobre intoxicaciones agudas y dotación de botiquines de antídotos.
2303,,8984849,Risperidona en el tratamiento de la esquizofrenia crónica: estudio multicéntrico comparativo versus haloperidol.
2304,,8964387,La depresión en la práctica diaria.
2305,,8984854,Afectación neuropsicológica en la epilepsia infantil.
2306,,8758675,"Variables clínicas, psicológicas y biológicas en un grupo de 108 pacientes adolescentes con anorexia nerviosa."
2307,,8653606,Validación de la escala de Allen para el diagnóstico del accidente vascular cerebral.
2308,,8766451,La ansiedad en el lenguaje y en la historia.
2309,,8766447,Son la misma experiencia la angustia patológica (o vital) y el miedo común? (un estudio controlado).
2310,,9005035,Determinación en sangre y orina del consumo reciente no terapéutico de sustancias psicotropas en los pacientes que ingresan en la unidad de psiquiatría de un hospital general de Valencia.
2311,,8766452,Psicopatía y neuropsicología del córtex prefrontal.
2312,,8766446,Trastorno disfórico premenstrual: un estudio epidemiológico.
2313,,8757545,Epidemiología del suicidio en México de 1970 a 1994.
2314,,8681166,Neuropsicología de la zurdería: conocimientos actuales.
2315,,10488588,"Estudio longitudinal, mediante el xenodiagnóstico, de la parasitemia en pacientes con infección por Trypanosoma cruzi crónica."
2316,,10554394,La enseñanza de la psicología médica.
2317,,8721923,Dosis diarias definidas de fármacos antiparkinsonianos en Alcoi.
2318,,8686563,Aspectos clínicos de la anorexia nerviosa en el varón.
2319,,11785034,Proteínas morfogenéticas óseas y neuronas colinérgicas en el sistema nervioso central.
2320,,8667665,Problemas específicos de la terapia antiálgica en el medio hospitalario.
2321,,12447815,Perfil neuropsicológico y conductual de los déficit de atención en el síndrome X frágil.
2322,,9803576,Estudio de las derivaciones de atención primaria a salud mental: Qué coincidencia existe entre los motivos de derivación y el diagnóstico del especialista?
2323,,9803575,Prescripciones de utilidad terapéutica baja inducidas en atención primaria.
2324,,8900972,Factores familiares en las tentativas de suicidio de adolescentes.
2325,,8851998,La dislexia. Estado actual de neuestros conocimientos neurológicos y neuropsicológicos.
2326,,8599037,La edad de inicio de los problemas por el alcohol como factor pronóstico de abstinencia en pacientes ingresados en el Hospital General.
2327,,8523953,"Trastorno por somatización en atención primaria: aspectos clínicos diferenciales. Grupo de Estudio de la Morbilidad Psíquica y Psicosomática de Zaragoza, Sección de Atención Primaria (GEMPPZ, AP)."
2328,,8558965,Enseñanza teórica y enseñanza práctica: una clasificación pertinente?
2329,,8585437,Psicooncología: ansiedad.
2330,,8585438,Estrés y ansiedad.
2331,,9717340,Variables relacionadas con las conductas de riesgo para la transmisión del VIH en pacientes drogodependientes.
2332,,11418967,Factores de riesgo de trastornos conductuales y emocionales en la niñez: estudio comunitario en el Uruguay.
2333,,11334599,"Comunicación, burnout y resultados clínicos: más preguntas que respuestas."
2334,,9796021,Cuarenta y dos años de neurofisiología aragonesa en el marco de las otras neuroespecialidades.
2335,,8728794,"Ethos, psique, soma. De la medicina y sus mutaciones."
2336,,8553925,Síndrome neuroléptico maligno: una revisión bibliográfica.
2337,,8553919,Epilepsia y conductas delictivas.
2338,,8728799,Serotonina plaquetaria en enfermos depresivos endógenos y controles normales.
2339,,8600561,Detección de problemas de salud mental en la infancia.
2340,,9585961,Potencial P300 provocado por estímulos visuales.
2341,,7484306,Abuso de antidepresivos inhibidores de la monoaminooxidasa (IMAO): una revisión crítica.
2342,,7484304,Escala de experiencias subjectivas Frankfurt-Pamplona.
2343,,8948897,"Los factores que se relacionan con el inicio, el uso continuado y el abuso de sustancias psicoactivas en adolescentes mexicanos."
2344,,7484301,Elaboración de un instrumento para el diagnóstico de los trastornos de personalidad basado en el SCID-II: Versión española. Traducción y adaptación.
2345,,10068742,Utilización de recursos médicos por los pacientes con síndrome de intestino irritable en un hospital de tercer nivel.
2346,,8525223,Construcción y evaluación de pauta de medición de riesgo relacional madre-recién nacido.
2347,,8525221,"Prevalencia de depresión postparto y factores asociados en Santiago, Chile."
2348,,9528052,Lafora y la neuropatología.
2349,,8525234,Por qué bioética hoy?
2350,,8602554,Alteraciones del sueño en senescentes consultantes a la práctica médica general.
2351,,7544059,Trastorno obsesivo-compulsivo y depresión.
2352,,7645413,Aplicabilidad de la versión española del Cuestionario de Salud Física-PSI-de Belloc: una escala de medida del estado de salud percibida.
2353,,9462977,Neurología extrahospitalaria. Análisis descriptivo de una consulta en el Baix Llobregat.
2354,,7569550,Utilización clínica de la naltrexona.
2355,,7731300,Delirium en población anciana ingresada en un hospital general.
2356,,7625242,Un nuevo trastorno de la alimentación (el debate diagnóstico II).
2357,,7625238,Trastornos de la personalidad en una unidad psiquiátrica: un análisis retrospectivo.
2358,,7497176,Factores etiológicos y pronósticos en la epilepsia tardía.
2359,,7660846,Detección de trastornos psiquiátricos en senescentes.
2360,,9580483,Educación médica en la Universidad de los Andes.
2361,,8548601,Tratamiento farmacológico de la enfermedad de Alzheimer: situación actual y perspectivas.
2362,,7717152,Psicooncología: influencia de la percepción externa sobre los rasgos de personalidad en mujeres con cáncer.
2363,,7717150,Psicopatología nuclear de la anorexia nerviosa. (El debate diagnóstico I).
2364,,7717148,Problemas relacionados con el alcohol en Cantabria.
2365,,7717153,Evolución y respuesta terapéutica en el trastorno obsesivo-compulsivo.
2366,,7484184,"El significado psicológico del concepto ""amiga"" en adolescentes mexicanos: una comparación por género."
2367,,7484187,Afiliación religiosa y enfermedad mental en Brasil.
2368,,10758426,La esquizofrenia: una enfermedad cerebral. II. Neuroimagen funcional.
2369,,7887209,El suicidio y la eutanasia como actitudes de deseo frente a la muerte.
2370,,7892642,Dieciocho meses de seguimiento en pacientes con esquizofrenia.
2371,,7811490,Sintomatología neuropsicológica frontal frente a temporal en tumores supratentoriales de estirpe neuroepitelial.
2372,,10611564,La esquizofrenia: una enfermedad cerebral. I. Neuroimagen estructural.
2373,,7996877,Estudio de la influencia de los factores laborales y sociodemográficos en el desarrollo del síndrom de agotamiento profesional en el área de medicina especializada del INSALUD de Avila.
2374,,7803052,Sumatriptán.
2375,,7817849,El rol femenino como determinante de la salud mental de las mujeres de la población general de Cantabria.
2376,,7817847,La reactividad al estrés como factor modulador de la psicopatología.
2377,,7984794,El síndrome de burn-out en los médicos del Sistema Sanitario Público de un Area de Salud.
2378,,7872025,Psicopatología del humor depresivo.
2379,,7817850,Modelos de esquizofrenia: una revisión de los hipotéticos procesos patológicos subyacentes a las manifestaciones fenomenológicas.
2380,,7817848,Depresión endógena y neurótica otra vez. III: Refuerzos para una hipotesis secuencial.
2381,,7810372,El insomnio en pacientes asmatícos.
2382,,7810373,Validacion de la escala de los síndromes positivo y negativo (PANSS) en una muestra de esquizofrenicos españoles.
2383,,7810371,Manifestaciones psiquiátricas en pacientes con lupus eritematoso sistémico.
2384,,7991801,Bases neurobiológicas de la agresión: implicaciones farmacoterapéuticas.
2385,,7484294,Factores pronósticos en pacientes esquizofrénicos.
2386,,7484292,Diseño de un programa de prevención del suicidio en la adolescencia.
2387,,8207992,Difusión internacional de los ensayos clínicos realizados en España. Un análisis a través de su publicación en revistas científicas.
2388,,7654924,Detección y evaluación de los pacientes toxicómanos atendidos en un centro de asistencia primaria.
2389,,8079675,Factores psicosociales en la úlcera duodenal.
2390,,8079671,Crisis de angustia nocturna en agorafóbicos.
2391,,7515627,Etiopatogenia de la esquizofrenia: aspectos neuroquímicos.
2392,,8209711,Depresión endógena y neurótica otra vez. II: Es un artefacto metodológico la separación entre ambas?
2393,,8290760,La privacíon de sueño y su efecto sobre el estado de ánimo y el rendimiento de los residentes.
2394,,8172010,Depresión endógena y neurótica otra vez. I: la distinta cualidad como elemento aglutinador de la sintomatología depresiva nuclear.
2395,,8291812,Interconsultas paidopsiquiátricas hospitalarias en niños con enfermedades crónicas.
2396,,8135152,"Factores implicados en las ""rutas asistenciales"" en salud mental."
2397,,8135150,El rol femenino como determinante de la salud mental de las mujeres de la población general de Cantabria.
2398,,8213289,"Niveles plasmáticos de fluoxetina: farmacocinética, respuesta terapeútica y efectos secundarios."
2399,,8318627,Diagnóstico y tratamiento de la sintomatología depresiva en atención primaria.
2400,,8333322,Diferencias en función de la edad de la memoria auditiva verbal.
2401,,8333316,Depresión neurótica vs depresión endógena: dos momentos evolutivos diferentes de la misma enfermedad? (Un estudio controlado).
2402,,8272618,Depresión y climaterio. Aspectos clínicos y neuroendócrinos.
2403,,8237436,Depresión en el embarazo y el puerperio: estudio de factores de riesgo.
2404,,8237432,Mapeo cromosómico molecular en enfermedades psiquiátricas.
2405,,8429725,Complicaciones psiquiátricas del postoperatorio del trasplante hepático.
2406,,8475821,Artritis reumatoide: algunos aspectos psicosomáticos.
2407,,8116458,"Aplicación diagnóstica de la CIE-10-1990 a un grupo de alcohólicos de la Clínica Psiquiátrica, 1991-1992."
2408,,8060442,El Centro de Tratamiento Diurno: su origen e impacto en los servicios de salud mental para niños y adolescentes.
2409,,1341127,Trastorno limítrofe de personalidad: estudio comparativo del diagnóstico clínico y la prueba de Rorschach.
2410,,1341123,Pacientes con trastornos de pánico: seguimiento de cinco años.
2411,,1296466,Un abordaje integral de los aspectos psicológicos del niño asmático.
2412,,1288070,Aspectos psicofisiológicos y psicopatología asociada en las disfunciones sexuales.
2413,,1288066,La influencia de la personalidad en la conducta suicida.
2414,,1288064,Trastornos de personalidad en pacientes con trastorno por crisis de angustia.
2415,,1482272,Influencia del clima familiar en la adaptación al programa de hemodiálisis en pacientes con insuficiencia renal crónica.
2416,,1462807,Ajuste premórbido y síntomas esquizofrénicos negativos.
2417,,1462805,La urgencia psiquiátrica en el hospital general: un análisis de las indicaciones de hospitalización.
2418,,1362345,Estudio de la creatinfosfokinasa en una población psiquiátrica hospitalaria.
2419,,1635972,Infección por VIH y SIDA: aspectos neuropsiquiátricos y Neuropsicológicos.
2420,,1529750,Ludopatía: estudio clínico y terapéutico-evolutivo de un grupo de jugadores patológicos.
2421,,1417421,Fundamentos lesionales y clínicos del daño cerebral alcohólico.
2422,,1416519,Intentos de suicidio en la infancia y adolescencia: características epidemiológicas.
2423,,1630206,Análisis de las revistas biomédicas españolas mediante el factor de impacto.
2424,,1416495,Ansiedad y depresión.
2425,,1497414,Validación del registro de la temperatura axilar como marcador biológico rítmico. Estudio de la variable sexo.
2426,,1496912,Estados depresivos en la esclerosis múltiple. Revisión bibliográfica crítica.
2427,,1610601,Alteraciones de la memoria en la enfermedad de Parkinson. Relación con las variables clínicas.
2428,,1340553,Aspectos clinicos de la depresion en pacientes de medicina general.
2429,,1605708,Diagnóstico y tratamiento extrahospitalarios de pacientes con trastorno por angustia.
2430,,1502960,La carbamacepina: un tratamiento adjunto eficaz en las esquizofrenias.
2431,,9723094,Intento suicida y desesperanza.
2432,,1821538,Análisis del entorno del niño como elemento de prevención.
2433,,1807100,Prevalencia y patrones psicosociales de consumo de alcohol en Cantabria.
2434,,1687234,La entidad nosológica de la bulimia nerviosa.
