,abstract,id,title
540,,24071039,Escoliosis de aparición precoz. ¿Qué opciones tengo?
541,,23597952,Administración intravenosa de ácido tranexámico para reducir la hemorragia y la transfusión en cirugía protésica de rodilla y cadera: ¿es segura y coste-efectiva?
542,,24701777,Modificación de la osteotomía de Scarf para el tratamiento del hallux valgus: experiencia en el Instituto Nacional de Rehabilitación.
543,,24701773,Resultados a medio plazo del desbridamiento artroscópico en las lesiones osteocondrales de astrágalo.
544,,24701767,Artroscopía de cadera... ¿Vamos bien?
545,,24071052,Procedimiento de Sauvé-Kapandji en los trastornos de la articulación radiocubital distal.
546,,24071046,¿Es el autoinjerto del campo quirúrgico suficiente para la obtención de una buena artrodesis en paciente con escoliosis idiopática del adolescente?
547,,24071042,Tratamiento de los puentes fisarios centrales postraumáticos mediante resección-interposición asistida por artroscopio.
548,,23540390,"Artrosis, osteoporosis y fracturas: controversias y evidencias."
549,,17257485,Repercusión en la estabilidad del segmento suprayacente después de la fijación de la espondilolistesis. Estudio comparativo de dos sistemas.
550,,24707612,Comparación del clavo intramedular femoral proximal (PFN) versus placa DHS para el tratamiento de fracturas intertrocantéricas. Análisis prospectivo.
551,,24707619,Analgesia postoperatoria en cirugía de reemplazo articular.
552,,24707617,Liberación del túnel del carpo con incisiones mínimas. Evaluación de la técnica en modelos de cadáver fresco.
553,,24707613,Anteromedialización en el tratamiento de la rótula alta y lateralizada en el adulto.
554,,23885650,Factores relacionados con la calidad de vida al año de la artroplastia total de cadera y rodilla: estudio multicéntrico en Cataluña.
555,,16446858,Valores plasmáticos de proteína C reactiva (PCR) en cirugía ortopédica electiva.
556,,23680661,Disminución de las transfusiones alogénicas por la generalización del uso de recuperadores de sangre postoperatorios en cirugía de prótesis de rodilla.
557,,24707602,Tratamiento de la tuberosidad anterior de la tibia por avulsi6n en adolescentes.
558,"antecedentes: la alta prevalencia de artrosis en los países occidentales, el elevado costo de las intervenciones de artroplastia de cadera y rodilla y las amplias variaciones en la práctica médica generan gran interés por comparar los costos asociados antes y después de la cirugía. Objetivo: conocer el costo de las intervenciones de reemplazo total de cadera y rodilla durante la estancia hospitalaria y al año de seguimiento posterior al alta. material y métodos: estudio multicéntrico y prospectivo efectuado en 15 hospitales de tres comunidades autónomas. La relación entre las variables independientes con el costo de la estancia y costo post-alta, se analizó con modelos multinivel y para agrupar los casos se utilizó la variable ""hospital."" Las variables independientes fueron: edad, sexo, índice de masa corporal, calidad de vida prequirúrgica (cuestionarios ED-5D, SF-12 y Womac), intervención (cadera-rodilla), índice Charlson, complicaciones, número de camas y dependencia económico-institucional del hospital, comunidad autó-noma y presencia de cuidador. Resultados: el costo promedio por paciente, sin incluir el costo de la prótesis, fue de 4,734 Euros ± 2,136 y el costo del seguimiento post alta de 554 Euros ± 509. Si se incluye el costo de la prótesis, al final del año el costo total asciende a 7,645 Euros ± 2,248. Conclusiones: existe un margen considerable en la reducción de los costos de estancia; más de 44% de la variabilidad observada no está determinada por las condiciones clínicas de los pacientes sino por el comportamiento de los centros hospitalarios. ",23769249,Prótesis total de rodilla y cadera: variables asociadas al costo.
559,,23746921,Tratamiento artroscópico de las lesiones osteocondrales de astrágalo: estudio de 73 casos.
560,,23746917,Artroplastia de cadera con vástago convencional en fracasos de osteosíntesis de fracturas del fémur proximal.
561,,24707609,Artroplastía total de rodilla navegada. ¿Por qué utilizarla?
562,,24707603,"Factor tipo ""burst"" de columna toracolumbar, fijación con tornillo."
563,,24707599,"Plastía de ligamento cruzado anterior con técnica de ""U-Dos""."
564,,23746920,Resultados a medio plazo de la artroplastia monopolar modular de cabeza radial.
565,,23746918,Resultados y complicaciones de la osteosíntesis de fracturas pertrocantéreas de fémur mediante clavo endomedular con espiral cefálica (clavo femoral proximal antirrotación) en 200 pacientes.
566,,23746916,Artroplastia total de cadera primaria electiva no cementada en octogenarios. Estudio de caso-control.
567,,23746914,Factores pronósticos del fenómeno de crankshaft en los pacientes con escoliosis y cartílago trirradiado abierto. ¿Es el doble abordaje la solución?
568,,23473582,Utilización de dabigatrán etexilato en postoperatorios traumatológicos de adultos mayores en un sistema de hospitalización a domicilio.
569,,23177315,Papel de la radiología intervencionista en el diagnóstico y tratamiento de la columna vertebral dolorosa.
570,,24701766,Artroplastía de hombro reversa: complicaciones y prevención.
571,,24701762,Tenotomía y aponeurotomía percutánea (TAP) para la contractura de los flexores de rodilla en niños con parálisis cerebral espástica.
572,,24701760,Utilización del metal trabecular en artroplastía total de rodilla en pacientes obesos graves y mórbidos (IMC >35 kg/m2).
573,,24701756,Nuestra experiencia en la aplicación del control de daños ortopédico en fracturas de pilón tibial por alta energía.
574,,23608217,Consenso SECOT sobre tromboembolismo en la cirugía protésica de rodilla y cadera.
575,,23608211,Placas mediales versus laterales para las fracturas de pilón tibial: estudio prospectivo de 40 fracturas.
576,,23608209,Implante de concentrado de médula ósea autógeno en el tratamiento de la necrosis isquémica de cabeza femoral: evolución clínica al segundo año de seguimiento de un estudio prospectivo no controlado.
577,,24701761,Diafisectomía de la falange proximal en el quinto dedo supraducto y dedo en martillo en niños.
578,,24701759,"El atrapanovias. Una técnica útil, fácil y segura en la toma de autoinjerto de recto interno y semitendinoso en reconstrucción de ligamento cruzado anterior."
579,,24701757,Artrodesis metatarsofalángica del primer dedo y resección artroplástica de la cabeza del segundo al quinto metatarsiano en pie reumático.
580,,23608210,Pinzamiento femoroacetabular: asociación entre el área de sobrecobertura y la zona de delaminación condral acetabular.
581,,23199828,Eficacia de la vertebroplastia en fracturas vertebrales crónicas sintomáticas debidas a osteoporosis. Estudio de 5 pacientes.
582,,12861509,Lógica clínica en cirugía ortopédica de la parálisis cerebral.
583,,24192583,Guía de recomendaciones para la profilaxis de la enfermedad tromboembólica venosa en adultos en la Argentina.
584,,23748662,"Respuesta de los autores: Modelos farmacoeconómicos de simulación, metaanálisis y patrocinio de la industria."
585,,23594988,Repuesta a la carta al director acerca del artículo «Fracturas pediátricas de cabeza y cuello de radio»
586,,23594980,Los registros de artroplastias como sistemas de vigilancia poscomercialización: el Registro de Artroplastias de Cataluña.
587,,23594978,UniSpacer™: corrección de la desalineación en varo en la gonartrosis medial. Resultados preliminares.
588,,23461921,Estabilización dinámica transpedicular en el tratamiento del conducto lumbar estrecho. Seguimiento cuatro años.
589,,24701745,"Fractura de radio distal, correlación clínica-radiográfica posterior a fijación con placa volar."
590,,24701743,Resultados funcionales de la cirugía del conducto cervical estrecho.
591,,23250681,Compresion medular: aproximacion multidisciplinar a una autentica urgencia neurooncologica.
592,,23246338,Fijación lumbar posterior empleando el sistema de imagen quirúrgica O-arm: experiencia inicial.
593,,23748661,"Modelos farmacoeconómicos de simulación, metaanálisis y patrocinio de la industria."
594,,23594987,Fractura de la extremidad proximal de radio en niños.
595,,23594983,Adherencia y satisfacción en la profilaxis antitrombótica ambulatoria oral frente a la parenteral: estudio SALTO.
596,,23594981,Coste-efectividad del proceso hallux valgus en cirugía mayor ambulatoria.
597,,23594979,Reconstrucción vascular durante la cirugía de sarcomas para la preservación de extremidades: serie de casos y algoritmo de manejo.
598,,23594977,Análisis de costes del tratamiento con viscosuplementación con ácido hialurónico estabilizado en pacientes con artrosis de rodilla candidatos a implantación de prótesis.
599,,24701750,Incidencia y efecto de la discrepancia en la longitud de la pierna después de la artroplastía total de cadera.
600,,24701746,Plastía de manguito rotador con técnica de sutura puente bridge.
601,,24701744,Aumento de la estabilidad en la osteosíntesis de húmero distal osteoporótico con implantes convencionales.
602,,23246337,"Comentario al trabajo «Fijación lumbar posterior empleando el sistema de imagen quirúrgica O-arm: experiencia inicial», de Castro-Castro et al."
603,,23200630,Resultado funcional de la artroplastia de hombro en mayores de 65 años.
604,,23084319,El momento de retirada del manguito de isquemia en las artroplastias totales de rodilla no influye en la necesidad de transfusión.
605,,23325135,Impacto presupuestario para el Sistema Nacional de Salud de la prevención del trombolismo venoso con apixaban en pacientes sometidos a artroplastia total de rodilla o cadera.
606,,23594948,"Conceptos actuales sobre la enfermedad de Scheuermann: presentación clínica, diagnóstico y controversias sobre su tratamiento."
607,,23594944,Estudio de la concordancia de un sistema de planificación preoperatoria digital en artroplastia total de cadera.
608,,23594942,Cirugía de mínima invasión frente a cirugía convencional. Una aproximación desde la evidencia científica.
609,,23594938,El raquis no se libró de las leyes del mercado. La artrodesis con autoinjerto sigue siendo el procedimiento tipo.
610,,24712202,Artroplastía total de hombro con bloqueo interescalénico. Estudio de factibilidad.
611,,24712200,Estabilización dinámica interespinosa versus fijación transpedicular y artrodesis en el tratamiento del conducto lumbar estrecho en pacientes de 45 a 65 años de edad.
612,,23594949,Epifisiolisis de la cabeza femoral.
613,,23594943,Análisis coste-efectividad de apixaban frente a dabigatrán en la prevención de la tromboembolia venosa en pacientes intervenidos de artroplastia total de rodilla o de cadera.
614,,23594941,Tratamiento de la infección recalcitrante de cadera mediante colgajo de músculo vasto lateral.
615,,23594939,Correlación de resultados clínicos y perfil sagital en escoliosis del adulto. Valor del ángulo espinosacro y del ángulo de inclinación del raquis.
616,,23336147,Características morfométricas del sacro en población Mexicana. Su importancia dentro de los procedimientos de fusión y fijación lumbosacra.
617,,24712211,Fijación vertebral por vía transpedicular. Importancia de los estudios anatómicos y de imagen.
618,,24712205,Síndrome de túnel cubital y la prueba por rascado para determinar el procedimiento quirúrgico.
619,,24712203,"Artroplastía total de rodilla, pronóstico al restablecer la línea articular."
620,,22578911,El final de las vertebroplastias.
621,,23498067,Profilaxis de la enfermedad tromboembólica venosa en cirugía ortopédica mayor. Papel de los nuevos anticoagulantes.
622,,23594898,Artroplastia de codo.
623,,23594890,"Revisión de los resultados a los 10 años del tratamiento quirúrgico de las fracturas supracondíleas de húmero en el niño, tratadas mediante reducción abierta y fijación interna."
624,,23594888,Utilización de recursos sanitarios y costes asociados al diagnóstico y tratamiento de cada episodio de trombosis venosa profunda y sangrado en pacientes intervenidos de cirugía ortopédica de cadera o rodilla.
625,,23351443,Análisis económico de dalteparina en la indicacióncirugía de rodilla en el Instituto Mexicano del Seguro Social.
626,,24712195,Manejo artroscópico integral para la osteoartritis de hombro.
627,,22871355,Abordaje mínimamente invasivo de las lesiones espinales intradurales extramedulares. Revisión de 30 casos.
628,,22621713,Novedades en la enfermedad tromboembólica venosa.
629,,23594899,Carta en relación al artículo «Cirugía en lado erróneo: implicación del paciente y los profesionales. Experiencia en la Cirugía Mayor Ambulatoria de la Unidad de Pie»
630,,23594891,Síndrome de Fenton.
631,,23594887,¿Podemos responder a las crecientes expectativas sobre las artroplastias?
632,,23096538,Factores de riesgo e infección del sitio quirúrgico en procedimientos de cirugía ortopédica con prótesis.
633,,23594854,Las nuevas guías de profilaxis de enfermedad tromboembólica venosa en artroplastia de cadera y rodilla electivas: ¿nos acercamos o nos alejamos del consenso?
634,,23594844,Evaluación mediante navegación intraoperatoria de la laxitud del ligamento cruzado anterior en su reconstrucción anatómica monofascicular.
635,,23594851,El abordaje posterolateral en las fracturas trimaleolares de tobillo. Técnica quirúrgica.
636,,23594847,Tratamiento mediante aloinjertos óseos estructurales en resecciones por tumores óseos de huesos largos. Revisión de 37 casos.
637,,23594845,Eficacia y seguridad de una única inyección intraarticular de ácido hialurónico al 2% más manitol en artrosis de rodilla durante un periodo de 6 meses.
638,,22037162,Recursos y modelos de atención al pie diabético en Cataluña (España): estudio descriptivo sobre espacios de mejora.
639,,22738999,"Tromboprofilaxis con enoxaparina para artroplastia total de rodilla: estudio observacional, retrospectivo y multicéntrico comparando el inicio del tratamiento preoperatorio con el postoperatorio."
640,,23594808,Partículas de polietileno en líquido sinovial tras artroplastia de rodilla con un polietileno convencional o uno altamente entrecruzado. Estudio preliminar.
641,,23594811,Artrodesis del raquis. Ciencia básica.
642,,23594809,Integración tendinosa de plastias autólogas en túneles de diferente calibre. Estudio experimental en ovejas.
643,,23320309,Estudio comparativo entre las técnicas de Fisk-Fernández y Matti-Russe para el manejo de las seudoartrosis de escafoides carpal.
644,,22820359,"Nuevos anticoagulantes: dabigatrán, rivaroxabán y apixabán."
645,,23113400,Moldeamiento nasoalveolar prequirúrgico en el niño con fisura labiopalatina.
646,,22551483,El tratamiento preoperatorio con aspirina a dosis bajas no aumenta la hemorragia quirúrgica ni la tasa transfusional en la prótesis total de rodilla.
647,,22551482,Control del dolor postoperatorio en artroplastia de rodilla: bloqueo del nervio femoral con dosis única frente a bloqueo femoral continuo.
648,,22542876,Influencia de la intensidad de estimulación del catéter femoral sobre analgesia postoperatoria tras prótesis de rodilla.
649,,23594754,Tratamiento quirúrgico de las fracturas diafisarias y conminutas de la clavícula mediante placa anatómica de bajo perfil.
650,,23323298,Medición de iones de cromo y cobalto en pacientes con artroplastía total de cadera metal-metal.
651,,22985758,Valoración del estado cognitivo postoperatorio. Estudio preliminar comparativo de analgesia de plexo lumbar o epidural en pacientes sometidos a cirugia protésica de cadera.
652,,23594751,Cirugía del lado erróneo: implicación del paciente y los profesionales. Experiencia en la Cirugía Mayor Ambulatoria de la Unidad del Pie.
653,,23594749,Intereses específicos.
654,,23323297,Comparación entre tres tipos de artroplastía total de disco lumbar. Seguimiento mínimo de 4 años.
655,,22317849,Biopatología de la membrana sinovial en la artritis psoriásica.
656,,22265605,Abordajes anteriores mini-open en el raquis toracolumbar.
657,,22225611,Tratamiento regional del sarcoma y melanoma localmente avanzado de la extremidad mediante la perfusión aislada con tumor necrosis factor α y melfalan asociada a hipertermia.
658,,22520104,Neuronavegación en la cirugía de la inestabilidad atloido-axoidea: «the spinal shift»
659,,23177940,Valoración clínico funcional tras artroplastia unicompartimental de rodilla. Influencia de la corrección del eje mecánico.
660,,23177938,Fracturas de acetábulo. Resultados a corto plazo.
661,,23177936,Artroplastia primaria de cadera: resultados en el primer año y factores predictores de mala evolución.
662,,22552131,La rehabilitación y fisioterapia domiciliaria en las prótesis de rodilla.
663,,23320337,Funcionalidad y osteointegración de los aloinjertos oseos en osteosarcomas de huesos largos.
664,,23177941,Estudio multicéntrico sobre la incidencia de infección en prótesis de rodilla.
665,,23177937,Análisis estadístico de los factores que aumentan el sangrado perioperatorio en las fracturas trocantereas.
666,,23177935,Niveles de comprobación científica.
667,,22768814,Descripción en cadáver de nueva incisión segura para osteosíntesis de fractura de acetábulo.
668,"La asimetría de la longitud de los miembros inferiores es una afección en la cual la longitud de una pierna difiere de la contralateral, motivo de consulta frecuente en el consultorio del pediatra y del ortopedista infantil. El objetivo de nuestro trabajo fue desarrollar recomendaciones de seguimiento, planificación prequirúrgica y tratamiento de niños con asimetría de la longitud de los miembros inferiores mediante el consenso de expertos. Material y métodos. Se utilizó el método Delphi. Un grupo coordinador seleccionó el panel de expertos, diseñó y analizó cada una de las rondas de consulta. Los cuestionarios semiestructurados fueron enviados por correo electrónico en forma personalizada. Se estableció como criterio de consenso un acuerdo entre los expertos > 80 %. En cada una de las rondas, se reformularon los aspectos no consensuados y se agregaron nuevos sugeridos en la ronda anterior. Se consideró como medida de estabilidad para concluir la consulta cuando más del 70 % de los expertos no modificó su opinión en rondas sucesivas. Resultados. Participaron del consenso 8 expertos en ortopedia y 6 en diagnóstico por imágenes. Luego de 3 rondas de consulta, se logró el consenso en 39 recomendaciones referentes a seguimiento, planificación prequirúrgica y tratamiento. Fueron reagrupadas en 32 recomendaciones finales. Conclusiones. Estas son las primeras recomendaciones para el seguimiento de niños con asimetría de la longitud de los miembros inferiores mediante el consenso de expertos. ",30869482,Recomendaciones para el seguimiento de niños con asimetría en la longitud de los miembros inferiores: consenso de expertos.
669,,22634996,"Calidad de vida de persona con heridas complejas en Cartagena, Colombia."
670,,22256383,"Neuronavegacion en la cirugia de la inestabilidad atloido-axoidea:""the spinal shift""."
671,,22167284,Técnicas de reconstrucción nerviosa en cirugía del plexo braquial traumatizado. Parte 2: Transferencias nerviosas intraplexuales.
672,,22512099,Tratamiento quirúrgico de las luxaciones acromioclaviculares mediante cirugía mínimamente invasiva.
673,,22512097,Resultados a mediano plazo de la reparación artroscópica en la inestabilidad recidivante glenohumeral anteroinferior.
674,,22078695,Tendencia anual de las artroplastias de rodilla y cadera en artritis reumatoide entre 1998-2007.
675,,22176822,2-octilcianoacrilato y bicarbonato de sodio para osteosíntesis de arco cigomático. Un modelo animal.
676,,21945068,Validación de una escala reducida de capacidad funcional del cuestionario WOMAC.
677,,21855048,Cierre de fístulas nasopalatinas recurrentes con plasma rico en factores de crecimiento en pacientes con paladar hendido.
678,,23155632,Resultados preliminares en la corrección del pectus excavatum con técnica de Welch modificada por Acastello.
679,,21724181,Otra aplicación del sistema STRATOS para corrección de deformidades óseas del tórax (Pectux excavatum). Reoperación tras fracaso de un procedimiento de Ravitch.
680,,22141217,Utilidad del bloqueo iliofascial continuo versus la analgesia epidural continua para la analgesia postoperatoria en artroplastia total de rodilla.
681,,22509639,Vástagos cementados en la artroplastía de cadera: historia y evolución.
682,,22509635,Alargamiento femoral con fijador externo uniplanar en pacientes pediátricos.
683,,13281001,Ortopedia functional en el Instituto Municipal de Ortodoncia.
684,,4921952,Las reposiciones amplias de ortopedia; sus inconvenientes.
685,,14326846,EL NI NO FISURADO. COLABORACIÓN DE LA ORTOPEDIA FUNCIONAL DE LOS MAXILARES EN EL TRATAMIENTO DE LOS NIN OS FISURADOS.
686,,13649356,Respiración bucal y ortopedia máxilo-facial.
687,,13500603,Amputaciones y ortopedia.
688,,13323615,El contacto-presión en ortopedia.
689,,14365527,Acerca de la ortopedia y la traumatologäa y sus vinculaciones con la medicina psicosomática.
690,,13228954,"La pequeña sesion practica de la Societe Française d'Orthopedie dentofacial y las XXVIII jornadas Dentarias de Paris, 23-28 noviembre de 1954."
691,,22509636,"Artrodesis de tobillo con FMIP, asistida con artroscopía. Propuesta alternativa."
692,,22509634,Evolución del tratamiento de las fracturas de radio distal en España. Es el camino correcto?
693,,21930410,Ensayo clínico aleatorizado sobre el control del dolor en las fracturas pertrocantéreas de fémur mediante el uso o no de tracción cutánea.
694,,21743943,Fijación vertebral posterior guiada por neuronavegación. Experiencia en 121 casos.
695,,21743944,Resultados a largo plazo de la microdiscectomía lumbar en una población labo- ralmente activa.
696,,22512111,Valoración funcional de los diferentes tipos de plastía del ligamento cruzado anterior empleados en el Servicio de Artroscopía del Hospital General Xoco.
697,,22051719,Aloinjertos óseos y la función del banco de huesos.
698,,22030884,Actividades de prevención del pie diabético en pacientes de consulta externa de primer nivel.
699,,21295886,"Diabetes: gasto, proceso y resultado en España. Calidad con amputaciones."
700,,21597655,artrodesis posterior C1-C2. Experiencia en fijación transarticular e interarticular en 36 pacientes.
701,,15376571,Artroplastia total de rodilla en pacientes con artritis reumatoide.
702,,22512123,Correlación clínica - imagenológica - artroscópica en el diagnóstico de las lesiones meniscales.
703,,22512121,El abordaje anterolateral en la cirugía miniinvasiva de la cadera.
704,,21703141,Discectomía percutánea para tratamiento del dolor radicular.
705,,21527963,Relación del índice tobillo/brazo determinado por ultrasonido Doppler con desenlaces cardiovasculares y amputación en un grupo de pacientes con diabetes mellitus 2 estudiados en el Instituto Nacional de Ciencias Médicas y Nutrición Salvador Zubirán.
706,,21412668,Infección por Candida spp. sobre prótesis articulares.
707,,21339078,Auditorías clínicas del procedimiento de la artroplastia total de cadera y su impacto en la mejora de la calidad asistencial.
708,,21548257,Comparación entre artrodesis y no artrodesis en fracturas de vértebras torácicas y lumbares: Seguimiento de dos años.
709,,21548253,Artroplastía total de rodilla con inserto tibial ultracongruente. Seguimiento a dos años.
710,,21548251,Prevención de infecciones en el perioperatorio de la artroplastía primaria de cadera y rodilla.
711,,21354507,Resultados del afilamiento del oblicuo superior en el tratamiento del síndrome de Brown plus.
712,,21400759,Evaluación de resultados funcionales en el tratamiento de miembros pélvicos con cirugía multinivel en pacientes espásticos con parálisis cerebral infantil.
713,,21400762,Elongación por callotaxis en braquimetatarsia congénita.
714,,21246804,Fracturas de fémur distal. Análisis comparativo de dos diferentes tratamientos quirúrgicos.
715,,21246802,Evaluación de pacientes con fractura de radio distal tratados con fijación percutánea.
716,,21246800,El factor de necrosis tumoral alpha como biomarcador de infección en las artroplastias totales de rodilla.
717,,21246805,Evaluación neuromotora de pacientes con parálisis cerebral espástica tratados con cirugía ortopédica en el Instituto Nacional de Rehabilitación.
718,,20656538,Manipulación y preparación de aloinjerto de Aquiles para la reconstrucción del ligamento cruzado anterior-ligamento cruzado posterior.
719,,20638653,Fijación quirúrgica de las fracturas costales con grapas y barras de titanio (sistema STRATOS). Experiencia preliminar.
720,,21305762,Fractura-luxación de la articulación interfaláingica proximal.
721,,21305756,Evaluación de resultados en el tratamiento de fracturas periprotésicas Vancouver B1 y propuesta de indicaciones del uso de aloinjerto cortical como parte de la fijación.
722,,21222310,Diabetes y cambios en el estado funcional de los ancianos: una realidad?
723,,21194505,Costos directos e indirectos por amputaciones en mano derivadas de accidentes de trabajo.
724,,21222311,Necesidades específicas en el cuidado de los ancianos con diabetes mellitus.
725,,20645484,Comparación de los marcadores de la hemostasia dependiendo de la técnica anestésica/analgésica empleada en cirugía de prótesis de rodilla y cadera.
726,,20927140,Abordaje posterior mínimamente invasivo en artroplastia total de cadera. Estudio prospectivo y aleatorizado. Un año de seguimiento.
727,,20836375,Espaciador interespinoso. Aplicaciones en la hernia discal lumbar de origen degenerativo.
