,abstract,id,title
1019,"La insuficiencia del tendón del tibial posterior es la causa adquirida de dolor más común relacionada con la deformidad de pie plano valgo en adultos. El pie plano adquirido por el adulto es una deformidad sintomática muy dolorosa que resulta de un estiramiento gradual (atenuación) del tendón del tibial posterior, así como de los ligamentos que sostienen el arco de la planta del pie. El dolor progresivo en el pie plano adquirido por el adulto afecta cuatro veces más a las mujeres que a los hombres. Algunos factores que contribuyen a incrementar el riesgo del pie plano adquirido en el adulto son la diabetes, la hipertensión y la obesidad. Se piensa que la combinación de los eventos siguientes es la causa del pie plano adquirido por el adulto. La clasificación de Johnson Strom modificada por Mayerson lo evalúa en cuatro estadios. Este estudio se dividió en tres etapas: etapa 1: disección y análisis tridimensional del tendón, etapa 2: aplicación de herramientas de bioingeniería para determinar las causas de ruptura del tendón del tibial posterior y etapa 3: evaluación de 24 pacientes con enfermedad de pie plano valgo para describir la deformidad. ",30182553,Análisis biomecánico a través de simulación numérica de la ruptura del tendón del tibial posterior en el pie plano valgo: estudio en cadáver.
1020,,11321999,"Estudio de factores asociados con amputación, en pacientes diabéticos con ulceración en pie."
1021,,29126611,La ratio de grosor diafragmático (inspiratorio/espiratorio) como método diagnóstico de parálisis diafragmática asociada al bloqueo interescálenico.
1022,,11181208,Estenosis del canal lumbar en la acondroplasia. Prevención y corrección de la lordosis lumbosacra.
1023,"Los problemas discapacitantes de hombro en la tercera edad son frecuentes. Cuantificar los diagnósticos encontrados en 100 casos consecutivos en rehabilitación y su repercusión funcional en la escala de DASH. 100 pacientes consecutivos con edad 65 años recibidos en rehabilitación, se efectuó diagnóstico y valoración funcional en la escala de DASH. La distribución por género con predominio del femenino (67%); la edad mostró variación de 65 a 98 años con promedio y DE 78 ± 12; los 10 diferentes diagnósticos correspondieron a ruptura del tendón supraespino (58%); artrosis glenohumeral (11%); síndrome de pinzamiento (9%); secuelas de fractura de tercio proximal de húmero (9%); artrosis acromioclavicular (7%); ruptura del tendón de la porción larga del bíceps (2%); fractura de la escápula (1%); necrosis avascular de cabeza humeral (1%); luxación escápulo- humeral recidivante inveterada (1%) y lesión del nervio circunflejo (1%). La distribución correspondió a 52% derechas, 40% izquierdas y 8% bilaterales. La escala de DASH mostró variación de 94 a 52% con promedio y DE 71 ± 22.3. Los problemas de hombro en la tercera edad se asocian siempre a discapacidad importante. ",30182540,Lesiones de hombro en la tercera edad y su repercusión funcional en escala de DASH.
1024,,29598978,Valores normales de 3 métodos para determinar rótula alta en niños de 6 a 12 años.
1025,,29430329,Parámetros sagitales espino-pélvicos en una población asintomática Argentina.
1026,,31095194,Equinococosis quística músculo-esquelética primaria de evolución crónica.
1027,,28764906,Aportación enfermera en el abordaje de la fibrosis quística.
1028,,11706444,Placa-caja para fijación cervical por vía anterior. Estudio biomecánico.
1029,,11244832,"Primera anestesia con éter en Aguascalientes, México."
1030,,11234608,Análisis de la relación coste-efectividad de un programa de autotransfusión en cirugía protésica primaria de rodilla y cadera.
1031,"Un gran número de pacientes que padece artrosis se mantiene sintomático a pesar del tratamiento no quirúrgico. Se ha planteado que el uso de ultrasonido terapéutico de onda pulsátil sería una alternativa de tratamiento no quirúrgico de la artrosis, sin embargo, no está clara su real utilidad. Para responder esta pregunta utilizamos Epistemonikos, la mayor base de datos de revisiones sistemáticas en salud a nivel mundial, la cual es mantenida mediante búsquedas en múltiples fuentes de información, incluyendo MEDLINE, EMBASE, Cochrane, entre otras. Extrajimos los datos desde las revisiones identificadas, reanalizamos los datos de los estudios primarios, realizamos un metanálisis y preparamos una tabla de resumen de los resultados utilizando el método GRADE. Identificamos seis revisiones sistemáticas que en conjunto incluyen ocho ensayos aleatorizados. Concluimos que no está claro si el ultrasonido de onda pulsátil lleva a una mejoría funcional en artrosis, y que podría llevar a una disminución de escasa cuantía en el dolor en artrosis, pero la certeza de la evidencia es baja. ",29286351,¿Es el ultrasonido de onda pulsátil una alternativa en el tratamiento de la artrosis?
1032,,11706443,"Fusión cervical postdiscectomía. Estudio clínico-radiológico comparando el injerto óseo de cresta iliaca, placa cervical anterior con injerto óseo y placa-caja GD."
1033,,11387846,Reflexiones sobre la pauta con heparinas de bajo peso molecular más idónea para la profilaxis antitrombótica en artroplastia de cadera y rodilla.
1034,,11234601,Infiltración de la herida quirúrgica con anestésico local para analgesia postoperatoria en pacientes intervenidos de hernia de disco lumbar. Estudio comparativo entre ropivacaína y bupivacaína.
1035,"La osteoartritis de rodilla es una enfermedad articular caracterizada por degeneración, pérdida del cartílago y alteración del hueso subcondral asociadas a cambios en los tejidos blandos. En una muestra de 2,500 individuos se encontró una prevalencia de artrosis de 2.3% (IC 95% 1.7 a 2.9) en adultos. En nuestro hospital representa la segunda causa de consulta. Se tomaron dos grupos de pacientes: el primero, de 70 pacientes a los que se les aplicó hilano G-F 20 en tres infiltraciones; al otro grupo, de 40 pacientes, se le aplicó colágeno-PVP en cuatro aplicaciones. Se les realizó un interrogatorio basado en el cuestionario de WOMAC, con el cual pudimos valorar dolor, rigidez y capacidad funcional antes y después de la aplicación de los medicamentos. Nuestro estudio presentó que en ambos grupos hubo mejora de la calidad de vida al disminuir los síntomas tales como dolor, rigidez y limitación funcional; el colágeno fue más eficiente para la disminución del dolor y el hialino G-F 20, para la disminución de la rigidez y la limitación funcional. Ambos tratamientos mostraron seguridad y eficacia. Su uso en nuestro instituto para los pacientes fuera de tratamiento quirúrgico puede disminuir de manera importante los internamientos por dolor, con lo que podemos hacer un uso más eficiente de los recursos con que contamos. ",29641854,Comparación de la respuesta clínica a la aplicación de hilano G-F 20 y colágeno-PVP en pacientes con artrosis de rodilla.
1036,"El presente estudio fue realizado con la finalidad de conocer, evaluar y clasificar las fracturas de cadera tratadas en un servicio ortopédico de un hospital general. Estudio retrospectivo, transversal y descriptivo, con base en los archivos del Módulo de Cirugía de Cadera y Pelvis de un hospital general, en el período comprendido de Julio de 2009 a Diciembre de 2016. Se obtuvo un total de 1,545 pacientes con edades entre 14 y 107 años; de cada paciente se analizó el lado afectado, la causa de ingreso, sus patologías de base previas, el tipo de fractura, el tipo de tratamiento otorgado y el resultado final. El análisis estadístico fue realizado con el programa SPSS versión 18. Debido a la relevancia del tema, se examinaron las causas de las defunciones registradas (n = 58); en relación con los datos registrados, se obtuvo 2 y regresión logística binaria. Las fracturas de cadera continúan siendo un tema infravalorado, con grandes repercusiones económicas y sociales; conocer el tipo de fractura más frecuente, así como la población mayormente afectada, ayudará a establecer medidas de prevención eficaces para disminuir la morbimortalidad de esta enfermedad en un hospital general. ",29641852,Perfil epidemiológico de los ingresos al Módulo de Cirugía de Cadera y Pelvis del Hospital General Xoco de la Secretaría de Salud.
1037,,29206823,Fracturas torácicas y lumbares en los adolescentes. Estudio de ocho años.
1038,,29664526,Optimización perioperatoria del paciente anciano con fractura osteoporótica de cadera.
1039,"En la degradación del cartílago articular, la limitación funcional y el dolor se asocian a la alteración cuantitativa y cualitativa del ácido hialurónico en un proceso fisiopatológico sobre el que influye una amplia variedad de factores cuyo impacto agrava la enfermedad y disminuye la calidad de vida del paciente. El manejo farmacológico convencional para la osteoartritis es a menudo insuficiente. Por fortuna, en el mundo actual se cuenta con viscosuplementos capaces de mejorar, restituir y promover la producción endógena del ácido hialurónico degradado en los cuadros de osteoartritis. El uso de estos compuestos exige el apego a un conjunto de técnicas específicas, diseñadas para la correcta infiltración intraarticular del viscosuplemento sin necesidad de infligir una carga traumática adicional al paciente; estas técnicas con referencia especial al paciente afectado por la osteoartritis de rodilla (gonartritis) se describen en el presente artículo, en el que además se destacan los criterios para la elección del viscosuplemento idóneo, el más semejante al ácido hialurónico nativo de personas jóvenes y sanas y aquel cuyo uso terapéutico reporta mayores beneficios clínicos a corto y a largo plazo. ",29641861,Reunión multidisciplinaria sobre técnicas de aplicación para la restitución de fluido sinovial en pacientes con artritis de rodilla: puesta al día.
1040,,29196143,Inmunoglobulina G intravenosa como tratamiento adyuvante en epilepsia infantil farmacorresistente.
1041,"Los servicios bibliotecarios y de información enfocados a apoyar la investigación, la docencia y la atención médica son de vital importancia para la generación de nuevos conocimientos y su aplicación en la atención médica por el personal del área de la salud, y los alumnos en proceso de formación, contribuye a mejorar la calidad de la atención médica. Por ello, en el presente artículo exponemos un recorrido histórico y social de 50 años de los servicios bibliotecarios del Instituto Mexicano del Seguro Social en Puebla. De 1964 a 2014 ocurrieron muchos sucesos en el desarrollo de estos servicios en nuestro medio, desde la creación de un espacio pequeño ubicado en el sótano, hasta un espacio establecido ex profeso para otorgar servicio digno a todos los usuarios, por lo que se muestra este bosquejo histórico como reconocimiento a aquellos primeros bibliotecarios que contribuyeron a la formación de especialistas en México. ",29190871,Cincuenta años de los servicios de información biomédica en centros de documentación en salud de Puebla.
1042,,11200511,Incidencia de amputaciones de extremidades inferiores en la población con diabetes mellitus de Málaga (1996-1997).
1043,,11171464,Monitorización neurológica en anestesiología. Dónde estamos y adónde nos dirigimos?
1044,,11131855,"Nuevo distractor oseo simplificado, para la osteogénesis inducida en la mandíbula. Experiencia en 126 casos clínicos."
1045,,29211273,Diabetes mellitus tipo 2 y osteoartritis primaria de rodilla.
1046,"Determinar la confiabilidad entre dos observadores y el cambio mínimo detectable de los estudios de neuroconducción para diagnosticar el síndrome de túnel carpiano. Se estudiaron 69 pacientes remitidos para estudio electrofisiológico por sospecha de síndrome de túnel carpiano. A los pacientes, se les realizaron dos exámenes, dos días diferentes, por dos evaluadores. Se evaluaron las latencias sensitivas y motoras de los nervios mediano y cubital; todos fueron clasificados como negativos, incipientes, leves, moderados, severos o extremos. Se calculó la variación relativa entre ensayos, el coeficiente de correlación intraclase, el índice de kappa, el límite de acuerdo y el cambio mínimo detectable. La variación relativa entre ensayos de la latencia motora del nervio mediano fue de -6,8 % a 15,9 % con coeficiente de correlación intraclase de 0,98 para la diferencia con la latencia del nervio cubital. El cambio mínimo detectable fue de 0,4ms. La variación relativa entre ensayos de la latencia sensitiva del nervio mediano fue -5,0 % a 11 % con coeficiente de correlación intraclase de 0,95 para la diferencia con el nervio cubital. El cambio mínimo detectable fue de 0,2ms. La clasificación ele trofisiológica coincidió en 93 % de los casos, índice de kappa de 0,89. Las latencias sensitivas y motoras del nervio mediano así como la diferencia de estas con el nervio cubital son medidas confiables. El cambio mínimo detectable obtenido en nuestro estudio le sirve al clínico para establecer si los cambios de las latencias en estudios consecutivos o después del tratamiento son significativos. ",30183855,Confiabilidad de los estudios de neuroconducción en el síndrome de túnel carpiano.
1047,"Los osteocondromas subungueales son tumoraciones benignas de la región sub- o periungueal que ocasionan elevación, ulceración y deformidad a dicho nivel. Investigar la incidencia de osteocondroma subungueal en un segmento de población pediátrica. Estudio retrospectivo, transversal, descriptivo y observacional, basado en la revisión de expedientes con resultado histopatológico de osteocondroma de 2001 a 2014. Cuatro de los osteocondromas correspondieron a la presentación subungueal, con una distribución por sexos de 1:1 y un promedio de edad de 9.5 años, relación 3:1, derecho:izquierdo; el cuarto dedo fue el más afectado. El osteocondroma sunbungueal presenta una incidencia de 8.5% de todos los osteocondromas. ",29216690,Osteocondromas: presentación del osteocondroma subungueal.
1048,,29171628,Cooperación internacional ¿en qué estamos y hacia dónde vamos?
1049,,12601955,Elongación ósea progresiva del área máxilo-facial: distracción mandibular.
1050,,11082885,Plasticidad cortical y restauración de funciones neurológicas: una actualización sobre el tema.
1051,"La lesión del ligamento cruzado anterior (LCA) constituye una causa importante de reposo en deportistas. En su mayoría, las lesiones del LCA no requieren contacto externo y se asocian con factores de riesgo biomecánicos que aumentan la tensión en el LCA: el aumento del ángulo de valgo de rodilla (VR), flexión de cadera (FC) y una menor flexión de rodilla (FR). El LCA requiere cooperación de los grupos musculares perirrodilla, por lo que la fatiga producida por el ejercicio alteraría el balance y pondría en riesgo a este ligamento. El objetivo del estudio es determinar el comportamiento angular antes y después de una carga física para FC, FR y VR en niños nacidos en los años 2002-2003. Se realizó un estudio clínico no aleatorizado. La muestra consistió en 50 alumnos de escuelas de fútbol nacidos en los años 2002 y 2003. Se comparó el comportamiento angular de FC, FR y VR antes y después de realizar un entrenamiento estandarizado. El comportamiento angular fue medido a través de la realización de la prueba DJ, con datos obtenidos por sensores inerciales. Posterior al ejercicio, aumentaron las tres variables; sólo fue significativo el incremento en la flexión de cadera. Por otra parte, destaca la diferencia encontrada tanto en reposo como postejercicios entre la extremidad de apoyo y la hábil en el peak de valgo angular. Se concluyó que el comportamiento angular de FC aumenta significativamente en ambas extremidades postentrenamiento y que se deben aplicar medidas preventivas para el manejo del valgo en la extremidad de apoyo. ",29216703,Efecto de un entrenamiento deportivo en el compartimiento angular de la extremidad inferior en niños futbolistas de entre 11 y 12 años.
1052,"La patología relacionada al manguito de los rotadores permanece entre las enfermedades musculoesqueléticas más prevalentes. Hay una creciente necesidad de estudios de imagen (RMN, US, artroscopía) para probar el rendimiento diagnóstico de la historia clínica y el examen físico. Objetivo: Demostrar el valor diagnóstico de un modelo predictor clínico-radiográfico para rupturas completas del manguito de los rotadores. Material y métodos: Estudio descriptivo, observacional, prospectivo, transversal, analítico. Se evaluaron 55 pacientes con dolor de hombro en forma preoperatoria con 13 variables de predicción: edad > 50 años, dolor nocturno, debilidad muscular, signos clínicos de Neer, Hawkins, Jobe, caída de la rotación externa, Napoleón, abrazo del oso, Gerber; medición radiológica del espacio subacromial, índice acromial y ángulo crítico del hombro. En cada variable se midió sensibilidad-especificidad, valor predictivo positivo y negativo. Se compararon los resultados de cada variable para diagnosticar rupturas del manguito de los rotadores contra los hallazgos postoperatorios. Resultados: De los 55 pacientes evaluados, 42 presentaron ruptura completa del mango rotador en el postoperatorio. Se seleccionaron las ocho variables con mayor valor diagnóstico y se realizó una curva ROC, proporcionando un área bajo la curva de 0.88. Conclusiones: Este modelo de predicción emplea ocho variables (edad > 50 años, dolor nocturno, debilidad muscular, caída de la rotación externa, Jobe, Hawkins, espacio subacromial ≤ 6 mm y ángulo crítico del hombro > 35°) que en conjunto suman el valor predictivo de 0.88 (AUC) para diagnosticar rupturas completas del tendón supraespinoso. ",29216699,Valor diagnóstico de un modelo de predicción clínico-radiográfico para rupturas completas del manguito de los rotadores por pinzamiento subacromial.
1053,,29216708,Carta al Editor.
1054,"El pinzamiento femoroacetabular (PFA) se considera actualmente la causa principal de osteoartritis idiopática o primaria de cadera. Nuestro objetivo fue determinar la prevalencia de datos radiográficos de PFA en la población adulta sin patología coxofemoral en un período de seis meses. Estudio analítico, observacional, multicéntrico, ambispectivo y transversal realizado en archivos radiográficos digitales. Se midieron los ángulos de cobertura acetabular, cervicodiafisario, inclinación acetabular y ángulo de Tönnis; el tipo de coxa, índice triangular y deformidad en mango de pistola. De 212 articulaciones coxofemorales, 49.1% (104/212) correspondieron a hombres y 50.9% (108/212) a mujeres, con edad promedio de 42.81 ± 17.9 años; 21 articulaciones (21/212, 9.9%) presentaron deformidad en mango de pistola más índice triangular positivo para cam. Para determinar el tipo pincer, correlacionamos sobrecobertura acetabular, horizontalización acetabular, ángulo de Tönnis negativo ( 0°) y tipo de coxa profunda y/o protrusio, con una prevalencia de 5.66% de pincer (12/212). Nuestra población es muy pequeña a pesar de involucrar varias instituciones; la prevalencia del PFA tipo cam predominó en hombres, del lado derecho. El tipo pincer predominó en mujeres, del lado izquierdo. Este estudio está limitado por la amplia variación radiológica de la rotación femoral. Por otro lado, se aportan algunos datos sobre la prevalencia de deformidades de la cadera, previamente no registrada. ",29216704,Prevalencia de datos radiográficos de pinzamiento femoroacetabular en adultos mexicanos.
1055,,11187455,Uso apropiado de los mecanismos de fijación en la prótesis de cadera.
1056,,11068466,Nutrición parenteral total en la cirugía mayor del raquis.
1057,,28542655,Factores de riesgo asociados a insuficiencia renal aguda postoperatoria en pacientes pediátricos intervenidos de cirugía cardiaca que requirieron de circulación extracorpórea.
1058,"La artropatía de Charcot es una patología que afecta al sistema musculoesquelético al alterar la biomecánica y causar reacciones bioquímicas con alteraciones óseas y articulares. Se infiere la prevalencia de 1%. La historia natural de la enfermedad, clasificada por Eichenholtz y modificada por Simmons, consta de cuatro fases; en cuanto a la localización, Sanders describe cinco áreas afectadas en el pie. Nuestro objetivo fue valorar si el método establecido para el tratamiento de esta patología es eficaz al diagnosticar cada fase y dar el tratamiento correspondiente mediante los estándares establecidos en la literatura, sin importar la localización, como lo muestra el algoritmo. Se consideró que el tratamiento fue exitoso en los casos que presentaron alineación, consolidación total y marcha independiente con zapato comercial (85%), sin realizar amputaciones; hubo 15% de fracasos funcionales: casos no consolidados, con alineación parcial, marcha dependiente de soporte y reactivación. Al no encontrar diferencias significativas entre las fases de la enfermedad y los tratamientos, inferimos que el abordaje empleado es el adecuado a cada fase; el éxito no depende de la fase en la que se diagnostique, sino del tratamiento individualizado. ",28840671,Artropatía de Charcot: un método para su tratamiento. Seguimiento a cinco años.
1059,,11002720,Comentarios sobre cuál es el mejor momento para proceder a la osteosíntesis de las fracturas en los pacientes politraumatizados con traumatismo torácico asociado.
1060,"Diseño y validacion de un sistema de clasificacion para evaluar el grado de discapacidad de los pacientes con esclerosis lateral amiotrofica. Introduccion. Actualmente no existe un sistema de clasificacion validado y de uso comun para estadificar la gravedad de la esclerosis lateral amiotrofica. Pacientes y metodos. Basados en la escala de valoracion funcional para la esclerosis lateral amiotrofica revisada, se establecieron cuatro dominios (bulbar, destrezas manuales, funcion motora gruesa y funcion respiratoria). A cada item se le asigno una puntuacion de 0 si su calificacion era igual o mayor de 3 (independencia), o 1 si su calificacion era menor de 3 (dependencia). La escala de clasificacion funcional se definio desde el estadio 1 (sin perdida de independencia en ningun dominio) hasta el estadio 5 (perdida de independencia en los cuatro dominios). Esta clasificacion se correlaciono con la necesidad de ayudas externas, la calidad de vida aplicando la escala del cuestionario de evaluacion de la esclerosis lateral amiotrofica-40, la fuerza muscular y la sobrevida. Resultados. De un total de 244 pacientes, el 14,3% se encontraba en estadio 1; el 23,8%, en estadio 2; el 21,3%, en estadio 3; el 19,3%, en estadio 4; y el 21,3%, en estadio 5. Fuerza muscular y calidad de vida fueron inversamente proporcionales a la etapa de la enfermedad. La necesidad de ayudas externas se relaciona directamente con el aumento de los estadios de la enfermedad de 1 a 5 (p < 0,012). Se encontro una mayor sobrevida de los pacientes en los estadios 1 y 2 con respecto a los estadios 3, 4 y 5 (p = 0,004). Conclusion. El sistema de clasificacion propuesto es de facil aplicacion y se correlaciona bien con la clinica del paciente, su calidad de vida, el requerimiento de recursos y la sobrevida. ",28128428,Diseño y validacion de un sistema de clasificacion para evaluar el grado de discapacidad de los pacientes con esclerosis lateral amiotrofica.
1061,,11002715,Reducción de las necesidades transfusionales con aprotinina en cirugía ortopédica. Grupo Español de Estudio del Empleo de Aprotinina en Artroplastia de Cadera (GEEEAAC).
1062,,28728961,Necrosis avascular de cabeza femoral en pacientes tratados de leucemia. Evaluación de la necesidad de un protocolo diagnóstico.
1063,,28283313,Factores de riesgo asociados a recaída de enfermedad por reflujo gastroesofágico en pacientes de primer nivel de atención exitosamente tratados con inhibidor de la bomba de protones.
1064,"Introducción: La tuberculosis de la columna (TBC) es una enfermedad infecciosa grave, ocasionada por la migración de la bacteria Mycobacterium tuberculosis hacia la columna vertebral. El conocimiento de esta enfermedad es prioritario para el médico no familiar y familiar. Presentamos la experiencia en pacientes con TBC de un hospital del tercer nivel en Puebla, México. Métodos: estudio descriptivo. De enero a diciembre de 2014 recolectamos expedientes de pacientes con TBC. Las variables fueron edad, género, tiempo de estancia intrahospitalaria, enfermedades asociadas, sintomatología, métodos diagnósticos, segmento de la columna vertebral afectado, tipo de tratamiento empleado y complicaciones. Se usó estadística descriptiva, medidas de tendencia central y de dispersión. Resultados: fueron 14 pacientes (71.4% hombres); la edad promedio fue 60.29 ± 16.54 años (33-93), la estancia intrahospitalaria promedio fue de 18.93 ± 9.32 días (4-34). El segmento afectado fue el dorsal en seis pacientes (42.85%) y el lumbar en ocho (57.15%). Hubo enfermedades asociadas en nueve pacientes (64.28%). Todos los pacientes recibieron tratamiento médico. Se realizaron 11 procedimientos quirúrgicos a cinco pacientes (35.7%). Las complicaciones se presentaron en dos pacientes (14.3%). Conclusiones: La TBC debe ser manejada tempranamente para evitar complicaciones graves. La atención con el primer nivel de atención médica se debe coordinar y debemos apegarnos a lineamientos nacionales e internacionales de tratamiento. ",28212479,"Tuberculosis de columna vertebral: experiencia en un hospital de tercer nivel en Puebla, México."
