,abstract,id,title
309,,12813491,Aspectos legales de la atención toxicológica.
310,,12057181,La calidad de las evaluaciones de manuscritos en Gaceta Sanitaria.
311,,12057179,Prácticas de utilización de plaguicidas en agricultores.
312,,11940432,Los médicos y la justicia (VI): debo entregar la historia clínica o es suficiente con un informe?
313,,11835886,Los médicos y la justicia (V): el secreto profesional.
314,,11702419,Evaluación antropométrica del estado nutricional y estimación de las ingestas de hierro y de vitamina C de mujeres posmenopáusicas y hombres mayores de 45 años.
315,,11333745,Incidencia y causas de muerte súbita en menores de 36 años.
316,,11027099,Revisión estructural de agentes químicos que pueden inducir parkinsonismo.
317,,11151217,Retinosis pigmentaria: resultados del análisis del gen de la rodopsina en la población gallega.
318,,11996715,Necesidades prioritarias en formación médica en certificación de defunciones en España.
319,,10687413,Asociación entre el ácido úrico sérico y otros factores de riesgo cardiovascular en población laboral masculina de Valencia.
320,,10589251,Los médicos y la justicia (III): el médico como inculpado.
321,,10589252,Los médicos y la justicia (IV): la historia clínica.
322,,10568154,Los médicos y la Justicia (II): el médico como testigo o como perito.
323,,11424040,Diagnóstico diferencial del síndrome posconmocional.
324,,11455883,Consideraciones prácticas acerca del tratamiento quirúrgico de la otosclerosis.
325,,9646652,Información preoperatoria y consentimiento informado en pacientes intervenidos quirúrgicamente.
326,,10835695,Biologia molecular y medicina a fines del siglo XX.
327,,5149619,"Frecuencia de hidatidosis en autopsias efectuadas en el Instituo de Medicina Legal y 8 hospitales de Santiago, Chile (1947-1970."
328,,9296643,Peso del encéfalo normal del venezolano adulto según sexo y edad.
329,,11625830,Influencia de un libro del Dr. Oscar Amoedo en la creacion del Instituto de Odontologia Forense en Japon.
330,,8999210,Legibilidad de los formularios escritos de consentimiento informado.
331,,9008946,Demandas judiciales contra médicos en Chile.
332,,7500679,Un marco histórico para una nueva disciplina: la bioética.
333,,9273199,Violencia y salud en Colombia.
334,,7618036,Aplicación de los GRDs en un hospital comarcal.
335,,7960455,"Tendencias de la mortalidad por cáncer en España, en especial del cáncer de pulmón, en comparación con otros países desarrollados."
336,,7810370,Diferencias epidemiólogicas en delincuentes con relación a sus antecedentes psiquiátricos.
337,,7716426,Factores alimentarios y diferencias geogräficas de la mortalidad por cáncer de páncreas en España.
338,,1792984,El suicidio en la tercera edad.
339,,1679862,Polimorfismo del DNA en la investigación biológica de la paternidad. Estado actual.
340,,2090455,Experiencias y actitudes de estudiantes de medicina en relación con la psiquiatría.
341,,8378582,Metabolismo del acetato: estudio experimental.
342,,1767087,Observaciones epidemiológicas sobre la tendencia evolutiva de la mortalidad por asma en España.
343,,1867133,Estudio de comorbilidad de enfermedades afectivas y disturbios de personalidad.
344,,2346244,Encuesta dietética en el parvulario de la Universidad Politécnica de Valencia.
345,,7899736,Diversidad genética de tres sondas de DNA en la huella digital de DNA de una población mexicana.
346,,938147,Determinación del valor real del volumen ventricular por metodos angiográficos
347,,19637724,Datos poblacionales de cinco STRs de la serie INTERPOL en una población mestiza del Occidente de México.
348,,24915719,Contribuciones de la Comisión Nacional para el Uso Forense del ADN desde una perspectiva bioética.
349,,24915717,Es infalible la prueba pericial de ADN?: planteamiento de la cuestión.
350,,24915722,La prueba de perfiles de ADN en el proceso penal español: dos décadas de evolución tecnológica y legislativa.
351,,24915716,"Derechos fundamentales afectados en la toma de muestras biológicas para la obtención de medios de prueba de ADN válidos y eficaces, desde el punto de vista del Derecho interno y del Derecho de la Unión Europea."
352,,23115827,Estudio crítico de la última jurisprudencia del Tribunal Supremo acerca de los requisitos y garantías en la toma de muestras de ADN del sospechoso.
353,,19802425,La electroforesis capilar como una nueva estrategia en la medicina y el diagnóstico clínico.
354,,20476694,"Situación actual de las bases de datos de ADN en el ambito forense: nuevos avances, nuevas necesidades jurídicas."
355,,18330105,"Ley Orgánica 10/2007, de 8 de Octubre, reguladora de la base de datos policial sobre identificadores obtenidos a partir del ADN: antecedentes históricos y visión genética."
356,,24913747,La proyección social y sanitaria de los Institutos de Medicina Legal en España: más allá de la justicia.
357,,30030015,La autopsia molecular en la muerte súbita cardiaca.
358,,23195835,Análisis microbiológico post mórtem.
359,,21826379,Validación de la causa básica de defunción en las muertes que requieren intervención medicolegal.
360,,24895736,Ser médico. . . y patólogo forense.
361,,16792984,La autopsia médico-legal.
362,,15919035,Identificación de víctimas del desastre del tsunami en Tailandia.
363,,24986472,Clusters de casos de suicidio espacio-temporal en la comunidad de Antequera (España).
364,,27056605,Biomecánica y mecanismo de producción del traumatismo cráneo-encefálico en el peatón atropellado. Evaluación de la normativa actual en la automoción.
365,,25475339,Suicidios y fuentes médico-forenses en España.
366,,18457621,El médico en el estrado. Recomendaciones para comparecer como perito ante los tribunales.
367,,16712748,Mortalidad por enfermedades del miocardio en niños y jóvenes. Estudio observacional de base poblacional.
368,,22392472,Salud pública y patología forense.
369,,12040516,Muerte súbita inesperada en epilepsia en niños y jóvenes.
370,,6594300,Patología forense.
