,abstract,id,title
196,,25435292,La artroplastia invertida de hombro ante defectos óseos glenoideos.
197,Analizar la evolución funcional y radiológica de los pacientes mayores de 75 años intervenidos de cirugía de revisión de rodilla con vástagos cementados. ,27846356,Vástagos cementados en recambios de prótesis total de rodilla en pacientes mayores de 75 años. Análisis clínico y radiológico.
198,"El ligamento cruzado anterior (LCA) participa en la regulación de la cinemática articular de la rodilla, por lo que su ruptura debe repararse lo antes posible. El tratamiento quirúrgico está encaminado a la sustitución del LCA roto por un injerto que lo reemplazará tanto anatómica como biomecánicamente. Sin embargo, se pueden presentar diferentes condiciones que produzcan una rerruptura. ",27846352,Factores de riesgo y frecuencia de rerrupturas del ligamento cruzado anterior en adultos.
199,,26752323,Dosis única intravenosa de ácido tranexámico como medida de ahorro transfusional en prótesis total primaria de rodilla.
200,,26655209,Evaluación clínico-radiológica de la técnica de aloinjerto compactado y vástago cementado en cirugías de revisión de cadera.
201,,27546866,Espaciador de cadera «invertido» para defectos masivos de fémur distal en infecciones periprotésicas de rodilla.
202,"Comparar el resultado postoperatorio inmediato en el paciente sometido a artroplastía total cementada de rodilla con y sin el uso de isquemia. Estudio observacional, transversal, retrospectivo, analítico y unicéntrico. 180 pacientes operados de artroplastía total cementada de rodilla: 120 sin isquemia, 60 con isquemia, de 2011 a 2014, edad promedio 70 años con DE ± 7 años, se comparará el sangrado operatorio, diferencial de hemoglobina y dolor como criterios de resultado postoperatorio inmediato. Se excluyeron pacientes de clínica de dolor, manejo con anticoagulantes, coagulopatía previa, patología siquiátrica, insuficientes renales o con intolerancia a AINEs. En artroplastía total cementada de rodilla sin isquemia se presenta mejor control del dolor (p = 0.026). El diferencial de hemoglobina y sangrado operatorio es menor cuando está asociado al uso de isquemia (p = .008). Se requirió transfusión sanguínea en 32.8%, sin establecer una relación entre el uso o exclusión de isquemia con relevancia estadística (p = 0.301). El dolor referido más común se encuentra entre 0 y 3 de EVA correspondiente a dolor leve en 62.2% de los casos. El diferencial de hemoglobina promedio se reporta en 3.7 con desviación estándar de ± 1.3 en un rango de 0 a 7.4. Existe menor dolor postoperatorio en el paciente al que no se aplica isquemia durante el procedimiento quirúrgico; hay menor sangrado y diferencial de hemoglobina con el uso de isquemia; sin embargo, esto no representa estadísticamente una diferencia en la necesidad de transfusión sanguínea. Se recomienda utilizar con cautela la isquemia y su uso queda a elección del cirujano. ",27627771,Artroplastía total cementada de rodilla: comparación entre el uso o no de isquemia en el resultado postoperatorio inmediato.
203,,26318807,Influencia de la masa ósea preoperatoria en la remodelación femoral periprotésica tras la implantación de una prótesis ABG-II: resultados tras 10 años de seguimiento.
204,,26277601,Actualización en el tratamiento quirúrgico del melanoma cutáneo primario y metastásico.
205,,26194908,Rivaroxaban frente al tratamiento estándar en la prevención del tromboembolismo venoso tras artroplastia de cadera o rodilla en la práctica clínica diaria (datos de España del estudio internacional XAMOS).
206,"Introducción: la artrodesis es una cirugía de salvamento para la infección periprotésica de rodilla; este procedimiento reporta moderada efectividad, alto índice de complicaciones y es la última alternativa antes de la amputación. El objetivo de este estudio fue identificar si la artrodesis de rodilla con clavo expandible y fijador externo es un tratamiento seguro y efectivo. Métodos: estudio observacional, retrospectivo, en 17 pacientes con infección periprotésica y pérdida ósea importante, tratados mediante artrodesis con clavo centro-medular expandible autobloqueante y fijador externo monoplanar con evolución mínima de 1 año; la información se obtuvo del expediente clínico e imágenes de rayos X, siendo estas evaluadas por 2 ortopedistas especializados en rescate osteoarticular. Resultados: de 17 pacientes, con una pérdida ósea grado III en un 88.2% de los casos, se obtuvo una fusión en el 82.5%. Logrando la deambulación independiente en el 88.2%. Con un promedio de 2.4 intervenciones quirúrgicas por paciente. Sin complicaciones transquirúrgicas reportadas. Con un índice de complicaciones global del 47.1% incluyendo una amputación por sepsis. La evaluación inter-observador tuvo un valor de Kappa del 0.90 y la muestra alcanzó un poder estadístico del 60%. Conclusiones: se obtuvo una consolidación similar a otros métodos, en un tiempo promedio de 6.3 meses, con un menor índice de complicaciones al reportado con otras técnicas. Siendo esta una alternativa de salvamento para la realización de artrodesis de rodilla, antes de considerar la amputación de la extremidad. ",27855056,Artrodesis mixta de rodilla: una alternativa de salvamento en infecciones periprotésicas de rodilla.
207,,27634652,Patrón de revascularización de injertos de tendones flexores rotos en reconstrucción de ligamento cruzado anterior: un estudio histológico.
208,,27124478,Transexualidad: Una Alteración Cerebral que Comienza a Conocerse.
209,,26381801,Encuesta sobre el uso y comportamiento de las prótesis de cadera metal-metal en España.
210,,26149634,Estudio clínico comparativo de 2 técnicas quirúrgicas de rizartrosis del pulgar.
211,,26165592,Evaluación de resultados funcionales y Notching tras el tratamiento de fracturas de húmero mediante artroplastia total invertida a medio plazo.
212,,26004517,Artroplastia total invertida de hombro. Evaluación de resultados clínicos y complicaciones tras una serie de 52 casos.
213,,25765582,Elaboración de un índice objetivo de selección de pacientes subsidiarios de prótesis articular de rodilla.
214,,26239865,Efecto de la retirada del manguito de isquemia sobre las necesidades transfusionales en el paciente intervenido de artroplastia primaria de rodilla.
215,,26436930,El reconocimiento legal de la transexualidad en Chile mediante el procedimiento judicial de cambio de nombre: Un caso de complementariedad epistemológica entre medicina y derecho.
216,,25563527,Cribado mediante angiogammagrafía previo a la realización de gammagrafía con leucocitos (99m)Tc-HMPAO en el diagnóstico de infección de prótesis articulares.
217,,26591937,Gestión del dolor en pacientes del programa Rapid Recovery (RR) en artroplastia total de rodilla (ATR).
218,,26320346,Tratamiento de la anemia en cirugía de fractura de cadera.
219,,17506953,"Malformaciones vasculares (II). Diagnóstico, histopatología y tratamiento."
220,,26999968,Tratamiento de la inestabilidad acromioclavicular crónica.
221,,26486536,Recuperación de la artroplastia de rodilla a través de la movilización pasiva continua.
222,,26999965,Hemiartroplastía de cúpula radial en pacientes con fractura tipo III y IV según Mason Johnston.
223,,17240951,Doble transferencia de dedo de pie a la mano en niño con simbraquidactilia.
224,,27012081,Artroplastía de hombro en el medio privado. Análisis de las variables demográficas y de comorbilidad en una muestra de 120 pacientes.
225,,24880651,Resultados de una intervención de descolonización de Staphylococcus aureus en pacientes portadores a los que se indica una prótesis articular.
226,,26999928,Prótesis reversa de hombre.
227,,26999920,Estudio comparativo de los eventos adversos entre el abordaje posterolateral y lateral directo para artroplastía primaria de cadera no cementada en pacientes mayores de 65 años con fracturas del cuello femoral.
228,,25440456,Recambio de polietileno mediante la cementación de un nuevo componente sobre el metal-back osteointegrado.
229,,25176114,"Factores de riesgo para la infección en prótesis de rodilla, incluyendo la fractura intraoperatoria y la trombosis venosa profunda, no descritos previamente."
230,,25982604,Fijación de tórax inestable con placas y tornillos bioabsorbibles. Presentación de serie de casos.
231,,25048273,Factores de riesgo de luxación de artroplastia total de cadera primaria y su resultado funcional.
232,,25037111,La geometría de la quilla condiciona el comportamiento de la bandeja tibial frente a fuerzas de torsión en prótesis totales de rodilla.
233,,24913215,Desmontaje por efecto cut-out en el enclavado de fracturas pertrocantéreas de fémur: ¿cuál es el tratamiento de rescate de elección?
234,,24968972,¿Influye el deterioro cognitivo preoperatorio en los resultados de la artroplastia total de rodilla?
235,,24485164,Eficacia de la asistencia compartida entre cirujanos e internistas para ancianos con fractura de cadera.
236,,24361156,Ácido tranexámico intravenoso en la artroplastia total primaria de rodilla.
237,,9807890,Uretroplastias de sustitución con injerto libre de mucosa bucal.
238,,25200212,Vigilancia de la infección quirúrgica: ¿cuál es el método ideal?
239,,24054042,Implantación de un sistema de vigilancia de infección de la herida quirúrgica al alta en herniorrafia y mastectomía.
240,,26021098,Tribología moderna en artroplastía total de cadera: pros y contras.
241,,25091175,El registro español de artroplastias.
242,,24913216,Artroplastia de la articulación interfalángica proximal: comparación entre el abordaje palmar y dorsal.
243,,24636447,Detección de iones metálicos en cabello tras artroplastia de cadera metal-metal.
244,,9580283,La reconstrucción total de la pared posterior del conducto auditivo externo con cartílago costal alogénico. Técnica y resultados.
245,,24704093,Utilidad del score predictivo de Cameron para la realización de traqueostomía electiva después de cirugía tumoral oral.
246,,26021103,Uso de recuperador de sangre durante la artroplastía de rodilla.
247,,24924357,Artrodesis sin fusión ósea con clavo modular intramedular para revisión de prótesis total de rodilla infectada.
248,,26021102,Resultados funcionales de fracturas Neer III-IV tratadas mediante hemiartroplastía.
249,,26021100,Utilidad del aloinjerto óseo estructurado para defectos acetabulares en prótesis de revisión.
250,"uno de los aspectos más desafiantes de la artroplastia de revisión de rodilla es el manejo de la pérdida ósea. demostrar la capacidad de incrementar la densidad mineral ósea en áreas con pérdida ósea, mediante el uso de plasma rico en plaquetas. MATERIAL Y MÉTODOS: estudio prospectivo, aleatorizado, cegado; efectuado con pacientes a quienes se realizó artroplastia de revisión de rodilla con pérdida ósea metafisiaria de tibia. Los pacientes se asignaron al azar a dos grupos para rellenar los defectos con aloinjerto óseo liofilizado con plasma rico en plaquetas (grupo experimental, n= 9), y otro grupo que sólo recibió el injerto óseo liofilizado (grupo control, n= 7). En ambos grupos la evaluación de la densidad mineral ósea se hizo con absorciometría de rayos X de energía dual (DXA) antes de la operación, al mes, seis meses, y un año después de la cirugía. se estudiaron 16 pacientes sin diferencias significativas entre ambos grupos en la densidad mineral ósea durante el periodo de seguimiento. el plasma rico en plaquetas no demostró incrementar la densidad mineral ósea en pacientes con defectos óseos por artroplastia de revisión de rodilla. ",25167350,Defectos óseos en artroplastia de revisión de rodilla tratados con aloinjerto óseo y plasma rico en plaquetas.
251,"la anestesiología moderna ha integrado a la ultrasonografía como una herramienta que ha desplazado a la neuroestimulación como técnica de localización de nervios periféricos: ¿cuál es más efectiva para guiar el bloqueo interescalénico en artroplastia total de hombro? comparar dos técnicas de localización del plexo braquial bloqueo interescalénico como técnica anestésica en artroplastia total de hombro. MATERIAL Y MÉTODOS: estudio comparativo, prospectivo, sin asignación al azar. Se incluyeron todos los pacientes programados para artroplastia total de hombro; se formaron 2 grupos: grupo neuroestimulación donde el bloqueo interescalénico fue guiado por neuroestimulación, grupo ultrasonido que fue guiado por ultrasonido. Se midió el tiempo de latencia, grado de bloqueo sensitivo y motor, tasa de éxito, intensidad del dolor postoperatorio a las 6, 12 y 24 horas, satisfacción, y complicaciones. se incluyeron 110 pacientes, 55 por grupo, posición de silla de playa y abordaje deltopectoral. No hubo diferencias en las características demográficas, neuroestimulación vs ultrasonografía: latencia 19.11 ± 2.27 vs 17.24 ± 1.42 minutos p= 0.23. Bloqueo sensitivo en ambos grupos grado 0, bloqueo motor grado 0 en 76.4% y grado 1 en 23.6%, vs grado 0 en 100%. Tasa de éxito 100% en ambos grupos, dolor postoperatorio 6 horas 0.13 ± 0.54 vs 0.11 ± 0.13 p= 0.90; 12 horas de 1.67 ± 1.15 vs 1.65 ± 0.59 p= 0.89, 24 horas 3.15± 1.66 vs 2.99 ± 1.15 p= 0.78. Satisfacción: 54.5% muy satisfecho, y 45.5% satisfecho vs 96.36% muy satisfecho y 3.6% satisfecho. Complicaciones 18.18% vs 3.6% p= 0.023. CONCLUSIÓN: el ultrasonido es la técnica de localización del plexo braquial de elección en artroplastia total de hombro. ",25167348,Bloqueo interescalénico para artroplastia total de hombro: estudio comparativo ultrasonido vs neuroestimulación.
252,,24598138,Técnica de microindentación ósea y algometría de presión aplicada al recambio protésico de rodilla y dolor en punta de vástago tibial. Resultados preliminares en un grupo de 20 pacientes.
253,,17128825,Tagliacozzi: no sólo cirujano plástico.
254,,26021117,Prótesis total de rodilla por gonartrosis grado IV.
255,,26021109,Artroplastía unicompartimental medial de rodilla con prótesis Oxford fase 3. Resultados con seguimiento de 2 a 11 años.
256,,24529683,Anestesia subaracnoidea y anestesia general en el tratamiento quirúrgico de la hernia inguinal en pacientes ambulatorios. Análisis comparativo de coste-efectividad.
257,,24582306,Artroplastia total de cadera no cementada tras fractura cervical femoral aguda en pacientes activos. Estudio prospectivo emparejado con seguimiento mínimo de 5 años.
258,,24360407,Complicaciones y nivel de satisfacción tras la realización de una dermolipectomía y abdominoplastia después de efectuar una cirugía bariátrica.
259,,26040153,Evaluación del sangrado y tiempo quirúrgico en artroplastía total de rodilla con y sin torniquete. Estudio comparative.
260,,24529747,Influye la estabilidad mediolateral de las artroplastias totales de rodilla en la evolución clínica a corto plazo? Estudio multicéntrico a un año con cirugía asistida por ordenador.
261,,24456918,¿Son útiles las unidades de pie diabético?
262,,26040158,Evaluación y tratamiento de la luxación protésica de cadera.
263,,26040152,Moldes individualizados para alineación de la artroplastía primaria de rodilla.
264,,26040148,Fracturas periprotésicas de cadera.
265,,24060164,Estudio prospectivo y aleatorizado de los resultados a largo plazo de la hernioplastia inguinal con malla autoadhesiva frente a la técnica convencional con malla de polipropileno y sutura de fijación.
266,,24332957,Utilidad y versatilidad del titanio para la reconstrucción de la pared torácica.
267,,16801017,Pronóstico del melanoma cutáneo según el servicio quirúrgico: estudio comparativo en un hospital de tercer nivel.
268,"Introducción: La adquisición de habilidades quirúrgicas constituye un factor central en la formación de todo cirujano. Sin embargo, la evaluación de las habilidades técnicas es uno de los factores más débiles y menos desarrollados. En la actualidad los recursos para evaluar las competencias técnicas adolecen de subjetividad, falta de confiabilidad y validez. La observación directa, método de evaluación más frecuentemente utilizado en nuestro medio, presenta inconvenientes instrumentales y está fuertemente influenciada por las relaciones intersubjetivas y los rasgos de personalidad. El objetivo de esta investigación es proponer creación y el uso de un instrumento objetivo para evaluar el desempeño técnico y determinar su confiabilidad y validez.Material y método: se seleccionaron dos procedimientos: colecistectomía laparoscópica y hernioplastia inguinal (técnica de Lichtenstein). Se constituyeron tres grupos de comparación según la experiencia quirúrgica: inicial, intermedio, y expertos. Se filmaron las cirugías en tiempo real, sin identificación del paciente ni del cirujano. Las filmaciones sin edición fueron asignadas a dos cirujanos expertos en forma aleatoria por sorteo y con sobres sin identificación. Para la evaluación se propuso el uso de un instrumento objetivo (explicitación de pasos a evaluar y cuantificación mediante escala de Likert) y específico para cada procedimiento. Así mismo se utilizó la escala global OSATS (R. Reznick). Se aplicó análisis de varianza no paramétrico para determinar validez. Valores de p menores a 0.05 fueron considerados estadísticamente significativos. Valores superiores a 0,80 del Coeficiente alfa de Cronbach aseguraron confiabilidad. Resultados: Desde Abril del 2010 hasta Diciembre del 2012 se filmaron 36 colecistectomías videolaparoscópicas y 31 hernioplastias inguinales. Se encontraron diferencias significativas entre los grupos en todos los ítems evaluados p<0.05. El coeficiente ? de Crohnbach fue mayor a 0,80 para ambas técnicas. No hubo diferencias significativas entre las calificaciones de ambos evaluadores. No hubo diferencias entre nuestro instrumento específico y la escala global OSATS. Discusión: Es posible y útil aplicar un instrumento objetivo de evaluación del desempeño técnico en cirugía. La herramienta presentó validez de constructo y confiabilidad aceptables. La filmación confiere perdurabilidad a un evento efímero: la cirugía. La objetividad se basa en la enunciación y cuantificación explícita de cada paso, y en la aleatorización y anonimato de la muestra. La uniformidad de criterios entre los evaluadores es fundamental para obtener resultados satisfactorios. Evaluarsiempreimplicaráunrecorte de la realidad. ",25647551,Evaluación objetiva de competencias técnicas en cirugía.
269,,25470903,Características psicológicas y resilientes de una muestra de mujeres puertorriqueñas con cirugía de reconstruccción mamaria por cáncer.
270,,24783645,Tratamiento quirúrgico del nevus melanocítico gigante: un cambio de objetivo.
271,,24531683,Disfunciones sexuales secundarias a la estenosis uretral y a la uretroplastia.
272,,24531671,Hipospadias primario.
273,,24531667,"Aspectos generales de la estenosis uretral: etiología, epidemiología, fisiopatología, clasificación. Principios generales de la reparación uretral."
274,,26031141,Lesiones del ligamento cruzado anterior.
275,"Objetivo: Determinar el estado de salud general percibida por los pacientes sometidos a artroplastia total de cadera con mini-vástago. Material y Método: Se ha administrado el cuestionario de salud SF-36 para evaluar el estado de salud percibido por 13 pacientes varones con una edad media de 46,62 (34-53) años en los que se implantó una artroplastia total de cadera no cementada tipo MiniHip® (CorinMedical) tras un seguimiento medio de 23,2 (12-47) meses. Los resultados obtenidos se compararon con los valores de referencia de la población española en varones de 45 a 54 años. Resultados: Se hallaron diferencias en aspectos como rol físico y emocional, función física, función social y dolor; mientras que en el resto de los ítems la puntuación fue similar a la de la población de referencia. Discusión: Existe la necesidad de conocer en qué grado afectan nuestras intervenciones a la calidad de vida del paciente y la manera en que es percibida por él mismo para complementar los resultados de nuestras intervenciones. Conclusión: Es necesaria una nueva perspectiva para la valoración funcional y de calidad de vida de los pacientes jóvenes sometidos a una artroplastia total de cadera. ",25927884,Valoración subjetiva de salud en el paciente joven con coxoartrosis: aplicación del cuestionario SF-36.
276,,24342698,Colgajo antebraquial radial en cabeza y cuello: nuestra experiencia.
277,,23265771,Sobre el uso de pegamento en la cirugía de las hernias. Técnica de fijación combinada en la eventroplastia laparoscópica.
278,,23764518,Resultados de una encuesta nacional sobre el cierre de la pared abdominal.
279,,24716364,Factores perioperatorios que afectan la artroplastía total de cadera.
280,,24522360,Uso del plasma rico en plaquetas en cirugía ligamentosa de rodilla.
281,,24054825,Reincorporación laboral después de cirugía electiva de la hernia inguinal.
282,,24645245,Aplicaciones de autoinjerto graso en pacientes pediátricos.
283,,24701770,"Eficacia de la prótesis no convencional para la cadera tipo RIMAG en pacientes con tumores óseos primarios, metástasis y pérdidas osteoarticulares no tumorales."
284,,24522417,Validación de un instrumento para evaluar calidad de vida asociada a hipertrofia mamaria en mujeres chilenas.
285,,24080885,Absceso de psoas asociado a infección de una artroplastia de cadera.
286,,24071043,Consenso SECOT sobre artroplastia de rodilla dolorosa.
287,,23597952,Administración intravenosa de ácido tranexámico para reducir la hemorragia y la transfusión en cirugía protésica de rodilla y cadera: ¿es segura y coste-efectiva?
288,,24187814,Impacto en la calidad de vida con cirugía reconstructiva posterior al tratamiento de cáncer de mama.
289,,23540390,"Artrosis, osteoporosis y fracturas: controversias y evidencias."
290,,17469237,Algunos aspectos éticos de la donación y el trasplante.
291,,23566935,Hernias hiatales: ¿cuándo y por qué deben ser operadas?
292,,23885651,Factores clínicos y hallazgos en la artroscopia de pacientes con artrosis de rodilla que favorecen la conversión a artroplastia total.
293,,24707619,Analgesia postoperatoria en cirugía de reemplazo articular.
294,,23885650,Factores relacionados con la calidad de vida al año de la artroplastia total de cadera y rodilla: estudio multicéntrico en Cataluña.
295,,23680661,Disminución de las transfusiones alogénicas por la generalización del uso de recuperadores de sangre postoperatorios en cirugía de prótesis de rodilla.
296,"antecedentes: la alta prevalencia de artrosis en los países occidentales, el elevado costo de las intervenciones de artroplastia de cadera y rodilla y las amplias variaciones en la práctica médica generan gran interés por comparar los costos asociados antes y después de la cirugía. Objetivo: conocer el costo de las intervenciones de reemplazo total de cadera y rodilla durante la estancia hospitalaria y al año de seguimiento posterior al alta. material y métodos: estudio multicéntrico y prospectivo efectuado en 15 hospitales de tres comunidades autónomas. La relación entre las variables independientes con el costo de la estancia y costo post-alta, se analizó con modelos multinivel y para agrupar los casos se utilizó la variable ""hospital."" Las variables independientes fueron: edad, sexo, índice de masa corporal, calidad de vida prequirúrgica (cuestionarios ED-5D, SF-12 y Womac), intervención (cadera-rodilla), índice Charlson, complicaciones, número de camas y dependencia económico-institucional del hospital, comunidad autó-noma y presencia de cuidador. Resultados: el costo promedio por paciente, sin incluir el costo de la prótesis, fue de 4,734 Euros ± 2,136 y el costo del seguimiento post alta de 554 Euros ± 509. Si se incluye el costo de la prótesis, al final del año el costo total asciende a 7,645 Euros ± 2,248. Conclusiones: existe un margen considerable en la reducción de los costos de estancia; más de 44% de la variabilidad observada no está determinada por las condiciones clínicas de los pacientes sino por el comportamiento de los centros hospitalarios. ",23769249,Prótesis total de rodilla y cadera: variables asociadas al costo.
297,,23746917,Artroplastia de cadera con vástago convencional en fracasos de osteosíntesis de fracturas del fémur proximal.
298,,24707609,Artroplastía total de rodilla navegada. ¿Por qué utilizarla?
299,,23746920,Resultados a medio plazo de la artroplastia monopolar modular de cabeza radial.
300,,23746916,Artroplastia total de cadera primaria electiva no cementada en octogenarios. Estudio de caso-control.
301,,23473582,Utilización de dabigatrán etexilato en postoperatorios traumatológicos de adultos mayores en un sistema de hospitalización a domicilio.
302,,23199474,¿Es segura la hernioplastia sin sutura como opción para tratar las hernias de pared abdominal? Estudio prospectivo con un adhesivo tisular sintético (n-hexil-α-cianoacrilato).
303,,22541448,Implantes biológicos en la cirugía de las hernias de la pared abdominal.
304,,24701766,Artroplastía de hombro reversa: complicaciones y prevención.
305,,24701760,Utilización del metal trabecular en artroplastía total de rodilla en pacientes obesos graves y mórbidos (IMC >35 kg/m2).
306,,23608217,Consenso SECOT sobre tromboembolismo en la cirugía protésica de rodilla y cadera.
307,,23608209,Implante de concentrado de médula ósea autógeno en el tratamiento de la necrosis isquémica de cabeza femoral: evolución clínica al segundo año de seguimiento de un estudio prospectivo no controlado.
308,,16155635,Ginecomastia. Tratamiento quirúrgico.
