,abstract,id,title
398,,19580136,Utilidad del heliox en la obstrucción de vía aérea superior secundaria a disfunción bilateral de cuerdas vocales postiroidectomía.
399,,19580134,Analgesia epidural en trabajo de parto y trastorno de conversión.
400,,19537276,Embolización arterial para control de hemorragia aguda perioperatoria.
401,,19537264,Trombocitosis severa perioperatoria en un caso de resección pulmonar.
402,,19408794,Inyección accidental de contraste hidrosoluble tras colocación de una sonda de nutrición enteral.
403,,19408784,Consideraciones anestésicas en una paciente con déficit de pantotenato cinasa tipo 2 (enfermedad de Hallervorden-Spatz) para estimulación cerebral profunda.
404,,19408785,Manejo anestésico en gestante afecta de púrpura trombocitopénica idiopática.
405,,19334661,Sección y embolización de catéter permanente por síndrome de pinzamiento costoclavicular (pinch-off).
406,,19334672,Hematoma epidural gigante.
407,,19334660,Fracaso renal agudo secundario a síndrome hemolítico urémico en gestante con preeclampsia.
408,,19284128,Ignición del tubo orotraqueal inducida por electrocauterio durante una traqueostomía.
409,,20831018,Fractura-luxación de columna toracolumbar en paciente gestante: diagnóstico por imagen y tratamiento.
410,,10981443,Tetraplejía en el postoperatorio inmediato de una estapedectomía.
411,,19177867,Atrapamiento de un catéter epidural. Reconstrucción de imágenes de tomografía computarizada.
412,,19177866,Neumomediastino y enfisema subcutáneo extenso tras parto eutócico.
413,,19086737,Hernia inguinoescrotal gigante.
414,,19086725,Manejo anestésico de una gestante con miocardiopatía chagásica.
415,,19086726,Insuficiencia respiratoria aguda tras tratamiento con ciclofosfamida en paciente con glomerulonefritis proliferativa.
416,,18982797,Diagnóstico: neumatocele como complicación de la neumonía relacionada con la ventilación mecánica por Staphylococcus aureus.
417,,18982789,Bloqueo del plexo cervical en paratiroidectomía mínimamente invasiva. A propósito de tres casos.
418,,18982788,Neumoencéfalo masivo y fístula de líquido cefalorraquídeo tras toracotomía.
419,,18853693,Rotura epidural de aguja de doble calibre durante anestesia subaracnoidea.
420,,18853683,Hipertensión pulmonar severa: implicaciones anestésicas en cirugía laparoscópica.
421,,18693675,Aguja metálica enclavada en aritenoides. Imagen y manejo anestésico.
422,,18693663,Anestesia total intravenosa para recolocación de un desfibrilador automático implantable en paciente con síndrome de QT-largo.
423,,18693664,Analgoanestesia subaracnoidea continua para trabajo de parto y cesárea en paciente intervenida de ependimoma.
424,,18661690,Eclampsia y amaurosis total bilateral en una paciente con diagnóstico a posteriori de leucoencefalopatía posterior reversible.
425,,18661701,Onda J de Osborn en electrocardiograma de un paciente con hipotermia grave.
426,,18661691,Embolia aérea durante cesáirea electiva y atonía uterina por feto macrosómico.
427,,18543508,Discordancia clínico-radiológica y resolución espontánea de un hematoma postcateterización epidural.
428,,24775406,Anestesia para corrección de escoliosis en paciente pediátrico con ataxia de Friedreich.
429,,18543507,Neuritis braquial idiopática tras una anestesia general.
430,,18401993,Manejo anestésico en una paciente previamente diagnosticada de síndrome de takotsubo.
431,,18402002,Hallazgo casual en radiografía preoperatoria de tórax de aneurisma de arteria subclavia derecha en paciente con disfagia.
432,,18401992,Manejo perioperatorio de un aneurisma de seno de Valsalva roto.
433,,18341907,Cirugía urgente en paciente con infarto agudo de miocardio de 72 horas de evolución: ¿cómo actuar?
434,,18383983,Vía aérea difícil en paciente con hemangioma gigante de lengua.
435,,18383975,Compresión medular neoplásica iniciada tras cateterización peridural.
436,,18383974,Perforación cardiaca como complicación tardía en paciente portador de un Desfibrilador Automático Implantable.
437,,18333387,Síndrome coronario agudo durante una cesárea en mujer joven sana.
438,,18333385,Tolerancia aguda a opioides e hiperalgesia postoperatoria tras breve infusión de remifentanilo controlados con analgesia multimodal.
439,,18221661,"Derrame pleural derecho, compatible con empiema, en mujer de 82 años."
440,,18200998,Neuropatía optica isquémica en el postoperatorio de cirugía de raquis lumbar.
441,,18201009,Exantema petequial por síndrome de embolia grasa.
442,,18200999,Cesárea en una gestante con crisis aguda de paludismo.
443,,18085118,Tetraparesia transitoria postoperatoria en paciente intervenido de osteofito cervical gigante C5-C6.
444,,18085110,Cesárea urgente en una paciente con síndrome de Coffin-Siris.
445,,18085111,Anestesia en un caso de síndrome de Angelman.
446,,17993109,Hematoma epidural bilateral secundario a traumatismo craneoencefálico.
447,,17993099,Revascularización coronaria en el paciente despierto bajo anestesia epidural.
448,,17953338,Infarto agudo de miocardio tras ablación por radiofrecuencia de vía cardiaca anómala en un niño.
449,,17953339,Ecocardiografía transesofágica intraoperatoria y movimiento sistólico anterior de válvula mitral: hallazgo intraoperatorio durante cirugía no cardíaca.
450,,17695954,Onda de pulsioximetría y pulso paradójico.
451,,17695949,Perforación diferida de ciego y sigma tras traumatismo abdominal cerrado en paciente politraumatizado.
452,,17598722,Anestesia subaracnoidea en paciente portador de bloqueo auriculoventricular completo congénito.
453,,17598729,Fuga del sellado traqueal encubierta.
454,,17518186,Manejo anestésico de recién nacida con fístula traqueoesofágica.
455,,17518176,Tratamiento conservador en el manejo de la vía aérea tras rotura traqueal iatrogénica.
456,,17364261,Síndrome de Horner secundario a anestesia epidural.
457,,17436666,Masa cervical gigante en recién nacida pretérmino.
458,,17436657,Paciente con convulsiones en el postparto. Diagnóstico diferencial.
459,,18669316,Lesión del plexo braquial secundario a bloqueo interescalénico en un paciente de acromioplastía vía artroscópica. Presentación de un caso.
460,,17390695,Manejo de la vía aérea en un paciente con espondilitis anquilosante.
461,,17390698,Rotura espontánea y migración hacia la arteria bronquial de un catéter vascular central implantable.
462,,17390694,Manejo anestésico en cesárea electiva de una gestante con enfermedad de beriberi.
463,,17319434,"Dos casos de obstrucción congénita de la vía aérea sometidos a E.X.I.T. (""ex-utero intrapartum treatment""): implicaciones anestésicas."
464,,17315104,Cuidados perioperatorios en la cirugía de estimulación subtalámica.
465,,17319443,Prótesis dental metálica enclavada en laringe.
466,,17319435,Espondilodiscitis infecciosa y absceso epidural después de una punción subaracnoidea para escisión de sinus pilonidal.
467,,17319433,Analgesia para trabajo de parto en paciente con mutación del factor V Leiden.
468,,17302082,Tratamiento perioperatorio de una gestante con infarto cerebral reciente secundario a miocardiopatía no compactada.
469,,17302080,Terapia electroconvulsiva en el tercer trimestre de la gestación. A propósito de un caso.
470,,17302093,Nudo verdadero en la guía para vía central.
471,,17302081,Complicaciones respiratorias perioperatorias en pacientes pediátricos con masas mediastínicas: a propósito de dos casos.
472,,17297835,Anestesia en un paciente con déficit del complejo III de la cadena respiratoria mitocondrial.
473,,17297833,"Polirradiculitis bilateral tras bloqueo epidural, una complicación grave poco frecuente."
474,,17297843,Enfermedad de paget e hidrocefalia obstructiva.
475,,17297834,Timectomía por videotoracoscopia asistida con bloqueo anestésico paravertebral bilateral en pacientes miasténicos.
476,,17125026,Megacolon gigante.
477,,17125017,Síndrome de dolor regional complejo tipo II tras cateterización de arteria radial. A propósito de un caso.
478,,17125015,"Manejo anestésico para la implantación de electrodos epicáirdicos en el ventrículo izquierdo, mediante cirugía mínimamente invasiva asistida."
479,,17066871,Hernia de hiato gigante identificada en la radiografía preoperatoria de tórax.
480,,17066865,Analgesia obstétrica en una paciente con tres cirugías previas de columna.
481,,17066863,Anestesia con sevoflurano para amigdalectomía a un niño con enfermedad de Duchenne.
482,,17066864,Manejo anestésico en la exéresis de un tumor intratorácico gigante.
483,,16910147,Bloqueo axilar bilateral del plexo braquial guiado por neuroestimulación múltiple y ultrasonidos en una paciente con politraumatismo.
484,,16910145,Síndrome neurológico transitorio tras bupivacaína hiperbara intradural. Un nuevo caso.
485,,16910154,Síndrome de pre-excitación tipo Wolff-Parkinson-White.
486,,16910146,Anestesia en dos casos de resección de un tumor renal con extensión a la vena cava.
487,,16827073,Miocarditis como diagnóstico diferencial del síndrome coronario agudo.
488,,16827071,Infarto agudo de miocardio durante el tratamiento tocolítico con ritodrine.
489,,17001363,Edema pulmonar por presión negativa: a propósito de 3 casos.
490,,16827072,Obstrucción del bronquio principal derecho en una paciente intubada con un tubo de doble luz izquierdo para cirugía de la aorta torácica.
491,,16711506,Punción intraneural del nervio ciático en la región poplítea. Demostración mediante el uso de la ecografía.
492,,16711502,Laceración traqueal tras intubación y aplicación de flujo contínuo de aire por el manguito externo del tubo endotraqueal.
493,,16711501,Manejo anestésico de un paciente con sialidosis.
494,,16671263,Drenaje de líquido cefalorraquídeo como tratamiento de una paraplejia tardía después de la colocación de endoprótesis en aorta torácica descendente.
495,,16671261,Bloqueo axilar en paciente alérgico a atropina ante una cirugía de urgencia.
496,,16671262,Coma prolongado por síndrome de embolia grasa tras fractura de fémur.
497,,16553356,Amígdala lingual hipertrófica en relación con un caso de intubación difícil.
498,,16553346,Seudoaneurisma de arteria radial post-canulación.
499,,16553344,Hemorragia cerebelosa tras anestesia subaracnoidea.
500,,16553345,Embolismo de líquido amniótico con evolución fulminante.
501,,16670736,Consecuencias del consumo de heroína: síndrome compartimental y rabdomiolisis.
502,,16475640,Tratamiento endovascular de lesiones en aorta torácica con drenaje de líquido cefalorraquídeo. Experiencia inicial en cinco pacientes.
503,,16475638,Fistula aorto-pulmonar como complicación de aneurisma de cayado aórtico.
504,,16435630,Imagen radiológica de hernia de Bochdalek.
505,,16435620,Mediastinitis tardía con hidrotórax bilateral tras perforación vascular por catéter venoso central.
506,,16435618,Cardiografía por impedancia toráicica en un caso de drenaje anómalo de vena cava superior en seno coronario.
507,,16435619,"Manejo anestésico de un paciente con displasia arritmogénica de ventrículo derecho, ascitis y colitis ulcerosa para una cirugía abdominal mayor."
508,,16363313,Reacción vascular inflamatoria al propofol.
509,,16363299,Manejo anestésico en el déficit de factor V de la coagulación.
510,,16363302,Toracoscopía aplicando CPAP y colapsando únicamente el lóbulo pulmonar a intervenir.
511,,16281745,Shock hipovolémico intraoperatorio consecuencia de un hematoma de la vaina de los rectos.
512,,16281746,Manejo anestésico en la corrección toracoscópica de atresia de esófago tipo I con ventilación unipulmonar con modalidad de flujo continuo.
513,,16281744,Deterioro hemodinámico severo durante la anestesia epidural para el tratamiento endovascular de una estenosis de aorta torácica.
514,,16200934,Vía aérea obstruida por quiste de vallécula gigante.
515,,16200924,Implicaciones anestésicas en un niño afecto de acidemia propiónica.
516,,16200922,Limitaciones de la ecocardiografía transesofágica en la valoración de masas intracardiacas. A propósito de un caso.
517,,16200925,Hematoma neuroaxial tras anestesia locorregional combinada resuelto de forma conservadora.
518,,16200923,Intubación con el videolaringoscopio GlideScope en un paciente afecto de severa espondilolistesis cervical.
519,,16038178,Detección de embolia aérea intracoronaria con ecocardiografía transesofágica intraoperatoria.
520,,16038176,Hafnia alvei: una causa infrecuente de neumonía grave en la unidad de reanimación.
521,,16038177,Intubación nasotraqueal con fibroscopio bajo sedoanalgesia con remifentanilo en paciente pediátrico con vía aérea difícil por hipertrofia gingival gigante.
522,,16038175,Arritmia por doble via intranodal con descompensación hemodinámica grave en un retrasplante hepático.
523,,15968917,Valoración preanestésica: no debemos bajar la guardia!
524,,15968907,Actualización del manejo anestésico de un paciente con síndrome carcinoide.
525,,15968908,Anestesia en la colestasis intrahepática. Síndrome de Alagille.
526,,15901037,"Hiperostosis esquelética idiopática difusa, enfermedad de Forestier y Rotés-Querol, en relación con una punción dural diffícil."
527,,15901029,Síndrome de hipotensión intracraneal espontánea tratada con parche hemático epidural.
528,,15850315,Lesiones dérmicas secundarias a endocarditis bacteriana.
529,,15850307,Corazón en criss-cross. Consideraciones anestésicas para derivación cavopulmonar total (Fontan).
530,,15850305,Falsa desaturación provocada por colorante durante la cirugía de mama.
531,,15765991,Anafilaxia intraoperatoria en un paciente con sensibilización al látex desconocida.
532,,15765992,Manejo anestésico en la mastocitosis.
533,,15747705,Ecocardiografía transesofágica intraoperatoria en el manejo de resección de hipernefroma con compromiso de vena cava y aurícula derecha.
534,,15747704,Complicaciones infecciosas tras analgesia epidural para control del dolor postoperatorio en cirugía abdominal.
535,,15641607,Bloqueo poplíteo posterior guiado por ecografía.
536,,15641605,Linfangioleiomiomatosis pulmonar: presentación de un caso de evolución fulminante y revisión de la literatura.
537,,15632996,Neumoencéfalo a tensión tras cirugía intracraneal en posición supina.
538,,15620166,Tratamiento de la cistitis intersticial mediante la estimulación de cordones posteriores.
539,,15620167,Convulsiones inducidas por ropivacaína tras la realización de un bloqueo del plexo braquial.
540,,15620165,Trasplante intestinal del adulto. Situación actual y perspectivas de futuro.
541,,15586541,Síndrome de Horner tras analgesia epidural para el trabajo de parto.
542,,15586539,Lesión de la aorta abdominal como complicación de la colecistectomía laparoscópica.
543,,15586540,Intubación con estilete iluminado en una paciente con paraganglioma secretor de catecolaminas.
544,,15495640,Edema pulmonar no cardiogénico y fallo renal agudo tras la retirada de un catéter venoso central.
545,,15495638,El fenómeno de lázaro: reanimación espontánea.
546,,16366175,Implante de marcapasos a través de la vena cava superior izquierda persistente. Reporte de un caso.
547,,15495639,Reacciń anafiláctica o crisis carcinoide? papel del octreótido como vasopresor.
548,,15495637,Estudio descriptivo de cuatro pacientes afectados de mucormicosis ingresados en nuestra unidad de reanimación.
549,,15303535,Hipotensión refractaria durante la anestesia a una paciente en tratamiento con antagonistas de los receptores de la angiotensina.
550,,15303536,Lesión pulmonar aguda relacionada con la transfusión de plasma fresco congelado.
551,,15214765,Crisis convulsiva en el postparto de dos pacientes epilépticas.
552,,15214763,Anestesia para la cirugía del divertículo de Zenker con láser CO2.
553,,15214764,Síndrome de embolia grasa tras recambio de vástago femoral de prótesis de cadera.
554,,15214762,Anestesia subaracnoidea para cesárea a una paciente con síndrome de Ehlers-Danlos tipo II.
555,,15168930,Cesárea y exéresis de un feocromocitoma bajo anestesia combinada epidural y general.
556,,15168929,Tratamiento de una plexopatía braquial postquirúrgica mediante bloqueo interescalénico prolongado.
557,,15200190,Colecistectomía abierta bajo anestesia epidural torácica en enfermedades intersticiales difusas del pulmón.
558,,15200188,Síndrome compartimental bilateral tras reperfusión quirúrgica en la isquemia crónica de miembros inferiores.
559,,15200189,Utilización del monitor PiCCO en cuatro pacientes en estado crítico.
560,,15200187,Reacción anafiláctica grave al metamizol durante una anestesia subaracnoidea.
561,,15072404,Edema pulmonar en una cesárea relacionado con la administración de 15-metil prostaglandina F2alpha.
562,,15072403,Manejo anestésico del síndrome de vena cava superior.
563,,14998149,Leiomioma uterino con extensión cardíaca: manejo anestésico.
564,,15000072,Anestesia general con perfusión de remifentanilo para desbridamiento e injerto a tres grandes quemados pediátricos.
565,,14737781,"Un caso de ""dificultad de ventilación-dificultad de intubación"" resuelto con ventilación jet transtraqueal."
566,,14648352,Cierre espontáneo de fístula arteriovenosa dural intracraneal tras hipotensión controlada bajo anestesia general. A propósito de un caso.
567,,14737780,Cardiomiopatía periparto y preeclampsia: una asociación de fatal desenlace.
568,,14737778,Taponamiento cardíaco por pseudoaneurisma aórtico fistulizado a ventrículo derecho.
569,,14753142,Pancreatitis hipertrigliceridémica y embarazo.
570,,14753143,Hematoma espinal y cerebral postpunción lumbar diagnóstica con evolución letal.
571,,14753141,Trombosis en vena cava inferior tras cirugía correctora de atresia tricuspídea (Técnica de Fontán) en paciente pediátrico.
572,,14601371,Tres casos de sedación y analgesia con propofol y remifentanilo para el trabajo de parto.
573,,14601369,Parada cardíaca durante intubación con fibrobroncoscopio en paciente con neoplasia del espacio parafaríngeo.
574,,14601370,Síndrome de bradicardia-taquicardia durante una anestesia espinal.
575,,14552110,Anestesia en el síndrome de Sebastian: una nueva macrotrombocitopenia hereditaria.
576,,14552109,Cesárea en una gestante a término con crisis convulsivas.
577,,12940221,Utilidad de la ecocardiografía transesofágica en la progresión del catéter de arteria pulmonar en un caso de anuloplastia tricuspídea.
578,,12940219,Paro cardíaco por embolia por CO2 en una colecistectomía laparoscópica.
579,,12940220,Diagnóstico casual de una comunicación interauricular tipo ostium secundum durante cirugía coronaria.
580,,12833798,Analgesia y anestesia obstétrica con remifentanilo a una paciente con enfermedad de von Willebrand.
581,,12833799,Hemorragia subaracnoidea en un paciente con una cardiopatía congénita cianótica corregida.
582,,12833797,Rotura y embolización de catéter central epicutáneo con emigración a la arteria pulmonar lobar derecha.
583,,12825307,Bloqueo poplíteo continuo con ropivacaína mediante catéter estimulante para analgesia postoperatoria tras cirugía del pie.
584,,12825308,Embolismo pulmonar tras colocación de venda de Esmarch para cirugía de tobillo.
585,,12708212,Un hemotórax como complicación de la técnica laparoscópica.
586,,12708213,Dos casos de meralgia parestésica del nervio femorocutáneo.
587,,12708211,Edema postneumonectomía.
588,,12712872,Interacción entre donepezilo y bloqueantes musculares en la enfermedad de Alzheimer.
589,,12708260,Ventilación diferencial en el manejo del síndrome de distress respiratorio agudo secundario a mediastinitis necrotizante descendente. Rol de la tomografía axial computarizada dinámica de pulmón.
590,,12712873,Anestesia y fibrobroncoscopia para el estudio de estridor crónico en un niño con síndrome de Robinow.
591,,12701265,Resección de quiste hidatídico hepático por laparoscopia bajo anestesia general con perfusión de remifentanilo.
592,,12701263,Poliuria en el postoperatorio de un meningioma frontal.
593,,12677977,Cesárea a una paciente con hemoptisis amenazante por carcinoide traqueal.
594,,12677975,Beriberi tras una esofaguectomía.
595,,12677978,Anestesia epidural a un niño con fractura de fémur e insensibilidad congénita al dolor.
596,,12677976,"Suero salino hipertónico 7,5% en el tratamiento de la alcalosis metabólica hipoclorémica grave."
597,,12516495,Hemisíndrome de cauda equina tras anestesia intradural con bupivacaína para cirugía de la cadera.
598,,12516493,Infarto agudo de miocardio en el perioperatorio de una neumonectomía.
599,,12455325,Rotura de la arteria ilíaca primitiva derecha durante la resección transuretral de un tumor vesical.
600,,12455323,Tiempo de tromboplastina parcial activado prolongado no sospechado en cirugía de urgencia. Orientación diagnóstica y terapéutica.
601,,12455324,Hemotórax agudo contralateral tras la canulación de la vena subclavia izquierda para hemodiálisis.
602,,12455322,Tolerancia aguda selectiva a remifentanilo tras infusiones prolongadas.
603,,12455320,Experiencia preliminar del tratamiento con dexmedetomidina del estado confusional e hiperadrenergia en la unidad de cuidados intensivos.
604,,12455119,Anestesia para cesárea a una paciente con enfermedad de von Hippel-Lindau.
605,,12353411,Cesárea en una paciente con trasplante hepático ortotópico.
606,,12353412,Asistolia después de anestesia combinada.
607,,12353410,Tratamiento radioterápico bajo anestesia en pediatría.
608,,12216510,Fallo en el funcionamiento de un desfibrilador automático implantable durante su colocación ocasionado por un neumotórax.
609,,12143275,Falla cardio-respiratoria severa tratada con asistencia cardiopulmonar extracorpórea. Caso clínico.
610,,12708217,Posibilidades anestesiológicas para la lobectomía por toracotomía a un paciente con alergia a múltiples bloqueantes neuromusculares.
611,,12216511,Hematoma epidural tras la retirada de un catéter a un paciente sin transtornos de la coagulación.
612,,14606382,Endocarditis por Candida parapsilosis tras antibioterapia prolongada.
613,,14606380,Dos soluciones diferentes a la sección del tubo nasotraqueal durante la osteotomía maxilar.
614,,14606383,Hipotensión perioperatoria grave tras nefrectomía con suprarrenalectomía.
615,,14606381,Colocación de un tubo de doble luz mediante fibrobroncoscopio de 6 mm de diámetro e intercambiador de tubos Cook a un paciente con intubación traqueal difícil no prevista.
616,,12136459,Utilidad del pH intramucoso sigmoideo en el diagnóstico precoz de la colitis isquémica postcirugía aórtica.
617,,12136458,Miocardiopatía periparto y edema pulmonar tras cesárea.
618,,12025239,Bloqueo infraclavicular del plexo braquial con técnica de inyección múltiple y abordaje en sentido craneal en paciente con dificultad prevista de intubación traqueal.
619,,12025240,Parada cardiorrespiratoria: una complicación infrecuente del bloqueo subdural.
620,,11898446,Anestesia epidural cervical con ropivacaína al 0.75% en la cirugía de hombro.
621,,11792287,Anestesia en un caso de síndrome de Holt-Oram.
622,,11674985,Ritmo nodal tras la administración de atropina a pacientes bradicárdicos bajo anestesia subaracnoidea. Descripción de cuatro casos y revisión fisiopatológica y terapéutica.
623,,11674986,Implicaciones anestesiológicas de la exéresis de paragangliomas carotídeos. A propósito de tres casos clínicos.
624,,11591286,Consideraciones anestésicas en el síndrome de Prader-Willi para cirugía mayor de cifoescoliosis.
625,,11591283,"Mejoría de la hipoxemia, en un síndrome hepatopulmonar tras trasplante hepático, mediante la utilización de óxido nítrico inhalado."
626,,11446944,Manejo anestésico de cesárea en gestante con déficit congénito de antitrombina III y tromboemboliso pulmonar.
627,,11446945,Esplenectomía en paciente con betatalasemia intermedia y anemia hemolítica grave.
628,,11455777,Síndrome de reabsorción. Presentación de un caso.
629,,11412735,Anestesia general con remifentanilo en dos casos de cesárea urgente.
630,,11333810,Atelectasia pulmonar durante la anestesia en un niño con infección de las vías respiratorias superiores.
631,,11333811,Drenaje de líquido cefalorraquídeo e hipotermia profunda sistémica con parada circulatoria total como método de protección medular durante la cirugía de aorta torácica.
632,,11333800,Neumotórax a tensión durante la extracción de un cuerpo extraño esofágico.
633,,11333798,Lupus eritematoso sistémico en la paciente gestante. Implicaciones anestésicas.
634,,11333799,Edema de reimplantación en el trasplante pulmonar. ¿Isquemia-reperfusión o edema hidrostático?
635,,11257958,Paraplejía tras toracotomía izquierda en un paciente portador de un catéter epidural.
636,,11257956,Hipertermia maligna en un cerdo anestesiado con desflurano.
637,,11257959,Embarazo y parto en la mujer con lesión medular en fase crónica.
638,,11234605,Marcapasos profiláctico preoperatorio: a propósito de su indicación en un caso controvertido.
639,,11171470,Ateroembolismo múltiple de colesterol tras resección de un aneurisma de aorta abdominal.
640,,11171468,Embolismo en bifurcación ilíaca secundario a mixoma auricular.
641,,11171469,Isquemia aguda de la mano como complicación de la canalización de la arteria radial. A propósito de dos casos tras cirugía de sarcoma abdominal.
642,,11305140,Trasplante pulmonar y hemofilia. Consideraciones perioperatorias.
643,,11305141,Plaquetopenia preoperatoria con diagnóstico postoperatorio de púrpura trombocitopénica trombótica.
644,,11002716,Hernia diafragmática tras esofagectomía transhiatal.
645,,11002717,Cesárea electiva con anestesia epidural a una gestante con miocardiopatía hipertrófica obstructiva.
