,abstract,id,title
4861,,7646696,Consideraciones acerca de las alteraciones cardiovasculares asociadas al uso de cemento óseo acrílico.
4862,,7619557,Prótesis autoexpandibles en el tratamiento de la traqueomalacia cervical y torácica.
4863,,7598550,Sección endoscópica de la estenosis ureterosigmoidea.
4864,,7598546,Carcinoma epidermoide de uretra masculina. Nuestra experiencia en cinco casos.
4865,,7752716,Derrame pericárdico y disnea rápidamente progresiva en una mujer de 50 años.
4866,,7769875,Desarrollo de un linfoma centroblástico difuso después de una esplenectomía en una enferma con mielofibrosis idiopática.
4867,,7769863,Corynebacterium urealyticum en pacientes con transplante renal.
4868,,7776744,Shock anafiláctico tras la ingestión de un laxante.
4869,,7776740,"Ictericia colestásica, infrecuente manifestación inicial de amiloidosis primaria."
4870,,7794640,Carcinoma indiferenciado de células pequeñas (oat cell) de esófago.
4871,,7784664,"Mujer de 51 años con hipotiroidismo, hipogonadismo y cuadro agudo de dolor abdominal, diarrea, vómitos, fiebre e hipotensión."
4872,,7739289,Isquemia cerebral como manifestación inicial de la endocarditis infecciosa.
4873,,7620074,Hematoma espontáneo del músculo recto del abdomen.
4874,,7620064,Eritropoyetina recombinante humana en el tratamiento de la anemia del mieloma múltiple con insuficiencia renal.
4875,,7776741,Características de una intoxicación alimentaria por clembuterol.
4876,,7746021,Utilidad del lavado broncoalveolar para el diagnóstico del embolismo graso.
4877,,16541563,Fístula aortoentérica: una causa inusual de hemorragia digestiva.
4878,,8525195,Displasia arritmogénica de ventrículo derecho. Opciones de tratamiento durante 12 años de seguimiento en un caso.
4879,,7794643,Enfermedad de Crohn apendicular.
4880,,7784663,Síncope y soplo cardíaco en mujer de 37 años.
4881,,7755440,Megacalicosis y enfermedad litiásica.
4882,,7755438,Síndrome de Wunderlich como primera manifestación de un angiomiolipoma renal.
4883,,7743066,Amiloidosis traqueobronquial. Una forma infrecuente de amiloidosis restringida al tracto respiratorio inferior.
4884,,7638536,Enteropatía neutropénica asociada a mieloma múltiple.
4885,,7620065,Tumor carcinoide de timo secretor de ACTH. Presentación de un nuevo caso.
4886,,7569549,Segundos tumores en pacientes oncológicos pediátricos. A propósito de cinco observaciones.
4887,,7621295,Peritonitis tuberculosa: valor diagnóstico de la adenosindeaminasa (ADA) en el líquido ascítico.
4888,,7621289,Angiosarcoma hepático: presentación de un caso asociado al tratamiento con sales de arsénico y revisión de la literatura.
4889,,7598967,Metástasis en el seno frontal de carcinoma renal de células claras: descripción de un caso y revisión de la literatura.
4890,,7543744,Fulguración de un foco extrasistólico ventricular.
4891,,7542555,Mesotelioma peritoneal con elevación de amilasa en líquido ascítico.
4892,,7497179,Encefalopatía epiléptica infantil precoz.
4893,,7734689,Siringomas. Presentación de siete casos.
4894,,7715266,Sarcoma de Kaposi oral: papel de la radioterapia.
4895,,7715262,Hiperplasia seudotumoral del lóbulo caudado del hígado en una paciente con síndrome de Alagille.
4896,,7707732,Sarcoma granulocítico: estudio de cinco casos.
4897,,7700095,Hemorragia suprarrenal que simula un adenoma no hiperfuncionante.
4898,,8659277,Oportunidad de la cirugía en las lesiones metastáticas del carcinoma de células renales tras respuesta a la inmunoterapia adyuvante.
4899,,7777680,Lesiones postoperatorias de los nervios periféricos. Análisis de 8 años.
4900,,7756012,Asociación de meningioma intracraneal y adenoma hipofisario.
4901,,7754158,Hiperpotasemia en el curso del tratamiento de la neumonía por Pneumocystis carinii con trimetoprima-sulfametoxazol.
4902,,7754150,Síndrome de distrés respiratorio del adulto y shock séptico asociados a tuberculosis.
4903,,7660845,Hijos de padres con trastorno del ánimo.
4904,,7639609,Adenosina para la supresión de taquicardia supraventricular paroxística en un recién nacido. Primer caso en México.
4905,,7621290,Esteatorrea autolimitada y hepatitis crónica autoinmune tipo I. Grupo para el Estudio de la Hepatitis Vírica y SIDA.
4906,,7598966,Tromboflebitis de la yugular interna: complicación de la cirugía oncológica cervical. Presentación de un caso.
4907,,7543743,Aneurisma interatrial como causa de arritmias supraventriculares en el neonato.
4908,,7497204,Mujer de 56 años con lesión pulmonar y déficits neurológicos focales.
4909,,7899658,Anestesia de urgencia en un caso de dilatación gástrica aguda y anorexia nerviosa.
4910,,7704395,Alternativa terapéutica para los aspergilomas pulmonares complicados no quirúrgicos.
4911,,7569463,Viremia VHC e infección por virus Herpes zoster en un paciente en hemodiálisis tratada con eritropoietina.
4912,,7749016,"Colecistitis aguda alitiásica complicando la presentación de un taponamiento cardiaco, como manifestación inicial de un carcinoma pulmonar."
4913,,7711124,Neumonía bacteriémica por Neisseria meningitidis en una paciente anciana.
4914,,7704402,Síndrome de la cimitarra en un adulto asintomático.
4915,,8728751,Enfermedad de Von Recklinghausen (neurofibromatosis) y embarazo: a propósito de un caso clínico.
4916,,8548616,Varón joven con cuadro de encefalopatía difusa.
4917,,8525037,Tumor trofoblástico del sitio placentario.
4918,,7878285,Alteraciones funcionales de ventrículo tras un episodio de electrocución accidental.
4919,,7766474,Tratamiento del pseudoquiste pancreático postraumático mediante drenaje percutáneo de Huisman.
4920,,7734166,Rabdomiosarcoma primario de hueso temporal.
4921,,7733687,Estudio de los factores que influyen sobre las consecuencias de la enfermedad en los pacientes urológicos.
4922,,7718718,Paniculitis mesentérica: un caso de presentación aguda y fatal?
4923,,7710012,Linfadenitis granulomatosa cervical. A propósito de 13 casos.
4924,,7639597,Transposición corregida de las grandes arterias en pacientes mayores de 65 años.
4925,,7569451,Osteomalacia hipofosfémica adquirida post-trasplante renal: una causa de osteoporosis grave.
4926,,7869785,Eficacia del tratamiento precoz con inmunoglobulina intravenosa en formas graves de dermatomiositis.
4927,,9805084,Septicemia por Shigella. Presentación de un caso y revisión de la literatura.
4928,,8731573,Mortalidad asociada al asma en el municipio de Rosario.
4929,,8728750,Hepatitis aguda fulminante no A no B en el embarazo: un caso clínico de probable hepatitis esporádica producida por virus E.
4930,,8579234,Plasmocitoma óseo solitario de mandíbula. Presentación de un caso y revisión de la literatura.
4931,,8548607,Variante del coma alfa.
4932,,7880957,Uso de los opiáceos en el abdomen agudo.
4933,,7880953,Asma profesional.
4934,,7878272,Fiebre botonosa mediterránea maligna: persistencia del parásito vector e implicación pronóstica.
4935,,7766473,La derivación porto sistémica transyugular. Una alternativa ante ciertas hemorragias recidivantes por hipertensión portal en el niño.
4936,,7734712,Complicación de la fiebre tifoidea en niños: anasarca. Reporte de un caso y revisión de la literatura.
4937,,7734167,Ameloblastoma maxilar.
4938,,7733686,Uropatía obstructiva como complicación de la patología aórtica y de la cirugía reconstructiva vascular periférica: presentación de 4 casos y revisión de la literatura.
4939,,7718713,Complicación gastrointestinal grave de la enfermedad de Behçet.
4940,,7639600,Enfermedad de Kawasaki: diagnóstico ecocardiográfico de los aneurismas coronarios. Informe de dos casos.
4941,,7639598,Infarto agudo del ventrículo derecho secundario a tromboembolia pulmonar masiva.
4942,,7625599,Metástasis de adenocarcinoma gástrico en laringe.
4943,,7621267,Hemangioendotelioma epitelioide: una indicación infrecuente de trasplante hepático?
4944,,7565039,Dolicoectasia de las arterias intracraneales. Adelantos en imágenes y terapéutica.
4945,,7485859,Parálisis facial periférica asociada a neoplasia de rinofaringe
4946,,7480907,Hígado graso agudo en el embarazo. Un diagnóstico a considerar.
4947,,7873267,"Anemia hemolítica autoinmune, complicación poco frecuente de la colitis ulcerosa."
4948,,7865566,Infección mortal de origen odontogénico.
4949,,7864670,Infarto renal postcirugía pulmonar en varón de 13 años de edad.
4950,,7734681,La cardiopatía de la distrofia miotónica.
4951,,8000698,Neumonitis varicelosa en el adulto previamente sano.
4952,,7846361,"Cuadro familiar agudo de cefalea y molestias digestivas con evolución fatal. Clínica Puerta de Hierro, Madrid (celebrada el 24 de octubre de 1994)."
4953,,7834326,Anafilaxia potencialmente mortal. Comunicación de tres casos.
4954,,7811496,Angeítis granulomatosa idiopática del sistema nervioso central de evolución muy prolongada.
4955,,7726692,Sección traumática de la aorta. Presentación de un caso operado con éxito.
4956,,7899737,Otitis externa maligna. Experiencia en 12 casos.
4957,,7846366,Hemorragia digestiva alta por fístula aortoentérica primaria.
4958,,7846356,Endocarditis por Candida en pacientes no adictos: una enfermedad de gran letalidad. Estudio clínico-patológico de tres casos.
4959,,7839004,Policlínica de anestesia y prevención de riesgos. Un caso de consejos desatendidos.
4960,,7654911,Es el accidente vascular cerebral un factor de riesgo en la patogenia de la colecistitis aguda alitiásica?
4961,,7557065,Evolución histórica de las técnicas quirúrgicas del transplante de páncreas.
4962,,7799675,Hipocalcemia en un paciente con síndrome de inmunodeficiencia adquirida tratado únicamente con foscarnet.
4963,,7799671,Síndrome neuroléptico maligno.
4964,,7799667,Vasculitis asociada a un síndrome mielodisplásico: aportación de 5 casos.
4965,,7991924,Seudoaneurisma aórtico e infarto agudo de miocardio secundarios a traumatismo torácico.
4966,,7986617,Carcinoma adenoescamoso del estómago.
4967,,7981291,Endocarditis tricúspide por Staphylococcus aureus sensible a la penicilina: 2 casos en adictos a drogas por vía parenteral.
4968,,7865358,Alternativas quirúrgicas ante la estenosis traqueal congénita.
4969,,7709125,Perforación intestinal múltiple en enfermedad de Crohn.
4970,,7995544,Siringomielia y embarazo. Informe de un caso.
4971,,7991927,Angiosarcoma pericárdico primario con metástasis pulmonares múltiples y hepática solitaria: hallazgos clínicos y anatomopatológicos.
4972,,7987550,Bronquiolitis folicular: una causa infrecuente de neumopatía intersticial.
4973,,7986612,"Enteritis y colitis por citomegalovirus en pacientes no inmunodeprimidos, afectación primaria o sobreinfección?"
4974,,7865369,Neuroblastoma quístico fetal.
4975,,7800879,Varón de 70 años con rápido deterioro de conciencia y alcalosis respiratoria.
4976,,7800877,Sepsis fulminante en paciente esplenectomizado. Sindrome de Waterhouse-Friderichsen debido a sepsis neumocócica.
4977,,7709126,El síndrome de Peutz-Jeghers e invaginación intestinal.
4978,,7527238,Perforación de gastroyeyunostomía: 2 casos.
4979,,7986606,Tumor pancreático endocrino de células F.
4980,,7746896,Estudios de perfusión miocárdica durante el esfuerzo y reposo efectuados en el Hospital Militar Gorgas (HMG).
4981,,7986605,Peritonitis del líquido ascítico por Candida albicans.
4982,,7986603,Vólvulo de colon transverso: una causa poco frecuente de obstrucción intestinal.
4983,,7858088,Linfadenopatía angioinmunoblástica. A propósito de un caso con manifestaciones clínicas inusuales y evolución a linfoma T.
4984,,7746905,"Carcinoma en el esófago, de células pequeñas."
4985,,7746897,Amiloidosis cardíaca secundaria a mieloma múltiple detectada por ecocardiografía.
4986,,7959147,Evolución de los embarazos complicados con hepatitis viral.
4987,,7938839,Anemia hemolítica microangiopática asociada a neoplasias: análisis de cinco casos y revisión de la literatura.
4988,,7772694,Endocarditis infecciosa subaguda complicada con absceso mitral e insuficiencia mitral severa.
4989,,7985060,Síndrome torácico agudo.
4990,,7967873,Mosquito de los equipajes: una nueva forma de transmisión del paludismo?
4991,,7967871,Transmisión parenteral accidental del VHC a un profesional sanitario.
4992,,7967867,Abdomen agudo por citomegalovirus en pacientes con SIDA. A propósito de dos casos.
4993,,8063182,Complicaciones y tratamiento del cólera durante el embarazo.
4994,,7999521,Duplicación de colon: presentación de un caso.
4995,,7944611,Rotura vesical extraperitoneal espontánea.
4996,,7944599,Carcinoma del uréter residual muchos años después de la nefrectomía: una causa esquiva de hematuria y un tumor de alto riesgo.
4997,,7938866,Colapso cardiovascular irreversible tras cementación de prótesis total de cadera: a propósito de un caso.
4998,,7732231,Hipotermia: una indicación no renal para la diálisis peritoneal.
4999,,7716366,Hepatoblastomas epiteliales en el adulto.
5000,,7967876,Formas inusuales de bacteriemia por Campylobacter jejuni en pacientes con infección por el VIH.
5001,,7999520,Vólvulo gástrico en una paciente con condrodisplasia punctata.
5002,,7973156,Bacteriemia nosocomial pediátrica. Utilidad potencial del cultivo de los líquidos de infusión.
5003,,7938863,Hidatidosis frenomediastínica y fístula cistoaórtica con embolismo sistémico múltiple.
5004,,7917567,Utilidad de la hemostasia endoscópica en la enfermedad vascular de Dieulafoy.
5005,,7732234,Tumor papilar quístico del páncreas: un carcinoma infrecuente de buen pronóstico.
5006,,7732230,Intoxicación por callampas venenosas en la IX región. Rol de Amanita gemmata.
5007,,7716367,Carcinoma escamoso primario de hígado.
5008,,8080867,Angiomatosis bacilar: a propósito de 2 casos.
5009,,8068419,Evaluación del significado clínico de la displasia gástrica: estudio de seguimiento histológico.
5010,,7992633,Aspectos psiquiátricos y sociales del SIDA. Informe de cuatro casos.
5011,,7918940,Cáncer de pulmón como tumor de cicatriz: a propósito de un caso y posibles mecanismos etiopatogénicos.
5012,,8061153,Neumonía por Mycoplasma pneumoniae: estudio serológico de un brote familiar en atención primaria.
5013,,8079692,Fístula vésico-ileal secundaria a cáncer de vejiga.
5014,,8079688,Metástasis vesicales de carcinoma pulmonar. Presentación de dos casos.
5015,,8079682,"Carcinoma epidermoide primario de vejiga. Diagnóstico, tratamiento y revisión de la literatura."
5016,,8068367,Aspectos otorrinolaringológicos de la enfermedad de Camurati-Engelmann (displasia diafisaria progresiva): revisión de la literatura y descripción de un caso.
5017,,8059055,Hipertermia maligna no fulminante en el curso de una tiroidectomía.
5018,,8059053,Infarto isquémico cerebral secundario a oclusión de la arteria carótida interna por traumatismo cervical cerrado.
5019,,8059047,Absceso epidural consecutivo a catéter cervical.
5020,,8016444,Bloqueo auriculoventricular completo y rotura del tabique interventricular en un niño tras traumatismo cerrado de tórax. Utilidad de la ecocardiografía Doppler color.
5021,,8016442,Trombosis coronaria como manifestación del síndrome antifosfolípido.
5022,,7991808,Síndrome de vasculitis renal y pulmonar con anticuerpos anticitoplasma de neutrófilos y anticuerpos antimembrana basal positivos. Informe de un caso.
5023,,7915866,Torsión y seminoma en testículo criptorquídico.
5024,,8204790,Brote de hepatitis aguda A colestásica en una familia. Un hecho a prevenir.
5025,,8059295,Sepsis y hemólisis intravascular masiva por Bacillus cereus como causa de muerte en gestante con leucemia aguda mieloblástica.
5026,,8043739,Tumor de Wilms del adulto. Revisión de la literatura sobre factores pronósticos y tratamiento.
5027,,8023000,Hemorragia digestiva de origen oscuro y angiosarcoma ileal.
5028,,7976717,Paraganglioma retroperitoneal. Patología poco frecuente.
5029,,7520195,Utilización de factores estimulantes de colonias en la anemia aplástica grave.
5030,,8204259,Encefalitis de troncoencéfalo por herpes simple.
5031,,8186911,Derrame pleural como única manifestación de criptococosis en un paciente con SIDA.
5032,,8086207,Linfoma laríngeo primario.
5033,,8011876,Ileítis terminal por criptosporidium y citomegalovirus en un paciente con SIDA.
5034,,8011722,Meningitis tuberculosa por microorganismos resistentes. Fracaso terapéutico en 2 pacientes con infección por HIV y tuberculosis diseminada.
5035,,8197522,Leucemia mieloide crónica (LMC) y neoplasias sólidas. Description de tres casos.
5036,,8085085,Glomerulonefritis fibrilar variedad glomeruloesclerosis nodular.
5037,,8011711,Enfermedad de Lyme en la provincia de Soria: estudio clinicoepidemiológico.
5038,,8008938,Supervivencia prolongada en enfermos con leucoencefalopatía multifocal progresiva asociada a SIDA tratados con altas dosis de zidovudina.
5039,,8133701,Endocarditis derecha por neumococo. Una enfermedad no tan grave.
5040,,8560065,Granulomatosis linfomatoide pulmonar: comunicación de un caso.
5041,,8204431,Manejo quirúrgico de la estenosis traqueal congénita.
5042,,8186001,Utilidad de la eritromicina en la gastroparesia postquirúrgica severa.
5043,,8161464,Crisis de ausencias típicas en la edad adulta: a propósito de 4 casos.
5044,,8155760,"Sobre ""Detección de antígeno de virus respiratorio sincitial en secreciones respiratorias""."
5045,,8155758,Fiebre prolongada como forma de presentación inusual de una infección por Mycoplasma pneumoniae.
5046,,8128085,Miocardiopatía dilatada en lactantes y niños.
5047,,8059594,Prótesis expansibles de vía biliar en estenosis malignas: experiencia inicial.
5048,,8025198,Eosinofilia y carcinoma de tiroides.
5049,,8025194,Déficit del factor VII de la coagulación en un portador crónico del virus B.
5050,,7990687,Injerto renal en un enfermo con estenosis mitral y cáncer de pancreas no diagnosticado.
5051,,7864310,Acroqueratosis paraneoplásica (síndrome de Bazex) asociada a metástasis ganglionar cervical de carcinoma indiferenciado simultáneo con carcinoma bien diferenciado de cavidad oral.
5052,,7854093,Hipopituitarismo originado por metástasis de carcinoma de colon asociado con aspergilosis hipofisaria.
5053,,7809434,"Prevención de defectos de cierre del tubo neural, a propósito de un caso de iniencefalia."
5054,,7785398,Retroalimentación biológica y cirugía en el tratamiento de la incontinencia fecal con lesión del esfínter anal externo. Seguimiento a largo plazo.
5055,,7659816,Listeriosis y embarazo.
5056,,7659804,Eclampsia: experiencia de 8 años.
5057,,7517059,Un caso de síndrome QT prolongado.
5058,,8171391,Púrpura trombótica trombocitopénica siguiendo a una púrpura trombocitopénica inmune.
5059,,8171385,Enfermedad de injerto contra huésped postransfusional en un paciente con linfoma no Hodgkin.
5060,,8142518,Absceso hepatico piógeno y VIH.
5061,,8142506,Leishmaniasis visceral y fracaso multiorgánico.
5062,,8049335,Mielopatía vacuolar asociada a perforación intestinal en un paciente sin sida.
5063,,9296818,Estudio inmunogenético de un caso de síndrome de DiGeorge.
5064,,8311346,"Aneurisma micótico de arteria femoral rupturado, por ""Salmonella typhimurium""."
5065,,8290759,Amiloidosis y apnea obstructiva del sueño. A propósito de un caso mejorado con presión positiva continua por vía nasal.
5066,,8285469,Herida mortal por arma de aire comprimido: presentación de un caso. Aspectos sociales.
5067,,8285467,Intoxicación aguda por monóxido de carbono. Importancia de su diagnóstico. Aportación de tres pacientes pediátricos.
5068,,8285465,Catarata bilateral en la fase de debut de la diabetes mellitus insulindependiente en la infancia.
5069,,8160571,Thermoactinomyces vulgaris como productor de alveolitis alérgica extrínseca.
5070,,8160569,Asma bronquial por exposición laboral a sulfitos.
5071,,7506875,Síncope en la edad pediátrica. Su evaluación diagnóstica.
5072,,8218818,Distrofia simpática refleja.
5073,,8292441,Hepatocarcinoma: forma infrecuente de presentación.
5074,,8292439,Síndrome de intestino ultracorto: tratamiento quirúrgico de un caso excepcional.
5075,,8260519,Lesión quística intracraneal en paciente de ámbito rural.
5076,,8259460,Varón joven con dolor en hemitórax izquierdo.
5077,,8256965,Otitis media causada por Vibrio alginolyticus: los riesgos del mar Mediterráneo.
5078,,8256955,Malformación de Chiari tipo II sintomática en periodo neonatal: revisión de cuatro casos.
5079,,8235006,Pericarditis aguda como presentación inicial de un angiosarcoma primario cardíaco. Correlaciones anatomoclínicas.
5080,,8165946,Quiste de uraco: causa inusual de obstrucción intestinal.
5081,,8140504,Aspergilosis broncopulmonar invasiva tratada con itraconazol en una paciente con leucemia aguda.
5082,,8140502,Afectación inicial del sistema nervioso central en un caso de mieloma múltiple no secretor.
5083,,8050706,Carcinoma adenoescamoso de colon. Reporte de dos casos y revisión de la literatura.
5084,,8285363,Complicaciones vasculares mayores tras cirugía de hernia discal lumbar.
5085,,8234976,Brote epidémico de escabiosis en relación con un paciente con infección por el virus de la inmunodeficiencia humana y sarna noruega.
5086,,8129977,Epistaxis debida a infestición nasal por sanguijuela.
5087,,8398372,Insuficiencia hepática aguda grave por carbamacepina.
5088,,8239217,Lactobezoar en recién nacido a término.
5089,,8218793,Reacción alérgica grave por la administración de cisplatino.
5090,,8218787,La tuberculosis como factor de riesgo de trombosis venosa.
5091,,8239041,Colitis pseudomembranosa después de cirugía por aneurisma aórtico abdominal roto.
5092,,8218775,Hiponatremia severa motivada por un síndrome de secreción inadecuada hormona antidiurética. Infrecuente complicación de la fiebre botonosa mediterránea.
5093,,8218771,Intoxicación letal por paraquat: aportación de un nuevo caso.
5094,,8218767,Aspergilosis diseminada angioinvasiva: diagnóstico necrópsico en pacientes leucósicos.
5095,,8217279,Hamartoma endobronquial. A propósito de un caso.
5096,,8332014,Fiebre del humidificador.
5097,,8368694,Intoxicación accidental por insecticida organoclorado.
5098,,8368686,Leucemia megacarioblástica aguda en la infancia.
5099,,8503590,Angioedema hereditario. Diagnóstico y tratamiento durante la infancia.
5100,,8324025,Descripción de una microepidemia escolar de tuberculosis.
5101,,8512979,Bacteriemia por Vibrio cholerae no 0:1.
5102,,8480953,Mioclonias benignas de la infancia.
5103,,8112541,Selectividad topográfica del sarcoma de Kaposi. Consideraciones generales y revisión de la literatura.
5104,,8112535,Esclerosis de várices esofágicas en hipertensión portal por trombosis de la porta secundaria a deficiencia de proteína C.
5105,,8471711,Fibrilación auricular en un paciente joven.
5106,,8455412,Síndromes por agotamiento en una maratón popular.
5107,,8485291,Intoxicación aguda por cocaína.
5108,,8392852,Carcinoma adenoide quístico de laringe: revisión de la literatura y aportación casuística.
5109,,8337544,Carcinoma metaplásico de mama como segunda neoplasia. Informe de un caso.
5110,,8215932,Encefalopatias epilépticas de la infancia.
5111,,8096372,Periarteritis nodosa cutánea en niños. A propósito de un caso.
5112,,8481435,Episodio de botulismo familiar.
5113,,8471349,Enteritis post-radiación: doble estenosis yeyuno-cólica.
5114,,8439109,Infección por Campylobacter jejuni en el período neonatal. Un cuadro potencialmente severo.
5115,,8406115,Embarazo ortotópico posterior a dos ectópicos. Informe de dos casos y revisión de la literatura.
5116,,8430242,"Hipotermia accidental, recalentamiento mediante el empleo de circulación extracorpórea."
5117,,8427924,Intoxicación accidental por paraquat.
5118,,8209038,Ligadura de las arterias ilíacas internas como tratamiento de hemorragias graves en obstetricia y ginecología.
5119,,8201917,"Hipertensión arterial, insuficiencia cardiáca, bronquitis crónica."
5120,,7991864,Adenocarcinoma de desviación mínima del cuello uterino.
5121,,7991862,Carcinoma verrucoso del cuello uterino. A proposito de un caso.
5122,,7991856,Peritonitis meconial diagnóstico antenatal ultrasonográfico y seguimiento de los recién nacidos.
5123,,7901959,"Dolor torácico no cardiogénico, reflujo gastroesofagico y trastorno motor esofágico como posibles causas, discusion de un caso."
5124,,1493065,Peritonitis esclerosante idiopática (P.E.I.). Presentación de un nuevo caso y revisión de la literatura.
5125,,1488541,Ingestión de peróxido de hidrógeno. A propósito de dos casos.
5126,,1292602,Criptococosis pulmonar en el SIDA.
5127,,1489796,Funguemia por Rhodotorula mucilaginosa en relación con nutrición parenteral total.
5128,,1489790,Infestación por Fasciola hepatica. Biopatología y nuevos aspectos diagnósticos y terapéuticos.
5129,,1293656,Anestesia inhalatoria en la porfiria variegata.
5130,,1489786,Infección respiratoria baja por Coxiella burnetii en niños.
5131,,1485035,Posible utilidad de la calcitonina sérica en pacientes sépticos en riesgo de desarrollar SIRPA.
5132,,1466575,Manejo conservador de la yatrogenia ureteral de origen ginecológico.
5133,,1443930,Taponamiento cardíaco y catéteres venosos centrales.
5134,,1450271,Vibrio alginolyticus en muestras clínicas.
5135,,1450269,Bacteriemia por Shigella flexneri.
5136,,1450261,Aislamiento de Mycobacterium tuberculosis con resistencia primaria a quimioterápicos en pacientes con infección por VIH.
5137,,1340831,Hemobilia. Presentación clínica y diagnóstico.
5138,,1631392,Hemorragia pulmonar difusa tras terapia trombolítica en infarto agudo de miocardio.
5139,,1509924,Tumor transicional de vejiga en la infancia.
5140,,1602902,Linfoma tiroideo. Una emergencia médica.
