,abstract,id,title
418,,15274770,Paciente diagnosticado de infección por virus de la inmunodeficiencia humana y tuberculosis que presentó empeoramiento de adenopatías cervicales tras iniciar el tratamiento.
419,,27450167,"Tatuaje en 3 dimensiones, granuloma por cuerpo extraño."
420,,27793343,Enfermedad de Crohn metastásica.
421,,29077281,Exantema urticarial refractario: síndrome de Schnitzler.
422,,27208911,Cola de fauno; signo cutáneo de disrafismo espinal.
423,,27006017,"Una complicación en dermatología, erupción variceliforme de Kaposi."
424,,15176928,Sífilis secundaria nodular en paciente VIH positivo simulando linfoma cutáneo.
425,,15175987,Meningomielitis sifilítica en paciente con sida.
426,,15142517,Síndrome de Cushing secundario a acetato de megestrol en una paciente con sida.
427,,27340117,Pénfigo herpetiforme con anticuerpos anti-desmogleína 1 y 3.
428,,27297865,Carcinoma basocelular escrotal.
429,,26900001,Pápula supraciliar derecha única en paciente con leucemia linfática crónica: importancia del diagnóstico precoz.
430,,27491872,Hemangioma epiteloide múltiple lineal asociado a malformación vascular quiescente.
431,,27126441,Tumor de lento crecimiento en región frontal.
432,,26993438,Infección cutánea por Gordonia araii.
433,,27208908,"Tratamiento multimodal de la calcifilaxis con tiosulfato sódico, alprostadil y oxigenoterapia hiperbárica."
434,,27206604,Síndrome de descamación de la piel acral: presentación de un caso y revisión bibliográfica.
435,,27013091,Placa alopécica en cuero cabelludo de larga evolución.
436,,26993031,Pápula pediculada y fisura en línea cervical anterior de recién nacido.
437,,15168933,Miocardiopatía periparto en puérpera con síndrome de inmunodeficiencia adquirida.
438,,15104940,Nocardiosis e infección por el VIH.
439,,15144751,Talidomida en el tratamiento de los plasmocitomas recurrentes de un paciente infectado por el VIH.
440,,15104941,Leucoencefalopatía multifocal progresiva en pacientes con sida. Hepatotoxicidad de la terapia de alta eficacia (TARGA) en pacientes con coinfección por VHB o VHC.
441,,15056447,Infección por virus varicela-zóster resistente a aciclovir en una paciente con sida.
442,,27040303,Exantema mucocutáneo inducido por Mycoplasma pneumoniae: ¿un nuevo síndrome separado del eritema multiforme? Un nuevo caso y revisión de la literatura.
443,,26643395,Granuloma fissuratum: entidad desconocida pero fácilmente identificable.
444,,27627453,Parotiditis bacteriana aguda por Staphylococcus aureus resistente a la meticilina en una paciente nonagenaria institucionalizada.
445,,27083393,Placa roja en la mejilla con crecimiento progresivo: eritema migratorio.
446,,26643398,"Eritema multiforme, etiología inusual: ketoprofeno tópico y virus varicela zoster."
447,,27006015,Placas ulceradas en ingle en paciente inmunodeprimida.
448,,15023314,Artritis séptica aguda por Candida albicans en una paciente con infección por virus de la inmunodeficiencia humana.
449,,15023308,"Varón de 61 años de edad con infección por virus de la inmunodeficiencia humana, lesiones cutáneas y hemiparesia derecha."
450,,14963851,Evolución y tratamiento de la encefalopatía subaguda progresiva por virus de inmunodeficiencia humana en el niño. Utilidad de la toxina botulínica.
451,,14746736,Hipoxemia de causa múltiple en una paciente con sida.
452,,26708460,Cuerno cutáneo en labio superior.
453,,26778361,Pápulas foliculares y placas eritematosas en espalda.
454,,26970655,Biopsia selectiva del ganglio centinela de localización axilar. Video quirúrgico.
455,,26726118,Miasis furunculoide.
456,,15219080,Fracaso renal en paciente VIH.
457,,15742928,Cyclospora cayetanensis en pacientes con SIDA y diarrea crónica.
458,,15628304,Necrosis avascular de cabeza y cuello de fémur en un paciente con sida.
459,,15239540,Oligodendroglioma de bajo grado en una paciente con sida.
460,,15034957,Asociación de SIDA y leishmaniosis tegumentaria americana en Argentina.
461,,14757003,Listeriosis en pacientes con infección por el virus de la inmunodeficiencia humana en España. Aportación de tres casos y revisión de la literatura.
462,,26739119,Calcifilaxis tratada con tiosulfato sódico intralesional.
463,,14670238,Ictericia obstructiva por linfoma no hodgkiniano en pacientes con infección por el VIH.
464,,14648351,Síndrome de Foix-Chavany-Marie asociado a VIH.
465,,14622520,Síndrome de sensibilidad retardada a fármacos.
466,,26602314,Erupción vesiculosa en paciente en tratamiento antituberculoso.
467,,14588236,Osteítis en sífilis secundaria.
468,,26058339,Síndrome de Chediak-Higashi: microscopia óptica del pelo.
469,,26006272,Ulceraciones costrosas en el cuero cabelludo.
470,,14755922,A propósito de un caso: linfoma no Hodgkin de hipofaringe en paciente con infección por VIH. Remisión sin tratamiento específico para el linfoma.
471,,14525713,Proctitis inespecífica en paciente con infección por VIH.
472,,25687573,Infestación cutánea diseminada por larva migrans.
473,,14755908,Fístula arteriovenosa intercostal postraumática en un paciente con SIDA.
474,,14563264,Nuevo caso de infección por VIH-2 en la Comunidad Valenciana.
475,,14499077,Leishmaniasis visceral y tuberculosis peritoneal en un paciente con infección por el virus de la inmunodeficiencia humana.
476,,14755911,Fractura patológica de sacro en un paciente VIH en terapia antirretroviral de alta eficacia.
477,,12975079,Linfoma pulmonar primario con afectación pleural como manifestación inicial de sida.
478,,25796311,Nódulo ulcerado en el dorso de la muñeca.
479,,25662480,Eritema ab igne inducido por manta eléctrica.
480,,25865608,Múltiples tumores cutáneos de larga evolución.
481,,14525698,Foliculitis por Candida en usuarios de drogas por vía parenteral.
482,,25547737,Lupus eritematoso cutáneo subagudo inducido por golimumab.
483,,12951980,"Artritis gonocócica en un paciente VIH prositivo,"
484,,12951968,Sífilis maligna en el paciente infectado por el virus de la inmunodeficiencia humana (VIH): descripción de un caso y revision de la literatura.
485,,25746612,Pigmentación asintomática mamaria de años de evolución.
486,,25662718,Tumores hiperqueratósicos en región pretibial.
487,,15456374,Tratamiento eficaz con voriconazol de un fungoma pulmonar por Pseudallescheria boydii en un paciente con infección por VIH y tuberculosis previa.
488,,12918153,Fibrosis retroperitoneal por pancreatitis en paciente VIH+.
489,,12848602,Enfermedad de Mondor: estudio de dos formas topográficas.
490,,12765581,Síndrome de leucoencefalopatía posterior reversible en un paciente infectado por VIH.
491,,15849972,"Micobacteriosis diseminada asociada al complejo Mycobacterium avium-intracellulare (MAI), en paciente infectado con el virus de inmunodeficiencia humana."
492,,12831312,Tuberculosis costal en paciente VIH. Presentación clínica y revisión.
493,,12724086,Tumoración muscular en una niña con infección por VIH: linfoma no hodgkiniano extranodal.
494,,25933080,"Utilidad de la ecografía cutánea en el diagnóstico diferencial de las lesiones azules, hidrocistoma."
495,,12768832,Osteonecrosis y VIH.
496,,12716550,Criptococosis diseminada en inmigrantes colombianos con infección por el virus de la inmunodeficiencia humana.
497,,12689580,Tratamiento de la hipertensión pulmonar asociada a la infección por VIH con treprostinil.
498,,12681213,Diplejía facial aislada en relación con primoinfección por el VIH.
499,,12681139,Infección por herpes zóster y criptococo tras inicio del tratamiento antirretroviral de gran actividad.
500,,25441018,Dermatitis flagelada por shiitake.
501,,12681220,Reconstitución clínica e inmunológica completa tras el tratamiento antirretroviral de gran actividad en un niño infectado verticalmente por el virus de la inmunodeficiencia humana tipo 1 con enfermedad avanzada.
502,,12586021,Síndrome de infiltración linfocitaria difusa en paciente con infección por virus de la inmunodeficiencia humana.
503,,25073829,Penfigoide ampolloso sobre cicatriz quirúrgica.
504,,25256432,Reacción granulomatosa de cuerpo extraño a pigmento rojo de tatuaje.
505,,24525168,Lámpara de Wood en porfiria eritropoyética congénita.
506,,12802986,Disfagia alta por linfoma de Burkitt de amígdala lingual resistente a quimioterapia.
507,,12605833,Artritis por Candida tropicalis en un paciente infectado por el virus de la inmunodeficiencia humana.
508,,12605791,Síndrome de lipodistrofia asociado a la infección por el virus de la inmunodeficiencia humana y lipomatosis mediastínica.
509,,12586035,Fiebre y erupción papular con linfadenopatías generalizadas e inflamación faringoamigdalar.
510,,24998098,Tumor de rápido crecimiento en la cara.
511,,12876907,"Embolización de la arteria esplénica como tratamiento del hiperesplenismo en pacientes hemofílicos, HIV-1 y HCV seropositivos."
512,,12762332,Leucoencefalopatía multifocal progresiva por poliomavirus JC.
513,,12605806,Amiloidosis AA en paciente infectado por el virus de la inmunodeficiencia humana: comunicación de un caso y revisión de la literatura.
514,,12550044,Varón con fiebre y dolor en hipocondrio izquierdo de semanas de evolución.
515,,15849956,SIDA y hemofilia en pediatría: a propósito de un caso.
516,,15849954,Absceso hepático y VIH: a propósito de un caso.
517,,12666310,Taponamiento cardiaco por adenocarcinoma de pulmón como forma de debut en infección por VIH.
518,,24768203,Tumores faciales y placa lumbar.
519,,12658846,Laringitis por Rhodococcus equi en paciente con SIDA.
520,,12593043,Endocarditis aórtica por Salmonella sp. en una mujer infectada por el virus de la immunodeficiencia humana.
521,,24768201,Úlcera crónica en vestíbulo nasal.
522,,12645381,Pseudotumor peneano luético. Presentación de un caso.
523,,12425885,Endocarditis por Stenotrophomonas maltophilia.
524,,12392654,Lipodistrofia periférica.
525,,12392652,"Síndrome febril, poliadenopatías y hepatoesplenomegalia."
526,,12421513,Trasplante hepático en un paciente infectado por el virus de la inmunodeficiencia humana.
527,,24355606,Cuadro ampolloso distal de inicio brusco y hemorragias en astilla.
528,,24625860,Vasculitis necrosante inducida por cocaína.
529,,12361553,A propósito de tres casos de hiperlactacidemia/acidosis láctica tras el tratamiento de la hepatitis C con interferón pegilado y ribavirina en pacientes coinfectados por VIH.
530,,12372245,Bloqueo auriculoventricular completo en paciente tratado con lopinavir/ritonavir.
531,,12221545,Retinitis por citomegalovirus tras terapia antirretroviral altamente activa: a propósito de un caso.
532,,12372229,Deterioro cognitivo en varón de 35 años.
533,,12372178,Tratamiento antirretroviral con nelfinavir en un paciente infectado por el VIH y diabetes mellitus secundaria a indinavir.
534,,12244794,Carcinoma epidermoide de pulmón y tuberculosis en paciente con infección por el virus de la inmunodeficiencia humana.
535,,12199987,Taquicardia ventricular y QT largo asociados a la administración de claritromicina en un paciente afectado de infección por el VIH.
536,,12224150,Leiomiosarcoma multicéntrico en paciente VIH.
537,,12152394,Síndrome mononucleósico con patrones viroinmunológicos similares a los de una primoinfección VIH-1 tras interrupción del tratamiento antirretroviral eficaz.
538,,12093411,Inmunodeficiencia 'idiopática? de linfocitos T-CD4: a propósito de un caso.
539,,12084378,Profilaxis antirretroviral en una trabajadora hospitalaria gestante.
540,,12049699,Infecciones bacterianas graves tras la supresión de profilaxis frente a Pneumocystis carinii en pacientes con infección por el VIH que han recuperado su recuento de CD4.
541,,12113727,Hipertensión pulmonar asociada a infección por VIH: revisión de 4 casos.
542,,12084379,Desensibilización en paciente con hipersensibilidad a fluconazol e infección por el virus de la inmunodeficiencia humana.
543,,12061992,La anamnesis se apoya en las pruebas diagnósticas.
544,,12143277,Litiasis ureteral por indinavir.
545,,11988159,Parálisis facial bilateral como manifestación inicial en la infección por el VIH.
546,,12053778,Con quién hablan los adolescentes mexicanos sobre el SIDA.
547,,11904086,Coma vigil tras meningitis por Listeria monocytogenes.
548,,11989094,Donovanosis: incremento de su incidencia en nuestro medio debido a casos importados de zonas endémicas.
549,,11886679,Anemia normocítica normocrómica con reagudizaciones frecuentes en un paciente con sida.
550,,11886680,Tumoración lumbar en un paciente con sida.
551,,12772658,"Creando música, creando conciencia. Gilberto Santiago lo dice cantando."
552,,12123134,Trasplante renal en un paciente con infección VIH conocida en el momento del trasplante. Evolución inicial.
553,,11809152,"Pancreatitis, triglicéridos y tratamiento antirretroviral de gran actividad."
554,,11785031,Demencia talámica por infarto talámico izquierdo y en rodilla de cápsula interna derecha.
555,,11852524,Tumor testicular de células de Sertoli esclerosante en un paciente VIH.
556,,11852520,Litiasis urinaria secundaria a Indinavir en enfermo HIV positivo.
557,,11852510,Afectación multiorgánica por Streptococcus constellatus en paciente VIH positivo y carga viral negativa.
558,,11844460,Necrosis avascular de la cabeza femoral en pacientes con infección por el virus de la inmunodeficiencia humana en tratamiento antirretrovírico.
559,,11995373,Leishmaniasis visceral con afectación duodenal en paciente VIH.
560,,11709126,Disminución progresiva de agudeza visual en paciente usuario de drogas por vía parenteral.
561,,11709131,Endocarditis por Klebsiella oxytoca: a propósito de un caso.
562,,11817235,Sepsis neumocócica en una paciente con infección por el virus de la inmunodeficiencia humana esplenectomizada vacunada.
563,,11602149,Hipertensión pulmonar grave tratada con bajas dosis de carvedilol en una paciente con infección por el virus de la inmunodeficiencia humana.
564,,11817224,Aracnoiditis y lesión intramedular. Complicaciones de la meningitis tuberculosa en dos pacientes con infección por el virus de la inmunodeficiencia humana.
565,,11707213,Hepatitis B aguda en un paciente con infección por el virus de la inmunodeficiencia humana previamente vacunado.
566,,11602146,Infarto esplénico asociado con la presencia de inhibidor lúpico en un paciente con sida.
567,,22959124,Mucinosis periorbitaria unilateral en lupus eritematoso sistémico.
568,,11725471,Polirradiculopatía por citomegalovirus en 2 pacientes con SIDA: tratamiento exitoso con terapia anti retroviral de alto grado de actividad (TAAGA).
569,,11715135,Meningitis simultánea por candida y tuberculosis como debut de SIDA.
570,,22520872,Nocardiosis cutánea primaria por Nocardia farcinica.
571,,11589092,Eficacia del TAC abdominal en el diagnóstico de la acumulación de grasa víscero-abdominal en pacientes con infección por VIH tratados con inhibidores de proteasas.
572,,11484147,Neurorretinitis en un paciente con infección-VIH.
573,,11534435,Meningitis por Listeria monocytogenes tras colonoscopia en paciente con infección por VIH y citomegalovirus.
574,,21798481,Mama ectópica vulvar.
575,,11503583,Carcinoma pulmonar de células gigantes en paciente con infección por el VIH.
576,,11440676,Coinfección VIH/VHC: ¿tenemos derecho a no tratar a nuestros pacientes?
577,,11526630,Cambios morfológicos en el tejido adenoamigdalar como manifestación inicial de HIV en pacientes asintomáticos.
578,,11512268,Absceso renal en el paciente con infección por VIH en la era de la terapia antiretroviral de alta eficacia.
579,,11446912,Fístula enterovulvar y enteroanal en una paciente infectada por el virus de la inmunodeficiencia humana.
580,,21996426,Placa eritematodescamativa con exudación en codo de 1 año de evolución.
581,,11496546,Linfoma primario pericárdico en la infección por VIH.
582,,11447912,Patrón miliar en paciente con infección por el virus de la inmunodeficiencia humana y tratamiento tuberculostático. Reacción paradójica de la tuberculosis tras el inicio del tratamiento antirretrovírico.
583,,11333714,Reacciones adversas cutáneas asociadas al tratamiento con nevirapina y vacunación antineumocócica en pacientes con infección por el virus de la inmunodeficiencia humana.
584,,11469080,"Coexistencia de tumor de MALT parotídeo, Helicobacter pylori y VIH."
585,,20451937,Lesiones exofíticas y ulceradas en la extremidad inferior en un paciente de origen marroquí
586,,11333726,Endocarditis por Bartonella en un paciente con infección por el virus de la inmunodeficiencia humana.
587,,11333724,Artritis infecciosa por Mycobacterium kansasii en un paciente con infección por el virus de la inmunodeficiencia humana.
588,,11333576,Encefalitis por primoinfección producida por el virus de la inmunodeficiencia humana como causa de síndrome confusional agudo en un servicio de urgencias.
589,,11321991,Quiste aracnoideo en paciente con SIDA y clínica neurológica.
590,,11374145,Deleción infrecuente en el codón 67 del gen de la transcriptasa reversa de HIV en falla al tratamiento antirretroviral.
591,,11256248,"Osteonecrosis bilateral de caderas, corticoides e inhibidores de la proteasa del virus de la inmunodeficiencia humana."
592,,11881432,Fracaso renal agudo como forma de presentación clínica de linfoma de Burkitt renal en un paciente HIV positivo.
593,,11256253,Sarcoma de Kaposi simulando abscesos esplénicos en una mujer con sida.
594,,11181282,Síndrome del seno cavernoso bilateral por linfoma no hodgkiniano como presentación de infección por VIH.
595,,11227243,Necrolisis epidérmica tóxica. Terapia en UCI con inmunoglobulinas intravenosas en un caso.
596,,11213580,Diarrea por citomegalovirus (CMV) como primera manifestación de SIDA.
597,,11468790,Escherichia coli O157:H7 y síndrome hemolítico urémico en un paciente VIH positivo.
598,,11213589,Paciente con infección por el VIH y acromegalia.
599,,11213581,Listeriosis: una infección poco frecuente en pacientes con VIH.
600,,20347456,Paniculitis pancreática.
601,,11196597,Exantema en un paciente infectado por el virus de la inmunodeficiencia humana tras iniciar tratamiento antirretrovírico.
602,,11082871,Aparición paradójica de tuberculoma y formación de absceso cerebeloso en un paciente con el virus de la inmunodeficiencia humana tratado con triple terapia antirretrovírica.
603,,11349514,Acidosis láctica fatal en paciente con síndrome de inmunodeficiencia adquirido y tratamiento antiretroviral de alto grado de actividad: comunicación de un caso.
604,,11126974,Anuria en pacientes HIV+ tratados con Indinavir.
605,,11262361,Síndrome de linfocitosis CD8 infiltrativo difuso en un paciente con infección por el virus de la inmunodeficiencia humana.
606,,10994353,Varón con infección por el virus de la inmunodeficiencia humana y hematuria.
607,,10996880,Leucoencefalopatía multifocal progresiva e infección por el virus de la inmunodeficiencia humana: un diagnóstico no invasivo.
608,,10953590,"Exantema palmoplantar en paciente con infección por VIH, UDVP y promiscuo sexual."
609,,10985105,Fallo hepático fulminante por enfermedad de Hodgkin en un paciente con infección por VIH.
610,,10953599,Infección pulmonar por Mycobacterium xenopi tras iniciar terapia de alta eficacia con indinavir.
611,,10909362,Ancianos con SIDA. Reflexiones a propósito de un caso.
612,,10901016,Neumonía cavitada por neumococo en la infección por el virus de la inmunodeficiencia humana.
613,,10859832,Brucelosis aguda e infección por el virus de la inmunodeficiencia humana. Situación actual.
614,,11107911,Psoriasis y SIDA: reporte de 2 casos.
615,,10919191,Diabetes insípida como manifestación de toxoplasmosis cerebral en un enfermo con SIDA.
616,,10859837,Isquemia cerebral transitoria e infarto cerebral en un paciente VIH positivo con déficit de proteína S.
617,,10932408,Enfermedad inflamatoria pélvica por Chlamydia trachomatis como causa de ascitis.
618,,10932405,Diarrea por protozoos en pacientes con serología positiva frente al virus de la inmunodeficiencia humana en la era TARGA.
619,,10932401,Enfermedad de Chagas: otra causa de masa cerebral ocupante en pacientes con síndrome de inmunodeficiencia adquirida.
620,,10846610,Derrame pleural tuberculoso bilateral e infección por el VIH.
621,,10804122,Leishmaniasis nasal en paciente HIV+
622,,10802922,Hematoma espontáneo perirrenal en enfermo VIH(+) sobre riñón pélvico.
623,,10905023,Osteomielitis por Mycobacterium kansasii en un paciente con infección por el virus de la inmunodeficiencia humana.
624,,10962889,"Síndrome coronario agudo asociado a neumonía por Chlamydia pneumoniae, en dos casos."
625,,10829472,Fiebre con exantema y meningismo: una forma de presentación de la infección aguda por el virus de la inmunodeficiencia humana.
626,,10721589,Mastitis tuberculosa bilateral en una mujer infectada por el virus de la inmunodeficiencia humana.
627,,10721587,Síndrome hemofagocítico asociado a enfermedad diseminada por citomegalovirus y Mycobacterium xenopi en un paciente infectado por el virus de la inmunodeficiencia humana de evolución fatal.
628,,10721581,Infiltrado pulmonar micronodular en un paciente con síndrome de inmunodeficiencia adquirida.
629,,11050815,Linfoma de cavum en un paciente hemofílico con SIDA.
630,,11151112,Retinopatía diabética en un paciente con infección por VIH y hemofilia tipo A.
631,,11107897,Condiloma gigante inguinal (tumor de Buschke-Lowenstein) con aspecto clínico de carcinoma escamoso.
632,,11050804,Transmisión del HIV-1 a través de la leche materna.
633,,10782456,Enfermedad de Hodgkin en pacientes con infección por el virus de la inmunodeficiencia humana. Estudio de 15 casos.
634,,10730413,Mejoría de una psoriasis grave en un paciente VIH(+).
635,,10721289,Masa intracraneal en paciente con infección por VIH.
636,,10835759,Hipertensión pulmonar e infección por VIH: comunicación de un caso.
637,,10687432,Artritis y tenosinovitis por Mycobacterium kansasii asociadas a la infección por el virus de la inmunodeficiencia humana.
638,,10687428,"Púrpura trombótica trombocitopénica, VIH y terapia antivírica."
639,,10686724,Traqueobronquitis herpética en un paciente con síndrome de inmunodeficiencia adquirida.
640,,10666913,Mielitis transversa por HIV en un paciente pediátrico con SIDA.
641,,10687421,Nódulos pulmonares en un paciente con infección por el VIH y neutropenia severa.
642,,10680236,Condiloma gigante del pene. Caso clínico.
643,,10652773,Paraparesia espástica tropical e infección mixta por Treponema pallidum y HTLV-I.
644,,10650655,Gabapentina en el tratamiento de la polineuropatía asociada al virus de la inmunodeficiencia humana.
645,,10670136,Orquiepididimitis tuberculosa como inicio clínico de infección por el virus de inmunodeficiencia humana (VIH).
646,,10650577,Reversibilidad de hiperlipemia intensa secundaria a indinavir con fenofibrato micronizado.
647,,10652813,Adolescente con clínica sugestiva de inmunodeficiencia adquirida y pruebas convencionale no confirmatorias.
648,,10618784,"Varón de 42 años, infectado por el VIH, con un cuadro neurológico rápidamente evolutivo."
649,,19802405,Eccema herpético por virus herpes simplex tipo 2. Revisión de la literatura a propósito de un caso.
650,,10563092,Psoriasis pustulosa rebelde a tratamiento convencional.
651,,10544385,Regresión de la lipomatosis múltiple con la administración de indinavir.
652,,10614140,Importancia del manejo de la hipertensión endocraneana en meningitis criptocócica en pacientes con síndrome de inmunodeficiencia adquirida. Informe de dos casos.
653,,10584257,Mielopatía vacuolar asociada al SIDA: diagnóstico pre mortem mediante resonancia magnética.
654,,10507175,Afectación polirradicular lumbosacra y meníngea en un paciente VIH.
655,,10522436,Mujer de 36 años con infección por el VIH y distensión abdominal.
656,,10507178,Abceso de psoas tuberculoso primario en paciente VIH.
657,,10481593,Leucemia de Burkitt como forma de presentación del sindrome de inmunodeficiencia adquirida. Descripción de dos casos.
658,,10439544,Empiema por Aspergillus fumigatus en un paciente con sida.
659,,10464965,Erecciones dolorosas relacionadas con el sueño.
660,,10396094,Concentraciones de óxido nítrico en líquido cefalorraquídeo de pacientes con infección por el virus de la inmunodeficiencia humana.
661,,10390762,Linfoma cerebral primario en paciente con infección por el VIH y tratamiento antirretroviral.
662,,10365393,Enfermedad de Hodgkin anorrectal en un paciente con infección por el VIH.
663,,10887572,Reporte de 1 caso de rinitis purulenta por Streptococcus pneumoniae en un paciente VIH/SIDA.
664,,10389322,Trombosis venosa profunda de extremidad inferior en paciente con SIDA y anticuerpos anticardiolipina.
665,,10532791,Otomastoiditis por Aspergillus fumigatus en un paciente con SIDA.
666,,10339856,Púrpura trombótica trombocitopénica asociada a infección por VIH.
667,,10365523,Miocarditis por Toxoplasma en un paciente con infección por el virus de la inmunodeficiencia humana.
668,,10365517,Enfermedad de Kikuchi en un paciente con síndrome de la inmunodeficiencia adquirida.
669,,10217855,Sepsis fulminante por Listeria monocytogenes en un paciente con infección por el virus de la inmunodeficiencia humana.
670,,10217851,Lesiones cavitadas pulmonares en un paciente infectado por el virus de inmunodeficiencia humana.
671,,10220772,Tratamiento con AZT y 3TC en una embarazada con infección por el VIH.
672,,10231350,Necrosis gástrica por vasculitis en un paciente VIH+.
673,,10193077,Afección del colon como forma de presentación de una leishmaniasis visceral en un paciente con sida.
674,,10568303,Quiste linfoepitelial de glándula parótida en estadio avanzado de infección por VIH. Una asociación infrecuente.
