,abstract,id,title
895,,25662721,"Disferlinopatía, una causa de falsa polimiositis refractaria."
896,,18817704,Signo del tres invertido y pirosis.
897,,18817702,Linfadenopatías axilares en un paciente con antecedentes de melanoma.
898,,18817700,Dolor y aumento de diámetro de extremidad inferior izquierda.
899,,18803930,Necrólisis epidérmica tóxica (síndrome de Lyell) en relación con la ingesta de ibuprofeno.
900,,18842222,Leucemia linfática crónica con transformación a linfoma difuso de célula grande B o síndrome de Richter con afectación ósea.
901,,18842243,Fiebre de origen desconocido en una gestante de 13 semanas.
902,,19753833,Complicación mucosa de la leishmaniasis cutánea.
903,,19295997,Manifestaciones oculares como presentación de un síndrome de vena cava superior.
904,,18682155,Resolución de lesión ósea en paciente con histiocitosis X pulmonar.
905,,18625188,La clave estaba en la historia clínica.
906,,19295998,Pancreatitis autoinmune. A propósito de un caso.
907,,18942269,"Paciente masculino de 74 años de edad con hiperemia conjuntival bilateral, polaquiuria, disuria, dolor urente en el meato urinario, dolor lumbar y artritis reactiva secundaria a aplicación de la vacuna BCG."
908,,18674508,Histoplasmosis diseminada en paciente con infección por el virus de la inmunodeficiencia humana.
909,,18625189,Tumoración en el músculo esternocleidomastoideo.
910,,19295976,Tromboflebitis supurada laterocervical tras cateterización venosa central.
911,,18620657,Corazón roto.
912,,18582429,Secundarismo luético.
913,,18570811,Isquemia intestinal de repetición por el factor VIII.
914,,18769744,Endocarditis por Peptostreptococcus: presentación de dos casos y revisión de la literatura.
915,,18457641,Claudicación intermitente y edematización de miembros inferiores en varón de 61 años.
916,,18457639,Ascitis en varón de 54 años.
917,,18457635,Neumonía cavitada con cultivo de esputo positivo para Mycobacterium gastri.
918,,18953367,Endometriosis intestinal.
919,,18714596,"Hombre de 60 años de edad con historia de hepatitis C en los últimos 15 años, síndrome febril y pérdida de peso en el último mes."
920,,18579040,Neumonía de repetición por cuerpo extraño.
921,,18457642,Fiebre y dolor abdominal tras el ascenso al Teide.
922,,18462644,Melanoma rectal con metástasis pulmonares.
923,,18457628,Litiasis renal no obstructiva.
924,,18447982,Masa orofaríngea en paciente con infección por VIH.
925,,18405511,Empiema necessitatis de etiología tuberculosa.
926,,18381008,Mujer de 71 años con tumefacción nasal.
927,,18381006,Exantema tras comida campestre.
928,,18381004,Enfermedad de Creutzfeldt-Jakob: dos nuevos casos en Talavera de la Reina.
929,,18560679,Síndrome overlap hepatitis autoinmune-cirrosis biliar primaria: a propósito de un caso.
930,,18367059,Caso en imagen 2. Enfermedad de Rendu-Osler hepática.
931,,18361890,Neumonía organizada asociada a tratamiento con peginterferón alfa.
932,,18355434,Signos de Grey-Turner y Cullen.
933,,18275774,Fístulas mandibulares en una mujer de 75 años.
934,,19133194,Absceso hepático piógeno productor de gas en paciente diabético.
935,,18575662,Infección profunda del cuello por Streptococcus grupo B en un paciente diabético: Caso clínico.
936,,18275773,Fumador de 59 años con rotura espontánea de bazo.
937,,18275771,"Paciente con fenómeno de Raynaud, derrame pleuropericárdico e infartos digitales."
938,,18483678,Bacteriemia primaria por Listeria monocytogenes en paciente con cirrosis hepática: Caso clínico.
939,,18483676,Atelectasia pulmonar recurrente secundaria a una metástasis endobronquial de un carcinoma de colon: Caso clínico.
940,,18432365,Hemoperitoneo como forma de presentación del carcinoma hepatocelular: experiencia de tres casos con rotura tumoral espontánea y revisión de la literatura.
941,,18341925,Varón de 34 años con diarrea y epigastralgia.
942,,18327747,Neumoencéfalo tras anestesia raquídea.
943,,18261398,Mujer de 36 años con tumoración quística pancreática y trombopenia.
944,,18432366,Ascitis mielomatosa: reporte de un caso y revisión de la literatura.
945,,18341924,Empeoramiento de lesiones de lepra en un paciente filipino.
946,,18261401,Masa cervical y mediastínica en una mujer de 72 años.
947,,18261399,Fractura de la diáfisis del radio en un varón de 31 años.
948,,19666277,Imágenes clínicas en gastroenterología. Diagnóstico incidental de parasitosis por endoscopia.
949,,19147427,Muerte cerebral en una embarazada y sobrevida del feto.
950,,18689153,Tumor pardo como manifestación inicial de hiperparatiroidismo primario.
951,,18496582,Paniculitis mesentérica. A propósito de un caso.
952,,18418459,Litiasis intrahepática.
953,,18377193,Infarto agudo de miocardio en gestante a término de 39 semanas tratado con fibrinolisis.
954,,18221664,Síndrome de los dedos púrpura en un varón de 90 años.
955,,18221662,Síndrome confusional en paciente con hiponatremia severa.
956,,18418460,Microembolismo tumoral y cor-pulmonar como manifestación de carcinoma hepatocelular.
957,,18377194,Accidente isquémico transitorio asociado a síndrome de calcinosis cerebral.
958,,18377190,Síndrome de Tako-Tsubo (discinesia apical transitoria). Un síndrome que simula un infarto de miocardio.
959,,18221682,Imagen de la semana. Tumor de estroma gastrointestinal (GIST).
960,,18221678,Varón de 46 años con hematoma suprarrenal bilateral.
961,,18221663,Varón de 33 años con hemorragia digestiva alta y dolor epigástrico.
962,,18208772,"Síndrome general, tos y nódulo pulmonar cavitado en una paciente con VIH sin tratamiento antirretroviral. Criptococoma pulmonar."
963,,18357359,Púrpura trombocitopénico trombótico con respuesta exitosa a vincristina.
964,,18278997,Infiltrado pulmonar y fiebre tras la resolución de neumonía por Pneumocystis jirovecii en un paciente con infección por el VIH.
965,,18093486,Meningococemia aguda fulminante.
966,,18040921,Oftalmopatía distiroidea asociada a hipotiroidismo.
967,,18021653,Hemorragia digestiva de origen atípico.
968,,18021651,Fiebre y lesiones cutáneas en un paciente de raza negra con infección por el VIH.
969,,18021649,Varón de 79 años con nódulos pulmonares bilaterales cavitados.
970,,18279000,"Varón de 69 años con afectación del estado general, hiperpigmentación, lesión cutánea y respuesta deficiente al tratamiento."
971,,18021650,Meningitis con múltiples lesiones intracraneales.
972,,17988600,"Acidosis láctica, hipoglucemia severa y hepatoesplenomegalia."
973,,18053492,Hemosiderosis suprarrenal.
974,,18001682,Obstrucción intestinal secundaria a fitobezoar.
975,,17953902,Nódulos cutáneos en antebrazo tras punción accidental de un dedo.
976,,17988624,Intoxicación por plomo.
977,,17983540,Síndrome RS3PE.
978,,17915169,Conferencias clinicopatológicas de la SEMI.
979,,18271654,RS3PE asociado a tuberculosis.
980,,17953918,Síndrome de Kartagener.
981,,17915176,Endocarditis y absceso aórtico por Corynebacterium macginleyi.
982,,17915174,Una causa inusual de nódulos pulmonares múltiples.
983,,17915114,"Fiebre, dolor en hipocondrio derecho y masa hepática con microcalcificaciones en consumidor de lácteos no pasteurizados."
984,,18227904,Etanercept y embarazo.
985,,18227900,Síndrome de Paget-Schroetter asociado a hiperhomocisteinemia.
986,,18198953,Complicaciones neurológicas como manifestación inicial de endocarditis infecciosa.
987,,18198951,Sarcoidosis y carcinoma fibrolamelar del hígado.
988,,17927936,Síndrome hereditario de hiperferritinemia y cataratas en una familia española con la mutación A40G (París) en el gen de la L-ferritina (FTL) asociada a la mutación H63D en el gen HFE.
989,,17915137,Deterioro subagudo en un anciano con demencia.
990,,17688870,Crisis parciales complejas por neurosífilis meningovascular.
991,,17669303,Necrolisis epidérmica tóxica inducida por fenitoína y radioterapia holocraneal.
992,,18246937,"Dolor abdominal difuso, febricula, náusea, malestar general y dermatosis ulcerativa."
993,,18198954,Peritonitis bacteriana espontánea como forma de presentación de síndrome nefrótico idiopático en un adulto de raza negra.
994,,17969956,Enfermedad por arañazo de gato.
995,,17688871,Enfermedad granulomatosa diseminada: sarcoidosis o tuberculosis?
996,,17688869,Mujer de 23 años con crisis hipertensiva.
997,,17688867,Síndrome febril en varón de 22 años.
998,,18020882,Linfoma esplénico de la zona marginal sin linfocitos vellosos en periferia.
999,,18020881,Presentación inusual de paniculitis mesentérica.
1000,,17692216,Hemoptisis en mujer joven inmunocompetente.
1001,,17692198,Absceso hepático amebiano: tratamiento farmacológico o punción-aspiración?
1002,,18020889,Cuatro casos de paludismo en viajeros. Una enfermedad emergente.
1003,,17969843,Mujer de 21 años de edad con dolor en tórax antero-posterior y hombro izquierdo.
1004,,17650893,Apoyo nutricio en una mujer embarazada y con muerte cerebral. Informe de un caso y revisión de la literatura.
1005,,18020892,Debut de lupus eritematoso sistémico con síndrome antifosfolipídico catastrófico: beneficio del tratamiento precoz.
1006,,18020890,Anticoagulante circulante y lesiones focales hepáticas asociados a marcada semiología sistémica en la lúes secundaria.
1007,,17914549,Manifestaciones neurológicas de la granulomatosis de Wegener: Caso clínico.
1008,,17907901,Adenocarcinoma de pulmón simulando una enfermedad pulmonar intersticial en un varón de 30 años.
1009,,17662217,Fallo hepático agudo en un paciente con tricoleucemia.
1010,,17583655,Lesiones cutáneas en paciente somalí con infección por VIH.
1011,,17568522,Mujer de origen filipino con tumoración en un pie.
1012,,17663976,Ataxia-telangiectasia.
1013,,17663970,Síndrome febril y debilidad muscular en un paciente de 50 años.
1014,,17662216,Tuberculosis gástrica: revisión a propósito de un caso.
1015,,17594868,Nódulo de la hermana María José.
1016,,17588369,Meningoencefalitis por Cryptococcus neoformans.
1017,,17570190,Linfoma no hodgkiniano difuso de células B grandes.
1018,,17568521,Tumoración cutánea de 20 días de evolución.
1019,,17568517,Síndrome Tako-Tsubo en una paciente con exacerbación de asma bronquial.
1020,,17910414,Abdomen agudo no quirúrgico como presentación clínica de fiebre Mediterránea familiar.
1021,,17898823,"Fiebre, derrame pleural y lesión osteolítica en paciente con infección por VIH."
1022,,17540155,Dermatitis por déficit de cinc.
1023,,17504675,Mujer de 52 años con patrón intersticial pulmonary retraso mental profundo.
1024,,17504673,Dolor abdominal en un paciente oncológico.
1025,,17493435,Hepatitis aguda tóxica por metimazol y propiltiouracilo.
1026,,17898824,Infección urinaria por E. coli complicada con abscesos múltiples.
1027,,17537374,Neumoencéfalo masivo tras meningitis neumocócica.
1028,,17504690,Perforación del tabique nasal en un paciente boliviano.
1029,,17504674,Lesiones hepáticas y uso prolongado de anticonceptivos orales.
1030,,17504672,Varón de 75 años con atelectasia del lóbulo medio.
1031,,17504668,"Neumonía lipoidea exógena aguda en ""comedores de fuego"". Descripción de dos casos."
1032,,17867903,Enfermedad de Crohn: ¿todavía hoy causa de fiebre de origen desconocido clásica?
1033,,17867901,Enfermedad oportunista poco frecuente en paciente con lupus eritematoso sistémico con tratamiento inmunosupresor.
1034,,17475187,"Diarrea, desequilibrio electrolítico e insuficiencia renal en varón de 94 años."
1035,,17475181,El curso clínico agresivo de la endocarditis neumocócica.
1036,,17462202,Sinusitis etmo-esfenoidal.
1037,,17453076,Angiomatosis bacilar por Bartonella quintana en un paciente con infección por virus de inmunodeficiencia humana.
1038,,17867902,Subtipos histológicos de liposarcoma: presentación de cuatro casos.
1039,,17475186,Pérdida de agudeza visual en varón exfumador.
1040,,23871273,Alteraciones ungueales bilaterales de predominio radial.
1041,,17658160,Linfedema como presentación inusual de cáncer de próstata.
1042,,17408540,Utilidad del rituximab en el tratamiento de pacientes con enfermedades sistémicas autoinmunitarias.
1043,,17397633,Diarrea en paciente con sonda de gastrostomía endoscópica percutánea.
1044,,17338871,Embolia grasa.
1045,,17590135,Degeneración cerebelosa paraneoplasica como presentación de una recidiva de carcinoma de mama.
1046,,17585705,"Varón de 49 años de edad con irritabilidad, palpitaciones, temblor de manos, pérdida de peso y nódulo tiroideo."
1047,,17397636,Mujer de 37 años con molestias abdominales y lesión focal esplénica.
1048,,17323242,Cefalea con déficit neurológicos focales y pleocitosis linfocitaria. Una entidad infradiagnosticada?
1049,,17590094,Hematopoyesis extramedular: ¿mecanismo compensador o síndrome clínico? Descripción de un caso y revisión bibliográfica.
1050,,17397574,Varón de 79 años con síndrome constitucional y hepatomegalia.
1051,,17397572,Dolor torácico y eosinofilia periférica.
1052,,17397566,Polineuropatía amiloidótica familiar de presentación tardía en la comarca de la Safor (Valencia): presentación de 4 casos.
1053,,17285520,Neuroesquistosomiasis: un reto para el diagnóstico.
1054,,17397571,Dolor abdominal agudo con radiografía de tórax patológica.
1055,,17369973,"Micobacteriosis hepato-esplénica, forma inusual de probable tuberculosis extrapulmonar. Caso clínico y revisión bibliográfica."
1056,,17335734,Mieloma múltiple.
1057,,17288912,Mujer de 31 años con tumoración en el muslo.
1058,,17388096,"Mujer de 30 años de edad con cuadro febril, emaciación y dolor súbito en el costado izquierdo."
1059,,17306156,Varón de 55 años con hipertensión pulmonar de aparición subaguda.
1060,,17306154,"Dolor abdominal, ictericia y masa mesentérica."
1061,,17306149,Infección asociada a catéter por Streptomyces: significado clínico del aislamiento de Streptomyces en cultivos.
1062,,17295598,Enfermedad perianal tratada como acné conglobata como debut de enfermedad de Crohn.
1063,,17288930,Diagnóstico: necrosis de la grasa pericárdica.
1064,,17266876,Acantosis nigricans como manifestación inicial paraneoplásica de adenocarcinoma gástrico.
1065,,17261247,Nódulos pulmonares cavitados.
1066,,17371150,Pileflebitis secundaria a diverticulitis.
1067,,17371148,Osteomielitis por Escherichia coli sobre fractura cerrada de húmero.
1068,,17315475,Leishmaniasis cutánea difusa en un paciente con sida.
1069,,17178085,Masa pélvica en un paciente con antecedente de micosis fungoide.
1070,,17371147,"Tratamiento paliativo del cáncer de cabeza de páncreas, dos años antes del diagnóstico."
1071,,17178084,"Fiebre, disnea y bacteriemia por Klebsiella oxytoca y Enterobacter cloacae."
1072,,17178082,Tromboembolismo pulmonar masivo asociado a embolismo arterial periférico.
1073,,17178080,Dolor abdominal de etiología muy infrecuente.
1074,,24356741,Hepatitis aguda por mononucleosis infecciosa en un varón de 21 años.
1075,,17222072,Linfoma de Burkitt abdominal en un adolescente.
1076,,17222070,Nocardiosis pulmonar como causa de reagudizaciones en un paciente EPOC.
1077,,17129528,Caso clínico: varón de 47 años con dolor cervical de dos meses de evolución.
1078,,17129526,Fiebre y lesión muscular del pectoral mayor.
1079,,17129524,Varón de 76 años con polimialgia y el signo del halo.
1080,,17129522,Trastornos inespecíficos del nivel de conciencia de seis meses de evolución.
1081,,17125680,Varón con infección por VIH avanzada y lesiones cutáneas hiperqueratósicas difusas.
1082,,17183786,Granulomatosis de Wegener.
1083,,17129527,"Mujer de 62 años con aftosis orogenital, lesiones oculares y condritis."
1084,,17129525,Varón de 82 años con estupor.
1085,,17129523,"Insuficiencia respiratoria, vómitos y diarrea en paciente con síndrome de Down."
1086,,17125679,Absceso hepático por Klebsiella pneumoniae en inmigrante oriental.
1087,,17211489,Dolor abdominal agudo debido a infarto esplénico en un paciente con enfermedad heterocigota de células falciformes expuesto a la altura.
1088,,17153269,Sarcoma de Kaposi clásico.
1089,,17134312,Endocarditis trombótica no bacteriana y neoplasia pulmonar.
1090,,17042993,Leucocitosis persistente e hiperglucemia.
1091,,17042991,Varón de 35 años con dolor lumbar y fiebre tras consumo intravenoso de cocaína.
1092,,17153249,Imagen se la semana: calcinosis es dermatomiositis del adulto.
1093,,17042992,Trombosis venosa profunda de miembro superior izquierdo y poliadenopatías.
1094,,17042988,Crisis convulsiva generalizada de origen metabólico.
1095,,17020678,Hepatitis aguda mantenida en paciente con hepatitis crónica C previa.
1096,,16987474,Eritema nodoso y alteraciones neurológicas.
1097,,17128821,"Disfonía súbita, fiebre y tos productiva en una mujer de 65 años."
1098,,16863632,Mujer joven con dolor lumbar de larga duración.
1099,,16863630,"Paraparesia progresiva y antecedente de enfermedad de Paget. Diagnóstico: enfermedad de Paget, con compresión medular."
1100,,16863628,El hombre encendido. Diagnóstico: psoriasis pustulosa generalizada de von Zumbusch.
1101,,17080574,Endocarditis embolígena poor Streptococcus viridans.
1102,,17078583,Tumor neuroendocrino vesical de célula pequeña: a propósito de un caso y revisión bibliográfica.
1103,,17051684,Osteopatía condensante diseminada.
1104,,16863629,Paciente con disnea progresiva de un mes de evolución.
1105,,17130992,Streptococcus constellatus: agente etiológico asociado en empiema pleural.
1106,,17067245,Pericarditis y arteritis de células gigantes.
1107,,16956537,Síndrome constitucional y bicitopenia de origen infeccioso.
1108,,17067244,Linfoma de colon como causa de fiebre de origen desconocido.
1109,,16956536,Fiebre recurrente y bacteriemia por Staphylococcus aureus.
1110,,17004358,Imagen de la semana. Sarna noruega.
1111,,16831386,Parálisis facial y edema labial recurrente.
1112,,16831384,Absceso en pabellón auricular tras inicio efectivo de TARGA (tratamiento antirretroviral de gran actividad).
1113,,17067234,Encefalitis límbica paraneoplásica y carcinoma epidermoide del seno piriforme.
1114,,17022309,Mujer de 56 años de edad con nódulos dolorosos y ulceras cutáneas.
1115,,16831385,Varón de 21 años con caquexia y presencia de abundante cantidad de gas intraabdominal.
1116,,17067222,Presentación atípica de un caso de arteritis de células gigantes.
1117,,16792946,Lesiones vertebrales osteolíticas en una paciente de origen nigeriano.
1118,,16792944,Lesión lítica en la tibia en un paciente procedente de Ecuador.
1119,,16762296,Nódulos pulmonares múltiples en paciente con bronquitis crónica.
1120,,16762294,Insuficiencia cardíaca congestiva y sarcoma de Kaposi.
1121,,17306153,Conferencia clinicopatológica de la SEMI.
1122,,17067223,Pancarditis neumocócica con infarto agudo de miocardio y fracaso cardiaco de curso fulminante.
1123,,17067221,Mixoma auricular izquierdo como forma de presentación de una angina de esfuerzo.
1124,,16762297,Tromboflebitis y neumonía en paciente VIH.
1125,,16762295,"Paciente con VIH, fiebre y lesiones cutáneas."
1126,,17001364,Neumomediastino espontáneo.
1127,,16886305,Imagen de la semana. Sepsis y artritis aguda por SARM de origen cutáneo.
1128,,16817703,"Perforación colónica, una rara complicación de pancreatitis aguda necrotizante."
1129,,16750111,Varón de 19 años con febrícula e infiltrado pulmonar apical.
1130,,16733036,"Trombocitopenia grave de probable mecanismo autoinmune, en relación con el tratamiento con interferón en un paciente con hepatitis crónica por el virus C."
1131,,16883665,Hipersensibilidad química mútiple en el síndrome del edificio enfermo.
1132,,16759582,Incapacidad motora en una paciente con artritis.
1133,,16750112,Odinofagia y lesiones cutáneas en paciente con metástasis cerebrales.
1134,,17190213,Neurofibroma de la vejiga: caso clínico y revisión de la literatura.
1135,,16796414,Artritis séptica como manifestación inicial de endocarditis bacteriana por Staphylococcus aureus.
1136,,16796412,Miocardiopatía chagásica: una causa de insuficiencia cardiaca de origen infeccioso.
1137,,16750093,Varón de 77 años con ictericia y prurito.
1138,,16725088,Varón de 35 años con fiebre y exantema purpúrico.
1139,,16796411,Quilotórax bilateral en un caso de adenocarcinoma metastásico de primario desconocido.
1140,,16750092,Infiltrados pulmonares en paciente en tratamiento con glucocorticoides.
1141,,16737433,Neumonía por Corynebacterium pseudodiphteriticum: una patología a considerar.
1142,,16597387,Derrame pleural izquierdo en paciente con insuficiencia cardíaca.
1143,,16527096,Determinación de cortisol salival en el diagnóstico de la enfermedad de Cushing pediátrico.
1144,,16525915,Seudoemesis gravídica causada por angioma venoso cerebral complicado.
1145,,16737434,Calcificaciones cerebrales típicas como orientación de cuadro clínico inespecífico.
1146,,16676108,Ascitis y falla renal: no olvidar el uroperitoneo.
1147,,16606564,Mujer de 56 años con dolor y crepitación en miembro inferior izquierdo.
1148,,16597386,Síndrome general y lesiones cutáneas.
1149,,17096607,"Síndrome de Ogilvie o pseudobstrucción aguda del colon: una causa rara de abdomen agudo, de elevada mortalidad y asociada a patologías frecuentes en un Servicio de Medicina Interna."
1150,,16566655,Histiocitosis pulmonar de células de Langerhans.
1151,,16545322,Neumonía intersticial bilateral recidivante en un paciente con infección por el VIH.
1152,,16527173,"Varón de 25 años con fiebre, adenopatías y lesiones cutáneas."
1153,,16566658,Un caso de carcinoma de trompa de Falopio.
1154,,16554930,Insuficiencia renal aguda secundaria a rabdomiólisis de esfuerzo.
1155,,16540040,Anomalías de la vena cava y trombosis venosa profunda.
1156,,16527174,"Mujer de 61 años con rápido aumento de volumen en el miembro superior derecho, dolor y limitación funcional."
1157,,17240628,Mieloma multiple y arteritis de celulas gigantes sin amiloidosis.
1158,,16542120,Intoxicación aguda por cocaína. A propósito de un caso.
1159,,16527047,Seudotumor testicular y síndrome constitucional.
1160,,16497261,Meningitis fulminante por Streptococcus pneumoniae. A propósito de tres casos.
1161,,16977971,Espondilodiscitis y absceso epidural candidiásico.
1162,,16871915,Endocarditis trombótica no bacteriana bivalvular asociada a cáncer y ecocardiograma transesofágico.
1163,,16548296,"Mujer de 51 años con ataque al estado general, fiebre, artralgias, mialgias y nódulos eritematosos."
1164,,16542121,Masa retroperitoneal en paciente varón joven.
1165,,16542119,Diagnóstico por tomografía axial computarizada de sinusitis esfenoidal.
1166,,16527048,Amiloidosis secundaria a pielonefritis xantogranulomatosa: presentación de un caso y revisión de la literatura.
1167,,16525924,Lesiones cerebrales en paciente con meningitis.
1168,,16527186,Focalidad neurológica en el paciente anciano.
1169,,16527187,Derrame pleural en paciente con artritis reumatoide de larga evolución.
1170,,16324555,Absceso en la pared torácica en un paciente inmunocompetente.
1171,,16324553,Síndrome febril prolongado sin focalidad.
1172,,9780424,Distomatosis por fasciola hepática: a propósito de tres casos en la Comunidad de Madrid.
1173,,16454590,Síndrome de Lemierre y Mycoplasma pneumoniae.
1174,,16454588,Fiebre e hiperprolactinemia como primera manifestación de histiocitosis de células de Langerhans.
1175,,16324532,"Varón de 67 años, etilismo crónico y descompensación hidrópica."
1176,,16324530,Fiebre y lesión necrótica cutánea.
1177,,16324526,Absceso epidural espinal sin espondilodiscitis. Descripción de cuatro casos.
1178,,16324531,Varón de 69 años con síntomas respiratorios e infiltrado pulmonar derecho.
1179,,22552523,Absceso pulmonar y empiema fulminante por Pseudomonas aeruginosa.
1180,,16341374,Síndrome neuroléptico maligno y poliserositis en paciente usuaria de clozapina: una asociación infrecuente.
1181,,16238965,Absceso pulmonar y abscesos cerebrales en paciente inmunocompetente.
1182,,16238963,Varón de 27 años con infiltrados pulmonares bilaterales y parotiditis aguda bilateral.
1183,,16216191,Varón de 72 años con lesiones paranasales crónicas.
1184,,16386078,Aneurisma micótico en cayado aórtico por Aspergillus fumigatus: aportación de un caso y revisión en la literatura.
1185,,16386075,Fracaso hepático agudo tras golpe de calor.
1186,,16194483,Dolor abdominal en una mujer guineana de 21 años.
1187,,16351490,Leucoencefalopatía multifocal progresiva en pacientes con sida. Hepatotoxicidad de la terapia de alta eficacia (TARGA) en pacientes con coinfección por VHB o VHC.
1188,,16075399,Parálisis seudocubital secundaria a un infarto isquémico cerebral.
1189,,16047299,Epilepsia de inicio tardío como primera manifestación de pseudohipoparatiroidismo.
1190,,16351493,Síndrome de lisis tumoral espontáneo en una paciente con linfoma no Hodgkin.
1191,,16288577,Taponamiento cardiaco por quiste hidatídico pericárdico.
1192,,16029764,Varón de 33 años con clínica de dolor abdominal e insuficiencia cardíaca derecha.
1193,,16420794,Gangrena gaseosa.
1194,,16029765,"Lesiones papulonecróticas en ambos codos, poliartralgias, sinusitis y deterioro de la función renal."
1195,,16029763,Nódulos pulmonares en paciente con infección por el virus de la inmunodeficiencia humana.
1196,,16476395,Síndrome de Sweet con lesiones ampollosas.
1197,,16011409,Nódulo de la hermana María José como manifestación de cáncer de origen desconocido: presentación de un caso.
1198,,16011407,Meningitis y absceso cerebral por Streptococcus intermedius en un paciente con infección por VIH-1.
1199,,15989858,Lesiones hepáticas y shock en un paciente de 75 años con leucemia mieloide crónica.
1200,,15970173,Masa cervical y extrapleural contralateral de rápido crecimiento en paciente infectado por el VIH.
