,abstract,id,title
906,,23601838,Coagulopatía fulminante tras el uso de bivalirudina en un paciente diagnosticado de trombocitopenia inducida por heparina y sometido a cirugía cardiaca con circulación extracorpórea.
907,,25079189,Sífilis congénita precoz: a propósito de 2 casos clínicos.
908,,24566787,Laringitis graves asociadas a reflujo gastroesofágico.
909,Resolucion espontanea de una fistula dural arteriovenosa tipo IV. ,24504885,Resolución espontánea de una fístula dural arteriovenosa tipo IV.
910,"Hipomielinizacion con atrofia de ganglios basales y de cerebelo. Aportacion de dos nuevos casos a una entidad de descripcion reciente. Introduccion. La hipomielinizacion con atrofia de ganglios basales y de cerebelo (H-ABC) es una rara entidad descrita recientemente. Se presentan dos nuevos casos pertenecientes a una misma familia. Casos clinicos. Caso 1: niño de 17 meses con retraso grave en todas las areas, ausencia de lenguaje y de contacto visual. En la exploracion destacaba una microcefalia con tetraparesia espastica. En la resonancia magnetica cerebral se apreciaba atrofia cerebelosa de predominio vermiano con perdida de volumen de ambos nucleos del putamen y la cabeza del caudado, y patron de hipomielinizacion de la sustancia blanca. En la electromiografia se objetivo un patron de polineuropatia cronica de predominio motor. Presento un descenso de los valores de acido homovalinico y de acido 5-hidroxindolacetico. El tratamiento con levodopa/carbidopa no fue efectivo. Caso 2: niña de 11 meses, hermana del caso anterior. Presentaba un retraso grave en todas las areas y en la exploracion clinica se detecto una microcefalia con tetraparesia espastica. La resonancia magnetica cerebral mostro hallazgos superponibles a los del hermano, con hipomielinizacion, atrofia cerebelosa y afectacion putaminal y de ambos caudados; en la electromiografia, hallazgos compatibles con polineuropatia motora de caracter desmielinizante. Presento un descenso de los valores de acido homovalinico y acido 5-hidroxindolacetico en el liquido cefalorraquideo. El tratamiento con levodopa/carbidopa resulto ineficaz. Conclusiones. Estos dos nuevos casos ayudan a caracterizar mejor esta entidad y refuerzan la hipotesis del origen genetico del sindrome, dado que se trata de dos casos pertenecientes a una misma familia. ",24504878,Hipomielinización con atrofia de ganglios basales y de cerebelo. Aportación de dos nuevos casos a una entidad de descripción reciente.
911,,24119395,Varón de 76 años con ascitis y síndrome constitucional.
912,,24021749,Duodenitis isquémica en paciente pluripatológico.
913,,23816749,Miastenia gravis generalizada seronegativa. Presentación de un caso de inicio precoz.
914,,23768857,Brote familiar de botulismo alimentario.
915,,25079188,Gastropatía hipertrófica perdedora de proteínas: enfermedad de Ménétrier. Caso clínico.
916,,24740774,Sarna sarcóptica: comunicación de un brote en un grupo familiar y su mascota.
917,,24566788,Embarazo adolescente no diagnosticado: análisis de un evento centinela.
918,Paraparesia rapidamente progresiva secundaria a un fibrosarcoma. ,24504886,Paraparesia rápidamente progresiva secundaria a un fibrosarcoma.
919,Multineuritis craneal aguda de causa fungica. ,24504884,Multineuritis craneal aguda de causa fúngica.
920,,24314611,Riñón en herradura infartado.
921,,24269419,Hipertensión intracraneal e hipertensión pulmonar. ¿Causalidad o casualidad?
922,,23849766,Agomelatina: fallo hepático fulminante en paciente con hígado graso.
923,,23485202,Bloqueo nervioso periférico guiado por ecografía en una paciente con polineuropatía desmielinizante inflamatoria crónica.
924,,23477891,Vía aérea difícil en un paciente pediátrico con mucopolisacaridosis tipo i (síndrome de Hurler).
925,,25555016,Hemorragia subaracnoidea y trombocitopenia asociada a bacteriemia por estafilococo.
926,,25555008,Mieloma IgE. Dificultades de laboratorio para su tipificación.
927,"Antecedentes: los linfangiomas son malformaciones congénitas o adquiridas (secundarias a traumatismos, infecciones o neoplasias) de la glándula mamaria sumamente raras. Estas lesiones tienden a infiltrar los tejidos circundantes y la degeneración maligna es excepcional. Su manifestación clínica es en tumores benignos y de crecimiento lento. Se diagnostica clínicamente y por estudios de imagen. El tumor se extirpa por razones estéticas y para establecer el diagnóstico diferencial con otras lesiones más comunes. Caso clínico: paciente femenina de 45 años de edad, con incremento progresivo del tamaño de la mama izquierda, quizá originado por un traumatismo y no tiene otros sintomas. El diagnóstico histológico definitivo fue: linfangioma quístico gigante de la glándula mamaria izquierda. Discusión: los linfangiomas son lesiones extremadamente raras en la glándula mamaria, de comportamiento agresivo local y benignas. El tejido linfático anormal posee cierta capacidad de proliferar y de acumular grandes cantidades de líquido, lo que representa su apariencia quística, como sucedió en el caso aquí reportado. La extirpación quirúrgica local es el tratamiento indicado. Conclusión: este primer caso de linfangioma quístico gigante de mama reportado en México permite corroborar la benignidad de la lesión. ",25510795,Linfangioma quístico gigante de mama. Reporte de un caso con seguimiento de 20 años y revisión de la bibliografía.
928,,25188667,"Cáncer de mama avanzado, fracturas patológicas e hipercalcemia en una anciana. Dificultades en las decisiones."
929,,24918674,Ruptura espontánea de pelvis renal con hematoma retroperitoneal.
930,"El diagnóstico de alergia alimentaria requiere una anamnesis adecuada y la realización de pruebas diagnósticas, las pruebas cutáneas con alimentos en fresco, con alergenos estandarizados, o con ambos; las pruebas de IgE específica para alimentos son útiles. El riesgo de reacciones sistémicas por pruebas cutáneas por punción es de 15 a 23 por cada 100,000 y el de anafilaxia es de 0.02%. Comunicamos el caso de cuatro pacientes que sufrieron anafilaxia durante la realización de prueba Prick-to-Prick con alimentos frescos. Los alimentos implicados fueron frutas de las familias Rosaceae, Anacardiaceae y Caricaceae. En dos pacientes la anafilaxia fue de grado 4, en una grado 2 y en otra grado 3, todas con adecuada respuesta al tratamiento farmacológico. Los factores de riesgo fueron: sexo femenino, antecedente personal de atopia, reacción sistémica previa a veneno de himenópteros y anafilaxia previa con pruebas por punción para aeroalergenos. Las cuatro pacientes tuvieron síndrome de alergia oral y 50% tenía antecedente de prueba por punción positiva a betuláceas. Durante la realización de pruebas Prick-to-Prick para alimentos los pacientes pueden presentar anafilaxia, por lo que deben realizarse en un área que cuente con equipo rojo. El antecedente de síndrome de alergia oral se observó en todos los casos y la mitad de las pacientes tuvieron positividad a betuláceas, estos antecedentes pueden ser factores de riesgo adicional de anafilaxia dura te la realización de pruebas Prick-to-Prick para alimentos. ",24912999,Anafilaxia secundaria a pruebas cutáneas prick-to-prick para alimentos y sus factores de riesgo.
931,,24861123,Evolución prolongada en síndrome de Crigler-Najjar tipo I.
932,,24791362,Sordera neurosensorial y aneurisma de la arteria vertebral: manejo endovascular.
933,,24736264,Shock séptico con evolución a edema agudo de pulmón y falla multiorgánica.
934,,24736256,Hemodiálisis para remover el anticoagulante dabigatrán en situaciones de urgencia.
935,,24721961,Pancreatitis aguda grave asociada a gangrena vesicular.
936,,24718532,"Rabia en Potos flavus identificados en el departamento de Madre de Dios, Perú"
937,,24701863,Preeclampsia atípica y éxito perinatal: reporte de caso.
938,,24483982,Derivación biliopancreática y resección simultánea de masa adiposa ulcerada gigante en paciente con índice de masa corporal de 75.
939,,26148402,SINDROME DE LYELL POTENCIALMENTE FATAL.
940,"La mucormicosis es una micosis emergente, de elevada mortalidad. El objetivo del estudio es presentar las características clínicas y evolución de los casos asistidos en el Sanatorio Allende, de la Ciudad de Córdoba República Argentina y hacer una actualización bibliografíca. Se presentan 5 pacientes con mucormicosis con diferentes formas clínicas de presentación. El diagnóstico clínico se confirmó por histopatología y/o cultivo de los tejidos. Concluimos que en la actualidad la sospecha clínica basada en la forma de presentación y los factores de riesgo siguen siendo claves para establecer la sospecha clínica y realizar el diagnóstico temprano. En cuanto al tratamiento se basa fundamentalmente en el desbridamiento quirúrgico para eliminación del tejido necrótico y Anfotericina liposomal como antifúngico de elección. El posaconazol nuevo triazol tendría un rol importante en la consolidación del tratamiento una vez que el paciente logra la estabilización clínica o como tratamiento de rescate. ",25927886,Mucormicosis revisión de casos y actualización.
941,Electroencefalograma de amplitud integrada en la hiperglicinemia no cetosica. ,24343542,Electroencefalograma de amplitud integrada en la hiperglicinemia no cetósica.
942,Signo del cerebelo blanco (reversal sign). ,24343540,Signo del cerebelo blanco (reversal sign).
943,,24099600,Foliculitis del jacuzzi: descripción de un brote de 6 casos.
944,,23562416,Leiomioma intraorbitario. Caso clínico y revisión de la literatura.
945,,23375688,Posibilidades de empleo de la oximetría cerebral transcutánea en zona de combate.
946,,23276379,Hernia diafragmática gigante en una paciente con escoliosis severa.
947,,23276375,Retrombosis tras la colocación de un filtro de vena cava inferior en el postoperatorio de cirugía oncológica.
948,,23228671,Anestesia para sustitución valvular en el segundo trimestre del embarazo.
949,"Antecedentes: la degeneración maligna es una complicación rara, observada principalmente en enfermedad pilonidal crónica recurrente y se asocia con muy mal pronóstico. En la bibliografía mundial se encuentra como una entidad poco frecuente. En España se revisaron 367 pacientes afectados de quiste pilonidal, simple o complicado. Entre ellos se encontraron tres casos (0.81%) de carcinoma epidermoide con quiste pilonidal. Caso clínico: paciente masculino de 60 años de edad, con cuadro clínico de 50 años de evolución de un tumor sacro. Luego de la exéresis el reporte histopatológico fue de quiste pilonidal; la evolución fue tórpida en la cicatrización, con bordes necróticos que se resecaron y el reporte fue: carcinoma epidermoide. Conclusión: el carcinoma epidermoide de sinus pilonidal es una enfermedad infrecuente asociada con muy mal pronóstico. ",25510796,Tumor epidermoide moderadamente diferenciado asociado con quiste pilonidal.
950,,25470910,Gliosarcoma pediatrico: Reporte de un Caso y Revisión de la Literatura.
951,,25347904,Nefropatía membranosa secundaria a exposición laboral con mercurio metálico.
952,,24918673,Neumotórax bilateral como complicación de metástasis pulmonar cavitaria de un angiosarcoma.
953,,24736269,Hepatitis fulminante fatal como presentación de una leucemia linfática aguda.
954,,24561844,Ictericia febril colestásica como forma de presentación de linfoma de Hodgkin.
955,,26753386,Sobrevida prolongada luego de la resección local de un leiomiosarcoma de recto.
956,,26742297,Mesotelioma peritoneal maligno en paciente sin exposición ocupacional. Reporte de un caso.
957,Necrosis retiniana aguda por virus herpes simple tipo 1 a los tres años de una encefalitis herpetica. ,24343541,Necrosis retiniana aguda por virus herpes simple tipo 1 a los tres años de una encefalitis herpética.
958,,24269456,Valor predictivo de la tomografía de coherencia óptica en la evolución del adenocarcinoma pulmonar con metástasis coroideas.
959,,24125594,Bajo rendimiento diagnóstico de la PET/TC con 11C-colina en la detección de metástasis hepáticas de origen prostático.
960,,23790532,Independencia transfusional en un paciente con anemia refractaria con exceso de blastos tipo 2 refractario a 5-azacitidina tratado con deferasirox y agentes estimuladores de colonias.
961,,23453310,Meduloblastoma congénito asociado a quiste aracnoideo intracraneal.
962,,23261225,La leucocitosis extrema puede inducir a un diagnóstico erróneo de hipoxemia severa. Descripción de un caso.
963,,23228418,Abordaje transdiafragmático de metástasis hepatopulmonares: casos que apoyan su viabilidad y seguridad.
964,,22632993,Colecistitis aguda enfisematosa de curso fulminante tras cirugía cardiaca.
965,,24516957,Reconstrucción anorrectal total luego de una coloproctectomía: resultados funcionales.
966,,24257259,Tumor pigmentado del cuerpo ciliar: ¿benigno o maligno?
967,,24099592,Absceso hepático masivo en paciente trasplantado hepático secundario a trombosis arterial tardía del injerto.
968,,24094924,Pancreatitis enfisematosa.
969,,23856135,Síndrome de la cabeza caída como primera manifestación de una esclerosis lateral amiotrófica.
970,,23747072,Síndrome de la varicela congénita y herpes zoster neonatal.
971,,23540613,Manejo de la tirotoxicosis grave por amiodarona cuando fracasa el tratamiento médico convencional.
972,,24728438,Calcificaciones pulmonares metastásicas en un trasplantado renal con un injerto con función renal adecuada: Caso clínico.
973,,24620528,Aneuploidía recurrente en pérdida gestacional del primer trimestre: reporte de un caso y revisión de la bibliografía.
974,,24620526,Roturas uterinas completas.
975,,24516960,Metástasis gástricas: un hallazgo no solo de autopsias.
976,,24288107,Enfermedad de Alpers juvenil.
977,,24257258,Oclusión de vena central de la retina como primera manifestación de cáncer de ovario.
978,,24011649,Utilidad de la cápsula endoscópica urgente en hemorragia digestiva grave secundaria a hemangiomatosis intestinal difusa.
979,,23790586,Distrés respiratorio y púrpura en un paciente inmunodeprimido: hiperinfestación con diseminación por Strongyloides stercoralis.
980,,23453239,Tratamiento perioperatorio de una embarazada con belonefobia severa.
981,,24718476,Síndrome hemofagocítico secundario: reporte de 5 casos.
982,,24314783,Infiltración cutánea por leucemia mielomonocítica crónica: presentación de tres casos
983,,23937820,Dolor torácico de 48 horas de evolución en un varón de 41 años.
984,,23896559,Tumores vertebrales de la región cervical alta.
985,,23731978,Embolización arterial en el tratamiento de la hemorragia digestiva baja masiva en los pacientes con enfermedad de Crohn.
986,,23622891,Fascitis necrosante secundaria al tratamiento con panitumumab.
987,,23602561,Descripción de un brote de tuberculosis y utilidad de la ecografía mediastínica.
988,,23473437,Manejo del retroneumoperitoneo tras CPRE.
989,,24716372,Tratamiento de la enfermedad de perthes tardía mediante artroscopía de cadera y artrodistasis con fijador externo. A propósito de un caso y revisión de la literatura.
990,,23622890,Miocarditis mortal por enterovirus asociada a tratamiento de linfoma folicular con rituximab y quimioterapia.
991,"El síndrome hipereosinofílico se distingue por eosinofilia periférica mayor de 1,500 cel/mm3 o eosinofilia tisular (o ambas), con disfunción o daño a órgano atribuible, una vez que se han descartado otras causas. Se comunica un caso de síndrome hipereosinofílico como forma de presentación de leucemia linfoblástica en una adolescente. Se trata de una paciente de 13 años de edad, con leucemia linfoblástica de células B a los nueve años, tratada con quimioterapia durante dos años, con logro de la remisión. Un año posterior a ésta comenzó con eritema malar, caída de pelo, artralgias en las manos, los codos, las rodillas y los hombros, dolores musculares (predominantemente en los muslos), disnea, opresión torácica e inyección conjuntival. La biometría hemática sólo reportó eosinofilia, el aspirado de médula ósea sin blastos, inmunofenotipo negativo; autoanticuerpos negativos, sólo ANA 1:1,280 (patrón nuclear en una determinación, las posteriores resultaron negativas) complemento normal, banda lúpica en piel negativa, IgG 2,195, IgA 231, IgM 327, IgE 109, pruebas cutáneas a aeroalergenos y alimentos negativos. Se trató con prednisona a dosis de 1 mg/kg. El ultrasonido abdominal reportó lodo hepático y hepatoesplenomegalia, la tomografía de alta resolución de tórax mostró afección intersticial centroloblillar, a considerar neumonitis eosinofílica. Posteriormente tuvo una dermatosis generalizada con pápulas no pruriginosas, de 1 x 1 cm, confluentes; la biopsia de piel reportó vasculitis leucocitoclástica. Seis meses después del inicio de los síntomas tuvo ataque al estado general, fiebre no controlable, hemorragia gingival, astenia y adinamia; la biometría hemática reportó blastos, y el aspirado de médula ósea confirmó el diagnóstico de leucemia linfoblástica de células B. La paciente experimentó deterioro acelerado, datos de dificultad respiratoria y edema agudo pulmonar. Se le inició quimioterapia, sin lograr respuesta, hasta que sobrevino la muerte. Existen varias causas del síndrome hipereosinofílico y una de las presentaciones menos frecuentes en niños es la asociación con procesos neoplásicos. ",24912912,Síndrome hipereosinofílico como presentación paraneoplásica en una adolescente.
992,,24483043,Diagnóstico ecográfico prenatal y seguimiento de quistes esplénicos fetales: a propósito de dos casos. Revisión de la bibliografía.
993,,24095168,Cuidados paliativos en atención primaria. A propósito de un caso.
994,,23809678,Neumopericardio y neumomediastino en un paciente diabético y consumidor de cocaína.
995,,23517742,Evolución favorable en un caso de enfermedad neonatal grave por echovirus 11.
996,,23182296,Infección de una prótesis aórtica abdominal secundaria a fístula aortoentérica: un reto diagnóstico y terapéutico.
997,,24248167,Endoftalmitis endógenas: revisión de una serie de casos y revaloración de una entidad ocular grave.
998,,24060306,Síndrome paraneoplásico ocular: retinopatía asociada al cáncer.
999,,24052446,Afasia y purpura trombotica trombocitopenica en una mujer joven: el dilema del recuento plaquetario.
1000,,24051185,Episodio aparentemente letal neonatal durante el «piel con piel». Tratamiento con hipotermia.
1001,,23827925,Hematoma retroperitoneal espontáneo y embarazo. Caso clínico.
1002,,23523400,Meningitis por Salmonella tras toxiinfección alimentaria en lactante alimentado con lactancia artificial.
1003,,23474266,Taponamiento cardíaco como primera manifestación de carcinoma papilar de tiroides.
1004,,23415545,Tumor carcinoide apendicular de células globoides.
1005,,23318163,Fallo multiorgánico en paciente con fungemia por Saprochaete capitata.
1006,"Antecedentes: el mieloma múltiple es una neoplasia de células plasmáticas caracterizada por destrucción ósea, insuficiencia renal, anemia e hipercalcemia. Los plasmacitomas de los huesos del cráneo representan menos de 1% de los tumores de cabeza y cuello. Se manifiestan como lesión primaria o secundaria a mieloma múltiple en 20-30%, incluso pueden aparecer varios años después del diagnóstico. Los autores comunicamos dos casos de pacientes mexicanas con lesiones plasmocíticas intracraneales, asociadas con mieloma múltiple.Casos clínicos: el primer caso es el de una paciente de 24 años de edad, con diagnóstico de mieloma múltiple e infiltración ósea que fue extirpado en 90%. Experimentó una recidiva local que requirió otra intervención para su remoción. El segundo caso es el de una mujer de 62 años de edad con un tumor intracraneal de células plasmáticas que se resecó en su totalidad. Ambas recibieron terapia adyuvante con quimio y radioterapia con resultados favorables. Las pacientes fallecieron a los 5 y 1.5 años, respectivamente, por insuficiencia renal como consecuencia de la enfermedad sistémica. Conclusiones: se propone a la quimioterapia y radioterapia como parte esencial del tratamiento de este tumor porque su comportamiento natural agresivo puede complicar la evolución, a pesar de ser accesibles quirúrgicamente. ",25125061,Comportamiento tumoral de neoplasias intracraneales de células plasmáticas. Reporte de 2 casos y revisión de la bibliografía.
1007,,24652244,Caso probable de fiebre manchada (Rickettsia felis) transmitida por pulgas.
1008,,24303691,Hernia de Amyand gigante.
1009,,24080890,Patrón serológico anómalo de reactivación del virus de la hepatitis B en 2 pacientes en tratamiento con alemtuzumab.
1010,,24047629,Paciente con SDT e infección por VIH.
1011,,24008543,Variante plasmocitoide del carcinoma urotelial: a propósito de un caso.
1012,,23537741,Eritema flagelado por setas Shiitake.
1013,"Antecedentes: la enfermedad diverticular colónica en niños y adolescentes es poco frecuente y sólo existen reportes de casos aislados en la bibliografía. La mayoría de los casos reportados se asocian con divertículos verdaderos congénitos y enfermedades genéticas de producción de la colágena. Caso clínico: paciente femenina de 13 años de edad, que ingresó a la División de Cirugía General y Endoscópica con diagnóstico de apendicitis aguda complicada. En la laparotomía se encontró enfermedad diverticular complicada de colon sigmoides. Se le practicó sigmoidectomía y colorrecto-anastomosis. El reporte histopatológico evidenció perforación de pseudodivertículo de colon sigmoides y peritonitis. La paciente fue dada de alta del hospital 72 horas posteriores a la cirugía, sin complicaciones. Conclusión: existen sólo reportes de casos aislados de niños y adolescentes con diverticulitis colónica, y su etiología no ha sido aún debidamente establecida. Esta paciente tuvo diverticulitis de sigmoides, similar a la enfermedad en adultos, sin padecimientos genéticos concomitantes. El caso es una excepción a lo reportado en la bibliografía de las diverticulitis en niños y adolescentes. ",25125064,Diverticulitis de sigmoides en adolescente. Reporte de caso.
1014,,24652245,Dengue perinatal.
1015,,24047632,Paciente con sdt y ed no respondedor a inhibidores de la 5PDE.
1016,,24008939,Signo de Battle.
1017,"Dos nuevas mutaciones en el gen que codifica la alfa-glucosidasa acida en un adolescente con enfermedad de Pompe de inicio tardio. Introduccion. La glucogenosis tipo II o enfermedad de Pompe es una enfermedad lisosomal con un patron de herencia autosomico recesivo. La enfermedad de Pompe de inicio tardio es una miopatia metabolica progresiva causada por una disminucion de la actividad de la enzima alfa-glucosidasa acida (GAA), lo que origina una disminucion de la degradacion y posterior acumulo del glucogeno dentro de los lisosomas y el citoplasma celular. Caso clinico. Adolescente venezolano, de 16 años, diagnosticado de glucogenosis tipo II o enfermedad de Pompe, de comienzo tardio, basado en la clinica del paciente y los hallazgos bioquimicos. La atrofia muscular de los miembros superiores e inferiores era evidente y presentaba maniobra de Gowers positiva. Los niveles sericos de creatincinasa eran elevados. Su capacidad funcional respiratoria estaba disminuida. La cuantificacion de la actividad enzimatica de la GAA en papel de filtro no mostraba una disminucion significativa de la actividad. El analisis genetico molecular revelo la existencia de dos mutaciones en condicion homocigotica en el gen GAA, c.547-67C>G y c.547-39T>G, ambas en el exon 2 del cromosoma 17. De acuerdo con la base de datos del genoma humano y la revision emprendida, los cambios detectados en este paciente representan nuevas mutaciones en el gen GAA. Esta afirmacion esta en concordancia con la clinica y cambios bioquimicos encontrados en el paciente. Conclusion. Es obligatorio el estudio genetico molecular en un paciente en el que se sospecha la enfermedad. ",24008937,Dos nuevas mutaciones en el gen que codifica la alfa-glucosidasa ácida en un adolescente con enfermedad de Pompe de inicio tardío.
1018,,23706911,Hiponatremia grave durante el tratamiento de aspergilosis pulmonar invasiva con voriconazol en una paciente octogenaria con enfermedad pulmonar obstructiva crónica.
1019,,23601736,Calcificación de la arteria esplénica.
1020,,23578844,Posible síndrome neuroléptico maligno asociado a aripiprazol e imipramina tratado con bromocriptina.
1021,,22954803,Intoxicación aguda grave por cafeína. A propósito de 2 casos con 2 cursos diferentes.
1022,,22784649,Hemorragia masiva después de anticoagulación con bivalirudina en 2 casos de pacientes con trasplante cardiaco.
1023,,23768858,Diarrea intratable y pérdida ponderal acusada secundarias a roflumilast.
1024,,23332624,"Reacción similar a la sarcoidosis después del tratamiento con adriamicina, bleomicina, vinblastina y dacarbacina en una paciente con linfoma de Hodgkin."
1025,,23271037,Efecto adverso excepcional de la suspensión del tratamiento con levotiroxina para la ablación con I-131 del remanente tiroideo en una paciente con cáncer diferenciado de tiroides.
1026,,23122989,Sobredosis letal accidental de colchicina.
1027,,23121707,Trastorno de conducta como presentación del síndrome de embolia grasa.
