,abstract,id,title
2705,,16527045,Deterioro neurológico grave tras una intoxicación por monóxido de carbono tres semanas antes.
2706,,16503034,La hernia de meninges asociada a otitis media crónica en un centro de atención otológica de la ciudad de México.
2707,,16497261,Meningitis fulminante por Streptococcus pneumoniae. A propósito de tres casos.
2708,,16583844,Embarazo con litiasis y cáncer vesicular resecable. Comunicación de un caso clínico y revisión bibliográfica.
2709,,16523553,Hematoma peritoneal secundario a sangrado arterial en paciente con fractura pélvica.
2710,,16454601,Quiste pericárdico post-traumático de localización atípica.
2711,,16435625,Enfisema subcutáneo masivo y perimuscular en cirugía laparoscópica de colon.
2712,,16373013,Presentación atípica de metástasis a distancia de hepatocarcinoma.
2713,,16341358,Fusariosis diseminada por Fusarium oxysporum en un paciente adulto con leucemia mieloide aguda y neutropenia severa febril.
2714,,16324621,Espasmos infantiles como primera manifestación de la acidemia propiónica.
2715,,16317594,Miopatía con fibras trabeculares asociada a síndrome poliglandular autoinmune tipo 1 familiar.
2716,,16583845,Cáncer de vagina en una mujer joven expuesta a dietilestilbestrol: caso clínico y revisión de la bibliografía.
2717,,16527186,Focalidad neurológica en el paciente anciano.
2718,,16476322,Lupus eritematoso neonatal: 4 casos y revisión clínica.
2719,,16400430,Neurolisteriosis en adultos: a propósito de seis casos clínicos.
2720,,16373012,Glucogenosis tipo III asociada a carcinoma hepatocelular.
2721,,16372219,Proptosis como primera manifestación de recidiva de cáncer escirro de mama.
2722,,16355356,Aneurisma cerebral asociado al síndrome de inmunodeficiencia adquirida en la infancia: descripción de un caso.
2723,,16341359,Endocarditis por Streptococcus pneumoniae en niños: presentación de un caso clínico y revisión de la literatura.
2724,,16438630,Invaginación yeyunal por mieloma múltiple IgG.
2725,,16363308,Profilaxis antihemorrágica en cirugía de bajo riesgo en el síndrome de Bernard-Soulier.
2726,,16363304,Bradicardia severa y anestesia espinal en paciente con enfermedad del seno sin diagnosticar.
2727,,16288431,Tomografía por emisión de positrones corporal: urge un cambio de tutela?
2728,,16288422,Polineuropatía crónica axonal recidivante en brotes. Caso clínico.
2729,,16287580,Hipertensión pulmonar y síndrome de Schönlein-Henoch.
2730,,16277963,Esclerosis hepatoportal y angiosarcoma hepático: una asociación infrecuente y una posible etiología común.
2731,,16266622,Riesgos de los tatuajes de henna negra.
2732,,16266620,Ventilación no invasiva en lactantes afectados de síndrome de Ondine: 'una indicación real?
2733,,16579168,Peritonitis secundaria a pióetra perforado en cáncer de cuello uterino.
2734,,16498733,Isquemia del pie derecho en un joven fumador.
2735,,16420851,"Etiología y diagnóstico del hematoma retroperitoneal complicado, actitud e indicación quirúrgica."
2736,,16373054,Metástasis en mama.
2737,,16363307,Anestesia intradural para cesárea en paciente con enfermedad de Takayasu.
2738,,16363305,Hematoma masivo de pared abdominal y hemoperitoneo secundario a la administración subcutánea de heparina de bajo peso molecular.
2739,,16363299,Manejo anestésico en el déficit de factor V de la coagulación.
2740,,16353791,Schwannomas intrapetrosos del nervio facial.
2741,,16324588,Sustitución completa de aorta en la enfermedad de Marfan. Control con angiorresonancia.
2742,,16324570,Encefalitis multifocal en un paciente con sida.
2743,,16324526,Absceso epidural espinal sin espondilodiscitis. Descripción de cuatro casos.
2744,,16311956,Afectación ocular severa bilateral por déficit de vitamina A.
2745,,16266625,Supervivencia de 14 años en un paciente con síndrome de Edwards.
2746,,16254865,Síndrome de leucoencefalopatía posterior reversible por cisplatino: presentación de un caso
2747,,16333390,Pancreatectomia central: Indicaciones y resultados peri operatorios de una técnica de conservación de tejido pancreático.
2748,,16281748,Anestesia urgente de la extremidad inferior mediante bloqueo combinado ciático y femoral.
2749,,16281744,Deterioro hemodinámico severo durante la anestesia epidural para el tratamiento endovascular de una estenosis de aorta torácica.
2750,,16276453,Hematoma subaracnoideo espinal tras punción lumbar en paciente con leucemia: presentación de un caso y revisión de la literatura.
2751,,16217691,Angioplastia transluminal percutánea de arteria subclavia en la enfermedad de Takayasu: resultados a largo plazo.
2752,,16216196,Infección cutánea diseminada por Mycobacterium chelonae tras administración de toxina botulínica en paciente inmunodeprimida.
2753,,16193451,"Enfermedad de Gaucher, variante neuropática aguda (tipo 2) con mutación K198E."
2754,,16193446,Isquemia cerebral secundaria a una endocarditis trombótica no bacteriana como forma de presentación de un tumor ovárico.
2755,,16351482,Infección bacteriémica por Nocardia otitidiscaviarum: revisión a propósito de un caso.
2756,,16351480,Paciente en estado de hipertrombofilia sin eventos trombóticos.
2757,,16351472,Eosinofilia y enteritis actínica secundarias aradioterapia por adenocarcinoma de próstata.
2758,,16193449,Aneurisma gigante de la arteria basilar asociado a aneurisma de la arteria carótida interna intracavernosa.
2759,,17969280,Tratamiento exitoso de un caso de cromoblatomicosis verrucosa extensa con exéresis quirúrgica asociada a uso de ketoconazol.
2760,,16219279,Histoplasmosis diseminada.
2761,,16194501,Tendinitis asociada a levofloxacino.
2762,,16194487,Insuficiencia cardíaca derecha refractaria por aneurisma ventricular derecho postradioterapia.
2763,,16193440,Sorpresa refractiva tras LASIK.
2764,,16185622,Trayecto intramiocárdico y reserva fraccional de flujo.
2765,,16159560,Infección diseminada por citomegalovirus en una paciente diagnosticada de linfoma T periférico (variante Lennert).
2766,,16138294,Colitis ulcerosa en una paciente con esclerosis múltiple en tratamiento con interferón.
2767,,16138292,Experiencia en el tratamiento agudo con trombólisis de la enfermedad vascular cerebral en un hospital de Costa Rica.
2768,,16476274,Anhidrosis segmentaria asociada a pupila de Adie: un caso de síndrome de Ross incompleto.
2769,,16397953,Onda J de Osborn en el paciente crítico secundaria hipotermia grave accidental.
2770,,16309358,Problemas clínicos en Micología Médica: problema no. 18. Coccidioidomicosis.
2771,,16294789,Hematuria grave recidivante por amiloidosis vesical secundaria. Mikulicz transuretral como opción hemostática.
2772,,16276676,Trombo libre en aurícula izquierda.
2773,,16193437,Neurorretinopatía isquémica asociada a interferón.
2774,,16193435,Trasplante de membrana amniótica tras resección quirúrgica en sarcoma de Kaposi conjuntival.
2775,,16185625,Origen aórtico de arteria pulmonar izquierda en neonato con tetralogía de Fallot.
2776,,16185623,Regurgitación mitral severa en endocarditis de Libman-Sacks. Cirugía reparadora.
2777,,16358430,Púrpura trombótica trombocitopénica como debut de un cuadro neoplásico.
2778,,16351493,Síndrome de lisis tumoral espontáneo en una paciente con linfoma no Hodgkin.
2779,,16200925,Hematoma neuroaxial tras anestesia locorregional combinada resuelto de forma conservadora.
2780,,16200923,Intubación con el videolaringoscopio GlideScope en un paciente afecto de severa espondilolistesis cervical.
2781,,16163433,Aneurisma de la arteria esplénica: diagnóstico diferencial y alternativas terapéuticas.
2782,,16137482,Hiponatremia aguda y síndrome de Ogilvie por intoxicación accidental con desmopresina.
2783,,16136403,Mucocele orbitario primario: proptosis y atrofia óptica.
2784,,16136401,Utilización de doble malla de prolene para reconstrucción de la pared orbitaria.
2785,,16200930,Vólvulo de intestino delgado tras la ingesta de paquetes de hachís.
2786,,16163434,"Hiperkalemia grave asociada a drogas que actúan sobre el sistema renina, angiotensina, aldosterona: un problema que requiere atención. Caso clínico."
2787,,16137471,Fístulas aortoentéricas: presentación clínica y hallazgos por tomografía computarizada helicoidal.
2788,,16136404,AFectación orbitaria como primera manifestación de la enfermedad de Hand-Schuller-Christian. Caso clínico.
2789,,16053833,Utilidad del stent recubierto en 2 casos de cardiopatía congénita complicada con aneurismas vasculares.
2790,,16370054,Intoxicación grave con verapamilo.
2791,,16294822,Cierre percutáneo de conducto arterioso y de comunicación interventricular muscular con dispositivos de Amplatzer en paciente con hipertensión pulmonar acentuada.
2792,,16164131,Plasmocitoma: presentación de un caso.
2793,,16022839,Infección perinatal por el VIH-1 en un niño sin formación de anticuerpos anti-VIH-1.
2794,,16022823,Tratamiento con aterectomía rotacional de una lesión con stent infraexpandido debido a una calcificación severa.
2795,,16022817,Trombosis de prótesis aórtica tras asistencia ventricular mecánica.
2796,,16007516,La policitemia como factor predisponente de amnesia global transitoria.
2797,,16294821,Implantación de un marcapaso a través de una vena cava superior izquierda persistente: utilidad del registro de actividad eléctrica endocavitaria.
2798,,16294819,Cierre percutáneo de foramen oval permeable con dispositivo de Amplatzer. Presentación de dos casos.
2799,,16262536,Quiste mulleriano parametrial derecho.
2800,,16237473,Síndrome de Chilaiditi complicado con vólvulo de colon transverso.
2801,,16164126,Carcinoma de células claras en riñón en herradura. Descripción de un caso y revisión de la literatura.
2802,,16153366,Pancreatitis aguda hiperlipémica y cetoacidosis diabética asociadas a necrosis intestinal.
2803,,16122410,Utilidad del PET-18FDG en la localización del tumor primario en un paciente con metástasis cerebrales.
2804,,16029735,Hemotórax espontáneo por carcinoma broncogénico.
2805,,16022822,Ablación de fibrilación auricular familiar. Buena evolución a largo plazo.
2806,,15989875,Hemangioendotelioma kaposiforme torácico. Cuatro casos con evolución variable.
2807,,15989873,Evolución de dos pacientes con síndrome de Hurler en tratamiento con enzima recombinante humana alpha-L-iduronidasa.
2808,,16145731,Meningoencefalitis por virus herpes tipo 6 en paciente anciano con Alzheimer.
2809,,16107163,Problemas clínicos en micología médica: problema No. 17.
2810,,16078791,Carcinoma renal de células claras y carcinoma urotelial ipsilateral sincrónicos: aportación de un nuevo caso y revisión de la literatura.
2811,,16078789,Embolización arterial selectiva en el tratamiento de la hematuria incoercible.
2812,,16038175,Arritmia por doble via intranodal con descompensación hemodinámica grave en un retrasplante hepático.
2813,,15999789,Potenciales evocados auditivos de estado estable en el estudio de dos pacientes con neuropatía auditiva.
2814,,15989812,Heterogeneidad clínica y evolutiva del hemangioendotelioma epitelioide hepático.
2815,,15970174,Absceso cerebral por Gemella haemolysans.
2816,,15970125,Hematoma intramural aórtico: descubrimiento incidental durante cirugía coronaria.
2817,,15927134,Infección perinatal por VIH-1 no esperada.
2818,,15927123,Osteomielitis crónica multifocal recurrente.
2819,,16078792,Hipertension arterial asociada a estenosis congenita unilateral de la union pieloureteral.
2820,,16048431,Síndrome emético de causa poco frecuente.
2821,,16038182,Cateterización accidental de catéter de Swan-Ganz en cava inferior. Monitorización radiológica.
2822,,16038176,Hafnia alvei: una causa infrecuente de neumonía grave en la unidad de reanimación.
2823,,15989858,Lesiones hepáticas y shock en un paciente de 75 años con leucemia mieloide crónica.
2824,,15989835,Hepatitis tóxica tras tratamiento con flutamida.
2825,,15986276,Manejo de las hiperplasias linfoides orbitarias.
2826,,15973639,Diagnóstico retrospectivo de infección congénita por citomegalovirus en un caso clínico infantil.
2827,,15970173,Masa cervical y extrapleural contralateral de rápido crecimiento en paciente infectado por el VIH.
2828,,15970128,Diagnóstico de miocarditis aguda por cardiorresonancia magnética con contraste.
2829,,15960947,Infección por Paracoccidioides brasiliensis en un inmigrante venezolano.
2830,,15948074,Trombosis venosa cerebral y enfermedad inflamatoria intestinal.
2831,,15948068,"Infiltracion meningea y cerebral por un linfoma no Hodgkin, diagnosticada por citometria de flujo en liquido cefalorraquideo."
2832,,17966586,"Ictero obstructivo, Fasciola hepatica: presentación de un nuevo caso."
2833,,16155622,Tuberculosis abdominal.
2834,,16091162,El trasplante cadavérico de riñón en herradura. Reporte de dos casos.
2835,,16089026,Cuerpo extraño en la luz endobronquial de origen post-traumático.
2836,,16089020,Artritis tuberculosa.
2837,,16089014,Utilidad de las extensiones de sangre periférica en sepsis meningocócicas.
2838,,16001944,Hipoglucemia intensa de ayuno secundaria a caquexia tuberculosa.
2839,,15989099,Hematuria grave recidivante por amiloidosis vesical secundaria. Mikulicz transuretral como opción hemostática.
2840,,15970157,Caso 1. Dolor pleurítico y afectación peritoneal limitada al hipocondrio izquierdo en varón de 58 años.
2841,,15968912,Anestesia en un paciente afecto de paraparesia espástica hereditaria.
2842,,15968910,Consideraciones anestésicas de la cirugía de la escoliosis grave en la edad pediátrica.
2843,,15968908,Anestesia en la colestasis intrahepática. Síndrome de Alagille.
2844,,15871837,Analgesia y asepsia en el examen oftalmológico del recién nacido prematuro.
2845,,15871835,"Sordera súbita bilateral tras vacunación del sarampión, rubéola y parotiditis."
2846,,15871829,Utilización del factor VII activado en hemorragias agudas graves.
2847,,16155623,Hepatitis isquémica en paciente de 81 años con transposición congénita corregida de grandes vasos.
2848,,16013947,Original Breve Intoxicación digitálica secundaria al tratamiento con claritromicina.
2849,,16001941,Quilotórax tuberculoso: caso clínico y revisión de la literatura.
2850,,15898014,Encefalitis herpética en Cáceres. Análisis de los últimos cinco años.
2851,,15891948,Aciduria glutárica tipo 1 con evolución normal: seguimiento de un caso hasta la edad adulta.
2852,,15871840,Un insólito cuerpo extraño.
2853,,16178460,Endocarditis fatal con localizaci'on mitral producida por Erysipelothrix rhusiopathiae.
2854,,16138701,Hipertensión ventricular derecha severa secundaria a obstrucción metastásica por hepatocarcinoma.
2855,,16021206,"Reporte de casos de Fasciolosis humana en el Instituto Especializado de Salud del Niño, Lima, Perú (1988-2003)."
2856,,16004520,Endocarditis subaguda asintomática en paciente en hemodiálisis.
2857,,15953953,Infarto encefálico por embolia aérea. Caso clínico.
2858,,15901034,Anestesia en la enfermedad de Wilson.
2859,,15861328,Síndrome del maquillaje Kabuki. A propósito de 18 casos españoles.
2860,,15826568,Síndrome de Möbius y episodio aparentemente letal.
2861,,15826556,Neumonía comunitaria grave por Proteus mirabilis.
2862,,15826552,Fascitis necrosante y bacteriemia.
2863,,15826518,Probable insuficiencia cardíaca por rofecoxib.
2864,,16476368,Meningococemia fulminante.
2865,,16420926,"Infección necrosante de partes blandas, con presencia de bacterias de origen intestinal en los tejidos afectos."
2866,,16013103,Peritonitis bacteriana espontánea por Listeria monocytogenes. A propósito de un nuevo caso.
2867,,15953954,Leucemia de células natural killer. Caso clínico.
2868,,15953952,Hemicraniectomía descompresiva en dos pacientes con infarto maligno de la arteria cerebral media.
2869,,15899221,Afectación extracraneal de oligoastrocitoma anaplásico desarrollado sobre un glioma de bajo grado.
2870,,15861329,Múltiples factores de riesgo trombofílicos identificados en un lactante con accidente vascular cerebral.
2871,,15849675,"Epilepsia, calcificaciones cerebrales y enfermedad celíaca. Importancia del diagnóstico precoz."
2872,,15847742,Hemorragia pulmonar por abciximab. Factores de riesgo y papel de la protamina.
2873,,15826519,Sepsis por PSA.
2874,,15815950,Síndrome de Costello. Presentación de un caso con seguimiento durante 35 años.
2875,,16420909,Ictericia y pancreatitis crónica: compresión de la vía biliar principal por un seudoquiste pancreático.
2876,,15910707,Fascitis necrotizante de pared abdominal secundaria a diverticulitis sigmoidea perforada en una hernia de Spiegel. Reporte de un caso.
2877,,15847277,"""Presentación de dos casos: vesical y prostático de oat-cell""."
2878,,15798874,Neumonía grave causada por Haemophilus influenzae no tipificable en un lactante: reporte de un caso.
2879,,15795877,Migraña que debuta en la senectud.
2880,,15757593,Absceso hepático amebiano autóctono: caso clínico y revisión de la literatura médica.
2881,,16089286,Melanoma maligno de células pequeñas en el embarazo.
2882,,15910706,Queratoquiste odontogénico en posición dentígera. Caso clínico.
2883,,15847268,Carcinoma suprarrenal: supervivencia a 7 años libre de enfermedad tras resección completa del tumor primario y resecciones repetidas de recidivas locorregional y a distancia. Revisión a raiz de un caso con una pobre esperanza de vida inicial.
2884,,15839821,Actinomicosis torácica: una vieja entidad con nuevas expresiones clínicas.
2885,,15798875,Leptospirosis: presentación de una infección fulminante y revisión de la literatura.
2886,,15766455,Intervencionismo coronario percutáneo a injerto de arteria radial. Resultado inicial y seguimiento.
2887,,15760607,Deberían repetirse las pruebas diagnósticas de la infección por el VIH en el segundo y tercer trimestres del embarazo?
2888,,15757594,Infecciones del tracto urinario causadas por bacterias del género Aeromonas.
2889,,15757590,Deterioro neurológico brusco en paciente adicto a drogas por vía parenteral.
2890,,15824833,Desenlace fatal por loxoscelismo cutáneo visceral.
2891,,15765998,Hematoma subaracnoideo tras punción lumbar diagnóstica.
2892,,15765994,Manejo anestésico de una gestante con estenosis aórtica severa y enfermedad de von Willebrand.
2893,,15765992,Manejo anestésico en la mastocitosis.
2894,,15765321,Enfermedad de Whipple cerebral sin manifestaciones gastrointestinales.
2895,,15756406,Lesión traumática del tronco cerebral diagnosticada por resonancia magnética. Reconsideración epidemiológica y pronóstica.
2896,,15743583,Tumoración de partes blandas y fiebre en paciente con síndrome mielodisplásico.
2897,,15743577,Espondilodiscitis y sacroileítis por Streptococcus agalactiae en adultos: caso clínico y revisión de la literatura.
2898,,15756407,Espasmo hemifacial como presentación clínica de meningiomas intracraneales. Presentación de 3 casos y revisión de la literatura.
2899,,15750900,Cistinosis: una causa infrecuente de miopatía distal.
2900,,15743586,Meningitis primaria por Streptococcus suis: primer caso en humanos descrito en América Latina.
2901,,15743584,Parasitación retroperitoneal por un organismo vermiforme en una paciente africana.
2902,,15725376,"Hiponatremia, edema cerebral y muerte encefálica en una intoxicación aguda por 3,4 metilendioximetanfetamina."
2903,,15701322,Osteomielitis por Salmonella grupo B en paciente portador sano.
2904,,16475543,Epistaxis grave recidivante secundaria a traumatismo nasal. Presentación de un caso atípico en varón de 22 años.
2905,,16475541,La otitis serosa como causa infrecuente de hipoacusia neurosensorial.
2906,,16231519,Fallo renal agudo en el hígado graso agudo del embarazo: a propósito de un caso.
2907,,16042130,Estudio del foco en un caso de fasciolosis humana en Neuquén.
2908,,15830794,Proptosis ocular izquierda y obstrucción de la via aérea superior en un linfoma de cavum.
2909,,15801644,Tratamiento quirúrgico del divertículo uretral femenino. Nuestra experiencia. Revisión de la literatura.
2910,,15768153,Hiperparatiroidismo primario con compromiso esquelético grave. Un caso de carcinoma paratiroideo.
2911,,15754751,Evolución clínica en dos pacientes con Síndrome de Wiskott-Aldrich.
2912,,15747710,Diagnóstico diferencial del Síndrome de Horner en analgesia epidural obstétrica. Cuándo preocuparse?
2913,,15747704,Complicaciones infecciosas tras analgesia epidural para control del dolor postoperatorio en cirugía abdominal.
2914,,15718023,Intoxicación digitálica mortal.
2915,,15712162,Atrofia muscular espinal asociada a hipoplasia olivopontocerebelosa. Informe de un caso.
2916,,15701336,Bacteriemia y absceso hepático secundarios a infección por Yersinia pseudotuberculosis.
2917,,15701329,Artritis neumocócica bacteriémica en un Hospital Universitario de Madrid (1993-2003).
2918,,16296642,"Disnea, hipercapnia, hipertensión pulmonar e infiltrados pulmonares en una anciana con cáncer de mama recientemente diagnosticado."
2919,,16231512,Revascularización eficaz de obstrucción total de arterial renal mediante angioplastia y colocación de Stent.
2920,,16193717,"Sepsis, fistulas intestinales, colostomía, en una anciana con enfermedad de Crohn."
2921,,16053014,Terapia de sustitución enzimática en la enfermedad de Fabry: evaluación clínico-histológica tras 18 meses de terapia.
2922,,16001693,Traumatismo laríngeo externo severo con fracturas mújltiples y compromiso de la vía aérea.
2923,,15912663,Calcifilaxis severa fatal en una paciente trasplantada renal con paratiroidectomía previa.
2924,,15912661,Evolución fatal de un paciente afecto de enfermedad de Fabry en tratamiento enzimático.
2925,,15801899,Perforación ileal secundaria a infección por citomegalovirus.
2926,,15786775,Carcinoma epidermoide en extrofia de vejiga.
2927,,15768154,Insuficiencia respiratoria progresiva secundaria a fibrosis pulmonar en una escolar: Caso clínico.
2928,,15747715,Rotura traqueal iatrogénica.
2929,,15747709,Resolución de dificultad de vía aérea en una cesárea urgente con Fastrach.
2930,,15747705,Ecocardiografía transesofágica intraoperatoria en el manejo de resección de hipernefroma con compromiso de vena cava y aurícula derecha.
2931,,15712169,"Infarto isquémico cerebral provocado por factor V de Leiden, esferocitosis hereditaria y tabaquismo."
2932,,15704021,A propósito de la incidencia de la enfermedad de Creutzfeldt-Jakob en el área de salud de Lanzarote. Descripción de dos casos definitivos.
2933,,15701332,Absceso cerebral en paciente inmunodeprimida.
2934,,15696429,Meningitis tras anestesia intradural y asepsia: dos cuestiones irreconciliables?
2935,,15696423,Bomba de baclofén intratecal en el tratamiento a largo plazo de las distonías generalizadas.
2936,,15641606,Sedación con remifentanilo para una traqueostomía en un paciente pediátrico.
2937,,15625639,Hematoma intracerebral agudo isodenso.
2938,,15607073,Sofía se cayó de la bicicleta y yo me tomaré pronto un descanso.
2939,,15574257,Osteomielitis crónica múltiple.
2940,,15568176,Anticoagulación en infartos cerebrales hemorrágicos por extensa trombosis de senos venosos.
2941,,15743164,Hepatocarcinoma con invasión cardiovascular: comunicación de 5 casos y revisión de la literatura.
2942,,15710076,Síndrome general con acidosis láctica de evolución fatal.
2943,,15641605,Linfangioleiomiomatosis pulmonar: presentación de un caso de evolución fulminante y revisión de la literatura.
2944,,15628967,Mesenteritis retráctil asociada a linfoma difuso en una paciente de 74 años.
2945,,15628965,Dolor abdominal e inestabilidad hemodinámica en paciente con pluripatología.
2946,,15597277,Astrocitoma anaplásico hemisférico multifocal secundario a radioterapia de tumor cerebeloso.
2947,,15574260,Triploidía completa 69XXY.
2948,,15574258,Peritonitis primaria en niños sanos.
2949,,15694058,Avulsión uterina secundaria a trauma cerrado de abdomen y pelvis.
2950,,15573323,Enfermedad de Creutzfeldt-Jakob de presentación rápidamente progresiva.
2951,,15573312,Síndrome de Moyamoya y displasia arterial asociados a síndrome de Down.
2952,,15546526,Amebiasis autóctona española. Enfermedad emergente o endémica?
2953,,15544737,Hepatitis autoinmune en pacientes con diagnóstico de esclerosis múltiple.
2954,,15530346,"Neumonía intersticial linfoidea en un paciente adulto con infección por el VIH, resuelta con tratamiento antirretroviral."
2955,,15511414,Insuficiencia cardíaca de alto gasto y edema agudo de pulmón como forma de expresión inicial de tirotoxicosis secundaria a bocio multinodular tóxico.
2956,,15709508,Síndrome de cimitarra asociado a atresia pulmonar con comunicación interventricular. Primer caso reportado.
2957,,15586540,Intubación con estilete iluminado en una paciente con paraganglioma secretor de catecolaminas.
2958,,15558201,Tratamiento neuroquirùrgico de los neurinomas del acùstico sin indicación de tratamiento con radiocirugía
2959,,15511211,Síndrome de apnea: factor de riesgo para psudotumor cerebral.
2960,,15490361,Linfoma primario del sistema nervioso central y enfermedad de Creutzfeldt-Jakob.
2961,,15482697,Piomiositis asociada a infección por VIH-1.
2962,,15470588,Degeneración cerebelosa con anticuerpos anti-Tr positivos sin linfoma de Hodgkin asociado. Seguimiento durante 4 años.
2963,,15469798,Endocarditis infecciosa aislada de la válvula tricúspide en paciente no adicto a drogas y sin cardiopatía previa predisponente.
2964,,15469796,Trombo auricular derecho asociado a catéter venoso.
2965,,15631210,Infarto maligno de la arteria cerebral media en una paciente con meningitis bacteriana.
2966,,15558206,Agenesia congénita del pediculo en una vértebra cervical. Hallazgo casual en pacientes con cervicalgia. Diagnóstico de certeza mediante TC espiral.
