,abstract,id,title
0,,30724988,Trasplante hepático exitoso en un paciente portador del Virus de la Inmunodeficiencia Humana (VIH).
1,,29428256,Utilidad de la técnica de Gram en exudados uretrales en la consulta de atención primaria.
2,,28893380,Placa facial y nódulos en cuero cabelludo.
3,,29616515,Infección emergente por Moraxella osloensis. A propósito de la infección genital.
4,,26968822,Síndrome extrapiramidal con corea generalizada como forma de presentación atípica de leucoencefalopatía multifocal progresiva.
5,"Sindrome del condilo occipital como primera manifestacion de un carcinoma hepatocelular metastasico. Presentacion de dos casos. Introduccion. El sindrome del condilo occipital consiste en la presencia de cefalea occipital unilateral que empeora con los movimientos cefalicos y se acompaña de paralisis del XII par ipsilateral. La infiltracion de la base del craneo por metastasis oseas se encuentra entre sus etiologias, especialmente las que afectan por infiltracion al nervio hipogloso en su paso a traves del canal oseo. Casos clinicos. Se presentan dos casos clinicos de sindrome del condilo occipital secundario a un hepatocarcinoma metastasico. El primero, un varon de 52 años con cirrosis hepatica secundaria a hepatopatia por virus de la hepatitis C, con sindrome del condilo occipital como sintoma inicial en un hepatocarcinoma diseminado; y el segundo, un varon de 56 años, tras recidiva de un hepatocarcinoma despues de un trasplante hepatico, a pesar de no cumplir los criterios de Milan. Conclusion. El sindrome del condilo occipital es un sintoma de alarma y requiere realizar un estudio completo mediante pruebas de imagen, puesto que puede ser la primera manifestacion de un hepatocarcinoma oculto. ",29480511,Sindrome del condilo occipital como primera manifestacion de un carcinoma hepatocelular metastasico. Presentacion de dos casos.
6,,28196678,Co-infección por linfogranuloma venéreo y Haemophilus parainfluenzae durante un episodio de proctitis.
7,,30226491,Fitz-Hugh-Curtis syndrome in elderly male patient. Case and literature review.
8,,30125257,Polineuropatía desmielinizante inflamatoria crónica en paciente diabética con sífilis.
9,,29940550,Polimorfismo clínico de linfogranuloma venéreo anorrectal en la ciudad de Buenos Aires.
10,,28705521,Acantomas epidermolíticos múltiples del escroto: lo que el prurito genital puede esconder.
11,"El sarcoma de Kaposi es un tumor linfoangioproliferativo descripto por primera vez en el año 1872 por Moritz Kaposi. Hay cuatro variantes clínicas, la forma clásica, la endémica, la iatrogénica asociada a trasplante o inmunosupresión y la epidémica asociada a SIDA, de la cual se hará referencia en esta publicación. Se describe un paciente varón de 31 años, al cual durante la misma internación se hace el diagnóstico de SIDA y de sarcoma de Kaposi. ",29902149,Sarcoma de Kaposi en paciente con diagnóstico tardío de VIH. Presentación de un caso y revisión.
12,,29488557,Eritrodermia psoriática en un hombre joven: sospechar infección por VIH.
13,,29171743,Bartolinitis por Streptococcus pneumoniae.
14,,28366615,Hepatitis aguda fulminante por virus B durante el tratamiento del virus de la hepatitis C con antivirales de acción directa en paciente infectado con VIH.
15,,27240445,Úlceras sobre placas psoriásicas en paciente con infección avanzada por el virus de la inmunodeficiencia humana.
16,,27956326,Coriorretinitis placoide posterior sifilítica como presentación inicial de neurosífilis temprana.
17,,28964002,Caso: Varón VIH-Positivo que no Sigue el Tratamiento Pautado pero Sí Acude a Revisiones en Consulta.
18,"La celulitis periorbitaria es una patología muy frecuente en la población pediátrica. Se define como la infección que compromete los tejidos blandos adyacentes a la órbita sin atravesar el septum orbitario. Después de la introducción de la vacuna contra Haemophilus influenzae, los patógenos involucrados, generalmente, son cocos Gram-positivos. A continuación, se presenta un caso de celulitis periorbitaria asociada a conjuntivitis purulenta por Neisseria gonorrhoeae en un niño de 2 años y 10 meses. Existen pocos casos descritos en la literatura en los que este microorganismo aparece como agente causal de celulitis periorbitaria. Con este caso, se quiere resaltar la importancia de la toma de cultivo en los pacientes que concomitantemente presenten conjuntivitis bacteriana y secreción purulenta, ya que esto facilitó el diagnóstico de esta patología por un agente etiológico poco frecuente. ",28737877,Neisseria gonorrhoeae: un agente causal infrecuente de celulitis periorbitaria en un niño.
19,,27823788,"Ampollas, úlceras y costras en paciente con infección VIH."
20,,29077283,Primer caso documentado de infección autóctona por virus Zika en España. Transmisión por vía sexual.
21,,27912903,Hipopigmentación genital similar a vitíligo tras tratamiento con imiquimod 5.
22,,27084670,Hipertensión portal idiopática no cirrótica y trombosis portal en paciente con infección por VIH.
23,"Los pacientes con VIH son susceptibles a la infección por micobacterias. En el caso de las micobacterias de crecimiento rápido, grupo al que pertenece el Mycobacterium fortuitum (M. fortuitum), se han descrito infecciones en la piel, pulmones, ganglios linfáticos y enfermedad diseminada. Presentamos el caso de un paciente varón de 43 años, con diagnóstico previo de VIH en tratamiento antirretroviral, que acude por fiebre, astenia, pérdida de peso y diarrea crónica. Se realiza tomografía abdominal y se evidencia hepatoesplenomegalia con lesiones nodulares en el bazo. El cultivo esplénico, finalmente, fue positivo para M. fortuitum, con PCR positivo a Mycobacterium tuberculosis. Los protocolos actuales de tratamiento para este tipo de infecciones se basan en la susceptibilidad mostrada en los cultivos realizados. En lo que respecta a coinfecciones entre M. fortuitum y Mycobacterium tuberculosis, en pacientes VIH positivos, la información es aun menor. ",29177396,Coinfección por Mycobacterium fortuitum y Mycobacterium tuberculosis en abscesos esplénicos en un paciente con VIH.
24,,28198172,Significación clínica de Cryptococcus neoformans en heces en paciente con SIDA.
25,,26304647,Neuropatía óptica retrobulbar unilateral como primera manifestación de la infección por el virus de la inmunodeficiencia humana.
26,"Existe poca información sobre la presencia del complejo Mycobacterium avium-intracellulare (MAC) en el Perú. Se describen cinco casos de infección por MAC en pacientes con VIH/SIDA del Hospital Nacional Dos de Mayo, Lima-Perú. Los pacientes presentaron, principalmente, fiebre persistente, diarrea crónica, síndrome consuntivo, pancitopenia y citofagocitosis. En todos ellos se identificó bacilos acido-alcohol resistentes en heces, por lo que recibieron tratamiento antituberculoso. El cultivo de heces fue negativo para Mycobacterium tuberculosis y, posteriormente, en todos se identificó a MAC mediante una prueba molecular (Genotype) en el cultivo de heces. Tres pacientes recibieron tratamiento para MAC luego de la identificación; sin embargo, todos fallecieron. Ante presentaciones similares a lo reportado, se sugiere el uso de métodos de mayor rendimiento (hemocultivo, mielocultivo, pruebas moleculares), así como asociar tempranamente drogas con actividad para MAC al esquema antituberculoso con la intención de mejorar el pronóstico de este grupo de pacientes. ",29177395,Infección por el complejo Mycobacterium avium-intracellulare en pacientes con VIH/SIDA en un hospital peruano: Una serie de casos.
27,,26993439,Peritonitis bacteriana espontánea por Streptococcus salivarius en paciente con coinfección por VIH-VHC en tratamiento con antivirales de acción directa.
28,,28236805,Toxicidad por warfarina al cambiar lopinavir/ ritonavir por dolutegravir: a propósito de un caso.
29,,28288232,Síndrome de Fanconi y raquitismo hipofosfatémico asociado al uso de tenofovir en una niña infectada con VIH.
30,,27601079,Imiquimod 5% tópico como terapia alternativa en carcinoma basocelular periocular en 2 pacientes con contraindicación quirúrgica.
31,,29223945,Trasplante cardíaco en paciente infectado con el virus de la inmunodeficiencia humana.
32,,27206927,Linfoma gástrico asociado a H. pylori: remisión completa con tratamiento de TARAA y erradicación de H. pylori en un paciente VIH-positivo.
33,,26826910,Artritis gonocócica en pacientes con infección por el virus de la inmunodeficiencia humana. Revisión de la literatura.
34,,26781841,Fracturas de fatiga de repetición en pies en un paciente tratado con antirretrovirales.
35,,28489843,Hipertensión portal no cirrótica por didanosina. Un caso infrecuente.
36,,27450641,Problemas clínicos en micología médica: problema número 50.
37,,25979601,Lesiones faciales y hepatitis aguda en paciente infectada por el virus de la inmunodeficiencia humana procedente de Paraguay.
38,,27701618,Coinfección por Mycobacterium africanum y Mycobacterium avium en una paciente con SIDA.
39,,27340116,Lesiones orales y coriorretinitis placoide posterior como forma de presentación de sífilis secundaria en un paciente inmunocompetente.
40,,26947207,Colecistitis retrohepática en paciente con virus de la inmunodeficiencia humana.
41,,27792721,Revisión histórica del sarcoma de Kaposi en la era pre-TARAA (terapia antirretroviral altamente activa): evolución con diferentes esquemas de quimioterapia y remisión con el uso de ganciclovir.
42,"El síndrome hemofagocítico secundario es infrecuente en pediatría y, más aun, asociado a tuberculosis. Presentamos el caso de una paciente con síndrome de inmunodeficiencia adquirida, tuberculosis diseminada y síndrome hemofagocítico. Niña de 8 años, condiagnóstico de síndrome deinmunodeficiencia adquirida, que se internó por fiebre, vómitos y dolor abdominal. Presentaba distensión abdominal, deshidratación, taquipnea, rales subcrepitantes y sibilancias en ambos pulmones, anemia, plaquetopenia y alteración de la coagulación. Recibió antibióticos de amplio espectro y se realizó una laparotomía exploradora con apendicectomia y biopsia ganglionar. A las 72 horas, presentó convulsión tónico clónica, deterioro del sensorio, fiebre, hipoxemia, hepatoesplenomegalia, ascitis y edema periférico. Presentaba bicitopenia, hiperferritinemia y examen microscópico de médula ósea con hemofagocitosis. Recibió gammaglobulina intravenosa, corticoides y transfusiones sanguíneas. Se aisló Mycobacterium tuberculosis del aspirado gástrico, médula ósea y biopsia ganglionar abdominal. Se trató con isoniacida, rifampicina, estreptomicina y etambutol, y presentó franca mejoría. ",27606663,Síndrome hemofagocítico asociado a tuberculosis en una paciente con inmunodeficiencia adquirida.
43,,26875479,Tumor anal gigante.
44,,26690336,Embolización de fístula adquirida de arteria bronquial a arteria pulmonar en paciente con infección por VIH.
45,,28092719,Comentario al Caso: Solicitud de Reversión de Vasectomía en Varón VIH con Pareja Serodiscordante.
46,,26455643,Tumefacción en región inguinal en varón VIH positivo.
47,,28092718,Caso: Solicitud de Reversión de Vasectomía En Varón VIH con Pareja Serodiscordante.
48,,28060986,Diagnóstico de infección por VIH por el hallazgo incidental de alteraciones ultraestructurales en una biopsia renal: Report of one case.
49,,27067291,Sífilis secundaria simulando liquen plano en el paciente con infección por VIH.
50,,26944208,«Maculopatía por poppers» en España. Una nueva enfermedad oftalmológica.
51,,27262572,Infección urinaria por Mycobacterium fortuitum en paciente con infección por el VIH.
52,,27661558,Síndrome de Cushing iatrogénico por corticoides inhalados en paciente VIH.
53,,26971987,Granulomatosis eosinofílica con poliangitis y nefropatía IgA en paciente con infección por VIH.
54,,27598502,Ergotismo por uso simultáneo de ergotamínico y terapia antirretroviral: Report of one case.
55,,27552021,Leucopatía reversible de la protuberancia: en paciente con SIDA y tratamiento retroviral.
56,,26920946,Coriorretinitis placoide sifilítica. Caso clínico.
57,,26749349,Proctitis en varón con relaciones sexuales con hombres e infectado por el virus de la inmunodeficiencia humana.
58,,26723942,"Infección por el virus de la inmunodeficiencia humana y porfiria cutánea tarda, a propósito de un caso."
59,,27315003,Lesión osteolítica de calota por sífilis secundaria.
60,"El linfoma plasmablástico es un subtipo raro y agresivo de linfoma no Hodgkin de células grandes B, descrito inicialmente en la cavidad oral de adultos varones con enfermedad por virus de inmunodeficiencia humana/síndrome de inmunodeficiencia adquirida. Se compone de una proliferación de células neoplásicas que se asemejan a los inmunoblastos, pero presentan inmunofenotipo característico de célula plasmática e infección latente por el virus de Epstein-Barr. En la población pediátrica, es una entidad excepcional. Presentamos el caso de una niña de 5 años de edad, con enfermedad por virus de inmunodeficiencia humana / síndrome de inmunodeficiencia adquirida de transmisión vertical con linfoma plasmablástico de cavidad oral. ",27079412,Linfoma plasmablastico oral en un paciente pediatrico con virus de inmunodeficiencia humana/sindrome de inmunodeficiencia adquirida: a proposito de un caso.
61,,26897508,Hipertensión arterial pulmonar asociada a infección por el virus de la inmunodeficiencia humana: análisis de 4 casos.
62,,25861924,Masa pulmonar en paciente con infección por el virus de la inmunodeficiencia humana.
63,,25979599,Colección intraabdominal en paciente con infección por virus de la inmunodeficiencia humana.
64,,27576285,Púrpura de Schönlein-Henoch en adulto HIV positivo adicto a cocaína y ANCA-p positivo.
65,,26004278,Verrugas vulgares sobre un tatuaje.
66,,26732933,Sarcoma de kaposi endemico en un paciente VIH negativo.
67,,26422325,Problemas clínicos en micología médica: problema número 48.
68,,25573291,Espiroquetosis intestinal: una causa infrecuente de diarrea crónica.
69,"Introducción: el carcinoma escamoso de la conjuntiva (CEC) es un tumor maligno epitelial de la mucosa conjuntival, de etiología multifactorial. Existen varias alternativas de tratamiento para el control de esta enfermedad con diferentes resultados terapéuticos. El objetivo del trabajo fue evaluar la respuesta antitumoral de la preparación de una formulación de cisplatino en 3 pacientes con HIV y CEC recidivante, candidatos a tratamiento de enucleación y exenteración orbitaria, y evaluar los efectos adversos que se presentaron con la administración de la formulación aplicada. Métodos: fueron tratados 3 pacientes masculinos, caucásicos, con media de edad 37 años, a los que se les realizó cirugía exerética y se les administraron 3 ciclos de quimioterapia subconjuntival, con duración de 3 meses. Resultados: todos los pacientes conservaron sus ojos y la visión. No hubo persistencia ni aparecieron recidivas tumorales durante el periodo evaluado. Un paciente falleció por progresión del HIV 2 años después de finalizado el tratamiento, mantuvo visión conservada y sin actividad tumoral. Conclusión: el tratamiento con quimioterapia subconjuntival adyuvante a la cirugía resulta eficaz y es tolerable en la población de pacientes tratados. ",26383805,Quimioterapia subconjuntival en pacientes con síndrome de inmunodeficiencia adquirida. Estudio experimental de 3 casos clínicos.
70,,28590107,Ascitis en un paciente con HIV.
71,,28590608,"Hepatitis aguda como única manifestación de sífilis
en un paciente inmunocompetente."
72,,25172528,Pliegues retinianos como efecto adverso no descrito del darunavir en paciente con VIH de 20 años de edad.
73,,26436802,Controlador de élite curado del virus de hepatitis C tras 14 semanas de triple terapia basada en telaprevir.
74,,25655788,Masa rectal en varón de 31 años con el virus de la inmunodeficiencia humana: diagnóstico diferencial.
75,,26397281,Hepatitis aguda no colestásica como primera manifestación de sífilis secundaria.
76,,26033002,Aneurisma ilíaco solitario y test FTA-Abs positivo.
77,,25466306,Infección por Salmonella enterica subespecie salamae en un paciente ecuatoguineano consumidor de carne de tortuga.
78,,26148028,"Diagnóstico genotípico y fenotípico de tuberculosis ósea y miliar en un paciente positivo para HIV en Bogotá, Colombia."
79,,25418148,Probable meningoencefalitis por virus de Epstein-Barr en una paciente con virus de la inmunodeficiencia humana.
80,,25131317,Hepatitis por sífilis secundaria.
81,,24913991,Rabdomiólisis y hepatotoxicidad grave por interacción entre ritonavir y simvastatina. ¿Puede emplearse la estatina más coste-efectiva en todos los pacientes infectados por el virus de la inmunodeficiencia humana?
82,,24269457,Rellenos de polialquilamida en lipodistrofia facial asociada al virus de la inmunodeficiencia humana: complicaciones oftalmológicas.
83,,25597735,Coinfección por Mycobacterium malmoense y Mycobacterium tuberculosis en paciente con el síndrome de inmunodeficiencia humana.
84,,25594760,Linfoma plasmablástico: un caso con enfermedad rectal y compromiso de médula ósea en un paciente VIH positivo.
85,,25229376,Queratoconjuntivitis gonocócica en el adulto: una entidad emergente.
86,,24252353,Paciente con virus de inmunodeficiencia humana y vía aérea difícil no prevista.
87,,25444137,"Disminución del nivel de conciencia, fiebre y disnea en una paciente infectada con el virus de la inmunodeficiencia humana."
88,,24206673,Infección por virus de la inmunodeficiencia humana tipo 2 adquirida en España con evolución a sida.
89,,24139335,Hipoacusia neurosensorial de etiología sifilítica en un paciente con infección por virus de la inmunodeficiencia humana.
90,,24564991,Tratamiento de la leucemia mieloide crónica e infección por el virus de inmunodeficiencia humana.
91,,24508220,Eczema coxsackium (Coxsackievirus A6) en una paciente adulta infectada por el virus de la inmunodeficiencia humana.
92,,25028906,Sarcoma de Kaposi gástrico en un paciente con virus de inmunodeficiencia humana (VIH).
93,,23706936,"Sepsis, miocardiopatía e infección por el virus de la inmunodeficiencia humana: a propósito de un caso."
94,,24361368,Sífilis e infección por el virus de la inmunodeficiencia humana.
95,,23566559,Manifestaciones oftalmológicas de la infección por toxoplasma en paciente portador del virus de la inmunodeficiencia humana. Descripción de un caso.
96,,24953114,Rotura espontánea de válvula tricúspide en un paciente con hipertensión pulmonar secundaria a VIH.
97,,23891129,Histoplasmosis diseminada como forma de inicio de la infección por el virus de la inmunodeficiencia humana.
98,,24718542,Infección pulmonar por Mycobacterium avium en paciente VIH/SIDA: primer reporte en Perú
99,,24721960,Compromiso intestinal por Mycobacterium avium en un paciente con VIH/SIDA.
100,,26742301,Adenoma de glándulas de Brunner: un tumor raro como causa de sindrome pilórico en un paciente con SIDA.
101,,23953102,"Máculas y pápulas cutáneas, eritemato-parduzcas, en paciente con virus de la inmunodeficiencia humana."
102,,23648368,Utilidad de los niveles plasmáticos de lopinavir durante el embarazo.
103,,23683755,Lesiones policíclicas infiltradas en espalda y extremidades superiores.
104,,24483056,Coinfección por Neisseria gonorrhoeae y Actinomyces naeslundii.
105,,23768853,Paciente con infección por el virus de la inmunodeficiencia humana y lesiones maculopapulares ulcerativas.
106,,23809201,Carcinoma epidermoide surgido de un condiloma acuminado gigante.
107,,24128106,Eltrombopag en trombocitopenia secundaria al tratamiento de la hepatitis C crónica: análisis de dos casos.
108,,24047629,Paciente con SDT e infección por VIH.
109,,24128109,Oclusión arterial asociada a la interacción entre ritonavir y ergotamina en paciente VIH.
110,,23414790,Hepatitis colestásica como forma de presentación de sífilis secundaria.
111,,23566623,Herpes zóster hemorrágico y multimetamérico como clave diagnóstica de infección por el virus de la inmunodeficiencia humana.
112,,23380469,Pápulas marrones y violáceas localizadas en la espalda de un paciente con infección por el virus de la inmunodeficiencia humana.
113,,23465581,Compresión medular por metástasis de hepatocarcinoma en paciente infectado por el virus de la inmunodeficiencia humana. A propósito de un caso.
114,,23540996,Paciente con exantema maculoso inespecífico.
115,,23063113,Enfermedad de Kikuchi-Fujimoto en una portadora del VIH.
116,,23949523,Diarrea recurrente por Cystoisopora belli en pacientes con infección por VIH con TARGA.
117,,23677162,Premasticación: una nueva forma de transmisión del virus de inmunodeficiencia humana. Primer caso pediátrico informado en Chile.
118,,23481872,Sífilis maligna en un paciente inmunocompetente.
119,"Introducción: la leishmaniasis visceral o kala azar es la presentación clínica más grave. En México, es una enfermedad rara por lo que su diagnóstico es tardío y generalmente culmina en la muerte del paciente. Se describe a un paciente VIH positivo que desarrolló leishmaniasis visceral. El objetivo es explicar sus características fisiopatológicas y de su tratamiento. Caso clínico: hombre de 45 años de edad, quien ingresó al hospital por cuadro crónico de diarrea sanguinolenta, distensión abdominal, dolor tipo cólico, pérdida de peso y fiebre. A la exploración física se identificó paciente febril con dolor en fosa iliaca derecha y hepatoesplenomegalia. La prueba ELISA para VIH resultó positiva y el ultrasonido hizo evidente una tumoración en ciego, por lo que se realizó biopsia. El informe histopatológico indicó que se trataba de leishmaniasis. Conclusiones: en los pacientes con leishmaniasis e infección por VIH existe pobre respuesta al tratamiento y la mortalidad es alta, causada por la menor respuesta inmune del huésped. En la literatura especializada se sugiere el tratamiento establecido para la infección por VIH combinado con miltefosine y anfotericina B liposomal para la leishmaniasis. ",23693114,Leishmaniasis visceral en un paciente VIH positivo.
120,,23650833,Sarcoma de Kaposi perianal. Presentación de un caso y revisión de la literatura.
121,,22884128,"Fiebre, diarrea y adenopatías mesentéricas en un paciente infectado por el virus de la inmunodeficiencia humana tipo 1."
122,,24356264,Múltiples aneurismas cerebrales en una paciente con sida.
123,,23924536,Ergotismo y HIV.
124,,23529366,Alopecia apolillada como manifestación de sífilis secundaria.
125,,24650656,Enfermedad de Chagas cerebral en SIDA.
126,,22981069,Linfogranuloma venéreo: utilidad diagnóstica de la «reacción en cadena de la polimerasa» para Chlamydia trachomatis.
127,,23979549,"Sífilis terciaria diagnosticada en un Servicio de Psiquiatría en Buenos Aires, siglo XXI."
128,,22766061,Linfogranuloma venéreo.
129,,23763226,Infarto cerebral en una adolescente con sida: reporte de caso.
130,,22498349,Sífilis secundaria con afectación pulmonar.
131,,22484104,Osteomielitis asociada a una bacteriemia por Staphylococcus aureus con susceptibilidad reducida a vancomicina tratada con daptomicina.
132,,22425146,Aspectos básicos en la práctica actual de la medicina clínica en el trópico (II). Enfermedades bacterianas y virales. Malnutrición.
133,,22503112,La aspergilosis cerebral en un paciente con infección por el virus de la inmunodeficiencia humana.
134,,23096480,Bacteriemia por Kocuria rosea en un paciente con SIDA.
135,,22221774,Linfoma plasmablástico de localización testicular como primera manifestación de infección por el VIH.
136,,22341750,Linfadenitis gonocócica en un paciente infectado por el virus de la inmunodeficiencia humana.
137,,22244993,Infiltrados pulmonares micronodulillares bilaterales en paciente con VIH avanzado.
138,,22197013,"Varón con infección VIH, fiebre y nódulos pulmonares bilaterales tras tratamiento antirretroviral de alta eficacia."
139,,22391426,Neurosífilis tras tratamiento de hepatitis sifilítica en un paciente inmunocompetente.
140,,22265873,Carga viral indetectable tras la adición de raltegravir al tratamiento de una adolescente con virus de la inmunodeficiencia humana embarazada de 36 semanas y en fracaso virológico.
141,,22137995,Necrosis avascular de cadera en paciente con infección por el virus de la inmunodeficiencia humana.
142,,22036464,Tratamiento de la psoriasis con fármacos anti-TNF-α en pacientes con infección por el virus de la inmunodeficiencia humana.
143,,21885024,Leishmaniasis visceral insospechada infiltrando un carcinoma epidermoide.
144,,21377234,Tuberculosis esplénica en paciente con VIH.
145,,22689039,Tratamiento conjunto con mirtazapina y terapia antiretroviral para la leucoencefalopatía multifocal progresiva asociada a infección por VIH-1: presentación de un caso clínico y revisión de la literatura.
146,,22119067,Leucoencefalopatía en paciente infectado por el virus de la inmunodeficiencia humana tipo 1 (VIH-1) y cuadro de emergencia hipertensiva.
147,,22079231,Lesiones cutáneas y fiebre en un paciente infectado por el VIH.
148,,22100777,Úlcera genital aguda no relacionada con enfermedad de transmisión sexual.
149,,22024011,Desensibilización a enfuvirtida: a propósito de un caso fallido.
150,,22195974,Gastritis sifilítica: una etiología a tener en cuenta.
151,,21924712,"Enfermedad de Castleman, VIH y rituximab."
152,,21778124,BCGitis por reconstitución inmunitaria en un niño VIH positivo.
153,,23241290,Infarto esplénico. ¿Ergotismo inducido por ritonavir?
154,,21839993,"Coinfección por VIH y VHC: abacavir y ribavirina, ¿por qué no?"
155,,22079228,Leishmaniasis recidivante en paciente con infección por VIH: un reto terapéutico.
