,abstract,id,title
0,,29978984,Exantema postvacunal en paciente con enfermedad relacionada con IgG4.
1,,28422472,Varicela por virus vacunal en un paciente en tratamiento con metotrexato.
2,,25088058,Control de la tuberculosis en un centro de acogida de menores: una asignatura pendiente.
3,,29793750,Fracaso de los programas de cribado: cáncer de intervalo.
4,,29912260,Parotiditis en Chile: caracterización clínica y molecular de dos casos en una población altamente inmunizada.
5,,29422301,Falsa hipoxia en neonato causada por un polimorfismo de la hemoglobina F.
6,,26994815,Infección meningocócica en paciente vacunado y en tratamiento con eculizumab.
7,,27771017,Hiperplasia folicular linfoide subcutánea secundaria a vacunas: descripción de los hallazgos ecográficos y correlación clínico-patológica.
8,"Introducción: la hemoglobina D Punjab (HbD Punjab) es la variante mundial más frecuente de hemoglobina D. En México se tienen reportes de casos aislados. El objetivo es presentar el diagnóstico molecular de dos familias con HbD Punjab y sus características clínicas. Casos clínicos: familia 1: neonato cuya madre era portadora de HbS. El padre y la hermana tenían variante natural para las mutaciones evaluadas, madre, hermano y caso índice heterocigotos para HbD Punjab. Familia 2: neonato con tamiz neonatal positivo para la detección de hemoglobinas anormales. Madre y caso índice fueron heterocigotos para HbD Punjab, homocigotos para HFE H63, y heterocigotos para síndrome de Gilbert UGT1A1*28. Padre, heterocigoto para HFE H63D, y hermana homocigoto para dicha mutación. El estudio de las dos familias para HbD Punjab, HbS, beta-talasemia, HFE y síndrome de Gilbert se hizo mediante PCR en tiempo real. Conclusión: la identificación molecular de la HbD Punjab es una propuesta metodológica accesible y permite diferenciar adecuadamente a los portadores. A través de esta metodología se identificaron dos casos adicionales en nuestro país, uno de ellos identificado inicialmente como HbS. ",27819792,Identificación molecular de la hemoglobina D Punjab en dos familias.
9,,26077278,Falso negativo en el primer cribado neonatal de hipotiroidismo congénito en recién nacido gemelo.
10,,26021573,Deficiencia parcial de 3β-hidroxiesteroide deshidrogenasa tipo 2: diagnóstico de una nueva mutación tras cribado neonatal positivo de deficiencia de 21-hidroxilasa.
11,,24951303,Hepatitis aguda A en paciente previamente vacunada.
12,,24631101,Paresia unilateral del VI par craneal posvacunal. A propósito de un caso.
13,,12772658,"Creando música, creando conciencia. Gilberto Santiago lo dice cantando."
14,,23746463,Tratamiento precoz con sistema de recirculación con adsorbentes moleculares (MARS) en dos intoxicaciones graves por setas.
15,"Objetivos: El objetivo general es la disminución de la morbilidad y mortalidad prematuras asociadas al síndrome metabólico (SM). Métodos: Se realiza un recuento de ingestas de 24h para 3 días y se realiza una historia clínica y dietética. Se realiza un seguimiento de 19 consultas para seguir la evolución. Resultados: Tras la pérdida de peso, la medición de glucemia capilar fue de 59 mg/dl retirándole el tratamiento con metformina y al cabo de 7 días sin tratamiento con metformina fue de 64 mg/dl. Conclusiones: La intervención en educación nutricional y del estilo de vida contribuyó a la disminución de casi un 10% del peso corporal, el paciente pasó de estar en el intervalo de IMC correspondiente a obesidad al de sobrepeso además mejoró la resistencia periférica a la insulina y en consecuencia ocasionó la retirada por parte del médico de Atención Primaria de la metformina pautada. ",25726246,Mejora de los parámetros clínicos en un paciente con síndrome metabólico mediante intervención en educación nutricional y mejora del estilo de vida.
16,,24645247,Tratamiento de la hidatidosis hepatopulmonar con cirugía mínimamente invasiva en nuestro hospital. A propósito de 4 casos.
17,"La restricción calórica de 30 a 60% de la ingestión calórica ad libitum, equilibrada y sin llegar a la malnutrición, es la estrategia no genética que ha logrado extender el promedio y el periodo máximo de vida de diversos organismos, desde microorganismos unicelulares como la levadura Saccharomyces cerevisiae, hasta primates Rhesus. Modelos genéticos y farmacológicos han mostrado que esta estrategia protege de enfermedades cardiovasculares, neurodegeneración y cáncer. Los estudios efectuados en primates sugieren que la restricción calórica retrasa la aparición de enfermedades asociadas con el envejecimiento, y en humanos implica efectos fisiológicos, bioquímicos y metabólicos que disminuyen los factores de riesgo de enfermedad cardiovascular y diabetes. Aunque en la actualidad se desconocen los mecanismos que generan los efectos positivos, a nivel celular se ha descrito disminución del estrés oxidativo, e incremento de la biogénesis mitocondrial. ",25125067,Restricción calórica: efectos metabólicos positivos e impacto celular.
18,,23245535,Sarampión del adulto en el siglo XXI.
19,,23207431,Estudio de contactos según círculos concéntricos en un caso de tuberculosis laríngea.
20,,24895723,Enfermedad de zuska. Diagnóstico en atención primaria.
21,,22552559,"Trasplante hepático en cirrosis por virus B: profilaxis con gammaglobulina antiHBs en dosis a ""demanda""."
22,,22040645,Eficacia de bevacizumab tópico en queratopatía lipoidea bilateral primaria.
23,,21507532,Enfermedad meningocócica invasiva por Neisseria meningitidis del serogrupo Y.
24,,21608288,Consideraciones anestésicas en el síndrome de Miller Fisher.
25,,21129708,Prevalencia de la mutación A1555G del gen MTRNR1 en pacientes con hipoacusia postlocutiva sin antecedentes familiares de sordera.
26,,19766262,Utilidad del análisis molecular en el diagnóstico diferencial del déficit congénito de 21-hidroxilasa detectado en el cribado neonatal.
27,,20451934,Alopecia universal en un adulto tras la vacunación de rutina con toxoide tetánico.
28,,29150214,Enfermedad de Best multifocal: la importancia de los test genéticos.
29,,28705390,Déficit de alfa-1-antitripsina asociado a alelos nulos.
30,,29056270,Insuficiencia suprarrenal debida a adrenoleucodistrofia ligada al cromosoma X diagnosticada en la edad adulta.
31,,27823796,Relevancia de las nuevas pruebas genéticas en el diagnóstico de la talla baja con dismorfias.
32,,27396926,Osificación pulmonar dendriforme en un caso subclínico de fibrosis pulmonar familiar.
33,,20388462,Encefalomielitis aguda diseminada con lesiones tumefactas tras vacunación contra el virus del papiloma humano.
34,,20098463,"Tratamiento de inducción combinando inmunoglobulinas, plasmaféresis y rituximab en pacientes hipersensibilizados que reciben trasplante renal de cadáver."
35,,27209158,Gestión y cuidados de Enfermería al paciente con síndrome de Lynch: caso clínico.
36,,26776484,Expansión del triplete citosina-guanina-guanina: 3 casos de síndrome OMIM en una misma familia.
37,,26683077,Neuropatía óptica de Leber: utilidad de la secuenciación masiva en el estudio de mutaciones mitocondriales en aparente homoplasmia.
38,,19409297,¿Se debe hacer cribado de enfermedad celíaca en la hepatitis crónica por el virus C?
39,,19378838,El papel del médico de primer contacto en la detección y tratamiento tempranos de la enfermedad renal crónica: retos y oportunidades.
40,,26223399,Manifestaciones dermatológicas de fibrosis quística en un lactante: acrodermatitis enteropática símil y pelo gris.
41,,18769812,Sirolimus en trasplante de órgano sólido pediátrico: Experiencia en 5 casos.
42,,24296335,Disección bilateral de carótida tras traumatismo craneocervical de baja energía con excelente respuesta tras tratamiento endovascular precoz.
43,,18401993,Manejo anestésico en una paciente previamente diagnosticada de síndrome de takotsubo.
44,,24269400,"Tratamiento precoz de vasculitis idiopática, aneurismas y retinitis (IRVAN). A propósito de un caso."
45,,23746468,Detección mediante multiplex ligation-dependent probe amplification de un caso de atrofia muscular espinal tipo I identificada en paciente de tres meses y extensa detección de portadores sanos en la familia.
46,,18026607,"Búsqueda Activa de Lepra y de Otras Enfermedades de la Piel en Escolares de Agua de Dios, Colombia."
47,,28366615,Hepatitis aguda fulminante por virus B durante el tratamiento del virus de la hepatitis C con antivirales de acción directa en paciente infectado con VIH.
48,,17192216,Técnica de Serra-Dória. Un buen recurso para el tratamiento de la acalasia esofágica recidivada.
49,,17166065,Tratamiento efectivo con un ungüento de glicina y prolina en un caso de úlceras recurrentes por déficit de prolidasa.
50,,16933172,Neuritis óptica tras vacunación de meningitis.
51,,26585815,Endoftalmitis tras tratamiento intravítreo con ranibizumab.
52,,21900060,Medicina predictiva potencialmente maleficente.
53,,27262573,Mieloradiculitis por reactivación del virus Epstein-Barr en paciente con Linfoma de Hodking.
54,,26620602,Enfermedad recurrente por Clostridium difficile ribotipo 027.
55,,21715058,"Haba tonka, gin tonic, Sintrom y cocina creativa: a des-propósito de un caso."
56,,26228257,Infección cutánea por Staphylococcus aureus resistente a meticilina de origen comunitario con transmisión intrafamiliar.
57,,15926140,Ataxia cerebelosa aguda en la varicela. Descripción de un caso con revisión de mecanismos fisiopatológicos.
58,,15511361,Síndrome de Guillain-Barré postinmunización con vacunas antihepatitis A y antifoidea.
59,,15467991,Trombosis venosa cerebral asociada a tiroiditis subaguda de De Quervain en una paciente con la mutación G20210A del gen de la protrombina.
60,,15483688,Tratamiento endoscopico con argon plasma en sangrado refractario post esfinterotomia: reporte de dos casos.
61,,24022027,Neumonía por Legionella pneumophila asociada al uso de un humidificador doméstico en una niña inmunocompetente.
62,,19552150,Plan de cuidados de la persona portadora de urostomía tipo Bricker.
63,,12872559,Osteomielitis esternal y escrofuloderma por vacuna BCG.
64,,12724089,Paro cardiorrespiratorio relacionado con examen oftalmológico en prematuros.
65,,12652417,Panencefalitis esclerosante subaguda: forma fulminante.
66,,12022053,Brote grave en paciente con encefalitis aguda diseminada recurrente por vacuna contra LA hepatitis B: A favor o en contra de la Vacunación?
67,,11820974,Comparación de tres técnicas ELISA para evaluar la seroprevalencia de IgG frente a Bordetella pertussis en niños vacunados con tres dosis de DTPe.
68,,12085427,Hematuria macroscópica tras inmunización con toxoide tetánico en un paciente con nefropatía IgA.
69,,16566199,Hemangioma congénito del canto interno orbitario. importancia de la exploración O.R.L. y opciones de tratamiento.
70,,11780162,Etica y demencia en la práctica médica.
71,,15225475,Cistinosis: diagnóstico mediante la determinación del contenido de cistina intraleucocitaria por cromatografía líquida de alta resolución.
72,,10702951,Identificación de dos familias con cáncer de colon hereditario no polipósico (CCHNP) y criterios de Amsterdam. Relevancia del árbol genealógico y las medidas de seguimiento.
73,,29195721,Rotura parcial de Port-a-Cath
74,,10650573,Análisis de un caso de toxoplasmosis congénita grave.
75,,29099381,Adenoma metanefrico: presentación de 2 casos y revisión de la literatura.
76,,10390753,Encefalopatía aguda autolimitada en relación con el componente antisarampionoso de la vacuna triple vírica.
77,,27293197,Utilidad de la espectrometría de masas MALDI-TOF en infecciones por microorganismos infrecuentes como Ochrobactrum intermedium.
78,,26394543,Malaria por Plasmodium falciparum en residente en España sin antecedente de viaje reciente a zonas endémicas.
79,,10363243,Estudio genético de una nueva familia con la enfermedad de Von Hippel-Lindau tipo IIB.
80,,10089783,Un caso de citolisis intensa tras la administración de vacuna antihepatitis B.
81,,26458523,Fibrilación auricular en paciente de 22 meses durante palatoplastia.
82,,25851912,Vacunación en el paciente con linfoma no hodgkiniano en tratamiento con rituximab u otros fármacos inmunodepresores.
83,,25703207,Niño con lesiones genitales al volver de Ghana.
84,"Existen numerosos reportes de pacientes con artritis reumatoidea (AR) que quedaron embarazadas mientras se encontraban en tratamiento con etanercept. Si bien se encuentra formalmente contraindicado durante embarazo y lactancia, su suspensión en casos de mujeres con AR severa ya no se aconseja debido a que no se ha reportado un aumento de malformaciones congénitas ni de complicaciones perinatales. Existen pocos datos acerca del éxito o fracaso de embarazos logrados por fertilización asistida en pacientes con AR en tratamiento con etanercept. Se describen dos casos clínicos de pacientes con AR severa en tratamiento con etanercept que realizaron técnicas de fertilización in vitro. Tras 4 intentos fallidos, ambas pacientes cursaron embarazos sin complicaciones obstétricas ni perinatales y no se registraron malformaciones congénitas ni complicaciones infectológicas en los recién nacidos. El perfil riesgo-beneficio de etanercept en pacientes con AR severa ha ido cambiando con la farmacovigilancia poscomercialización. Si existe indicación clínica, debe evaluarse el beneficio de no suspenderlo en el curso de tratamientos de fertilización asistida y embarazo. ",30882344,Embarazos a término por fertilización asistida en dos pacientes con artritis reumatoidea severa en tratamiento con etanercept.
85,,27650538,Infarto agudo de miocardio asociado con ictus subagudo bilateral cardioembólico en el territorio de la arteria cerebral anterior: la cara oculta de una fibrilación auricular de novo.
86,,28081976,Angiolipomas espinales epidurales: presentación de 7 casos y revisión de la literatura.
87,"Introducción: la enfermedad celiaca es una enfermedad autoinmune con síntomas que involucran a múltiples órganos. Las formas de presentación varían de modo notable lo que dificulta su diagnóstico. El objetivo es presentar un caso atípico de enfermedad celiaca. estudio descriptivo, retrospectivo, de corte transversal de un caso de mujer adulta que se presentó con tetania investigando el caso se llegó al diagnóstico de tetania secundaria a un síndrome de malabsorción intestinal debida a enfermedad celiaca, confirmada por histología. la enfermedad celiaca puede presentarse atípicamente como una tetania. ",30882343,Tetania como forma de presentación de enfermedad celiaca en el adulto.
88,,24071639,Fungemia por Trichosporon asahii en un paciente con neoplasia hematológica.
89,"La estrongiloidiasis es una afección desatendida causada por el parásito Strongyloides stercoralis. En los individuos inmunosuprimidos, fundamentalmente en los que tienen depresión de la inmunidad celular, puede desarrollarse el síndrome de hiperinfección por Strongyloides. La coinfección con virus linfotrópico de células T humanas (HTLV) es un factor de riesgo para el desarrollo de formas graves de estrongiloidiasis. Presentamos el caso de un hombre de 50 años con hiperinfección por Strongyloides y coinfección con HTLV. Se demoró el diagnóstico debido a su epidemiología inusual y a la sospecha inicial de enfermedad inflamatoria intestinal. El diagnóstico se confirmó mediante la identificación del parásito en muestras de lavado bronquio-alveolar y biopsias de mucosa duodenal y colónica. Se utilizó ivermectina subcutánea como tratamiento antihelmíntico con adecuada respuesta terapéutica. ",31048281,Hiperinfección por Strongyloides en paciente de la Patagonia con co-infección por HTLV-1.
90,"La arteriopatía por marihuana debe ser considerada en pacientes jóvenes con arteriopatía periférica sin factores de riesgo para ateroesclerosis. Se ha descrito por primera vez en 1960 y existen más de 100 casos en la literatura. Si bien se tiende a considerar como una entidad independiente de la tromboangeítis obliterante o enfermedad de Leo Buerger, debido a los hallazgos la consideramos dentro del espectro de esta última. Presentamos dos casos de pacientes jóvenes con enfermedad vascular periférica asociada al consumo de marihuana, luego de excluir otras enfermedades. El tratamiento es el cese del consumo. Es indispensable valorar el uso de drogas en pacientes jóvenes que se presentan con arteriopatía periférica. ",31048280,Arteriopatía periférica asociada a marihuana.
91,,28342552,Código ictus en paciente portador de dispositivo de asistencia ventricular externa.
92,,27461184,Amiotrofia y fasciculaciones como forma de presentación de la enfermedad de Creutzfeldt-Jakob esporádica. A propósito de un caso.
93,"El cáncer medular de tiroides (CMT) es un tumor maligno de las células C parafoliculares secretoras de calcitonina. Se estima que el 25% de los casos de CMT se asocian a variantes patogénicas a nivel de línea germinal en el protooncogen RET (locus 10q11.2), que son las causantes del desarrollo de Carcinoma Medular de Tiroides Familiar (CMTF) o de la Neoplasia Endocrina Múltiple tipo 2 (NEM2); condiciones genéticas con patrón de herencia autosómico dominante. Presentamos el primer reporte de una familia peruana con CMTF y con variante patogénica identificada a nivel de línea germinal en el gen RET, mediante secuenciamiento Sanger. Este manuscrito también muestra una revisión de la literatura de este síndrome hereditario oncológico, donde se resalta su importancia en la prevención primaria y potencial efecto en la salud pública en casos de portadores de variantes patogénicas germinales aparentemente sanos. ",30734711,Cáncer Medular de Tiroides familiar: reporte de un caso y revisión de la literatura.
94,,30724986,Carcinoma epidermoide primario del estómago. Reporte de tres casos.
95,"A pesar de que no existe una terapia estándar establecida para la cistitis eosinofílica (CE), la serie de casos nos guía en el tratamiento de los pacientes. Presentamos nuestra experiencia terapéutica con hidrodistensión y métodos complementarios. Con el fin de establecer un tratamiento estándar en pacientes con CE.MÉTODOS: Revisión retrospectiva de la historia clínica de un paciente con diagnóstico de cistitis eosinofílica. Una mujer de 66 años presentó síndrome uretral femenino hace un año y fue tratada inicialmente como una cistitis crónica. Después de más investigaciones incluyendo una cistoscopia y una biopsia de la vejiga, se le diagnosticó CE. Se evidenció sangrado de la mucosa urotelial y se realizaron cauterización e hidrodistensión. Después del tratamiento quirúrgico, se iniciaron corticosteroides y antibióticos. El tratamiento de mantenimiento se continuó con Vitamina C, Maurita flexuosa y Peumus boldus. La condición del paciente ha mejorado y sigue estando asintomática un año después.CONCLUSIÓN: La eficacia del tratamiento con hidrodistención, corticosteroides y antibióticos mostró resultados positivos a corto y largo plazo en este paciente. La vitamina C, Maurita flexuosa y Peumus boldus mostraron resultados favorables en el tratamiento de mantenimiento de CE. ",30560799,Cistitis eosinofílica tratada con hidrodistensión y métodos complementarios: comunicación de un caso.
96,,29724431,Metástasis digital acral: presentación de 2casos clínicos.
97,,30724987,Trombo a través de foramen oval permeable: embolia paradojal cerebral y factores de alto riesgo de recurrencia. Caso clínico.
98,,30785968,A propósito de un caso de disforia de género.
99,"El síndrome crioglobulinémico es producido por inmunoglobulinas que precipitan reversiblemente a bajas temperaturas, llamadas crioglobulinas. Su producción se asocia a varias causas, como desórdenes linfoproliferativos, infecciones crónicas y trastornos autoinmunitarios. No obstante, en muchos casos la etiología no logra determinarse. Existen tres tipos, siendo las de tipo II y III las que forman parte de las denominadas crioglobulinemias mixtas. Estas últimas producen un cuadro de vasculitis sistémica con manifestaciones clínicas diversas. La púrpura palpable es la más frecuente, acompañada en forma variable por artralgias, neuropatía y afección renal en forma de glomerulonefritis membranoproliferativa de tipo I. Presentamos el caso clínico de un paciente de sexo masculino de 71 años de edad con insuficiencia renal, síndrome nefrítico, hipertensión arterial y lesiones cutáneas purpúricas palpables ambos miembros, tórax y abdomen. Durante la internación se diagnostica crioglobulinemia mixta esencial asociada a vasculitis leucocitoclástica cutánea y glomerulonefritis membranoproliferativa tipo I. Describimos los métodos complementarios utilizados para llegar al diagnóstico, el tratamiento instituido y la evolución clínica del paciente. ",30734709,Crioglobulinemia mixta esencial tipo II: presentación de un caso.
100,,30725049,Edema pulmonar agudo grave secundario a tratamiento de neumotórax espontáneo primario. Caso clínico.
101,"El feocromocitoma constituye una neoplasia productora de catecolaminas que se presenta de forma esporádica o asociada a enfermedades de transmisión hereditaria, como la neoplasia endocrina múltiple. Los síntomas clásicos como la cefalea, sudoración y palpitaciones son atribuidos a la actividad del sistema nervioso simpático y suelen presentarse en forma de paroxismos. La tuberculosis pulmonar es una enfermedad infecciosa que constituye un problema de salud pública en muchos países, cuya incidencia depende de algunos factores incluyendo la inmunosupresión que generan las enfermedades endocrino-tumorales como la antes descrita. Presentamos el caso de un paciente masculino de 38 años que acude a emergencia por presentar un paroxismo de hipertensión arterial y dolor abdominal, como manifestaciones iniciales de un feocromocitoma en el contexto de una neoplasia endocrina múltiple de tipo IIA. El paciente desarrolló de forma concomitante tuberculosis pulmonar; no obstante, se logró tratar ambas entidades consiguiendo una evolución clínica favorable. ",30451214,Feocromocitoma en neoplasia endocrina múltiple IIA asociado a tuberculosis pulmonar presentada como abdomen agudo: reporte de caso y revisión de la literatura.
102,,28662908,Tormenta arrítmica resuelta tras angioplastia y ablación bajo soporte con oxigenación de membrana extracorpórea venoarterial.
103,,30030008,Biomicroscopia confocal en 4 pacientes con distrofia corneal policromática.
104,,29326008,Patología neurológica aguda por enterovirus: revisión de casos clínicos en un hospital andaluz de tercer nivel tras brote epidémico de Cataluña.
105,,28697891,Neumoperitoneo a tensión diferido tras colonoscopia.
106,"La fiebre maculosa de las Montañas Rocosas (FMMR) es una enfermedad transmitida por garrapatas y es fatal si el paciente no recibe tratamiento. La similitud de sus síntomas con otras enfermedades febriles exantemáticas puede retrasar la sospecha diagnóstica, lo cual contribuye a su mortalidad. Presentamos el caso fatal de una paciente con antecedente de hipertensión arterial y sin historial de viajes, que era residente de Sonora, México. Al principio se sospechó la presencia de una infección por virus del dengue, confirmada por prueba de ELISA. Su rápido deterioro, la falla multiorgánica y las características de su exantema orientaron la sospecha de FMMR. Se inició tratamiento con doxiciclina; sin embargo, la paciente falleció al séptimo día de evolución. Se confirmó una coinfección de Rickettssia spp. y virus del dengue. En zonas donde la Rickettssia es endémica, el tratamiento con doxiciclina debería iniciarse ante un paciente con síntomas compatibles, aun cuando se tenga evidencia de la presencia de otros agentes etiológicos. ",30394722,Caso fatal de coinfectada de rickettsiosis y virus del dengue en México
107,"Las candidiasis son infecciones oportunistas producidas por levaduras, cuyo agente etiológico implicado más frecuente C.albicans generando problemas a varios niveles. Mujer de 39 años diagnosticada de Candidiasis intestinal crónica cursando con sintomatología amplia y variada. Tras la valoración se procede a complementar el tratamiento con una alimentación centrada en la eliminación de azúcares simples, levaduras y productos fermentados. Además, se incluyen ácido caprílico, aceite de orégano y L.acidophylus. Existe un aumento de la actividad inmunológica acompañada de la mejora sintomatológica. ",25238848,Intervención dietético-terapéutica en Candidiasis intestinal.
108,,24280064,Bacteriemia espontánea del cirrótico por Campylobacter coli.
109,,30725032,Compromiso neuropático y autonómico en Enfermedad de Fabry: presentación de casos clínicos.
110,,29241627,Trasplante de microbiota fecal en niño con enfermedad inflamatoria intestinal de inicio muy precoz.
