,abstract,id,title
1030,,8728751,Enfermedad de Von Recklinghausen (neurofibromatosis) y embarazo: a propósito de un caso clínico.
1031,,8559987,Leucemia y embarazo. Revisión a propósito de un caso clínico.
1032,,8525037,Tumor trofoblástico del sitio placentario.
1033,,8714065,Fascitis necrotizante postcesárea. Sinergismo bacteriano o infección mixta de tejidos blandos?
1034,,7835740,Herpes gestacional. Presentación de un caso y revisión de la literatura.
1035,,9691757,Hipotiroidismo: causa de galactorrea con normoprolactinemia.
1036,,9666299,Embarazo en pacientes con hemosiderosis pulmonar idiopática. Presentación de un caso.
1037,,19994770,Tratamiento conservador de la fertilidad en una paciente con diagnóstico de endometriosis pélvica profunda.
1038,,9646669,Ceguera cortical como síntoma de presentación de una preeclampsia.
1039,,7995543,Embarazo post-desarterialización parcial del útero. Informe de un caso.
1040,,9608076,Trombosis de la vena cava inferior y distress respiratorio del adulto.
1041,,9629804,Manifestaciones de la leucemia congénita como hidrops fetal no inmunológico.
1042,,7959159,Insuficiencia renal aguda asociada al síndrome de HELLP. Presentación de un caso.
1043,,9611876,Infección recidivante por Streptococcus agalactiae.
1044,,9567423,Terapia antirretroviral combinada para la prevención de la transmisión vertical de la infección por el VIH-1.
1045,,9586389,Enfermedad de Crohn y embarazo. Informe de un caso.
1046,,9580467,El control preconcepcional en la gestante diabética.
1047,,19149403,Extracción de quiste gigante de ovario por minilaparotomía: técnica de reloj de arena.
1048,,9528216,"Síndrome antifosfolípidos, embarazo molar e infarto cerebral. Presentacíon de un caso."
1049,,9674212,"Escleroderma lineal, aborto espontáneo y hemiplejía; hemorragia pulmonar, anticuerpos antifosfolipidicos y linfoma angiocéntrico."
1050,,9607223,Metástasis cervical de un coriocarcinoma.
1051,,9542309,Sensación ocular de cuerpo extraño y prurito generalizado en una joven guineana.
1052,,9528215,Tratamiento laparoscópico conservador del embarazo ectópico bilateral. Informe de dos casos y revisión de la literatura.
1053,,18783677,Esplenosis pelviana.
1054,,9477648,Muerte fetal repetida y síndrome de anticuerpos antifosfolípidos. Presentación de un caso.
1055,,8034217,Dermatomiositis y eclampsia. Análisis de un caso y revisión de la literatura.
1056,,8165347,Taquicardia supraventricular fetal tratada con digoxina transplacentaria.
1057,,7659817,Hidrops fetal no immune asociado a talasemia familiar: transfusión intravascular.
1058,,7659799,Síndrome de Marfán y embarazo.
1059,,8349132,Infarto agudo del miocardio y embarazo. Presentación de un caso y revisión de la literatura.
1060,,8516525,Paro cardíaco en neonato de madre tratada con labetalol.
1061,,8209043,Hemorragia digestiva masiva secundaria a úlcera tífica en el embarazo.
1062,,7991875,Síndrome de potter por agenesia renal bilateral y atresia duodenal.
1063,,7991861,Desfibrilación uterina en útero con inercia. A propósito de dos casos.
1064,,1618404,Estenosis aórtica y embarazo: presentación de un caso y revisión fisiopatológica.
1065,,1342735,Investigación de virus herpes simplex e inmunoglobulinas en líquido amniótico en embarazadas con herpes genital y seguimiento por varios años: 3 casos clínicos.
1066,,1342467,Mola invasora con rotura uterina.
1067,,1342455,Manejo médico del embarazo tubario. Experiencia preliminar.
1068,,1797620,Embarazo heterotópico. Informe de un caso y revisión de la literatura.
1069,,1937121,Eritema nodoso y embarazo. Informe de un caso.
1070,,2066006,Embarazo abdominal. Urgencia quirúrgica.
1071,,1845200,Ruptura hepática espontanea en hipertensión inducida por el embarazo.
1072,,1845190,Muerte materna por rotura uterina espontánea del embarazo en primigesta.
1073,,1845089,Infarto del miocardio y embarazo.
1074,,2485369,Manejo obstétrico y perinatal en miastenia gravis.
1075,,7659816,Listeriosis y embarazo.
1076,,7659804,Eclampsia: experiencia de 8 años.
1077,,7659800,Rotura uterina espontánea asociada a placenta increta en primigesta.
1078,,7569169,Regresión espontánea de un higroma quístico.
1079,,7569157,Corioangioma placentario complicado: causa infrecuente de parto prematuro.
1080,,8288134,Necrosis hemorrágica hepatocelular y hematoma hepático subcapsular en 20 casos de enfermedad hipertensiva del tercer trimestre del embarazo (toxemia).
1081,,8272639,Embarazo e hipertensión portal.
1082,,8209040,Hígado graso agudo del embarazo: dos casos clínicos.
1083,,7991874,Coriocarcinoma gestacional en un embarazo tubario.
1084,,7991868,Vólvulos del colon durante el embarazo: 2 casos clínicos.
1085,,1342462,Pérdida recurrente del embarazo en pacientes con anticuerpos anticardiolipinas (AACL).
1086,,1845199,Síndrome del primer arco: diagnóstico ultrasonográfico.
1087,,1845181,Tratamiento quirúrgico por laparoscopia del embarazo tubario.
1088,,1669556,Hidrops fetal no immune secundario a taquicardia fetal: diagnóstico y tratamiento intrauterino.
1089,,1669549,Cerclaje transabdominal en el tratamiento de la incompetencia cervical.
1090,,2729801,Pseudoquiste hemorrágico suprarrenal congénito y neuroblastoma in situ.
1091,,19213214,Quiste mesentérico. Informe de un caso.
1092,,9445737,Reacción de hipersensibilidad aguda grave a la salazopirina.
1093,,9499311,Embriofetopatía alcohólica. Casuística neonatal propia en los últimos doce años.
1094,,7789855,"Endometriosis cutánea en cicatriz abdominal, posterior a operación cesárea. Informe de un caso y revisión de la literatura."
1095,,9499290,Hidrops fetal por aloinmunización Kell.
1096,,9376420,Diagnóstico molecular prenatal de fibrosis quística. Reporte de tres casos.
1097,,18798405,Adenocarcinoma invasor primario de trompa de falopio concomitante con enfermedad pélvica inflamatoria aguda. Comunicación de un caso y revisión de la bibliografía.
1098,,18077864,Malla de polipropileno multifilamento con autofijación de silicona exteriorizada a vagina.
1099,,18259657,Utilidad del estudio molecular de CYP21A2 en el manejo prenatal de hiperplasia suprarrenal congénita: detección de dos nuevas mutaciones en Chile.
1100,"La reciente introducción de las pruebas prenatales no invasivas (NIPT, por sus siglas en inglés) basadas en el ADN libre ofrece un método más preciso que los métodos tradicionales de detección en el suero materno para identificar aneuploidías fetales. La eficacia de las pruebas NIPT para detectar los síndromes de Down, Edwards y Patau se ha demostrado en ensayos clínicos. Sin embargo, los enfoques de las pruebas NIPT que aprovechan la información sobre el polimorfismo de un solo nucleótido (SNP, por sus siglas en inglés) tienen el potencial de identificar triploidías, síndromes de microdeleción cromosómica y otras variantes genéticas no habituales. Para destacar este enfoque de las pruebas NIPT, se presenta un caso poco frecuente de monosomía del cromosoma X debido a mosaicismo confinado a la placenta, del que había una sospecha prenatal por el resultado de una prueba prenatal no invasiva basada en el polimorfismo de un solo nucleótido. Los resultados de las pruebas invasivas (amniocentesis) mostraron una pequeña proporción de mosaicismo del cromosoma X (45, X[5]/46, XX[95]). Después del nacimiento, el cariotipo de la niña no reveló anomalías (46 XX), lo que confirmó que el mosaicismo se limitaba a la placenta. Estos resultados ponen de manifiesto la necesidad del consentimiento informado de la paciente, y del minucioso asesoramiento anterior y posterior a las pruebas, para garantizar que comprenda las limitaciones y las ventajas de dichas pruebas, y las repercusiones de los resultados. ",27606664,Recién nacida normal con sospecha prenatal de monosomía del cromosoma X debido a mosaicismo confinado a la placenta.
1101,,9381266,Síndrome de Diamond-Blackfan: gestación y herencia.
1102,,9297431,Hemocromatosis perinatal y secuencia deformativa de oligoamnios: asociación causal o casual?
1103,,9289327,Neumonía eosinófila aguda en gestante.
1104,,9273337,Manejo de la púrpura trombocotopénica autoinmune refractaria durante el embarazo. Revisión de la literatura e informe de tres casos.
1105,,9289536,Tratamiento con adenosina de la taquicardia paroxistica supraventricular durante el embarazo.
1106,,9376413,Mastitis por Nocardia brasiliensis en una paciente immunocompetente.
1107,,17910877,Holoprosencefalia. Papel de la resonancia magnética en el diagnóstico prenatal.
1108,,18293679,Quiste de ovario de 38 kg. Reporte de un caso y revisión de la bibliografía.
1109,,9377116,Reacción anafiláctica por aplicación de pruebas cutáneas: comunicación de un caso.
1110,,9303875,Hígado graso agudo del embarazo complicado con pancreatitis.
1111,,9281004,Hígado graso del embarazo. A propósito de un caso.
1112,,18293669,Síndrome de Pallister-Killian. Comunicación de un caso.
1113,,9312290,Meningitis aséptica por Coxiella burnetii.
1114,,9312288,Bacteriemia por Campylobacter fetus secundaria a biopsia rectal.
1115,,17553408,Papilomas intraductales de mama en paciente afectada de síndrome de Costello.
1116,,9190444,Linfoma de Burkitt de inicio en la glándula tiroides. Presentación de un caso.
1117,,7835736,Miomectomía histeroscópica. Manejo médico quirúrgico. Presentación de un caso.
1118,,9229731,Control angiográfico de la hemorragia obstétrica posparto. Caso clínico y revisión de la bibliografía.
1119,,9190354,Apéndice caudal en los defectos secuenciales de ruptura de amnios. Presentación de un caso.
1120,,9162790,Remisión espontánea de la trombocitemia esencial durante la gestación.
1121,,9147744,Trombosis del seno lateral durante el primer trimestre del embarazo.
1122,,9148348,Esclerosis múltiple y analgesia epidural obstétrica.
1123,,9082895,Síndrome de varicela fetal secundario a varicela materna en la 26 semana de gestación.
1124,,9412132,Hemorragia digestiva baja aguda en coriocarcinoma testicular.
1125,,17628919,Marcador tumoral Ca 19.9 aumentado sin evidencia de malignidad.
1126,,8181777,Diagnóstico por ultrasonografía de labio y paladar hendido. Diagnóstico diferencial. Presentación de casos.
1127,,1032844,Deficit de factor V en obstetrícia y ginecología.
1128,,3155246,Enfermedad de von Willebrand en obstetricia. Experiencia clínica.
1129,,9148424,Remisión citogenética completa de la leucemia mieloide crónica con interferón alfa-2b a bajas dosis y busulfán a altas dosis mensuales.
1130,,9019437,Cistitis hemorrágica en el embarazo: informe de un caso y análisis del tratamiento.
1131,,9082499,Disfunción ventricular severa reversible en una paciente con eclampsia y síndrome HELLP.
1132,,9004784,Colestasis gravídica intrahepática. Implicaciones maternofetales.
1133,,9004749,Monitorización de la presión intracraneal y eclampsia.
1134,,9004789,Colestasis intrahepática del embarazo. Una enfermedad benigna?
1135,,17133966,Angiofibroma celular de la vulva. Comunicación de un caso y revisión de la bibliografía.
1136,,9019196,SDRA recurrente tras neumonía varicelosa complicado con candidiasis diseminada en mujer gestante.
1137,,9036483,Circulación extracorpórea durante el embarazo: a propósito de un caso. Actualización y revisión de la literatura.
1138,,8974956,Ruptura uterina y placenta percreta en el segundo trimestre. Presentación de un caso.
1139,,8974950,Sarampión y embarazo. Evolución y manejo.
1140,,9020013,Incidentaloma renal y embarazo.
1141,,9019979,Síndrome alcohólico fetal asociado a trisomía X.
1142,,20188641,Síndrome de Frey secundario a traumatismo obstétrico. Presentación de 2 casos.
1143,,16972526,Leiomioma vaginal.
1144,,8239216,Anestesia intradural en neonato con cardiopatía congénita. Alternativa a la anestesia general.
1145,,8327742,Endometriosis en cicatriz de episiotomía: presentación de un caso y revisión de la literatura.
1146,,1410742,Método alternativo ante un fracaso de intubación en anestesia obstétrica urgente.
1147,,2101379,"Pseudobstrucción del colon (síndrome de Ogilvie), asociado a operación cesárea. Informe de dos casos y revisión de la literatura."
1148,,3238131,Edema pulmonar en el curso de una cesárea.
1149,,3826949,Hematoma epidural en el recién nacido.
1150,,6687335,Uretroplastia. Informe de dos casos.
1151,,6681214,Endometriosis extragenital. Caso clínico.
1152,,6680786,Perforación de ciego poscesarea (a propósito de 2 casos).
1153,,7342887,Fístulas vesicouterinas.
1154,,426393,Ruptura neonatal de hígado y bazo.
1155,,1261849,Endometríosis post-episiotomia
1156,,71751,Pruebas de maduración pulmonar fetal persistentemente negativas por anencefalia. (Caso clínico).
1157,,5163420,Parto gemelar atípico.
1158,,5997538,Inducción del parto por narco-hipnosis. Caso clínico.
1159,,8239215,Mesotelioma quístico benigno congénito.
1160,,1488929,Fístula vesico-uterina: a propósito de dos nuevos casos.
1161,,1842990,Meningitis aséptica pos anestesia espinal. Caso clínico.
1162,,2292431,"Pseudobstrucción de colon (síndrome de Ogilvie), asociado a operación cesárea. Informe del dos casos y revisión de la literatura."
1163,,2490425,Dispositivo intrauterino intramioma.
1164,,3452998,Fístula utero-vesical: a propósito de un caso.
1165,,3618323,Síndrome de Yousseff. Presentación de 3 casos.
1166,,3432789,Shock tóxico. Una toxemia por Staphylococcus aureus.
1167,,4081236,La anestesia intradural en la intervención de cesarea. A propósito de un caso.
1168,,7352969,Parálisis diafragmática y de Erb-Duchenne: un traumatismo obstétrico infrecuente.
1169,,676826,Fístulas vesicouterinas.
1170,,1027054,Indución al parto con PGF 2alfa
1171,,4768887,Consideraciones médicas y deontológicas en torno a la cesárea iterativa. A propósito de una séptima cesárea.
1172,,5854659,Dos casos de difteria en enfermas cesareadas.
1173,,8967661,Síndrome de varicela fetal: a propósito de un caso.
1174,,8966354,Anestesia en el síndrome de Kearns-Sayre (miopatía mitocondrial).
1175,,8991450,Neumonía por sarampión en embarazada portadora de anticuerpos para el HIV. Respuesta al tratamiento con inmunoglobulinas.
1176,,8804189,Tumor testicular primario oculto o tumor testicular fundido. A propósito de un caso.
1177,,8984957,Comisurotomía mitral percutánea con balón de Inoue durante el embarazo.
1178,,8849109,Peritonitis meconial intrautero asintomática: a propósito de un caso.
1179,,19994627,Analgesia obstétrica subaracnoidea continua. Una alternativa eficaz a la anestesia epidural.
1180,,8928980,Pseudohipoaldosteronismo en un recién nacido pretérmino.
1181,,8924658,"Síndrome HELLP en el Hospital Nacional ""Daniel A. Carrión"": reporte de 2 casos."
1182,,8753930,La inversión uterina: una complicación obstétrica grave.
1183,,8753931,Ecografía transesofágica en el manejo intraoperatorio de una paciente embarazada con sospecha de trombosis de la vena cava.
1184,,8696651,Carcinoma pulmonar de células grandes productor de hormona gonadotrofina coriónica: dificultad en el diagnóstico diferencial con un coriocarcinoma.
1185,,16583838,Mioma uterino gigante.
1186,,8796945,Possible asociación entre la administración materna de metamizol e hipertensión pulmonar persistente en el recién nacido.
1187,,8815470,Hiperparatiroidismo primario y gestación. A propósito de un caso.
1188,,8698247,Deficiencia hereditaria de antitrombina III. Presentación de un caso obstétrico y revisión de la literatura.
1189,,8991660,Síndrome de HELLP: a propósito de un caso y revisión de la literatura.
1190,,8679849,Taquicardia supraventricular durante el embarazo: incidencia y manejo terapéutico.
1191,,16309040,Trombosis de la arteria umbilical. Comunicación de un caso y revisión de la bibliografía.
1192,,8616687,Pancreatitis aguda hiperlipémica y embarazo.
1193,,8851833,Anestesia en tres casos de síndrome de Marfan.
1194,,8815484,Encefalitis herpética neonatal. Conceptos actuales a propósito de un caso.
1195,,8714192,Bacteriemia por Campylobacter jejuni asociada a aborto espontáneo.
1196,,8679821,"Embarazo, cáncer de mama e infartación tumoral."
1197,,8523957,Diagnóstico de la enfermedad de Cushing en la gestación.
1198,,15847149,Sarcoma uterino. Reporte de un caso.
1199,,8560039,Primigesta con insuficiencia hepática de rápida evolución en el tercer trimestre del embarazo.
1200,,8537037,Embarazo abdominal recurrente. Presentación de un caso.
1201,,8733320,Oxigenación extracorpórea de membrana en sindrome de distrés respiratorio del adulto. Experiencia en 2 pacientes.
1202,,8668826,Hidropesia fetal no inmune.
1203,,7557537,Ruptura hepática espontánea en el embarazo. Presentación de un caso. Revisión de la literatura.
1204,,7672650,"Coriocarcinoma puro, primario, del ovario. Presentación de un caso."
1205,,7672653,Embarazo gemelar complicado con pérdida de un producto in utero. Presentación de un caso y revisión de la literatura.
1206,,7647209,Tiroiditis silente y tiroiditis posparto.
1207,,7658746,Síndrome de Budd-Chiari durante el puerperio en una paciente con enfermedad de Bechçet.
1208,,15318756,Actinomicosis tuboovárica. Comunicación de un caso.
1209,,7642149,Leiomioma de la uretra durante el embarazo. Informe de un caso y revisión de la literatura.
1210,,7627830,Valor diagnóstico del dolor abdominal alto en el síndrome HELLP.
1211,,7548651,Neumotórax espontáneo en la respuesta a la quimioterapia de un tumor germinal metastásico.
1212,,7789847,Brucelosis durante el embarazo. Evolución y resultados perinatales.
1213,,8815662,Cistitis polipoidea en diabética embarazada.
1214,,7784690,Anuria en el tercer trimestre del embarazo en una paciente sometida a trasplante renal.
1215,,7784688,Placenta previa accreta e histerectomía obstétrica.
1216,,7784691,Manejo anestésico del embarazo abdominal y las complicaciones postoperatorias.
1217,,7784689,Síndrome HELLP y sus complicaciones durante la preeclampsia-eclampsia.
1218,,7784687,Manejo anestésico del parto en una gestante con infarto de miocardio.
1219,,7620066,Embarazo ectópico ovárico.
1220,,7621294,Influencia del embarazo en el curso de la hepatitis crónica C.
1221,,7734694,Tiroiditis posparto. Detección de dos casos en atención primaria.
1222,,19928404,Síndrome de Ehlers-Danlos tipo III y tipo IV.
1223,,8728750,Hepatitis aguda fulminante no A no B en el embarazo: un caso clínico de probable hepatitis esporádica producida por virus E.
1224,,8602451,Un caso de leucemia aguda y embarazo.
1225,,7777715,Neoplasias quísticas del páncreas: informe de tres casos de difícil diagnóstico.
1226,,7480907,Hígado graso agudo en el embarazo. Un diagnóstico a considerar.
1227,,7480903,Pseudosarcoma botryoides durante el embarazo.
1228,,7734679,Piomiositis estafilocócica durante el embarazo: una asociación casual?
1229,,7849221,Embarazo e inmunización de la hepatitis B.
1230,,12717649,Convulsiones y hemorragia subaracnoidea tras exposición a paroxetina in utero.
1231,,7821835,"Fiebre tifoidea durante la gestación. Curso clínico, tratamiento y repercusión perinatal."
1232,,7995550,Embarazo séptico cervical. Informe de un caso.
1233,,12666413,"Perforación uterina y de rectosigmoides por dispositivo intrauterino, presentación de un caso con revisión de la literatura."
1234,,12643222,"Pubertad precoz periférica por tumor ovárico de las células de la granulosa juvenil, con manifestaciones iso y heterosexuales en una niña de 6 años."
1235,,7973033,Taquicardia incesante fetal coincidiendo con taquicardia supraventricular de la gestante.
1236,,7986608,Influye el embarazo en la actividad de la hepatitis crónica C?
1237,,12661336,Endometriosis de pared abdominal. Revisión de la literatura. Informe de un caso.
1238,,7959147,Evolución de los embarazos complicados con hepatitis viral.
1239,,16540009,Recurrencia ovárica y paraaórtica de un carcinoma de cuello uterino detectada mediante PET/TC.
1240,,8063183,Embarazo gemelar mediante la técnica de donación de ovocitos en una mujer con síndrome de Turner.
1241,,7732232,Insuficiencia renal y respiratoria en una embarazada con esclerosis sistémica progresiva. Caso anatomo-clínico.
1242,,8063182,Complicaciones y tratamiento del cólera durante el embarazo.
1243,,7942236,Angiomiolipoma renal de rápido crecimiento asociado a embarazo.
1244,,7840720,Infarto agudo del miocardio en el puerperio. Reporte de un caso y revisión de la literatura.
1245,,8051977,Embarazo y eritema nudoso recidivante.
1246,,8016445,Infarto agudo de miocardio posparto: papel de la metilergometrina en su etiopatogenia.
1247,,8023001,Absceso cerebral en paciente con fístulas arteriovenosas pulmonares.
1248,,8204255,Infarto cerebral por émbolo tumoral como forma de presentación de un coriocarcinoma.
1249,,8168717,Profilaxis antirrábica postexposición en mujeres gestantes.
1250,,8142515,Mastitis aguda por Salmonella sp. durante el embarazo.
1251,,8255118,Edema agudo de pulmón secundario a tratamiento tocolítico en gestante gemelar pretérmino.
1252,,8288135,Trombosis venosa mesentérica (TVM) en el puerperio. Presentación de dos casos.
1253,,8285468,Sepsis por haemophilus influenzae tipo B en el recién nacido.
1254,,8285462,Síndrome de inmunodeficiencia adquirida discordante en gemelos dizigotos.
1255,,8359706,"Perforación de intestino grueso por un dispositivo intrauterino ""medicado"" tipo 7 de cobre."
1256,,8217512,Actitud terapéutica ante un feto con válvulas de uretra posterior.
1257,,8342980,Adenocarcinoma de células renales y hemorragia retroperitoneal masiva durante el embarazo.
1258,,8342978,Coriocarcinoma primario de vejiga urinaria. Aportación de un caso con estudio inmunohistoquímico y ultraestructural.
1259,,8315966,Embarazo a término en gestante diagnosticada de leucemia aguda tratada con un protocolo que incluye VP-16.
1260,,8497153,Manifestaciones clínicas y bioquímicas en 3 casos de disfunción tiroidea posparto.
1261,,8471706,Osteítis condensans ilii.
1262,,8499528,Mobiluncus en absceso de mama.
1263,,8471284,Hipertrofia del tiroides ectópico lingual durante el embarazo. Caso clínico.
1264,,8063080,Enfermedades transmitidas sexualmente (ETS) en un grupo de adolescentes que asisten a un Instituto de Atención Perinatal.
1265,,1488544,Mastitis de repetición y síndrome de hiperinmunoglobulina E.
1266,,1456627,Profilaxis con aciclovir en la varicela congénita.
1267,,1472608,Amenorrea-galactorrea: prolactinoma.
1268,,1416542,"Lupus Eritematoso Neonatal: dermatitis, bloqueo A-V y anticuerpos SSA/Ro."
1269,,1416525,Asociación de neurofibromatosis tipo I y méduloblastoma.
1270,,1497236,Hemorragia cerebral intraparenquimatosa y asimetría craneal por traumatismo perinatológico inusual.
1271,,1601314,Embarazo heterotópico con inseminación intrauterina. Presentación de un caso.
1272,,1546209,Comunicación de un caso de galactorrea en paciente tratada con teofilina.
1273,,1342439,Ruptura espontánea del hígado en una embarazada hipertensa.
1274,,1822153,Haemophilus influenzae e infección genital.
1275,,1801077,Hiperparatiroidismo primario durante la gestación.
1276,,1666834,Rotura espontánea de un adenoma hepático asociado a peliosis hepática.
1277,,1745809,Cistoadenoma pancreático durante la gestación.
1278,,1765306,Embarazo en cavidad uterina rudimentaria no comunicada. Presentación de un caso en multípara.
1279,,1844756,Insuficiencia renal aguda por necrosis cortical renal. Dos casos clínicos de pacientes sobrevivientes.
1280,,1844139,Endemia chagásica familiar detectada a consecuencia de un caso de infección congénita.
1281,,1948545,Tres casos de inhibidor del factor VIII adquirido postparto.
1282,,1844297,Insulinoma y embarazo. Caso clinico.
1283,,1879722,Transmisión postnatal del virus de inmunodeficiencia humana (VIH). Historia de breve lactancia al seno. (Presentación de un caso clínico).
1284,,1867489,Tumor de células de Leydig: presentación de tres nuevos casos de evolución benigna.
1285,,1788462,Tiroiditis de Hashimoto: evolución postparto.
1286,,1824160,Efectos del ácido ursodeoxicólico en pacientes con colestasis gravídica.
1287,,2125810,Encefalopatía por interrupción vascular intraútero en un lactante con el antecedente de muerte antenatal de su gemelo monocigoto.
1288,,2261194,Diagnóstico de la enfermedad de Moyamoya por resonancia magnética.
1289,,2236786,Niño afecto de síndrome de Romano-Ward nacido de madre afecta de síndrome de Jervell y Lange-Nielsen.
1290,,2205140,Colelitiasis fetal. Caso clínico y revisión de la literatura.
1291,,2363093,Anemia hemolítica crónica no esferocítica (AHCNE) por déficit de piruvato quinasa (PK) en una familia costarricense portadora de hemoglobinopatía C.
1292,,2152271,Colitis amibiana fulminante y ameboma en un mismo paciente.
1293,,2133155,Artritis gonocóccica durante el embarazo. Consideraciones a propósito de un caso.
1294,,2329873,Sepsis en gestante por probable psitacosis de origen no aviar.
1295,,2329862,Linfoma de Burkitt y embarazo.
1296,,2365172,Hipotiroidismo primario asociado con un síndrome quiasmático que simula prolactinoma.
1297,,2327672,Manifestaciones neurológicas de la infección VIH en el niño.
1298,,2486977,Litopedion en embarazo cervical: comunicación de un caso.
1299,,2486973,Hematoma hepático subcapsular en preclampsia severa postparto. Presentación de un caso.
1300,,2622256,Insuficiencia respiratoria aguda por varicela en una gestante.
1301,,2694873,Cromosoma 17 en anillo y neumopatía recidivante.
1302,,2624509,Mixoma auricular izquierdo con oclusión importante de la válvula mitral.
1303,,2519805,Plasmaferesis en pancreatitis aguda secundaria a hiperlipidemia familiar en una embarazada.
1304,,2486855,Intoxicación con mercurio durante el embarazo. Presentación de un caso y revisión de la literatura.
