,abstract,id,title
675,,10089653,Pancreatitis aguda por anfotericina B en un paciente VIH positivo.
676,,10451569,Síndrome nefrótico agudo asociado a sífilis secundaria.
677,,9972600,Manifestaciones mucocutáneas en la infección aguda por el VIH. Presentación de tres casos.
678,,9930014,Apariencia pseudoneoplásica de la infección citomegálica del tracto digestivo.
679,,9922978,Diabetes mellitus e inhibidores de la proteasa. Una complicación a tener en cuenta.
680,,9859098,Hipertrigliceridemia y diabetes mellitus asociadas al uso de inhibidores de la proteasa en los pacientes con infección por el VIH.
681,,9887631,Gran acumulación atípica de tejido adiposo en un paciente con infección por el virus de inmunodeficiencia humana.
682,,10319673,Absceso pancreático tuberculoso como manifestación inicial del síndrome de inmunodeficiencia adquirida (SIDA).
683,,9844454,Siete casos nuevos de infección por VIH-2 reconocidos en Madrid en 1996 y 1997.
684,,9859589,Tumor híbrido de pene: es correcta dicha denominación?
685,,9835157,Primoinfección por el virus de la inmunodeficiencia humana acompañada de micobacteriosis diseminada.
686,,9834921,Transmisión intrafamiliar del virus de la inmunodeficiencia humana en relación con cuidados paliativos.
687,,10079542,Granulomatosis linfomatoide pulmonar asociada a SIDA. A propósito de un caso y revisión de la literatura.
688,,9810540,Síndrome de Balint secundario a leucoencefalopatía multifocal progresiva en una paciente con síndrome de inmunodeficiencia adquirida.
689,,9808887,Fibrin-ring granulomas en un paciente con sida e infección diseminada por Mycobacterium avium-intracellulare.
690,,9808885,Masa tumoral indolora en la mejilla.
691,,9774887,Cuadro febril con úlceras generalizadas y lesiones plantares.
692,,9737158,Mujer con virus de la inmunodeficiencia humana positivo con masa preauricular bilateral.
693,,9706593,Tromboflebitis por acetato de megestrol en pacientes con infección por el virus de inmunodeficiencia humana.
694,,9691752,Falsa positividad de anticuerpos frente al virus de la inmunodeficiencia humana en un caso de fiebre Q.
695,,9658481,Mielopatía por VIH como síntoma inicial del síndrome de inmunodeficiencia adquirida.
696,,9656529,Sarna noruega en paciente con sida. Profilaxis primaria de un posible brote epidémico hospitalario.
697,,9656519,Pancreatitis tuberculosa en la infección por el VIH.
698,,9656515,Pancreatitis aguda durante la primoinfección VIH-1.
699,,9719725,Bloqueo neuromuscular prolongado inducido por mivacurio en un pa ciente con síndrome de inmunodeficiencia adquirida.
700,,9656528,Shock séptico y fallo multiorgánico por Mycobacterium tuberculosis.
701,,9666591,Tumoración en la región preesternal en un paciente HIV positivo diagnosticado de tuberculosis.
702,,9656758,Tuberculosis yeyunal perforada en paciente con infección por VIH.
703,,9656561,Condilomas acuminados en la infancia: presentación de un caso.
704,,9646573,Tiroiditis por Pneumocystis carinii en un paciente con infección HIV.
705,,9646567,Absceso retromamario por Nocardia asteroides en paciente HIV positivo.
706,,9646565,Tumoración costal dolorosa en un paciente HIV positivo.
707,,9629805,Manifestaciones cardíacas del síndrome de inmunodeficiencia adquirida en pacientes pediátricos.
708,,9611888,Buena evolución de un absceso miocárdico con tratamiento médico en un paciente HIV positivo.
709,,9567425,Colecistitis alitiásica por citomegalovirus (CMV) en paciente con SIDA.
710,,9567423,Terapia antirretroviral combinada para la prevención de la transmisión vertical de la infección por el VIH-1.
711,,9611879,Paciente con neumonía de repetición y masa mediastínica.
712,,9608502,Pancreatitis aguda por carbamacepina en un paciente con sida.
713,,9549192,Hemorragia por úlceras esofágicas en paciente VIH: tratamiento con argo beam.
714,,9542214,Efecto de los antagonistas de los canales de calcio en la hipertensión pulmonar primaria asociada al virus de la inmunodeficiencia humana.
715,,10347969,Rabdomiolisis asociada a infección gonocóccica diseminada en una anciana.
716,,9922486,Peritonitis espontánea chagásica en un enfermo de Sida.
717,,9542315,Criptococosis ganglionar como manifestación inicial de SIDA.
718,,9542307,Tuberculosis diseminada con manifestaciones cutáneas en pacientes con SIDA. A propósito de 4 observaciones.
719,,9580151,Obstrucción intestinal y tiroiditis necrosante secundarias a infección por Pneumocystis carinii en un paciente hemofílico seropositivo para el virus de la inmunodeficiencia humana.
720,,9713103,Ventilacion mecanica no invasiva como tratamiento de la neumonia severa en un paciente con serologia HIV positiva.
721,,9522508,Primoinfección VIH con candidiasis esofágica y toxoplasmosis aguda.
722,,9522523,Artritis criptocócica como forma de inicio del síndrome de inmunodeficiencia humana.
723,,9518037,Hiperplasia angiofolicular multicéntrica plasmocelular en un paciente VIH positivo.
724,,9522528,Infección diseminada por Mycobacterium simiae en paciente HIV.
725,,9522524,Nocardiosis pulmonar y subcutánea en un paciente HIV positivo.
726,,9494163,Tumor germinal de testículo y síndrome de inmunodeficiencia adquirida.
727,,9527378,Diarrea por Cryptosporidium como primera manifestación de SIDA en un anciano.
728,,16801022,Carcinoma espinocelular in situ tratado con imiquimod al 5 %
729,,9379737,Fiebre Q en pacientes infectados por el virus de la inmunodeficiencia humana.
730,,9424136,Fascitis necrosante estreptocócica en paciente hemofílico con infección por el virus de la inmunodeficiencia humana.
731,,9424132,Aftas orales y esofágica en un niño con sida tratadas con éxito con factores estimuladores de colonias (GM-CSF).
732,,9424126,Condensación pulmonar en paciente con sida.
733,,9462995,Manifestaciones sinusales del síndrome de inmunodeficiencia adquirida.
734,,9424677,Infección por VIH y carcinoma pulmonar.
735,,16595119,Enfermedad de Darier lineal.
736,,9379724,Diabetes insípida e infección por el VIH.
737,,9453764,Pancreatitis asociada al cotrimoxazol en un paciente VIH positivo.
738,,9411573,Lesiones necróticas en dedos en paciente VIH positivo.
739,,9410059,Infección por VIH y porfiria cutánea tarda.
740,,9376491,Histoplasmosis diseminada e infección por VIH.
741,,9377243,"Síndrome de malabsorción, leishmaniasis gastrointestinal e infección por VIH."
742,,9411554,Ulceras faciales en un enfermo con síndrome de inmunodeficiencia adquirida en fase avanzada.
743,,9280634,Retinitis por citomegalovirus en una paciente pediátrica diagnosticada de SIDA.
744,,9411555,Imágenes nodulares hipodensas en bazo en un paciente con infección por el virus de la inmunodeficiencia humana.
745,,9410124,Cardiopatía e infección por el virus de la inmunodeficiencia humana: presentación de dos casos.
746,,9382335,Cardiomiopatía dilatada regresiva en una niña con infección VIH.
747,,9280810,Nefropatía IgA asociada a la infección por el virus de la immunodeficiencia humana. Descripción de un caso.
748,,9304133,Quistes linfoepiteliales intraparotídeos y virus de la inmunodeficiencia humana.
749,,9244622,Hipoacusia perceptiva y SIDA.
750,,9289531,Esplenectomía como tratamiento de un caso de púrpura trombocitopénica recidivante en un paciente con infección por el VIH.
751,,9265088,Nefropatía VIH y amiloidosis.
752,,9324603,Bacteriemia por Hafnia alvei en un paciente con SIDA.
753,,9280979,Policitemia en un paciente con VIH.
754,,9235102,Asociación de adenocarcinoma pulmonar e infección por el virus de la inmunodeficiencia humana.
755,,9265089,"Sepsis por Leuconostoc cremoris, neutropenia e infección por el virus de la inmunodeficiencia humana."
756,,9376387,Ulcera esofágica en paciente con SIDA.
757,,9235111,Endocarditis infecciosa por Neisseria subflava en dos pacientes adictos a drogas por vía parenteral y diagnosticados de síndrome de immunodeficiencia adquirida.
758,,9312293,Infección por HIV y síndrome de Lyell: una llamada de atención ante los antiinflamatorios.
759,,9172917,Enfermedad de motoneurona e infección por VIH.
760,,9312286,Adenitis mixta por Mycobacterium avium complex y Mycobacterium tuberculosis complex en paciente con infección por HIV.
761,,9303648,Nutrición parenteral domiciliaria en un paciente infectado con el VIH. Una indicación excepcional.
762,,9162543,Absceso tuberculoso del páncreas como manifestación inicial del SIDA.
763,,9206506,Pentoxifilina y aftosis oral en pacientes con infección VIH.
764,,9147749,Trombosis de seno longitudinal superior en un paciente con SIDA. Revisión de la literatura.
765,,9115820,Carcinoma epidermoide anal: rara incidencia o raro diagnóstico?
766,,9147505,SPECT cerebral con talio-201 en el diagnóstico diferencial de lesiones cerebrales focales en pacientes con SIDA.
767,,9102675,Lesiones cavitadas pulmonares en paciente con infección VIH.
768,,9091033,Cistitis alcalina incrustante secundaria a infección por Proteus mirabilis en un paciente VIH.
769,,9479175,Síndrome de Stevens-Johnson en el curso del SIDA. Acciones de enfermería ante la infección.
770,,9382198,Quistes linfoepiteliales de glándula parótida: su relación con la infección por virus de la inmunodeficiencia humana.
771,,9091205,Sindrome de Parsonage y Turner en pacientes VIH positivo.
772,,9082891,"Fenotipo inductor de sincitio, resistencia a zidovudina y rápida progresión clínica en un niño infectado por VIH."
773,,9072193,Suboclusión intestinal por histoplasmosis diseminada en un paciente VIH positivo.
774,,16476331,Pustulosis eosinofílica infantil.
775,,9019611,Neumonía por Chlamydia trachomatis en el adulto.
776,,9064185,Neuropatías ópticas y trastornos oculomotores periféricos en pacientes con SIDA.
777,,9064173,Hidrocefalia normotensiva como manifestación de sífilis meningovascular.
778,,9053018,Sarna costrosa (Noruega) en paciente afectado de neurosida.
779,,9019608,Fiebre y dolor abdominal en un paciente con infección por el virus de la inmunodeficiencia humana y linfoma de Burkitt.
780,,9019606,Miositis por Pleistophora en un paciente con sida.
781,,9132869,Ineficacia de anfotericina B oral en el tratamiento de la candidiasis orofaríngea resistente a fluconazol en pacientes VIH-positivos.
782,,9064389,Neumonía eosinófila crónica en el SIDA.
783,,9035709,Diagnóstico de 4 casos de microsporidiosis intestinal en enfermos de SIDA.
784,,9019213,Infección por VIH y meningitis linfomatosa.
785,,9004748,Enfermedad cerebrovascular como forma de presentación de la infección por VIH.
786,,9035722,Artritis séptica por Salmonella en un hemofílico afectado de sida: tratamiento agresivo.
787,,9035710,Tuberculosis colónica como causa de rectorragia en 2 pacientes con infección por HIV.
788,,8983575,Neumonía por Pneumocystis carinii en paciente VIH con test de desaturación de oxígeno con el ejercicio negativo.
789,,9019202,Síndrome de distrés respiratorio del adulto secundario a tuberculosis miliar en paciente con infección por el VIH.
790,,9011899,Anestesia para cesárea en un caso de distrofia muscular tipo Emery-Dreifuss.
791,,9011217,Endocarditis infecciosa por Escherichia coli.
792,,9011209,"Fiebre persistente, adenopatías retroperitoneales, pancitopenia y hepatosplenomegalia en un inmigrante africano con infección por HIV-1."
793,,8991411,Vasculitis por pseudomona. A propósito de un caso.
794,,8962781,Sarcoma de Kaposi de la vía biliar sin afectación cutánea en paciente con SIDA.
795,,9036248,Mieloma múltiple quiescente e infección por el VIH: coincidencia o asociación?
796,,8991450,Neumonía por sarampión en embarazada portadora de anticuerpos para el HIV. Respuesta al tratamiento con inmunoglobulinas.
797,,8984553,Endocarditis de la válvula de Eustaquio producida por Staphylococcus hominis en un paciente con infección por VIH.
798,,8983373,Nocardiosis diseminada asociada a infección por VIH.
799,,8983365,Supervivencia prolongada en un paciente immunodeprimido por VIH tratado con foscarnet.
800,,8983366,Toxoplasmosis ocular sin afectación del SNC en pacientes con infección por el VIH. Presentación de dos casos.
801,,15171898,Tumoración ulcerada eritematoviolácea en pierna derecha.
802,,9102752,Tuberculosis del Esófago en un paciente VIH-positivo.
803,,8962981,Monoartritis crónica por osteoma osteoide.
804,,8962735,Sordera brusca e infección por el VIH.
805,,8754500,Sarcoidosis e infección por VIH.
806,,8767078,Lesiones esofágicas ulceradas en un paciente con SIDA. Esofagitis herpética.
807,,8756229,Bacteriemia por Erysipelothrix rhusiopathiae en un paciente HIV-positivo.
808,,8755213,Leucemia linfoblástica aguda (LLA) con morfología L1 de aparición durante el tratamiento de LLA-L3 en niño con SIDA.
809,,8767077,Patrón intersticial de mala evolución en paciente VIH positivo.
810,,8801377,Hipocalcemia e hipomagnesemia asociadas al tratamiento con pentamidina en dos pacientes con infección por el VIH.
811,,8691913,Carcinoma broncogénico en pacientes con infección por virus de la inmunodeficiencia humana.
812,,8801374,Histoplasmosis diseminada y sida. Aportación de 4 casos.
813,,8924483,Ulceras colónicas por Campylobacter jejuni en una paciente infectada por el HIV.
814,,8696650,Infección por Chlamydia pneumoniae asociada con anemia hemolítica autoinmune por anticuerpos calientes.
815,,8656771,Sarcoma de Kaposi diseminado con afectación hepatosplénica en el SIDA.
816,,9044654,Neumotórax en pacientes con SIDA y tuberculosis.
817,,9044650,Streptococcus equisimilis como agente etiológico de endocarditis.
818,,8701072,Abdomen quirúrgico en un enfermo con infección por el virus de la inmunodeficiencia humana.
819,,8830612,"Condilomas acuminados en niños: presentación de un caso, estado actual y protocolo de actuación."
820,,8650394,"Fiebre, tos y condensación pulmonar radiológica en un paciente VIH+."
821,,8645516,Asociación entre porfiria cutánea tarda y virus de la hepatitis C.
822,,8637278,Criptococosis pleural en pacientes con infección por el virus de la inmunodeficiencia humana.
823,,8695696,Shock anafiláctico mortal por rifampicina en un paciente con infección por HIV.
824,,8695688,Neumonía por Rhodococcus equi en pacientes infectados por el HIV: presentación de 2 casos y revisión de la litertura.
825,,8779042,"La linfadenopatía angioinmunoblástica: Comparación de dos casos clínicos, uno de ellos con anticuerpos contra el virus de inmunodeficiencia humana (VIH)."
826,,8714157,Criptococosis cutánea primaria y neumonía bacteriémica por Pseudomonas aeruginosa en el sida: caso clínico y revisión de la literatura.
827,,8664069,Ulcera esofágica idiopática fistulizada a arbol bronquial en paciente VIH-positivo.
828,,8652195,Trastornos del movimiento asociados al SIDA.
829,,8684025,Coriorretinitis inespecífica como primera manifestación de infección por VIH y de encefalitis difusa por Toxoplasma.
830,,8948938,Oclusión intestinal por tuberculosis ileocólica en un paciente infectado por el virus de la inmunodeficiencia humana.
831,,8948827,Piomiositis y SIDA.
832,,8664074,Pancreatitis aguda y síndrome de inmunodeficiencia adquirida.
833,,9138346,Sarcoma de Kaposi pulmonar primario asociado a SIDA en un varón heterosexual drogadicto.
834,,8948852,Hipertensión pulmonar primaria en una paciente con infección por VIH.
835,,8948846,Lesiones hiperqueratósicas en un paciente con SIDA.
836,,8815484,Encefalitis herpética neonatal. Conceptos actuales a propósito de un caso.
837,,8714194,Artritis infecciosa coxofemoral por Candida albicans en un paciente seropositivo al HIV.
838,,8948847,"Fiebre, tos y condensación pulmonar radiológica en un paciente VIH+."
839,,8734936,"Diarrea, hipotensión, hiponatremia e hipernatruria en SIDA."
840,,8714191,Histoplasmosis diseminada en paciente infectado por el HIV.
841,,8679832,Utilidad del litio en neutropenia asociada a SIDA.
842,,8558983,Neumonitis granulomatosa: una manifestación clínica y patológica atípica de la neumocistosis en el SIDA.
843,,8850242,Fiebre Q en un paciente hemofilico con infeccion por el VIH.
844,,8808482,Neumonía comunitaria cavitada en paciente infectado por HIV.
845,,8599052,Endocarditis sobre válvula pulmonar en adictos a drogas por vía parenteral.
846,,8588727,Hematoma perinéfrico espontáneo en un caso de SIDA.
847,,8523960,Diarrea asociada a Clostridium difficile y Salmonella enteritidis en paciente con infección por VIH.
848,,8679810,Neumonía varicelosa en el adulto.
849,,8538258,Traqueobronquitis aspergilar en un enfermo de sida.
850,,8560042,Dolor y tumefacción muscular en paciente VIH positivo.
851,,8804178,Seminoma y VIH: una asociación casual?
852,,8560045,Accidente cerebrovascular isquémico asociado al consumo de crack.
853,,8519843,Convulsiones inducidas por imipenem en paciente HIV-positiva.
854,,7490942,Transmisión sexual de cepas VIH-1 resistentes a la zidovudina.
855,,7490938,Lesión linfoepitelial quística de parótida en pacientes infectados por el VIH-1.
856,,8555314,Intento autolítico con dosis masiva de zidovudina.
857,,8519540,Linfoma gástrico primario en paciente VIH positivo.
858,,12605801,Nódulo inflamatorio tras picadura de insecto.
859,,8924555,La inmunofluorescencia directa en el diagnóstico de la infección Twar.
860,,7475449,Episodio maníaco asociado a infección por VIH en estadio C3.
861,,7475486,Criptococosis diseminada con afectación ganglionar y de médula ósea en paciente con infección por VIH.
862,,8669335,Absceso prostático tuberculoso en paciente con SIDA.
863,,8580458,Síndrome de hiperinfección por Strongyloides stercoralis en una paciente con infección por el virus de la inmunodeficiencia humana (VIH): reporte de un caso y revisión de la literatura.
864,,7481015,Hemiparesia-atáxica en varón VIH positivo.
865,,8924536,Un caso de hipertensión pulmonar primaria en paciente portadora del virus de la inmunodeficiencia humana.
866,,8777532,Carcinoma broncogénico e infección por el virus de la inmunodeficiencia humana.
867,,8657954,Cryptococosis extra meníngea en un paciente con SIDA.
868,,8519829,Síndrome de cauda equina con adenosindesaminasa elevada en paciente con infección por HIV.
869,,8519826,Síndrome hemofagocítico asociado a la infección aguda por HIV.
870,,7569213,Leishmaniasis visceral en enfermo infectado por VIH-2.
871,,7578826,Tetania por foscarnet en una paciente con síndrome de inmunodeficiencia adquirida.
872,,7623513,Formas infrecuentes de transmisión del VIH-1.
873,,7623511,Síndrome de Guillain-Barré con seroconversión anti-VIH.
874,,7603120,Progresión rápida a SIDA en un paciente infectado con una cepa del VIH-1 formadora de sincitios.
875,,7654843,Cuadro similar a esclerosis múltiple e infección por HIV.
876,,7654839,Leishmaniasis visceral con afectación de intestino delgado y colon en un enfermo con infección por HIV.
877,,7623512,Acidosis láctica idiopática en un enfermo con sida.
878,,7644800,Alteraciones neurorradiológicas en un caso de polirradiculopatía lumbosacra por citomegalovirus en un enfermo de SIDA.
879,,7627427,Criptococosis sistémica y neumocistosis en un paciente VIH-positivo.
880,,7789849,Carcinoma cervicouterino avanzado en una paciente con infección del virus de inmunodeficiencia adquirida humano. Informe de un caso y revisión de la literatura.
881,,7617944,Varón de 34 años afecto de infección por VIH que ingresa por un cuadro de fiebre e insuficiencia respiratoria.
882,,7779890,Leishmaniasis visceral y sida: detección de anticuerpos frente a Leishmania infantum mediante Western blot.
883,,7779881,Adenitis supurativa axilar en paciente HIV-positivo.
884,,7743064,Bronquiectasias asociadas a infección por el virus de la inmunodeficiencia humana.
885,,7734501,Trastornos de la visión y lesiones oculares en un paciente con SIDA.
886,,7621289,Angiosarcoma hepático: presentación de un caso asociado al tratamiento con sales de arsénico y revisión de la literatura.
887,,7575195,Hemicorea asociada a toxoplasmosis cerebral y SIDA.
888,,7715266,Sarcoma de Kaposi oral: papel de la radioterapia.
889,,7795126,Presentación atípica de neumonía por Pneumocystis carinii.
890,,7877382,Esclerosis lateral primaria en un paciente con sida. Imagen en resonancia magnética.
891,,7898164,Infección por el virus de la inmunodeficiencia humana tipo 2 en una prostituta.
892,,7732194,Foliculitis pustulosa eosinofílica en el síndrome de inmunodeficiencia adquirida. Presentación de seis casos.
893,,7732182,Diarrea y expulsión en heces de estructura blanquecina en paciente con síndrome de inmunodeficiencia adquirida.
894,,7877385,Un nuevo caso de linfocitopenia T CD4+ idiopática e infección oportunista sin infección por VIH.
895,,7877381,"Fiebre, adenopatías, hepatosplenomegalia y lesiones cutáneas en una mujer de 31 años con infección por el virus de la inmunodeficiencia humana."
896,,7732193,Abscesos tuberculosos hepáticos en pacientes con infección por el virus de la inmunodeficiencia humana: presentación de dos casos y revisión de la literatura.
897,,7732185,Linfocitopenia-T CD4+ idiopática e infección oportunista sin infección por el virus de la inmunodeficiencia humana.
898,,7778717,Leishmaniasis en O.R.L.
899,,7718714,Resolución con tratamiento esteroideo de una fístula esofágica idiopática en un paciente con SIDA.
900,,7877372,Microsporidiosis intestinal en enfermos con sida: estudio de tres casos.
901,,8728874,Probable transmision de HIV por contacto homosexual femenino.
902,,7893796,Abscesos esplénicos tuberculosos en pacientes con sida: dos nuevos casos.
903,,7727166,Esofagitis moniliásica y gastritis por citomegalovirus: diagnóstico óptico e inmunohistoquímico en paciente VIH+.
904,,7565053,Criptococosis y SIDA inesperados en una anciana.
905,,7827773,Neumonía por Rhodococcus equi en pacientes con sida.
906,,7855703,Respuesta al tratamiento y larga supervivencia de un paciente seropositivo para el virus de la inmunodeficiencia humana afecto de un linfoma no hodgkiniano.
907,,7734669,Necrosis avascular bilateral de cabeza femoral en un varón VIH positivo.
908,,7808072,Fungemia por Candida krusei en una paciente con SIDA.
909,,7811779,Neumonía por Rhodococcus equi en un paciente con sida. Resistencia primaria al imipenem.
910,,7811775,Nódulos cutáneos y dolor epigástrico en un paciente con infección por HIV.
911,,7811782,Sida por HIV-2 en Guipúzcoa.
912,,7529052,Tratamiento combinado de G-CSF y ganciclovir en un paciente con retinitis por citomegalovirus y sida.
913,,7799675,Hipocalcemia en un paciente con síndrome de inmunodeficiencia adquirida tratado únicamente con foscarnet.
914,,7981299,Leishmaniasis visceral con afectación intestinal en paciente con SIDA.
915,,7981293,Absceso cerebral e infección por HIV.
916,,7981291,Endocarditis tricúspide por Staphylococcus aureus sensible a la penicilina: 2 casos en adictos a drogas por vía parenteral.
917,,7865657,Púrpura trombótica trombopénica e infección VIH. A propósito de un caso.
918,,7996902,Bacteriemia recidivante por Mycobacterium tuberculosis en el sida: concentraciones subterapéuticas de los fármacos antituberculosos?
919,,7996900,Leishmaniasis oral en un paciente con el virus de la inmunodeficiencia humana.
920,,7981290,Bacteriemia y artritis recurrente por Streptococcus pyogenes en un heroinómano con SIDA.
921,,7754449,Síndrome hipereosinofílico inducido por GM-CSF en un paciente con SIDA. Posible respuesta al tratamiento con alpha-interferón.
922,,7967901,Vitíligo asociado a síndrome de inmunodeficiencia adquirida.
923,,7984797,Criptococosis de presentación exclusivamente cutánea en un paciente con SIDA.
924,,7948124,Púrpura de Schönlein-Henoch asociada a infección por HIV.
925,,7948122,Tuberculosis lingual en paciente con HIV-positivo.
926,,7948114,Colitis por citomegalovirus que simula una neoplasia en paciente con infección por HIV.
927,,7772688,Artritis esternoclavicular por S. pneumoniae en paciente con infección por VIH.
928,,7772693,Abdomen agudo secundario a tuberculosis intestinal en paciente con infección por VIH.
929,,7772689,Leishmaniasis visceral y SIDA. A propósito de dos casos con diseminación cutánea.
930,,7944609,Síndrome de Reiter e infección urinaria en un caso de SIDA.
931,,7938834,Valores bajos de ADA en la tuberculosis pleural en pacientes con serología VIH positiva.
932,,7938832,Porfiria cutánea tarda e infección por el virus de la inmunodeficiencia humana. A propósito de dos nuevos casos.
933,,7938824,Degeneración bullosa pulmonar de rápida evolución en pacientes infectados por el VIH. Descripción de cuatro casos y revisión de la literatura.
934,,7981372,Seminoma testicular en paciente infectado por el virus de la inmunodeficiencia humana.
935,,8086188,Meningorradiculitis sifilítica en paciente con infección por el virus de la inmunodeficiencia humana.
936,,7992633,Aspectos psiquiátricos y sociales del SIDA. Informe de cuatro casos.
937,,8059035,Lesión vertebral osteolítica en paciente con SIDA.
938,,8049292,Alteración de la sensibilidad táctil en un paciente HIV-positivo.
939,,8049290,Colección intramuscular en paciente infectado por HIV.
940,,8003599,Papulosis bowenoide. Revisión de cuatro casos en un centro de salud.
941,,7916774,Sífilis gástrica. Reporte de los dos primeros casos en Cuba.
942,,7912840,Hiperpigmentación cutánea en paciente VIH+.
943,,8011880,Histiocitoma maligno en un paciente con infección por el virus de la immunodeficiencia humana.
944,,8008938,Supervivencia prolongada en enfermos con leucoencefalopatía multifocal progresiva asociada a SIDA tratados con altas dosis de zidovudina.
945,,8133713,Hipertensión pulmonar primaria en embarazada portadora del virus de la inmunodeficiencia humana.
946,,8133711,Sida por VIH-2: primer caso diagnosticado en España.
