,abstract,id,title
394,,25639904,Furunculosis recurrente familiar producida por un clon comunitario de Staphylococcus aureus resistente a meticilina (SARM) multirresistente productor de leucocidina de Panton Valentine (LPV).
395,,25454601,Tumor de Frantz o neoplasia sólida seudopapilar de páncreas.
396,,25899645,Síndrome de la arteria de Percheron.
397,,25639905,Prueba de la tuberculina en paciente con psoriasis.
398,,25499903,Edema pulmonar neurogénico y shock cardiogénico asociado a brote de esclerosis múltiple.
399,,25179365,Hepatitis tóxica por albendazol.
400,,26397281,Hepatitis aguda no colestásica como primera manifestación de sífilis secundaria.
401,,26290028,Necrólisis epidérmica tóxica (NET) y desarrollo de abscesos hepáticos.
402,,25881765,Síndrome de Ortner y disfagia por aurícula izquierda gigante en el paciente anciano.
403,,25818035,Síndrome hipereosinofílico con choque cardiogénico: primer caso en México.
404,,25441019,Utilidad de un algoritmo diagnóstico en la hiperferritinemia: presentación de una familia española con hemocromatosis hereditaria y mutación en el gen SLC40A1.
405,"La vancomicina es un antibiotico empleado en infecciones por bacterias gram-positivas con un modelo farmacocinetico bicompartimental. Su monitorizacion ha permitido establecer rangos terapeuticos (10-20 mg/L) que evitan la nefrotoxicidad y la ototoxicidad debidas a niveles supraterapeuticos, asi como la ineficacia y aparicion de resistencias por niveles subterapeuticos. La nefrotoxicidad por vancomicina en monoterapia a dosis habitual segun patogeno y regimenes tipicos (dosis habitual: 15-20 mg/kg/12 h) es poco frecuente y generalmente reversible. Ademas, la monitorizacion de sus concentraciones plasmaticas permite lograr concentraciones en rango terapeutico que facilitan un uso seguro y efectivo del farmaco. La hipoperfusion renal puede producir dano prerrenal, provocando una elevacion de los niveles de creatinina serica, con la consiguiente disminucion de la eliminacion del antibiotico y nefrotoxicidad. Presentamos un caso de nefrotoxicidad no esperada por vancomicina en un paciente con sindrome de secrecion inadecuada de hormona antidiuretica paraneoplasico asociado. ",26276741,Intoxicación por vancomicina en un paciente con síndrome de secreción inadecuada de hormona antidiurética y diarrea.
406,,26183760,Tratamiento de dehiscencia de herida quirúrgica mediante terapia de presión negativa tópica: caso clínico.
407,,25805556,Neumoperitoneo tras cirugía. Una completa anamnesis es la clave.
408,,25662723,Síndrome de Meigs.
409,,25510631,Hipertensión portal de causa no cirrótica por didanosina: una causa infrecuente de hemorragia digestiva.
410,,25843634,Insuficiencia cardiaca derecha tras el implante de un marcapasos.
411,,25475655,Piomiositis por Escherichia coli en un paciente en tratamiento crónico con glucocorticoides.
412,,25048256,Tumor carcinoide gástrico como causa rara de anemia ferropénica.
413,,25891950,Parálisis hipopotasémica secundaria en adulto con hipertensión.
414,,25759207,Pancreatitis aguda en relación con amoxicilina-clavulánico.
415,,25577579,Masa en fosa renal derecha y fístula cutánea secundaria a pielonefritis xantogranulomatosa.
416,,25261274,Eosinofilia pulmonar asociada a ácido valproico.
417,,24054075,Devastadora mielopatía por trombo aórtico en paciente anticoagulado.
418,,25577578,Espina de pescado como causa de perforación esofágica.
419,,25443210,Linfoma no-Hodgkin primario del sistema nervioso central asociado a sida en un paciente con panuveítis por virus Epstein-Barr. Reporte clínico-patológico.
420,,25088654,"Síndrome renopulmonar, importancia del diagnóstico precoz."
421,,25088054,Hipertensión intracraneal idiopática asociada a exceso dietario de vitamina A.
422,,26486545,Embolismo tumoral pulmonar microvascular en paciente con tumor urotelial.
423,,25444040,Bacteriemia e infección de prótesis articular por Pasteurella multocida.
424,,25904520,Bacteriemia por Helicobacter cinaedi en paciente infectado por virus hepatitis C tratado con triple terapia.
425,,25543227,"Tuberculosis miliar con afectación pulmonar, meníngea y ósea."
426,,25441023,Síndrome de Vogt-Koyanagi-Harada.
427,,25200214,Tuberculosis pleural y peritoneal por Mycobacterium bovis.
428,,25601537,Absceso tiroideo por Lactococcus lactis en paciente inmunocompetente.
429,,25553716,Nódulo subcutáneo paraciliar de origen infrecuente.
430,,25541010,Lesiones ectimatosas en el abdomen de un paciente con artritis reumatoide.
431,,25433775,Púrpura perifolicular: signo clásico de escorbuto.
432,,25103065,Enfermedad de Chagas: la amenaza oculta.
433,,24952667,Masa endobronquial como primera manifestación de un linfoma anaplásico de células T.
434,,24768028,Infección por Anisakis con presentación atípica: a propósito de un caso.
435,,25023852,Colangitis y bacteriemia por Raoultella planticola.
436,,25986979,Actinomicosis de pared abdominal. A propósito de un caso.
437,,25680502,Hiperfosfatemia y perforación rectal; complicaciones asociadas al uso de enemas de fosfato.
438,,25487310,Estatus epiléptico y demencia rápidamente progresiva en una mujer de 90 años: enfermedad de Creutzfeldt-Jakob esporádica.
439,,25439633,Varón brasileño de 19años con anemia ferropénica grave.
440,,25070519,"Angioma de células del litoral, una causa infrecuente de síndrome constitucional."
441,,25049159,Encefalitis límbica anti-NMDAR (receptor de N-methy-D-aspartate) diagnosticada mediante ¹⁸F-FDG PET/TAC.
442,,24326243,Parálisis facial secundaria a metástasis única en hueso temporal de un cáncer vesical.
443,,25542338,Una causa inusual de absceso cutáneo a tener en cuenta.
444,,25441021,Signo del surco y engrosamiento de la fascia en la fascitis eosinofílica.
445,,24559541,Brote de saturnismo asociado a un tratamiento basado en la medicina ayurvédica.
446,,25037616,Masa verrucosa en la lengua: papilomatosis oral florida.
447,,24930862,Enteropatía asociada al uso crónico de olmesartán.
448,,24698717,Eficacia y seguridad de rituximab en el tratamiento del síndrome antifosfolipídico primario: análisis de 24 casos a partir de la revisión de la bibliografía.
449,,26148029,Infección invasiva por Streptococcus pneumoniae: reporte de caso de un paciente con síndrome de Austrian.
450,,25982611,Fístula colecistocutánea espontánea.
451,,25596668,Disfunción de prótesis mitral en paciente con síndrome de Bland-White-Garland. Primer caso informado en América Latina.
452,,25249394,Enfermedad de Gorham (síndrome del hueso evanescente).
453,,25205081,Hepatitis aguda por extracto de té verde.
454,,25192920,Evaluación de las técnicas de fisioterapia mediante tomografía de impedancia.
455,,24768202,Síndrome de platipnea-ortodeoxia y síndrome de Budd-Chiari: una asociación inédita.
456,,24698716,Ictus pontocerebeloso como primera manifestación de un linfoma B difuso de células grandes intravascular de localización renal.
457,,26102124,Esporotricosis cutánea diseminada con compromiso articular en una mujer con diabetes tipo 2.
458,,25771092,Trombosis venosa asociada a catéter venoso central en pacientes con cáncer.
459,,25680436,Tratamiento del síndrome de secreción inadecuada de hormona antidiurética secundario a sertralina.
460,,25534907,Probable enfermedad de Kawasaki diagnosticada en fase de secuelas en un hombre adulto de 56 años de edad.
461,,25073813,Anaplasmosis humana: comunicación de 2 casos.
462,,25439634,Aislamiento de micobacterias de crecimiento rápido a partir de muestras de piel y tejidos blandos. Una etiología a tener en cuenta.
463,,24873980,Síndrome serotoninérgico por linezolid y metoclopramida.
464,,24529679,Insuficiencia suprarrenal iatrogénica por la interacción entre ritonavir y fluticasona inhalada. Revisión de la literatura.
465,,25131317,Hepatitis por sífilis secundaria.
466,,25073819,Feocromocitoma suprarrenal en un paciente hipertenso con crisis hipertensiva.
467,,24948523,Síndrome RS3PE: descripción de un caso y revisión de la literatura.
468,,25542662,Actualización en el tratamiento de la dermatomiositis; a propósito de un caso.
469,,25174860,Mediastinitis aguda por espina de pescado.
470,,24813927,Varón joven con fiebre y dolores musculares tras acudir al dentista.
471,,24642477,Una conjuntivitis de etiología excepcional.
472,,25073827,Varón de 33 años con poliartritis recurrente.
473,,25073823,Metástasis craneal de carcinoma folicular de tiroides.
474,,25015248,Tromboembolia pulmonar e infartos cerebrales múltiples en una mujer de 36 años.
475,,24913993,Toxoplasmosis cerebral en paciente con macroglobulinemia de Waldenström.
476,,24491462,Trauma por suspensión: una forma de asfixia posicional.
477,"La asociación entre la deficiencia de vitamina D y un mayor riesgo de diversas enfermedades, entre ellas cardiovasculares y autoinmunes, ha aumentado en los últimos años el uso de suplementos para la normalización de los valores plasmáticos de esta vitamina. Desde entonces se ha descrito un mayor número de casos de intoxicación iatrogénica por vitamina D. Presentamos una enferma de 81 años con encefalopatía metabólica e insuficiencia renal secundarias a una intoxicación por vitamina D. Los suplementos orales con calcio y vitamina D se le prescribieron después de sufrir una fractura vertebral osteoporótica. La enferma mejoró clínica y analíticamente tras hidratación y diuréticos. Es importante destacar la hipercalcemia como causa de encefalopatía metabólica y considerar la intoxicación por vitamina D como etiología poco frecuente pero posible de hipercalcemia e insuficiencia renal reversibles. ",25726247,Encefalopatía metabólica secundaria a intoxicación por vitamina D.
478,,24996966,Síndrome poliglandular autoinmune tipo IIIC: reporte de un caso.
479,,24854191,Eritromelalgia primaria.
480,,24837200,Nódulos pulmonares y síndrome constitucional en paciente octogenario. Un caso de granulomatosis con poliangeítis asociado a p-ANCA.
481,,24461741,"Hipofosfatemia, una reacción adversa poco conocida del hierro intravenoso."
482,,25567400,Síndrome febril persistente secundario a abscesos cerebrales: una rara complicación de la meningococemia.
483,,25275849,Resistencia a hormonas tiroideas (RTH). Reporte de caso.
484,,24908622,Silicosis conglomerada en un trabajador de limpieza con chorro de arena.
485,,24969100,Nefropatía epidémica por el virus Puumala: a propósito de un caso.
486,,24856172,Infección cutánea por larva migrans.
487,,24315743,"Alcalosis metabólica con hiponatremia, hipopotasemia e hipocloremia como forma de presentación de fibrosis quística en un adulto."
488,,24280064,Bacteriemia espontánea del cirrótico por Campylobacter coli.
489,,24878333,"Varón de 21 años con trismus, tromboflebitis séptica y nódulos pulmonares."
490,,24231591,Uveítis intermedia en paciente inmunocompetente.
491,"Introducción: ocasionalmente concurren la fascitis necrotizante (FN), con miositis, y síndrome de choque tóxico post-estreptocócico (SSTE) asociados con infección por estreptococo ß-hemolítico del grupo G (EGG). Caso clínico: presentamos un caso de infección en el que concurren simultáneamente FN, miositis, artritis y SSTE en una mujer de 83 años con secuelas de enfermedad cerebrovascular, hospitalizada tras dos días de fiebre y dolor, así como hinchazón del pie izquierdo. Se encontraba hipotensa y el pie mostraba coloración púrpura con flictenas que se extendían hacia el tercio inferior de la pierna; no había crepitación a la presión digital. Se empleó hidratación parenteral, vasopresores, tigeciclina y clindamicina. Tanto el tejido desbridado como el líquido aspirado de la articulación de la rodilla revelaron cocos gram positivos. Al quinto día la paciente desarrolló falla renal y respiratoria que requirieron de apoyo. La paciente fue sometida a amputación supracondílea de la pierna izquierda; después de eso, su condición mejoró. Un mes después fue dada de alta. Conclusiones: el EGG puede causar infecciones potencialmente mortales, como FN, miositis, y/o SSTE. El EGG por lo general afecta a pacientes ancianos con estados comórbidos y ocasionalmente a sujetos sanos. ",25078751,"Fascitis necrotizante, miositis y síndrome de choque tóxico secundario a estreptococo del grupo G. Reporte de un caso."
492,,24746276,Mujer de 64 años con ictericia y alteración del sensorio.
493,,25444137,"Disminución del nivel de conciencia, fiebre y disnea en una paciente infectada con el virus de la inmunodeficiencia humana."
494,"la etiología más frecuente del quiste pancreático es la pancreatitis aguda y las agudizaciones de pancreatitis crónica; el 50% de los casos se alivia espontáneamente. El tratamiento se indica en pseudoquistes persistentes, sintomáticos o complicados. comunicar un caso y las opciones de tratamiento del pseudoquiste pancreático, definido como una colección de líquido en la transcavidad de los epiplones. Caso clínico: paciente femenina de 59 años de edad, con ANTECEDENTES de colecistectomía laparoscópica, pancreatitis necrotizante y en los últimos dos meses dolor abdominal, saciedad temprana y náuseas. La tomografía reveló un pseudoquiste pancreático de 92 y 62 mm, razón por la que se efectuó una cistogastroanastomosis laparoscópica. la cistograstroanastomosis laparoscópica es el tratamiento ideal para el tratamiento del pseudoquiste pancreático porque ofrece: drenaje continuo, bajo índice de recidiva y pocas complicaciones que superan al tratamiento endoscópico y al drenaje guiado por imagenología, junto con las ventajas de mínima invasión. ",25167354,Pseudoquiste pancreático. Revisión y reporte de caso.
495,,24485971,Trastornos electrocardiográficos tras intoxicación alcohólica aguda.
496,,24361160,Síndrome de secreción inadecuada de vasopresina secundario a herpes zóster localizado.
497,,24844193,Endocarditis por Salmonella enteritidis sobre válvula nativa. Curación con tratamiento médico.
498,,24698718,Fiebre e infiltrados pulmonares en un varón de 66 años.
499,,24684888,Espondilodiscitis por Clostridium perfringens.
500,,24569138,Hepatitis aguda asociada a Mycoplasma en paciente adulto sin afectación pulmonar.
501,,24786936,Invaginación ileocólica en un paciente infectado por el virus de la inmunodeficiencia humana.
502,,24378149,Lesiones purpúricas dolorosas: un signo de alarma.
503,,24355606,Cuadro ampolloso distal de inicio brusco y hemorragias en astilla.
504,,24268914,Masas en senos paranasales y enfermedad relacionada con la Ig G4.
505,,24022026,Manifestaciones neurológicas por intoxicación por adelfa.
506,,24582409,Nocardiosis abdominal seudotumoral: una presentación clínica infrecuente.
507,,24564991,Tratamiento de la leucemia mieloide crónica e infección por el virus de inmunodeficiencia humana.
508,,24508220,Eczema coxsackium (Coxsackievirus A6) en una paciente adulta infectada por el virus de la inmunodeficiencia humana.
509,,24388003,Melanosis coli.
510,"Antecedentes: el divertículo de Meckel es la anomalía congénita más común del tubo digestivo. El diagnóstico preoperatorio es difícil de establecer, por su variable presentación clínica. Caso clínico: paciente femenina de 61 años de edad, con antecedente de cuadros de oclusión intestinal repetitivos ocho meses antes de nuestra valoración. En el último internamiento tuvo: desequilibrio hidroelectrolítico, dolor persistente y falta de respuesta al tratamiento médico; por esto se le realizó una laparotomía exploradora que descartó el síndrome adherencial, y como hallazgo dos defectos diverticulares a 40 y 70 cm de la válvula ileocecal, con torsión sobre su eje. El reporte histopatológico confirmó la existencia de dos divertículos de Meckel con cambios de tipo inflamatorio hemorrágico y mucosa gástrica heterotópica de tipo antral. Conclusión: la duplicación del divertículo de Meckel es un hallazgo raro, con solo nueve casos publicados en la bibliografía internacional. El diagnóstico se realiza, frecuentemente, como hallazgo transoperatorio. El tratamiento del divertículo sintomático es quirúrgico; sin embargo, en el asintomático existe controversia y depende del criterio del cirujano y de las características propias de cada paciente. ",25238477,Doble divertículo de Meckel. Presentación de caso y revisión de la bibliografía.
511,,24630530,"Disección aórtica aguda, lo fundamental de la historia clínica y la exploración física."
512,,24560736,Síndrome coronario agudo asociado a salbutamol nebulizado.
513,,24525302,Mastitis granulomatosa idiopática. Una entidadde difícil diagnóstico y tratamiento.
514,,24480287,Cuerpos extraños abdominales de carbonato de lantano.
515,,24206673,Infección por virus de la inmunodeficiencia humana tipo 2 adquirida en España con evolución a sida.
516,,24139335,Hipoacusia neurosensorial de etiología sifilítica en un paciente con infección por virus de la inmunodeficiencia humana.
517,,24018254,Morfea en placas inducidas por paclitaxel.
518,,23711748,Carcinoma neuroendocrino de oído medio.
519,,24831432,Informe de 3 casos de reanimación extrahospitalaria en la ciudad de Querétaro. Importancia de un sistema integral de atención de emergencias médicas.
520,,24484855,Latanoprost y crisis de sudoración.
521,,24447997,Síndrome de Lady Windermere: afectación del lóbulo medio y língula por Mycobacterium avium complex.
522,,24361368,Sífilis e infección por el virus de la inmunodeficiencia humana.
523,,24361151,Quilotórax en el síndrome de las uñas amarillas.
524,,24314795,Colitis por Aeromonas hydrophila como primera manifestación de un cáncer de colon.
525,,24930081,Posibilidades de la ecocardiografía clínica en el paciente con insuficiencia cardíaca: algunos ejemplos extraídos de la práctica clínica.
526,,24447902,Malestar general en el paciente anciano como presentación de síndrome antisintetasa sin afectación muscular.
527,,24280629,Rabdomiólisis tras una sesión de spinning. Pruebas para descartar miopatía metabólica.
528,,24183575,Lesiones cutáneas múltiples en un paciente colombiano.
529,,23937821,Mastitis granulomatosa perilobulillar idiopática: descripción de un caso.
530,,23583185,Síndrome constitucional como presentación de meningioma pontocerebeloso.
531,,24246774,Varón de 58 años con lesiones cutáneas y deterioro neurológico.
532,,24210977,Varón de 24 años con fiebre e infiltrados pulmonares.
533,,24209983,Calcinosis cutis en paciente adulto con dermatomiositis.
534,,24120097,Lesiones periorificiales y acrales.
535,,23937817,Mixoma auricular.
536,,23683968,Infección respiratoria por Mycobacterium mucogenicum.
537,,23276378,Acarbosa y propofol: ¿una peligrosa combinación?
538,,24566795,Retraso en el diagnóstico de un cuadro grave de enfermedad de Huntington juvenil: un reporte de caso.
539,,24054772,Calcificaciones en ganglios de la base y crisis convulsivas.
540,,24021749,Duodenitis isquémica en paciente pluripatológico.
541,,23768857,Brote familiar de botulismo alimentario.
542,,25555009,Variante faringo-cérvico-braquial del síndrome de Guillain-Barré
543,,24871125,Histiocitosis de células de Langerhans.
544,,24481438,Trasplante fecal domiciliario en una mujer de la tercera edad.
545,,24094676,Trombosis arterial y venosa como primera manifestación de síndrome antifosfolípido en paciente octogenaria.
546,,24022025,Nueva mutación en una familia española con síndrome de hiperferritinemia hereditaria y cataratas.
547,,23953102,"Máculas y pápulas cutáneas, eritemato-parduzcas, en paciente con virus de la inmunodeficiencia humana."
548,,23910149,Absceso cerebral sobre infarto isquémico previo.
549,,23849482,Necrosis bilateral de cuero cabelludo en paciente con arteritis de células gigantes.
550,,23306606,Embolismo gaseoso arterial cerebral secundario a un trauma torácico por disparo.
551,,22749569,Diplopía aislada como forma de presentación de CADASIL: a propósito de un caso.
552,,24183658,Hipersensibilidad al aroma de melocotón como excipiente.
553,,24029174,Infliximab en el tratamiento de la enfermedad de Crohn gastroduodenal resistente.
554,,23845252,Síndrome papulopurpúrico en guante y calcetín y trombocitopenia en relación con infección por parvovirus B19.
555,,23768463,Linfoma B difuso de célula grande subtipo centro germinal con infiltración extensa de la pared torácica.
556,,24001471,Enterolitiasis con reservorio ileoanal.
557,,23611823,Afectación hepática inducida por vacuna antihepatitis B.
558,,24315080,Parálisis periódica hipopotasémica tirotóxica: a propósito de un caso.
559,,23622890,Miocarditis mortal por enterovirus asociada a tratamiento de linfoma folicular con rituximab y quimioterapia.
560,,23937820,Dolor torácico de 48 horas de evolución en un varón de 41 años.
561,,23768851,Esplenosis abdominal.
562,,23182296,Infección de una prótesis aórtica abdominal secundaria a fístula aortoentérica: un reto diagnóstico y terapéutico.
563,,24080889,Bacteriemia por Kluyvera ascorbata en un paciente adulto.
564,,23706911,Hiponatremia grave durante el tratamiento de aspergilosis pulmonar invasiva con voriconazol en una paciente octogenaria con enfermedad pulmonar obstructiva crónica.
565,"La restricción calórica de 30 a 60% de la ingestión calórica ad libitum, equilibrada y sin llegar a la malnutrición, es la estrategia no genética que ha logrado extender el promedio y el periodo máximo de vida de diversos organismos, desde microorganismos unicelulares como la levadura Saccharomyces cerevisiae, hasta primates Rhesus. Modelos genéticos y farmacológicos han mostrado que esta estrategia protege de enfermedades cardiovasculares, neurodegeneración y cáncer. Los estudios efectuados en primates sugieren que la restricción calórica retrasa la aparición de enfermedades asociadas con el envejecimiento, y en humanos implica efectos fisiológicos, bioquímicos y metabólicos que disminuyen los factores de riesgo de enfermedad cardiovascular y diabetes. Aunque en la actualidad se desconocen los mecanismos que generan los efectos positivos, a nivel celular se ha descrito disminución del estrés oxidativo, e incremento de la biogénesis mitocondrial. ",25125067,Restricción calórica: efectos metabólicos positivos e impacto celular.
566,,24034765,Gota tofácea crónica.
567,,23582700,Oftalmoplejía completa izquierda aguda como manifestación inicial de un carcinoma de próstata metastásico: a propósito de un caso.
568,,23561243,Calcificaciones cerebrales en el lupus eritematoso sistémico.
569,,23886366,Ptosis palpebral: manifestación ocular inusual de la enfermedad de Crohn.
570,,23683970,Colitis isquémica por émbolos de colesterol.
571,,23608204,Aparición de un nódulo pulmonar tras tratamiento corticoideo.
572,,23523031,"Paciente de 47 años con fiebre, adenopatías y encefalopatía."
573,,23834980,Eritrocitosis secundaria a la producción inapropiada de eritropoyetina por un carcinoma de células renales.
574,,23870628,Hemorragia de intestino medio causada por uncinariasis y diagnosticada por cápsula endoscópica. Caso clínico.
575,,24960327,Inmunodeficiencias primarias en el adulto. Un reto diagnostico para medicina interna.
576,,23947007,Neuritis óptica por picadura de abeja.
577,,23510616,Disfagia secundaria a divertículo esofágico gigante.
578,,23510615,Retinocoroiditis enigmática.
579,,24089282,Linfadenitis necrotizante histiocitaria: comunicación de 3 casos.
580,,24468300,Paciente monorrena con diarrea de 2 semanas de evolución.
581,,23499013,Prueba de sonda duodenal y ultrasonido de hígado y vías biliares en el diagnóstico de atresia de las vías biliares extrahepáticas. Serie de 4 casos.
582,,23260387,Hiperpigmentación lingual en paciente con infección crónica.
583,,24468301,Dorsalgia persistente en varón de 62 años: ¿dolor mecánico?
584,,23781714,Endocarditis infecciosa por Rhizobium radiobacter. Reporte de un caso.
585,"Introducción: la gota es una artropatía inflamatoria que frecuentemente se asocia con obesidad, consumo de alcohol, hipertensión e hipertrigliceridemia. La calcifilaxis se caracteriza por la calcificación metastásica de los vasos de mediano y pequeño calibre. En forma independiente ambas se asocian con mortalidad elevada. Cuando la hiperuricemia y la calcifilaxis están presentes, el riesgo de muerte es de 80%. Caso clínico: hombre de 51 años de edad, con antecedentes de alcoholismo e hipertensión arterial sistémica, quien desarrolló úlceras en extremidades, edema generalizado y síndrome urémico. Tres semanas después de su ingreso falleció debido a sepsis ocasionada por Staphylococcus aureus. El diagnóstico fue calcifilaxis asociada con síndrome metabólico, comorbilidades, factores de riesgo cardiovascular y de insuficiencia renal. Conclusiones: la hiperuricemia es parte del complejo que conforma el síndrome metabólico, resultante de factores genéticos y ambientales. Se reconoce que es un factor asociado con la mortalidad cardiovascular, lo que obliga a considerar a la hiperuricemia en las guías de práctica clínica en la prevención y tratamiento de enfermedades con alta mortalidad debido a las complicaciones que se presentan. ",23693113,"Calcifilaxis, insuficiencia renal y gota. Un paciente con hiperuricemia como factor de riesgo para morir."
586,,23650824,Shock hipovolémico por sangrado secundario a várices gástricas.
587,,23083694,Secreción inadecuada de hormona antidiurética secundaria a carcinoma microcítico de vejiga urinaria: una asociación no descrita.
588,,23040670,Lesiones ocupantes de espacio hepáticas en paciente diabético.
589,,23900333,Disección carotídea en paciente con síndrome de Ehlers-Danlos tipo vascular.
590,,23452536,Enfermedad de Mondor. A propósito de un caso.
