,abstract,id,title
191,"Entre las opciones terapéuticas para las deformidades anteriores del tórax, la cirugía pediátrica ha dispuesto de tratamientos ortóticos y de técnicas quirúrgicas “abiertas”. La toracoplastia compresiva anterior se une a las anteriores y amplía las opciones terapéuticas. Se describe aquí esta técnica en lo que supone la primera serie europea comunicada. Revisión retrospectiva de las toracoplastias por técnica de Abramson modificada para el tratamiento del pectus carinatum y protrusiones costales en nuestro servicio entre 2010 y 2012. Descripción de la técnica a partir de los primeros cinco casos completados de nuestra serie, cuatro varones y una mujer, con edades entre los 13 y los 19 años. En todos los casos la técnica se ha podido completar sin complicaciones intra o perioperatorias y con resultados excelentes, tanto para el equipo quirúrgico como para los pacientes. El tiempo operatorio medio ha sido de 190 minutos y el alta hospitalaria se ha conseguido entre los tres y seis días después de la intervención, una vez completado el control analgésico. Consideramos que la toracoplastia compresiva anterior es una técnica mínimamente invasiva para la corrección del pectus carinatum y deformidades afines que resulta particularmente útil en los casos en los que la rigidez del tórax impide la adopción de tratamientos ortopédicos, en casos de no aceptación del tratamiento ortótico o cuando la cirugía convencional se considera demasiado agresiva. ",27775279,Toracoplastia anterior compresiva (técnica de Abramson modificada) para el tratamiento del pectus carinatum.
192,,24411563,Fractura crónica de hueso hioides.
193,,24314816,Meningitis aguda por Streptococcus suis.
194,,23871097,Canalización de una vía venosa periférica guiada con ecografía en un paciente quirúrgico.
195,,23787369,Visión ecográfica del bloqueo subaracnoideo.
196,,23722068,Estenosis traqueal.
197,,23664062,Cesárea urgente y craneotomía en una paciente con rotura de una malformación arteriovenosa cerebral.
198,,23871098,Manejo perioperatorio de la enfermedad de Von Willebrand tipo 2B en una paciente sometida a cirugía abdominal urgente.
199,,23768746,Anestesia general para cesárea urgente en una gestante con accidente cerebrovascular agudo.
200,,23735318,Shock séptico debido a la infección por Clostridium difficile adquirida en la comunidad. Estudio de un caso y revisión de la literatura.
201,,23731837,Oxigenación con membrana extracorpórea en la disfunción primaria del injerto en trasplante bipulmonar pediátrico: a propósito de un caso.
202,,23706936,"Sepsis, miocardiopatía e infección por el virus de la inmunodeficiencia humana: a propósito de un caso."
203,,24018279,Reversión de flutter auricular a ritmo sinusal tras administración de propofol.
204,,23664218,Cardiomiopatía de Takotsubo en el contexto de sepsis por Staphylococcus aureus.
205,,23601838,Coagulopatía fulminante tras el uso de bivalirudina en un paciente diagnosticado de trombocitopenia inducida por heparina y sometido a cirugía cardiaca con circulación extracorpórea.
206,,23395352,Anestesia epidural continua en neonato: a propósito de un caso.
207,,23375689,Traqueocele yatrógeno después de traqueostomía percutánea.
208,,23352376,Taponamiento cardíaco tras punción esternal. Utilidad de la ecografía focussed assessment with sonography for trauma.
209,,24286889,Delirium prolongado por propofol en un adolescente de 14 años.
210,,23664061,Rotura de aneurisma ilíaco durante el precondicionamiento con levosimendán previo a cirugía de revascularización coronaria.
211,,23582587,Estenosis traqueal por ectasia del tronco braquiocefálico derecho.
212,,23485202,Bloqueo nervioso periférico guiado por ecografía en una paciente con polineuropatía desmielinizante inflamatoria crónica.
213,,23477891,Vía aérea difícil en un paciente pediátrico con mucopolisacaridosis tipo i (síndrome de Hurler).
214,,23452777,Monitorización hemodinámica con sistema de onda de pulso durante la cirugía del feocromocitoma.
215,,23375467,Encefalopatía transitoria por contraste tras coronariografía que simulaba una hemorragia subaracnoidea.
216,,23276376,Inserción de balones intraarteriales ilíacos previa a la realización de cesárea ante la sospecha de acretismo placentario.
217,,23266343,Oximetría cerebral en endarterectomía pulmonar con parada circulatoria.
218,,23489880,Cesárea electiva en una paciente con síndrome de sensibilidad química múltiple.
219,,23332538,Sarcoma de arteria pulmonar.
220,,23261225,La leucocitosis extrema puede inducir a un diagnóstico erróneo de hipoxemia severa. Descripción de un caso.
221,,22898141,Reparación de vena yugular interna única después de recurrencia por cáncer de laringe.
222,,23796840,Aislamiento pulmonar con bloqueador bronquial EZ-Blocker en una paciente intervenida de simpatectomía torácica endoscópica bilateral.
223,,23375688,Posibilidades de empleo de la oximetría cerebral transcutánea en zona de combate.
224,,23276375,Retrombosis tras la colocación de un filtro de vena cava inferior en el postoperatorio de cirugía oncológica.
225,,23228671,Anestesia para sustitución valvular en el segundo trimestre del embarazo.
226,,23453239,Tratamiento perioperatorio de una embarazada con belonefobia severa.
227,,23375687,Perforación del pilar anterior de la amígdala derecha durante la intubación orotraqueal facilitada por el videolaringoscopio Glidescope.
228,,23260992,Tratamiento anestésico del neonato con atresia de esófago asociada a fístula traqueoesofágica y ano imperforado.
229,,23228669,Hipertensión intracraneal idiopática: cesárea con anestesia epidural tras normalización de la presión del líquido cefalorraquídeo.
230,,23177529,Extravasación diferida de un catéter venoso central.
231,,23332535,Quiste hidatídico pericárdico. Presentación de un caso.
232,,22963762,Paraplejía tardía transitoria tras reparación de aneurismas torácico y toracoabdominal.
233,,23332536,Síndrome de Rett: consideraciones anestésicas y valoración del umbral del dolor en la cirugía de escoliosis.
234,,23261222,Tratamiento anestésico de un paciente intervenido por pseudoaneurisma de arteria mesentérica superior.
235,,23153592,Fondaparinux como alternativa a la anticoagulación en una paciente con dispositivo de asistencia ventricular y trombocitopenia inducida por heparina.
236,,23137762,Tratamiento conservador de un paciente con heridas cardíacas por proyectiles.
237,,23153593,Anestesia epidural para cesárea urgente en una gestante con accidente cerebrovascular agudo.
238,,22920835,Hipertensión endocraneal asociada a la sedación con sevoflurano mediante el dispositivo AnaConDa(®)en un paciente con traumatismo craneoencefálico severo.
239,,24268888,Manejo anestésico del paciente con enfermedad de Kawasaki durante la cirugía de revascularización coronaria: informe de un caso.
240,,23664217,Anestesia epidural caudal para un caso de gangrena de Fournier.
241,,23083979,Tricobezoar y anestesia.
242,,23121707,Trastorno de conducta como presentación del síndrome de embolia grasa.
243,,23046959,Mediastinitis secundaria a diverticulectomía de Zenker por láser CO2.
244,,22784646,Anestesia y reanimación en un caso de placenta pércreta.
245,,23261224,Analgesia epidural para trabajo de parto en una paciente con enfermedad de Rendu-Osler-Weber.
246,,22935761,Analgesia epidural para cirugía de Nissen en un lactante mediante acceso caudal.
247,,22749301,Imagen ecocardiográfica de una disección de aorta tipo A con rotura al pericardio.
248,,23153594,Neumotórax bilateral y neumomediastino tras microcirugía transoral con láser y traqueotomía.
249,,22698859,Metahemoglobinemia en una paciente sana tras administración tópica de anestésicos locales para depilación con láser.
250,,22695204,Edema pulmonar por reexpansión tras resección de timoma gigante.
251,,22749298,Hallazgo accidental de un quiste de Tarlov durante una infiltración caudal guiada por escopia.
252,,22658397,Rotura traqueal postintubación de instauración clínica tardía. Breve revisión etiopatológica y del tratamiento.
253,,22727653,Vía aérea difícil en un paciente con enfermedad de Forestier y Rotés-Querol.
254,,22677265,Vasoespasmo coronario en la inducción de la anestesia general.
255,,23040654,Síndrome de Rett: doble catéter epidural para control del dolor postoperatorio tras cirugía de escoliosis. Revisión de la bibliografía.
256,,22795750,Proyectil anclado en C1 tras intento autolítico.
257,,22575775,Fascitis necrotizante en una paciente con inmunodeficiencia común variable.
258,,22609264,Abdomen agudo e hiperparatiroidismo: descripción de un caso.
259,,22818586,Efecto antidepresivo de dosis subanestésicas de ketamina en el postoperatorio de una paciente con depresión no controlada.
260,,22658396,Traqueobroncopatía osteocondroplástica: vía aérea difícil no prevista.
261,,22565223,Tratamiento anestésico de cesárea en una gestante diabética con miocardiopatía hipertrófica y disfunción diastólica restrictiva.
262,,22877758,Anudamiento de un catéter de arteria pulmonar.
263,,22727654,Intubación nasotraqueal con fibrobroncoscopio como única posibilidad en un paciente con anquilosis de la articulación temporomandibular.
264,,22683272,"Descripción de un caso de síndrome de cirugía fallida de espalda, estimulación medular y embarazo."
265,,22809578,Resolución espontánea de paraparesia por hematoma epidural dorsolumbar asociado a anestesia subaracnoidea y analgesia postoperatoria mediante catéter epidural.
266,,22591627,Laparotomía en paciente con síndrome del «body packer»
267,,22704938,Uso del videolaringoscopio McGrath(®) e intercambiador de tubos pediátrico para cambio de tubo endotraqueal en un paciente con vía aérea difícil.
268,,22695200,Taponamiento cardiaco como complicación infrecuente en la cateterización venosa central.
269,,22658394,Vía aérea difícil no prevista en un paciente intervenido de artroscopia de hombro con anestesia general y bloqueo interescalénico del plexo braquial.
270,,23282779,"""Systolic anterior motion""(SAM): una causa infrecuente de hipotensión severa en el perioperatorio de cirugía no cardiaca."
271,,22789614,Tratamiento anestésico en la exéresis de un quiste hidatídico cardíaco.
272,,22695201,Bloqueo infraclavicular bilateral guiado por ultrasonidos.
273,,22632904,Psoriasis dorsolumbar evolucionada: ¿anestesia regional o general?
274,,22658398,Bicitopenia asociada al parto de un feto muerto de 32 semanas.
275,,22633208,Uso de presión positiva continua en la vía aérea de Boussignac en un paciente con obesidad mórbida intervenido de cirugía torácica.
276,,22608203,Intubación nasal con fibrobroncoscopio en paciente con bocio tiroideo gigante.
277,,22542877,Endocarditis por Candida glabrata sobre válvula protésica.
278,,22704939,Síndrome de Guillain-Barré (variante Miller-Fisher) en la Unidad de Reanimación.
279,,22658395,Crisis epiléptica en el postoperatorio tardío de endarterectomía carotídea: ¿un caso de síndrome de hiperperfusión cerebral?
280,,22575776,Amnesia global transitoria en el contexto de una anestesia general.
281,,22609263,"Acidosis láctica asociada a metformina: incidencia, diagnóstico, factores pronóstico y tratamiento."
282,,22657353,Manejo anestésico en el síndrome de Berdon.
283,,22627010,Shock séptico secundario a artritis séptica de cadera por Staphylococcus aureus: tratamiento en la Unidad de Reanimación.
284,,22591626,Colocación de filtro de cava por trombosis venosa profunda durante el embarazo.
285,,22579016,Instilación de anestesia tópica en la vía aérea con la sonda MADgic para la intubación del paciente despierto con videolaringoscopio Glidescope.
286,,22463783,Tratamiento con equinocandinas en un paciente crítico sometido a técnica continua de reemplazo renal.
287,,22542882,Detección intraoperatoria de un episodio de isquemia cerebral mediante la monitorización de la presión tisular de oxígeno cerebral.
288,,22463786,Candidiasis invasora en una paciente sometida a retrasplante unipulmonar.
289,,22985764,Rotura traqueal postintubación tratada con prótesis en Y de Dumon.
290,,22985762,Anestesia en un paciente con síndrome de Lesch-Nyhan.
291,,22985765,Punción paramedial para anestesia subaracnoidea en un paciente con gran tatuaje.
292,,22985763,Descripción de un caso de intoxicación por Paraquat.
293,,22985759,Airtraq como dispositivo de primera elección para un lactante con vía aérea difícil conocida.
294,,22985757,Ceguera cortical postoperatoria tras lobectomía pulmonar superior derecha.
295,,22480562,Gastrosquisis inviable neonatal.
296,,22480558,Anestesia general en un pacientecon síndrome de Clarkson.
297,,22480556,Condrodisplasia punctata de Conradi-Hünermann: implicaciones anestésicas.
298,,22429640,Tratamiento de la vía aérea en un caso de enfermedadde Madelung o lipomatosis cervical.
299,,22429638,Intubación orotraqueal con laringoscopio óptico Airtraq en un niño con síndrome de Smith-Lemli-Opitz y vía aérea difícil.
300,,22429639,Paciente con síndrome de Madelung y dificultaden el tratamiento de la vía aérea.
301,,22429637,Fractura de mandíbula en paciente con neurodegeneración asociada al déficit de pantotenatocinasa (síndrome de Hallervorden-Spatz).
302,,22263407,Eficacia de sugammadex para la reversión del bloqueo neuromuscular en una paciente con distrofia muscular de Becker.
303,,22263416,Efecto techo de la neostigmina: valor de la monitorización neuromuscular en su diagnóstico.
304,,22279886,Neumotórax postoperatorio espontáneo contralateral.
305,,22141226,Fuga de anestésico local de un bloqueo paravertebral al espacio interpleural.
306,,22141220,Abordaje percutáneo secuencial en una paciente diagnosticada de estenosis aórtica severa y miocardiopatia hipertrófica obstructiva.
307,,22141227,Neurofibroma gigante lumbar.
308,,22141221,Dos casos de complicaciones graves tras radiofrecuencia pulmonar.
309,,22046874,Fistula vértebro-yugular tras canalización venosa central.
310,,22046869,Tratamiento de una paciente con drepanocitosis homocigota durante la cirugía cardiaca con circulación extracorpórea.
311,,21797100,Velamiento del ventrículo izquierdo por bulla pulmonar gigante.
312,,21797098,Rotura accidental de catéter caudal en el espacio paravertebral.
313,,21797090,Sepsis puerperal tardía con shock séptico y disfunción cardiaca.
314,,21797099,Doble parche hemático epidural como tratamiento de un síndrome de hipotensión intracraneal espontánea.
315,,21797097,Neumoencéfalo tras punción dural accidental durante la realización de un bloqueo epidural para analgesia del parto.
316,,21797089,Intubación orotraqueal con laringoscopio óptico Airtraq en pacientes acromegálicos.
317,,21688519,Broncoespasmo severo con dehiscencia de esternotomía.
318,,21688511,Intubación con tubo de doble luz mediante laringoscopio Airtraq en dos pacientes despiertos con vía aérea díficil prevista.
319,,11898445,Ruptura tardía de catéter central implantable por vía subclavia.
320,,21688520,Ecografía transesofágica intraoperatoria en un mixoma auricular gigante.
321,,21688518,Imagen ecocardiográfica de mixoma auricular izquierdo causante de insuficiencia cardiaca aguda.
322,,21688512,Tratamiento farmacológico preoperatorio de dos pacientes trombopénicos para intervención neuroquirúrgica.
323,,21688510,Bloqueo interescalénico guiado por ecografía en un paciente con alteraciones anatómicas de la región supraclavicular secundarias a radioterapia y cirugía.
324,,21608292,Vena cava superior izquierda persistente en un lactante de dos meses.
325,,21608291,Hallazgo casual de vena cava superior izquierda persistente.
326,,21879168,Casos clínicos: ecocardiografía transesofágica y monitorización hemodinámica en cirugía no cardiaca.
327,,21534303,Hallazgo de un bronquio traqueal derecho durante fibrobroncoscopia intraoperatoria.
328,,21534295,Intoxicación aguda grave por etilenglicol: valor de la monitorización del gap osmolar en su diagnóstico.
329,,21534293,Oxigenación extracorpórea en un síndrome de distrés respiratorio agudo tras trasplante hepático.
330,,21427835,Diagnóstico de síndrome de HELLP por visualización hepática intraoperatoria.
331,,21427829,Mascarilla laríngea flexible en decúbito lateral y artritis reumatoide.
332,,21427836,Traumatismo craneoencefálico con objeto penetrante en paciente pediátrico.
333,,21427830,Disfunción ventricular y edema agudo de pulmón asociado a crisis hipertensiva intraoperatoria. Evaluación clínica y ecocardiográfica.
334,,21348224,Pseudoaneurisma subclavio izquierdo iatrogénico.
335,,21348218,Cardiopatía congénita con estenosis pulmonar y comunicaciones intracardiacas asociadas en adulto: tratamiento anestésico.
336,,21348219,Síndrome de Horner y bloqueo del plexo braquial tras anestesia epidural para trabajo de parto y cesárea.
337,,22283026,Elefantiasis-linfedema gigante de extremidad inferior derecha.
338,,22283019,Neuropatía sensible a la presión tras un parto bajo analgesia epidural.
339,,22283025,Anestesia subaracnoidea para cesáirea en una paciente con macromastia gestacional.
340,,22283020,Abordaje multidisciplinar en el tratamiento de una hemoptisis grave con amenaza vital.
341,,21155343,Laceración traqueal durante la intubación traqueal con guía de intubación Frova.
342,,21155348,Corrección de ductus arterioso pesistente no diagnosticado durante el tratamiento endovascular de coartación de aorta.
343,,21155342,Intoxicación por flecainida.
344,,21033466,"Influencia del neumoperitoneo en la curva de capnografía: imagen en ""Torre de Castillo""."
345,,21033465,Luxación cervical C6-C7.
346,,21033459,Tratamiento anestésico de una paciente con síndrome de Ellis-Van Creveld.
347,,29122332,Rotura de catéter epidural.
348,,20857646,Megaesófago en un paciente con acalasia avanzada.
349,,20857638,Tratamiento perioperatorio de un paciente para trasplante unipulmonar izquierdo combinado con revascularización coronaria sin empleo de circulación extracorpórea. Breve revisión fisiopatológica y de la bibliografía.
350,,29680334,Cirugía a corazón abierto para el tratamiento de trombo auricular derecho relacionado con cateterización venosa central.
351,,20857645,Nudo verdadero de cordón umbilical.
352,,20645501,Poliquistosis hepatorrenal.
353,,20645489,Edema agudo pulmonar por obstrucción de la vía aérea en el periodo postanestésico inmediato.
354,,20836249,Hiperinfección por Strongyloides stercoralis.
355,,20645500,Vía aérea difícil en una paciente con neurofibromatosis (enfermedad de von Recklinghausen).
356,,20527356,Lesiones óseas torácicas tras reanimación cardiopulmonar como hallazgo casual en un estudio de gammagrafía ósea.
357,,20527348,Hemólisis masiva intravascular secundaria a sepsis por Clostridium perfringens.
358,,20527357,Imagen ecográfica del desgarro intimal en disección aórtica aguda tipo I.
359,,20527347,Porfiria aguda intermitente y síndrome de secreción inadecuada de ADH.
360,,20499815,Pectus excavatum grave.
361,,20499805,"Torsión pulmonar como complicación de una lobectomía pulmonar, descripción de dos casos."
362,,20499803,Bloqueo fase II después de una dosis subclínica de succinilcolina. Importancia de la monitorización neuromuscular.
363,,20499814,Pectus excavatum.
364,,20499802,Parche hemático epidural en el tratamiento de cefalea postpunción dural grave en cirugía mayor ambulatoria.
365,,20422859,Anestesia subaracnoidea de urgencia en posición de decúbito prono.
366,,20422851,Aneurisma del seno de Valsalva roto y gestación. Qué técnica anestésica es preferible para una cesárea electiva?
367,,20422860,Dilatación gástrica secundaria a la migración de un tornillo de osteosíntesis.
368,,20337012,Rotura vesical durante resección transuretral de próstata.
369,,20337004,Uso de guía metálica para intubación traqueal mediante fibroscopia en un neonato con síndrome de Treacher Collins y atresia de coanas.
370,,20337000,Utilización del laringoscopio rígido y el nasofibroscopio flexible en la valoración de la vía aérea difícil: descripción de 3 casos.
371,,20337011,Esplenomegalia gigante con hiperesplenismo.
372,,20337003,Síndrome de QT largo adquirido perioperatorio.
373,,20196522,Uso del videolaringoscopio de McGrath junto con la guía Frova en el manejo de la vía aérea difícil.
374,,20151527,Trasplante pulmonar en dos pacientes con sarcoidosis. Descripción de casos y revisión fisiopatológica.
375,,11257957,"Mascarilla laríngea Fastrach, sevoflurano y remifentanilo: una alternativa anestésica del paciente miasténico."
376,,20151534,Edema pulmonar por reexpansión tras pleuroscopia por derrame pleural masivo paraneoplásico.
377,,20151526,Tratamiento de anemia aguda grave por hemorragia vaginal en la testigo de Jehová: a propósito de dos casos.
378,,20112548,Desarrollo de síndrome de hiperestimulación ovárica grave tras la administración exógena de gonadotropina coriónica humana.
379,,28262247,Uso del TotalTrack VLM para intubación endotraqueal urgente en vía aérea difícil prevista con obstrucción por lesiones ocupantes de espacio y distancia interdental reducida.
380,,20112559,Desconexión y migración del catéter de un reservorio venoso subcutáneo.
381,,20112549,Tratamiento anestésico para cesárea en una paciente con epidermolisis bullosa distrófica recesiva.
382,,20112547,Isquemia de médula espinal tras embolización de arteria bronquial y toracotomía derecha.
383,,19994619,Conducta perioperatoria en un paciente con síndrome de San Filippo sometido a exodoncia múltiple.
384,,19994628,Disección aórtica aguda: utilidad de la ecocardiografía transesofágica intraoperatoria.
385,,19994620,Hiponatremia postoperatoria en pacientes pediátricos.
386,,19856697,Cuerpo extraño en bronquio segmentario distal.
387,,19856691,Uso de la LMA CTrach en el paciente despierto con criterios de vía aérea difícil.
388,,19811973,Revisión de las estenosis traqueales tras intubación: a propósito de un caso.
389,,19856698,Antena metálica en árbol traqueobronquial.
390,,19856692,Embolia gaseosa durante cirugía laparoscópica en lactante con síndrome de Cornelia de Lange.
391,"En los Estados Unidos se estimó que, durante el 2015, unos 61 560 pacientes serían diagnosticados con cáncer renal y que 14 080 morirían por esta enfermedad. Presentamos el caso de un paciente con carcinoma de células renales y trombo tumoral de vena cava inferior que sufrió una hemorragia perioperatoria grave y coagulopatía después de una esternotomía de emergencia. También abordamos aspectos relevantes del cuidado anestésico perioperatorio incluyendo consideraciones y manejo de coagulopatía, falla renal y hepática en un paciente oncológico. El caso es un hombre de 49 años que fue llevado a embolización tumoral guiada por radiología, nefrectomía radical izquierda y trombectomía de vena cava inferior. En el período postoperatorio desarrolló sepsis, falla orgánica múltiple y efusión pericárdica que requirió pericardiocentesis. Durante la pericardiocentesis sufrió perforación iatrogénica de ventrículo izquierdo que necesitó esternotomía de emergencia y reparación del ventrículo izquierdo. Los pacientes con cáncer son a menudo un reto para el equipo de cirugía y anestesia, y el cuidado de emergencia requiere un abordaje integral y organizado. El uso de factor recombinante VIIa NovoSeven puede ayudar en el manejo de la hemorragia severa perioperatoria después de cirugía cardiotorácica en pacientes oncológicos, pero se deben hacer estudios posteriores para confirmarlo. ",27420728,Hemorragia perioperatoria grave asociada a punción del ventrículo izquierdo post pericardiocentesis en un paciente con carcinoma de células renales: reporte de caso.
392,,19725352,Canalización de una variante anatómica de la vena femoral guiada por ecografía.
393,,19725348,Descripción de un caso de drepanocitosis y consideraciones anestésicas.
394,"La anafilaxia es una reacción de hipersensibilidad sistemica y grave, de inicio rápido y potencialmente mortal. En los recién nacidos prematuros, el sistema inmunitario aún no ha madurado y, por lo tanto, tienen menos probabilidades de presentar anafilaxia. La administración de amikacina, que contenía metabisulfito de sodio, a un prematuro de 3 días de vida le indujo anafilaxia casi mortal. Debido a que se sospechaba un caso de anafilaxia, se inició la administración de amikacina en el bebé. Una vez comenzado el tratamiento, se observó una mejoría clínica. Al tercer día de tratamiento con amikacina, el recién nacido tuvo, repentinamente, taquipnea, taquicardia, angioedema y cianosis. Se le diagnosticó anafilaxia y se inició el tratamiento. Una hora después de la mejoría clínica, se produjo una reacción tardía. Inmediatamente, se intubó al recién nacido. La anafilaxia es una emergencia médica; por lo tanto, los médicos deben realizar una evaluación rápida y atenta para detectar esta reacción potencialmente mortal. Incluso después del tratamiento satisfactorio de la anafilaxia, el paciente debe permanecer bajo observación durante 72 horas dada la posibilidad de una reacción bifásica. ",27164357,Anafilaxia tras la administración de amikacina con metabisulfito de sodio a un recién nacido prematuro.
395,,19580135,Infarto agudo de miocardio como hallazgo casual: consideraciones sobre la evaluación preanestésica.
396,,19243790,Génesis de la taquicardia ventricular monomorfa sostenida.
397,,19580144,Coloración verde de la orina relacionada con infusión de propofol.
