,abstract,id,title
0,,24871126,Lesiones esplénicas en medicina interna.
1,,22652296,La enfermedad de Von Hippel-Lindau y el papel del internista en las enfermedades raras.
2,,27131948,Infección masiva por Ancylostoma duodenale como causa de hemorragia intestinal y anemia severa.
3,,20434145,Atención urgente a un paciente alcohólico.
4,,9197031,Consulta del internista en el 2000.
5,,20144794,"Conducta terapéutica en la diabetes tipo 2. Cuanto más breve, mejor."
6,,31081502,OnabotulinumtoxinA en el tratamiento de la odontalgia atípica: descripción de un caso clínico.
7,,27776963,Paresia idiopática del nervio hipogloso.
8,"Introducción: la enfermedad celiaca es una enfermedad autoinmune con síntomas que involucran a múltiples órganos. Las formas de presentación varían de modo notable lo que dificulta su diagnóstico. El objetivo es presentar un caso atípico de enfermedad celiaca. estudio descriptivo, retrospectivo, de corte transversal de un caso de mujer adulta que se presentó con tetania investigando el caso se llegó al diagnóstico de tetania secundaria a un síndrome de malabsorción intestinal debida a enfermedad celiaca, confirmada por histología. la enfermedad celiaca puede presentarse atípicamente como una tetania. ",30882343,Tetania como forma de presentación de enfermedad celiaca en el adulto.
9,,30503027,Fitobezoar gástrico gigante secundario a estenosis pilórica tratado con Coca-Cola
10,,30848774,Síndrome de DRESS con compromiso pulmonar extenso. Una presentación inhabitual.
11,,30694190,Ceguera cortical como manifestación inicial de endocarditis trombótica no bacteriana.
12,,30378394,Aislamiento de Moraxella atlantae en la válvula nativa de un paciente con endocarditis infecciosa.
13,"El feocromocitoma constituye una neoplasia productora de catecolaminas que se presenta de forma esporádica o asociada a enfermedades de transmisión hereditaria, como la neoplasia endocrina múltiple. Los síntomas clásicos como la cefalea, sudoración y palpitaciones son atribuidos a la actividad del sistema nervioso simpático y suelen presentarse en forma de paroxismos. La tuberculosis pulmonar es una enfermedad infecciosa que constituye un problema de salud pública en muchos países, cuya incidencia depende de algunos factores incluyendo la inmunosupresión que generan las enfermedades endocrino-tumorales como la antes descrita. Presentamos el caso de un paciente masculino de 38 años que acude a emergencia por presentar un paroxismo de hipertensión arterial y dolor abdominal, como manifestaciones iniciales de un feocromocitoma en el contexto de una neoplasia endocrina múltiple de tipo IIA. El paciente desarrolló de forma concomitante tuberculosis pulmonar; no obstante, se logró tratar ambas entidades consiguiendo una evolución clínica favorable. ",30451214,Feocromocitoma en neoplasia endocrina múltiple IIA asociado a tuberculosis pulmonar presentada como abdomen agudo: reporte de caso y revisión de la literatura.
14,,29269099,Mediastinitis aguda como complicación atípica de una mononucleosis infecciosa.
15,,27461183,Distrofia muscular de Emery-Dreifuss tipo 2: nueva mutación de novo en el gen la lamina A/C.
16,,30198854,"Síndrome de la orina morada en bolsa, un compañero de viaje."
17,"El carcinoma de las glándulas paratiroides (CP) descrito por De Quervain en 1909 representa la neoplasia menos frecuente, siendo su incidencia de 1.25/10,000,000 personas. Se han reportado aproximadamente 1,000 casos de carcinoma paratiroideo en la literatura mundial. En México existen dos series, una de ocho pacientes y otra de cuatro, además de tres reportes de casos aislados. Dado que el CP es funcionalmente activo el comportamiento clínico inicial es similar a las neoplasias paratiroideas benignas. Femenino de 66 años de edad con dolor óseo en muslo y fractura espontánea de fémur, en la que se detectaron lesiones osteolíticas, hipercalcemia, niveles elevados de fosfatasa alcalina y de paratohormona; con gammagrama que mostró un tumor funcionante localizado en mediastino superior, fue sometida a extirpación en bloque con hemitiroidectomía derecha con tumor de la glándula paratiroides. El estudio histopatológico reportó CP. El CP representa la neoplasia menos común; en pacientes con niveles de paratohormona mayores de 1,000 pg/ml e hipercalcemia mayor de 14 mg/dl debe sospecharse dicha patología. ",30549507,Carcinoma de paratiroides: diagnóstico por fractura de fémur.
18,,30540735,Carcinoma neuroendocrino de esófago: reporte de caso.
19,"Las infecciones por protozoos son prevalentes a nivel mundial, en particular en pacientes inmunosuprimidos. Comunicamos el caso de una paciente procedente de la ciudad de Viña del Mar, Chile, portadora de leucemia mieloide aguda en quiense confirmó una infección por Lophomonas sp. en lavado bronquioalveolar. Se manejó con antibióticos, pero falleció decomplicaciones de su enfermedad de base. Existe poca literatura disponible respecto a este microorganismo. Concluimos que debe considerarse a Lophomonas sp. como posibilidad diagnóstica si se encuentran protozoos en lavados bronquioalveolares de pacientes inmunosuprimidos. ",30517513,Infección pulmonar por Lophomonas sp en una paciente con leucemia mieloide aguda.
20,,30148915,Taponamiento cardiaco de origen inflamatorio como primera manifestación de timoma.
21,,27161424,Accidente isquémico transitorio medular como presentación de aneurisma disecante de aorta. Descripción de caso y revisión de la literatura.
22,,17491616,Calcinosis cutis: a propósito de un caso.
23,,30148932,Mieloma múltiple en pacientes con lupus eritematoso sistémico: presentación de dos casos.
24,,28993067,Uso de cotrimoxazol en sellado de catéter. A propósito de un caso en una situación difícil.
25,,30118469,"Hemangioma cavernomatoso hepático gigante, presentación infrecuente de una lesión común."
26,,29999129,Necrolisis epidérmica tóxica en el curso de un síndrome hemofagocítico secundario a linfoma de Hodgkin. Caso clínico.
27,,28683899,Virus Zika: manifestaciones cutáneas en 3 pacientes.
28,,27126565,Linfomatosis meníngea tardía en linfoma del manto controlada con quimioterapia.
29,,29999130,Hemoptisis como manifestación inicial de la enfermedad de Behçet. Casos clínicos.
30,,29799892,Síndrome antifosfolípido catastrófico “seronegativo” en pediatría: Caso clínico.
31,,28851565,Asociación de absceso cerebral y malformación arteriovenosa pulmonar.
32,,28645695,"Neumomediastino, cuando la crisis asmática no mejora."
33,,28057353,Nódulo indoloro localizado en la mano.
34,,27979434,Masa indolora en muslo de crecimiento lento.
35,"El primer caso de infección por virus chikunguña (CHIKV) en México ocurrió en Jalisco, en mayo de 2014 y se ha ido diseminando a lo largo del país, por lo que hoy en día se considera una infección emergente transmitida por vectores. Se caracteriza por fiebre de inicio abrupto, astenia intensa, artralgias múltiples, simétricas, bilaterales y debilitantes, de predominio en brazos y piernas, mialgias, cefalea y rash maculopapular. En el caso expuesto describimos a una mujer originaria del estado de Guerrero, la cual presentó sintomatología pulmonar asociada a infección por CHIKV, lo que representa una manifestación atípica de esta enfermedad, ya que solo ha sido reportada en cerca de 100 casos a nivel mundial. En el contexto epidemiológico se sabe que la única herramienta que se tiene disponible en estos momentos es la erradicación de los vectores que promueven su transmisión, ya que carecemos de inmunidad poblacional, por lo que es de vital importancia evitar el estancamiento de agua y alentar el uso de ropa de protección. Por último, se debe hacer énfasis en la forma en la que se actúa en México, por medio de la difusión de información, para evitar, en primer lugar, la infección aguda que puede llevar a la muerte en casos extremos, y en segundo término, salvar las complicaciones crónicas. ",29906040,Presentación clínica atípica de infección por flavivirus. Reporte de caso
36,,29523499,Síndrome del torniquete por pelo en nevo melanocítico.
37,,29162227,Dermatomiositis anti-MDA-5 positivas. Descripción de clínica cutánea y sistémica a propósito de dos casos.
38,,29033067,Leiomiomatosis multinodular esofágica: una causa infrecuente de masa mediastínica.
39,,29664513,Enfermedad injerto contra huésped cutánea crónica tipo vitiligo. Caso clínico.
40,,29390604,Efecto antipseudomónico de los macrólidos. Experiencia en un caso de neumonía nosocomial por Pseudomonas aeruginosa multirresistente sin respuesta a antibioterapia.
41,,28757282,Infiltrado pulmonar unilateral: una forma rara de presentación de un linfoma pulmonar primario.
42,,30285928,Fiebre manchada de evolución fatal en la provincia de Salta.
43,,30125257,Polineuropatía desmielinizante inflamatoria crónica en paciente diabética con sífilis.
44,,29940548,Diagnóstico oportuno de paracoccidioidomicosis diseminada en un adulto inmunocompetente.
45,,29778558,"Trasplante renal exitoso con protocolo de eculizumab, timoglobulina y belatacept en paciente altamente sensibilizada con síndrome hemolítico urémico atípico por mutación del factor H."
46,,29685553,Uso de un nuevo dispositivo para la prevención de embolias pulmonares previo a una trombectomía farmacomecánica.
47,,29463427,Diarrea crónica: un caso de macroglobulinemia de Waldenström.
48,,29290321,Enfermedad de Kikuchi-Fujimoto: evolución en brotes con respuesta a antipalúdicos.
49,,29274669,Dolor abdominal recurrente. Síndrome de atrapamiento del nervio cutáneo abdominal a propósito de tres casos.
50,,29221634,La ecografía en el punto de atención al paciente en la sospecha de hipertensión arterial secundaria.
51,,29169780,Diverticulosis yeyunal masiva: causa infrecuente de malabsorción intestinal.
52,,28864238,"Necrosis grasa por Sintrom, una complicación poco conocida."
53,,28844625,Nefritis lúpica asociada con c-ANCA.
54,,28641902,Linfoma de Hodgkin como causa de fiebre de origen desconocido en el anciano.
55,,28610986,Estenosis bronquiales web-like secundarias a granulomatosis con poliangitis.
56,,28578879,Parálisis diafragmática en granulomatosis eosinofílica con poliangitis.
57,,28473223,Enfisema subcutáneo de la extremidad inferior.
58,,28283311,Artritis séptica de rodilla nativa por Corynebacterium striatum.
59,,28256443,Enfermedad por arañazo de gato en paciente con artritis reumatoidea tratado con etanercept.
60,,28089360,Aspergilosis renal posterior a trasplante hepático: informe de un caso infrecuente.
61,,28063779,"Síndrome antisintetasa e influenza B, afectación pulmonar característica."
62,,27989497,Dacrioadenitis por enfermedad relacionada con IgG4 en una adolescente afrodescendiente de Colombia.
63,,30504114,Síndrome de Horner como presentación de tuberculosis pulmonar.
64,,30285931,Síndrome del dedo azul como manifestación de feocromocitoma.
65,,29940551,Taponamiento cardíaco como forma de presentación de timoma mediastinal.
66,,29571917,Macroglobulinemia de Waldenström presentándose como glomerulonefritis membranoproliferativa crioglobulinémica tipo II.
67,,29496301,"A propósito de un caso, linfoma cerebral primario diagnosticado durante estudio de demencias en una paciente inmunocompetente."
68,,29306316,Linfoma cutáneo asociado a metotrexato en un paciente con artritis reumatoide.
69,,29291915,¿Seguimos siendo guardianes de nuestros pacientes?: la contribución de James Drane a la ética clínica actual.
70,,29183801,Peritonitis por Cryptococcus neoformans en el paciente cirrótico.
71,,29132942,Tratamiento con dalbavancina en paciente con tromboflebitis séptica yugular por Staphylococcus aureus tras la inserción de un desfribilador automático implantable.
72,,28874309,"Cor triatriatum, una causa inusual de evento cerebrovascular cardioembólico en adultos. A propósito de un caso."
73,,28864094,Crisis paratiroidea: hipercalcemia como urgencia médica.
74,,28684031,Obstrucción intestinal por cápsula endoscópica en un paciente con síndrome de Peutz-Jeghers.
75,,28552686,Paniculitis eosinofílica asociada a hipocomplementemia y paraproteinemia.
76,,28291561,Enteropatía sprue-like asociada a olmesartán: causa emergente de diarrea crónica asociada a fármacos.
77,,28242213,¿Otro tofo gotoso? Las múltiples caras del encondroma.
78,,28209397,Idoneidad de la punción guiada por ecografía de alta resolución en el diagnóstico de una tumoración de partes blandas infectada por Mycobacterium tuberculosis.
79,,27919708,Enfermedad pulmonar intersticial temprana en poliangitis microscópica: reporte de un caso y revisión de la literatura.
80,Se presenta caso de paciente obesa a quien se le realiza endoscopía digestiva alta por disfagia tras ingesta accidental de hueso de pollo. Se constata leve esofagitis de reflujo y atrofia duodenal. La biopsia intestinal informa atrofia intestinal con infiltrado inflamatorio. Los autoanticuerpos para enfermedad celiaca resultan positivos. La paciente nunca presentó síntomas digestivos. Se confirma enfermedad celiaca silente e inicia dieta sin gluten. ,29902150,Enfermedad Celíaca Silente en una paciente obesa
81,,28774742,Shock cardiogénico e isquemia aguda de miembros inferiores como complicaciones de la enfermedad de Kawasaki.
82,,28736067,Xantogranuloma necrobiótico asociado a gammapatía monoclonal IgG kappa de significado incierto.
83,,28416231,Neurorretinitis unilateral.
84,,28756998,Efectividad de infliximab en la fiebre mediterránea familiar resistente a colchicina.
85,,28669416,Diagnóstico radiológico en el shrinking lung syndrome en pacientes con lupus eritematoso sistémico. Utilidad de la ecografía diafragmática.
86,,28641879,Mycobacterium xenopi y carcinoma pulmonar de células escamosas.
87,,28027806,Absceso cerebral actinomicótico en paciente inmunocompetente.
88,,29664531,"Síndrome de Austrian, reporte de caso."
89,,28728953,Diplopía secundaria a osteoma frontoetmoidal gigante.
90,,28602215,Síndrome antifosfolípido transitorio e infarto esplénico en un paciente con infección aguda por parvovirus B19.
91,,28262111,Lesiones cutáneas ampollosas en un paciente con lupus eritematoso sistémico.
92,,27112975,Lesiones máculo-papulosas diseminadas en paciente en contacto con ganado.
93,"Introducción: la obstrucción aislada de la vena esplénica es una complicación de carcinoma pancreático, pancreatitis o pseudoquiste del páncreas. La trombosis de la vena esplénica puede conducir a hipertensión portal segmentaria y sangrado de várices gástricas. Caso clínico: un hombre de 31 años de edad fue referido a nuestro hospital en 2013 con el diagnóstico de pancreatitis de dos semanas de evolución. Tenía el antecedente de consumo de alcohol. El examen físico no mostró estigmas de cirrosis hepática. El laboratorio reveló hemoglobina de 9.5 g/dL con leucocitos y plaquetas normales. Las pruebas de función hepática fueron normales. La TAC abdominal mostró un pseudoquiste, el cual fue drenado por punción percutánea. Por recurrencia del pseudoquiste, se efectuó drenaje y necrosectomía por laparoscopia retroperitoneal. El paciente presentó hiperglucemia durante su estancia. Después de haber egresado, acudió a urgencias por sangrado gastrointestinal superior sin inestabilidad hemodinámica. La gastroscopia mostró várices gástricas sangrantes. La colonoscopia mostró resultados normales. La biopsia de hígado también resultó normal. La angio-TAC abdominal mostró obstrucción de la vena esplénica. Se sometió a esplenectomía y fue egresado. Conclusión: este caso es raro en nuestro medio debido a la alta frecuencia de hipertensión portal por cirrosis. Las várices gástricas aisladas con función hepática normal son un signo de trombosis de la vena esplénica. El tratamiento definitivo es la esplenectomía. ",29190873,Hipertensión portal segmentaria por trombosis de la vena esplénica causada por pancreatitis.
94,,28648592,Papel de la PET/TC en el seguimiento y respuesta al tratamiento de los pacientes con tuberculosis.
95,,28242121,Mujer de 60 años con problemas de visión y lesiones cutáneas.
96,,28069335,Toxicidad neurológica por ertapenem en paciente con enfermedad renal crónica estadio IV.
97,,29488578,Endocarditis marántica como presentación de cáncer de páncreas. Caso clínico.
98,,29077297,Síndrome de fuga capilar sistémica: una causa rara de shock.
99,,28736065,Inmunodeficiencia común variable asociada a enfermedad pulmonar intersticial granulomatosa-linfocítica tratada con un régimen combinado de rituximab y azatioprina.
100,,28662886,Síndrome de Dress y panuveítis bilateral por ranelato de estroncio.
101,,28651881,Acetato de megestrol. ¿Es su uso tan inofensivo como parece?
102,,28571952,Anemia inducida por linezolid.
103,,28545719,Rotura de aneurisma de aorta torácica: lo que la verdad esconde.
104,,28527603,Tuberculosis peritoneal en pacientes con artritis reumatoide en tratamiento con adalimumab.
105,,28081874,Neumomediastino y neumoperitoneo secundario a neumatosis quística intestinal tras colocación de gastrostomía endoscópica percutánea.
106,,27515890,Tumor fibroso solitario gástrico.
107,,29488599,Neumonía por Pneumocystis jiroveci post inicio de tratamiento con infliximab en paciente con enfermedad de Crohn.
108,,29488595,Anemia crónica grave por Ancylostoma duodenale en Ecuador. Diagnóstico por duodenoscopia.
109,,28647279,Plombaje pulmonar.
110,,28629659,Miositis focal secundaria a radiculopatía.
111,,28040241,Neumomediastino espontáneo.
112,,27506336,Metástasis a duodeno de cáncer renal de células claras con patrón sarcomatoide: reporte de caso.
113,,26874569,Hepatitis tóxica tras tratamiento concomitante con interferón beta y aloe vera en un paciente con esclerosis múltiple: a propósito de un caso.
114,,29424412,Rivaroxaban para el tratamiento de la trombocitopenia inducida por heparina. Caso clínico.
115,"Se presenta el caso de una paciente afectada por una diabetes insípida central transitoria asociada al embarazo, en el contexto de una eclampsia, la cual se presentó durante las crisis convulsivas, identificándose por poliuria importante, así como alteraciones de la densidad urinaria, y mejorando tras la administración de desmopresina nasal, lo cual con-firmó el diagnóstico y sirvió de tratamiento, remitiendo totalmente el cuadro sin secuela alguna. ",29193952,Diabetes insípida central transitoria asociada a embarazo. Reporte de caso y revisión de bibliografía.
116,,28511877,Lesión inflamatoria en el mentón.
117,,28063611,Mucormicosis pulmonar en paciente joven con inicio de diabetes mellitus.
118,,28038849,Disección aórtica extensa de curso fulminante.
119,,27979376,Cinturas hipercaptantes.
120,,29424413,Polirradiculoneuritis aguda asociada a infección por Virus Herpes Humano 7 en un paciente adulto inmunocompetente.
121,"Clostridium difficile es una bacteria formadora de esporas, productoras de exotoxinas, causante de diarrea nosocomial potencialmente mortal. En fechas recientes se han reportado brotes de C. difficile ribotipo 027, la cual se caracteriza por ser una cepa hipervirulenta y de gran resistencia al tratamiento habitual. presentamos tres casos que fueron diagnosticados con Clostridium difficile cepa NAP1/027/BI, los cuales cursaron con diferentes cuadros clínicos. Dos de los pacientes fueron tratados exitosamente con la combinación de vancomicina más tigeciclina. El otro caso fue tratado con trasplante de microbiota fecal, con resolución de la enfermedad. en pacientes con infección asociada a Clostridium difficile cepa NAP1/027/BI, es una buena opción terapéutica el considerar el uso de tigeciclina en conjunto con vancomicina, así como el trasplante de microbiota fecal. ",29193949,Serie de casos de Clostridium difficile cepa NAP1/027/BI con novedosos tratamientos.
122,,28476453,Síndrome de platipnea-ortodesoxia asociado a foramen oval permeable.
123,,28416228,Enfermedad por arañazo de gato. Presentación como tumoración epitroclear.
124,,28148396,Un extraño brote de vasculitis.
125,,26874571,"Diaforesis recurrente, estado confusional agudo y mesotelioma pleural."
126,,28336121,Artritis séptica por Klebsiella oxytoca.
127,,27923465,Necrobiosis lipoídica.
128,,28676728,Enteropatía asociada a olmesartán: atención a un fenómeno iatrogénico emergente.
129,,28410758,Una causa inusual de dolor abdominal: disección espontánea de la arteria mesentérica superior.
130,,28396137,Embolia coronaria paradójica a través de un foramen oval permeable.
131,,28389009,Intoxicación por ayahuasca.
132,,29182204,Síndrome de QT largo y taquicardia ventricular en torsade de pointes secundarios a hipopituitarismo: una asociación a tener en cuenta. Caso clínico.
133,,28825286,Ha tragado: ¿qué hago?
134,,28336117,Meningitis por Moraxella catarrhalis durante tratamiento con certolizumab.
135,,28325694,Tuberculosis miliar y genital simultáneas.
136,,28277239,Meningioma paucisintomático en una paciente joven.
137,,28249705,Bulla pulmonar gigante sobreinfectada.
138,,27823789,Lesiones en brazo tras excursión por el campo.
139,,27751509,Mononucleosis infecciosa con manifestaciones clínicas inusuales.
140,,27555066,Coroidopatía punctata interna complicada con desprendimiento neurosensorial exudativo: respuesta favorable al tratamiento con corticoides y ranibizumab intravítreo.
141,"En el carcinoma suprarrenal metastásico no existen esquemas de tratamiento aprobados tras la progresión a una primera línea de quimioterapia/mitotane, si bien un alto porcentaje de pacientes son candidatos a recibirlos. En este artículo realizamos una revisión sobre las posibles alternativas terapéuticas tras la progresión a una primera línea de tratamiento en pacientes con carcinoma suprarrenal metastásico. A propósito de la misma, se presenta un caso clínico en el que se consigue una prolongada supervivencia global, mucho mayor de la esperable, probablemente debido al manejo multidisciplinario del caso y a la utilización de la mayor parte del arsenal terapéutico disponible. ",28777782,Quimioterapia paliativa tras progresión a la primera línea en el carcinoma suprarrenal metastásico: caso clínico y revisión de la literatura.
142,,28279535,Monoartritis séptica erosiva y osteomielitis de la muñeca por Mycobacterium intracellulare en un paciente inmunocompetente.
143,,27823788,"Ampollas, úlceras y costras en paciente con infección VIH."
144,,29171632,Leucemia linfoblástica aguda con grave alteración hepática como manifestación inicial. Presentación de dos casos y revisión de la literatura.
145,,28427732,Endoftalmitis endógenas bacterianas. A propósito de 2casos.
146,,28283274,Tratamiento exitoso de un caso de pericarditis crónica constrictiva utilizando micofenolato sódico en una paciente con esclerosis sistémica.
147,,27686935,Edema angioneurótico tras trombólisis intravenosa.
148,,27650211,Necrosis del cuero cabelludo.
149,,27650209,Paciente con nódulos supurativos en el dorso nasal.
150,,26522851,Diabetes y alteraciones motoras.
151,,28825243,Reflexiones acerca del dímero D y la escala Wells: a propósito de un caso inesperado de tromboembolismo pulmonar.
152,,28169034,Diagnóstico mediante EBUS lineal de infección pulmonar por Actinomyces graevenitzii.
153,,28898346,Radioyodo como tratamiento de hipertiroidismo en un paciente en hemodiálisis: Caso clínico.
154,"Introducción: la granulomatosis con poliangeítis (GP) es una vasculitis sistémica necrosante con afección multiorgánica que afecta principalmente el tracto respiratorio y los riñones. La fiebre en estos pacientes se considera indicador de actividad, pero si se presenta de forma aislada, deben descartarse otras causas. Caso clínico: paciente de sexo masculino que ingresó por fiebre de origen desconocido y pérdida de peso; se le diagnosticó granulomatosis con poliangeítis por antecedente de glomerulonefritis pauciinmune, nódulos pulmonares fijos y sinusitis crónica de cuatro años de evolución; sin embargo, la fiebre persistió a pesar del tratamiento y en ausencia de infección. Se realizó biopsia de úlcera faríngea que reportó linfoma de células T/NK de tipo nasal ulcerado positivo para CD56 y granzima. Conclusión: el linfoma T/NK nasal es una rara entidad, de mal pronóstico, que debe considerarse en pacientes con GP que no responden a esteroide, por lo que requieren biopsia de la lesión e inmunohistoquímica. ",28440998,Linfoma T/NK nasal en granulomatosis con poliangeítis. Reporte de un caso.
155,,28153333,Necesidad de cribado de enfermedad de Chagas y de infestación por Strongyloides previo a inicio de terapia biológica en países no endémicos.
156,,27876187,Afectación multiorgánica por Klebsiella pneumoniae serotipo K1.
157,,27712847,Enfermedad invasiva por Haemophilus influenzae serotipo b en el adulto.
158,,27567332,Dermatomiositis asociada a cáncer ovárico.
159,,27450172,Tratamiento de la pericarditis aguda recidivante guiado por resonancia magnética.
160,,28559053,A propósito de un caso de hamartoma retiniano adyacente a cabeza de nervio óptico en un caso de esclerosis tuberosa.
161,,29056254,Afectación tiroidea por enfermedad de Rosai-Dorfman.
162,,27260631,Afectación hepática grave como debut de un síndrome hemofagocítico.
163,,28063615,Gastroenteritis eosinofílica: aportación de tres casos clínicos con presentaciones diferentes.
164,,27450162,Hipertensión renovascular en un paciente con arteritis de Takayasu.
165,,27344581,Neuralgia occipital y su manejo en Atención Primaria.
166,,27172857,Sepsis respiratoria por Moraxella atlantae: utilidad de la espectrometría de masas en la identificación de especies poco frecuentes.
167,,28283275,Afección renal en el síndrome de MELAS: descripción de 2 casos.
